{
    "datosbasicos__duracion_contrato": "12 meses",
    "importes__importe_licitacion_(sin_iva)": "469.040,00EUR",
    "datosbasicos__division_por_lotes": "Si",
    "origen": {
        "terminos_uso": "http://www.juntadeandalucia.es/informacion/legal.html",
        "url": "http://www.juntadeandalucia.es/temas/contratacion-publica/perfiles-licitaciones/detalle/000000080708.html"
    },
    "datosbasicos__titulo_expediente": "APEO, DESEMBOSQUE Y APILADO EN CARGADERO DE MADERA Y BIOMASA PARA EL APROVECHAMIENTO FORZOSO POR EL INCENDIO DE PENUELAS, EN EL MONTE COTO MAZAGON (HU-11002-JA) Y COTO FLORES (HU-11003-JA). NET973131.",
    "datosbasicos__numero_lotes": "3",
    "importes__importe_licitacion_(con_iva)": "567.538,40EUR",
    "secciones": {
        "presentacion_solicitudes": 6,
        "estado_expediente": 1,
        "apertura_ofertas": 8,
        "importes": 0,
        "documentacion_complementaria": 3,
        "presentacion_ofertas": 7,
        "requisitos_criterios_condiciones": 5,
        "obtencion_documentacion_informacion": 4,
        "informacion_lotes_adjudicados_o_resueltos": 2,
        "referencias_diarios_oficiales": 9,
        "anuncios_publicados": 10
    },
    "estado_expediente__notas": [
        "18/12/2018 14:17 - Adjudicacion",
        "Actualizado: Adjudicacion",
        "Ver lotes"
    ],
    "obtencion_documentacion_informacion": {
        "lugar": [
            "Agencia de Medio Ambiente y Agua de Andalucia",
            "C/ Johan G. Gutenberg 1 41092 (SEVILLA )"
        ],
        "puntos_contacto": [
            "http://www.atiende.agenciamedioambienteyagua.es/",
            "955260000",
            "955044610",
            "http://www.agenciamedioambienteyagua.es/"
        ]
    },
    "datosbasicos__tipo_contrato": "Administrativo especial",
    "anuncios_publicados": [
        {
            "anuncio_desc": "Convocatoria de licitaci\u00f3n",
            "link": "http://www.juntadeandalucia.es/haciendayadministracionpublica/apl/verifirmapdc/descargaInformeParametros?transaccion=RwsK2zSKbd94ziPhEKdCvHP4a3pxggof&tipoPie=4",
            "anuncio_id": " 2018-0000027864",
            "descripcion": "09/08/2018 10:51, 2018-0000027864-Convocatoria de licitaci\u00f3n",
            "numero_expediente": "NET973131",
            "datetime": "2018-08-09T10:51:00+00:00"
        },
        {
            "anuncio_desc": "Convocatoria de licitaci\u00f3n (Infor.Adicional)",
            "link": "http://www.juntadeandalucia.es/haciendayadministracionpublica/apl/verifirmapdc/descargaInformeParametros?transaccion=yMXRIxGq1OfmD8Zkx2u5YKvJYER37PP1&tipoPie=4",
            "anuncio_id": " 2018-0000031025",
            "descripcion": "29/08/2018 12:09, 2018-0000031025-Convocatoria de licitaci\u00f3n (Infor.Adicional)",
            "numero_expediente": "NET973131",
            "datetime": "2018-08-29T12:09:00+00:00"
        },
        {
            "anuncio_desc": "Convocatoria de licitaci\u00f3n (Infor.Adicional)",
            "link": "http://www.juntadeandalucia.es/haciendayadministracionpublica/apl/verifirmapdc/descargaInformeParametros?transaccion=hx9ZTad4c%2FZiw5%2FDFBeXf4YdAfNuj%2FNj&tipoPie=4",
            "anuncio_id": " 2018-0000031931",
            "descripcion": "03/09/2018 15:47, 2018-0000031931-Convocatoria de licitaci\u00f3n (Infor.Adicional)",
            "numero_expediente": "NET973131",
            "datetime": "2018-09-03T15:47:00+00:00"
        },
        {
            "anuncio_desc": "Convocatoria de licitaci\u00f3n (Infor.Adicional)",
            "link": "http://www.juntadeandalucia.es/haciendayadministracionpublica/apl/verifirmapdc/descargaInformeParametros?transaccion=fTPcWlb3NckVeFwfzVltSM4cenB071d7&tipoPie=4",
            "anuncio_id": " 2018-0000035809",
            "descripcion": "24/09/2018 11:52, 2018-0000035809-Convocatoria de licitaci\u00f3n (Infor.Adicional)",
            "numero_expediente": "NET973131",
            "datetime": "2018-09-24T11:52:00+00:00"
        },
        {
            "anuncio_desc": "Convocatoria de licitaci\u00f3n (Infor.Adicional)",
            "link": "http://www.juntadeandalucia.es/haciendayadministracionpublica/apl/verifirmapdc/descargaInformeParametros?transaccion=I2B%2Be2Hr4HMjMQP0lVXDESJqUCje%2B%2B1i&tipoPie=4",
            "anuncio_id": " 2018-0000036078",
            "descripcion": "25/09/2018 13:18, 2018-0000036078-Convocatoria de licitaci\u00f3n (Infor.Adicional)",
            "numero_expediente": "NET973131",
            "datetime": "2018-09-25T13:18:00+00:00"
        },
        {
            "anuncio_desc": "Convocatoria de licitaci\u00f3n (Infor.Adicional)",
            "link": "http://www.juntadeandalucia.es/haciendayadministracionpublica/apl/verifirmapdc/descargaInformeParametros?transaccion=CGGR2QmvYr1M%2FDLjXThu1KVT2q%2Bc%2Fsfz&tipoPie=4",
            "anuncio_id": " 2018-0000037745",
            "descripcion": "03/10/2018 11:04, 2018-0000037745-Convocatoria de licitaci\u00f3n (Infor.Adicional)",
            "numero_expediente": "NET973131",
            "datetime": "2018-10-03T11:04:00+00:00"
        },
        {
            "anuncio_desc": "Convocatoria de licitaci\u00f3n (Infor.Adicional)",
            "link": "http://www.juntadeandalucia.es/haciendayadministracionpublica/apl/verifirmapdc/descargaInformeParametros?transaccion=452Op%2BN2%2FakgBJcrVpIOjKVT2q%2Bc%2Fsfz&tipoPie=4",
            "anuncio_id": " 2018-0000042572",
            "descripcion": "23/10/2018 15:35, 2018-0000042572-Convocatoria de licitaci\u00f3n (Infor.Adicional)",
            "numero_expediente": "NET973131",
            "datetime": "2018-10-23T15:35:00+00:00"
        },
        {
            "anuncio_desc": "Convocatoria de licitaci\u00f3n (Infor.Adicional)",
            "link": "http://www.juntadeandalucia.es/haciendayadministracionpublica/apl/verifirmapdc/descargaInformeParametros?transaccion=CVLA%2BfP1%2Bow4p%2FS6TPqFxHlqT3SzUohr&tipoPie=4",
            "anuncio_id": " 2018-0000049914",
            "descripcion": "22/11/2018 15:07, 2018-0000049914-Convocatoria de licitaci\u00f3n (Infor.Adicional)",
            "numero_expediente": "NET973131",
            "datetime": "2018-11-22T15:07:00+00:00"
        },
        {
            "anuncio_desc": "Convocatoria de licitaci\u00f3n (Infor.Adicional)",
            "link": "http://www.juntadeandalucia.es/haciendayadministracionpublica/apl/verifirmapdc/descargaInformeParametros?transaccion=sQ5WcexYTbDJzvwBFftfxfI9rwqOEXGf&tipoPie=4",
            "anuncio_id": " 2018-0000050485",
            "descripcion": "26/11/2018 11:44, 2018-0000050485-Convocatoria de licitaci\u00f3n (Infor.Adicional)",
            "numero_expediente": "NET973131",
            "datetime": "2018-11-26T11:44:00+00:00"
        },
        {
            "anuncio_desc": "Convocatoria de licitaci\u00f3n (Infor.Adicional)",
            "link": "http://www.juntadeandalucia.es/haciendayadministracionpublica/apl/verifirmapdc/descargaInformeParametros?transaccion=0MQa3JKbBv418Z6sZLGYcavJYER37PP1&tipoPie=4",
            "anuncio_id": " 2018-0000061154",
            "descripcion": "12/12/2018 10:44, 2018-0000061154-Convocatoria de licitaci\u00f3n (Infor.Adicional)",
            "numero_expediente": "NET973131",
            "datetime": "2018-12-12T10:44:00+00:00"
        },
        {
            "anuncio_desc": "Adjudicaci\u00f3n",
            "link": "http://www.juntadeandalucia.es/haciendayadministracionpublica/apl/verifirmapdc/descargaInformeParametros?transaccion=5ygaLEvRbIEZXiRm4PeJvoYdAfNuj%2FNj&tipoPie=4",
            "anuncio_id": " 2018-0000062448",
            "descripcion": "18/12/2018 14:17, 2018-0000062448-Adjudicaci\u00f3n",
            "numero_expediente": "NET973131",
            "datetime": "2018-12-18T14:17:00+00:00"
        },
        {
            "anuncio_desc": "Adjudicaci\u00f3n",
            "link": "http://www.juntadeandalucia.es/haciendayadministracionpublica/apl/verifirmapdc/descargaInformeParametros?transaccion=5ygaLEvRbIHclsEUKcKj%2FCmkfG71%2BFxx&tipoPie=4",
            "anuncio_id": " 2018-0000062444",
            "descripcion": "18/12/2018 14:20, 2018-0000062444-Adjudicaci\u00f3n",
            "numero_expediente": "NET973131",
            "datetime": "2018-12-18T14:20:00+00:00"
        },
        {
            "anuncio_desc": "Adjudicaci\u00f3n",
            "link": "http://www.juntadeandalucia.es/haciendayadministracionpublica/apl/verifirmapdc/descargaInformeParametros?transaccion=5ygaLEvRbIEewiSw9gaZCIJinNB9TyKu&tipoPie=4",
            "anuncio_id": " 2018-0000062440",
            "descripcion": "18/12/2018 14:23, 2018-0000062440-Adjudicaci\u00f3n",
            "numero_expediente": "NET973131",
            "datetime": "2018-12-18T14:23:00+00:00"
        }
    ],
    "datosbasicos__tramitacion": "Ordinario",
    "datosbasicos__descripcion": "APEO, DESEMBOSQUE Y APILADO EN CARGADERO DE MADERA Y BIOMASA PARA EL APROVECHAMIENTO FORZOSO POR EL INCENDIO DE PENUELAS, EN EL MONTE COTO MAZAGON (HU-11002-JA) Y COTO FLORES (HU-11003-JA). NET973131.",
    "datosbasicos__numero_expediente": "NET973131",
    "presentacion_ofertas__notas": [
        "Agencia de Medio Ambiente y Agua de Andalucia",
        "C/ Johan G. Gutenberg 1 41092 (SEVILLA )",
        "Las personas licitadoras pueden presentar sus ofertas en las distintas oficinas provinciales de la Agencia de Medio Ambiente y Agua de Andalucia, cuyas direcciones pueden consultar en la web http://www.agenciamedioambienteyagua.es/"
    ],
    "importes__valor_estimado": "469.040,00EUR",
    "informacion_lotes_adjudicados_o_resueltos": [
        {
            "lote_1__importe_adjudicacion_(sin_iva)": "175.828,00EUR",
            "lote_1__no_licitadores": "8",
            "numero_expediente": "NET973131",
            "id": "lote_1",
            "lote_1__importe_adjudicacion_(con_iva)": "212.751,88EUR",
            "lote_1__nif": "B41517335",
            "lote_1__adjudicatario": "CARBODIAZ, S.L."
        },
        {
            "lote_2__no_licitadores": "8",
            "lote_2__importe_adjudicacion_(sin_iva)": "149.149,44EUR",
            "lote_2__nif": "B21363619",
            "lote_2__importe_adjudicacion_(con_iva)": "180.470,82EUR",
            "numero_expediente": "NET973131",
            "lote_2__adjudicatario": "NOCEDA, SERVICIOS INTEGRALES MEDIOAMBIENTALES, S.L.",
            "id": "lote_2"
        },
        {
            "lote_3__no_licitadores": "8",
            "lote_3__nif": "B06645444",
            "lote_3__adjudicatario": "MARLE FORESTAL, S.L.",
            "lote_3__importe_adjudicacion_(con_iva)": "144.599,84EUR",
            "numero_expediente": "NET973131",
            "lote_3__importe_adjudicacion_(sin_iva)": "119.504,00EUR",
            "id": "lote_3"
        }
    ],
    "datosbasicos__lugar_ejecucion": "HUELVA",
    "datosbasicos__procedimiento": "Abierto",
    "datosbasicos__lugar_tramitacion": "SEVILLA",
    "datosbasicos__lugar_ejecucion_nuts": "ES615",
    "datosbasicos__clasificacion_cpv": "77230000 Servicios relacionados con la silvicultura.",
    "referencias_diarios_oficiales": [],
    "apertura_ofertas": {
        "lugar": [
            "Agencia de Medio Ambiente y Agua de Andalucia",
            "C/ Johan G. Gutenberg 1 41092 (SEVILLA )",
            "Fecha Apertura del sobre de criterios de adjudicacion evaluables por aplicacion de formulas : 28/09/2018 a las 11:30 horas"
        ]
    },
    "importes__importes_adjudicacion": "Ver lotes",
    "documentacion_complementaria": [
        {
            "descripcion": "PPT NET973131 (pdf) (213.3Kb)",
            "numero_expediente": "NET973131",
            "link": "http://www.juntadeandalucia.es/contratacion/document/download?refCode=2018-0000061154&refDoc=2018-0000061154-0"
        },
        {
            "descripcion": "PCAP NET973131 (pdf) (519.91Kb)",
            "numero_expediente": "NET973131",
            "link": "http://www.juntadeandalucia.es/contratacion/document/download?refCode=2018-0000061154&refDoc=2018-0000061154-1"
        },
        {
            "descripcion": "Memoria de Necesidades NET973131 (pdf) (82.4Kb)",
            "numero_expediente": "NET973131",
            "link": "http://www.juntadeandalucia.es/contratacion/document/download?refCode=2018-0000061154&refDoc=2018-0000061154-2"
        },
        {
            "descripcion": "APROBACI\u00d3N EXPEDIENTE CONTRATACI\u00d3N NET973131 (pdf) (22.15Kb)",
            "numero_expediente": "NET973131",
            "link": "http://www.juntadeandalucia.es/contratacion/document/download?refCode=2018-0000061154&refDoc=2018-0000061154-3"
        },
        {
            "descripcion": "DEUC NET973131 espd-request.pdf (pdf) (85.48Kb)",
            "numero_expediente": "NET973131",
            "link": "http://www.juntadeandalucia.es/contratacion/document/download?refCode=2018-0000061154&refDoc=2018-0000061154-4"
        },
        {
            "descripcion": "DEUC NET973131 espd-request.xml (xml) (124.95Kb)",
            "numero_expediente": "NET973131",
            "link": "http://www.juntadeandalucia.es/contratacion/document/download?refCode=2018-0000061154&refDoc=2018-0000061154-5"
        },
        {
            "descripcion": "Resoluci\u00f3n Adjudicaci\u00f3n_NET973131 (pdf) (48.82Kb)",
            "numero_expediente": "NET973131",
            "link": "http://www.juntadeandalucia.es/contratacion/document/download?refCode=2018-0000062448&refDoc=2018-0000062448-0"
        },
        {
            "descripcion": "Resoluci\u00f3n Adjudicaci\u00f3n_NET973131 (pdf) (48.82Kb)",
            "numero_expediente": "NET973131",
            "link": "http://www.juntadeandalucia.es/contratacion/document/download?refCode=2018-0000062440&refDoc=2018-0000062440-0"
        },
        {
            "descripcion": "Resoluci\u00f3n Adjudicaci\u00f3n_NET973131 (pdf) (48.82Kb)",
            "numero_expediente": "NET973131",
            "link": "http://www.juntadeandalucia.es/contratacion/document/download?refCode=2018-0000062444&refDoc=2018-0000062444-0"
        },
        {
            "descripcion": "Plano lote 8 norte (pdf) (719.49Kb)",
            "numero_expediente": "NET973131",
            "link": "http://www.juntadeandalucia.es/contratacion/document/download?refCode=2018-0000061154&refDoc=2018-0000061154-6"
        },
        {
            "descripcion": "Plano lote 8 sur (pdf) (602.24Kb)",
            "numero_expediente": "NET973131",
            "link": "http://www.juntadeandalucia.es/contratacion/document/download?refCode=2018-0000061154&refDoc=2018-0000061154-7"
        },
        {
            "descripcion": "Plano lote 9 (pdf) (708.21Kb)",
            "numero_expediente": "NET973131",
            "link": "http://www.juntadeandalucia.es/contratacion/document/download?refCode=2018-0000061154&refDoc=2018-0000061154-8"
        },
        {
            "descripcion": "Nota adicional para la visita de campo NET973131 (pdf) (54Kb)",
            "numero_expediente": "NET973131",
            "link": "http://www.juntadeandalucia.es/contratacion/document/download?refCode=2018-0000061154&refDoc=2018-0000061154-9"
        },
        {
            "descripcion": "Comunicado subsanaciones sobre 1 (pdf) (139.72Kb)",
            "numero_expediente": "NET973131",
            "link": "http://www.juntadeandalucia.es/contratacion/document/download?refCode=2018-0000061154&refDoc=2018-0000061154-10"
        },
        {
            "descripcion": "Acta Apertura Sobre N\u00ba 3_NET973131 (pdf) (66.41Kb)",
            "numero_expediente": "NET973131",
            "link": "http://www.juntadeandalucia.es/contratacion/document/download?refCode=2018-0000061154&refDoc=2018-0000061154-12"
        },
        {
            "descripcion": "Acta propuesta Adjudicaci\u00f3n_NET973131 (pdf) (104.39Kb)",
            "numero_expediente": "NET973131",
            "link": "http://www.juntadeandalucia.es/contratacion/document/download?refCode=2018-0000061154&refDoc=2018-0000061154-13"
        },
        {
            "descripcion": "Acta mesa calificaci\u00f3n de la documentaci\u00f3n OEMV_NET973131 (pdf) (71.34Kb)",
            "numero_expediente": "NET973131",
            "link": "http://www.juntadeandalucia.es/contratacion/document/download?refCode=2018-0000061154&refDoc=2018-0000061154-14"
        },
        {
            "descripcion": "Subsanaci\u00f3n SOEMV Lote 1 (pdf) (50.35Kb)",
            "numero_expediente": "NET973131",
            "link": "http://www.juntadeandalucia.es/contratacion/document/download?refCode=2018-0000061154&refDoc=2018-0000061154-15"
        },
        {
            "descripcion": "Subsanaci\u00f3n SOEMV Lote 2 (pdf) (49.13Kb)",
            "numero_expediente": "NET973131",
            "link": "http://www.juntadeandalucia.es/contratacion/document/download?refCode=2018-0000061154&refDoc=2018-0000061154-16"
        },
        {
            "descripcion": "Acta Propuesta Adjudicaci\u00f3n__NET973131 (pdf) (38.01Kb)",
            "numero_expediente": "NET973131",
            "link": "http://www.juntadeandalucia.es/contratacion/document/download?refCode=2018-0000061154&refDoc=2018-0000061154-17"
        },
        {
            "descripcion": "Acta Apertura Sobre N\u00ba 1_NET973131 (pdf) (38.8Kb)",
            "numero_expediente": "NET973131",
            "link": "http://www.juntadeandalucia.es/contratacion/document/download?refCode=2018-0000061154&refDoc=2018-0000061154-11"
        }
    ],
    "requisitos_criterios_condiciones": {
        "requisitos_minimos_contratista": "Los establecidos en el pliego de cl\u00e1usulas administrativas particulares",
        "criterios_adjudicacion": "OFERTA ECON\u00d3MICA. HASTA 100 %",
        "criterios_objetivos_para_la_seleccion_candidatos_el_procedimiento": "- Solvencia t\u00e9c: conforme a Art 90 LCSP, por alguno de estos medios 1) Clasificaci\u00f3n Administrativa O, 6, 2. - 2) Relaci\u00f3n de los principales servicios efectuados durante los tres \u00faltimos a\u00f1os de igual o similar naturaleza, por un importe de, al menos, 70 % del valor estimado del contrato para cada lote. Para empresas de nueva creaci\u00f3n: Se exige que el responsable de la ejecuci\u00f3n del contrato posea una titulaci\u00f3n de Ingeniero o Ingeniero T\u00e9cnico de Montes o equivalente.-Solvencia econ\u00f3mica: conforme al Art 87 LCSP, por cualquiera de estos medios A) y B). A) Clasificaci\u00f3n Administrativa O, 6, 2. - B) Declaraci\u00f3n relativa cifra anual de negocios referido al a\u00f1o de mayor volumen de negocio de los tres \u00faltimos concluidos deber\u00e1 ser al menos LOTE 1: 37.064,00 eur; LOTE 2: 31.488,00 eur; LOTE 3: 25.256,00 eur.",
        "condiciones_especiales_adjudicacion_contrato": "1) Garantizar el mantenimiento o mejora de los valores medioambientales. Mantener el buen estado de la vegetaci\u00f3n y la fauna en general, y en especial las especies de flora y fauna protegidas. 2) Prevenir la siniestralidad laboral y garantizar la seguridad y la protecci\u00f3n de la salud. Es condici\u00f3n especial de ejecuci\u00f3n que la persona adjudicataria designe una persona,vinculada a la empresa y con formaci\u00f3n espec\u00edfica en la materia, para la supervisi\u00f3n y control de la aplicaci\u00f3n de las condiciones de seguridad y salud laboral exigibles, as\u00ed como para la detecci\u00f3n de las posibles incidencias que surjan en este \u00e1mbito."
    },
    "presentacion_ofertas__fecha_limite_presentacion_ofertas": "18/09/2018 a las 12:00 horas",
    "datosbasicos__organo_contratacion": "Agencia de Medio Ambiente y Agua de Andalucia",
    "estado_expediente__estado": "Adjudicado",
    "id": 80708
}