{
    "estado_expediente__estado": "Resuelta (Formalizado)",
    "obtencion_documentacion_informacion": {
        "fecha_limite_obtencion": "07/09/2018 a las 14:00 horas",
        "lugar": [
            "Servicio de Contratacion de la Secretaria General Tecnica",
            "C/ Juan Antonio de Vizarron S/N 41071 (SEVILLA Espana)"
        ]
    },
    "requisitos_criterios_condiciones": {
        "criterios_adjudicacion": "Los establecidos en el pliego de cl\u00e1usulas administrativas particulares",
        "condiciones_especiales_adjudicacion_contrato": "Los establecidos en el pliego de cl\u00e1usulas administrativas particulares",
        "criterios_objetivos_para_la_seleccion_candidatos_el_procedimiento": "Los establecidos en el pliego de cl\u00e1usulas administrativas particulares",
        "requisitos_minimos_contratista": "Los establecidos en el pliego de cl\u00e1usulas administrativas particulares"
    },
    "estado_expediente__no_licitadores": "6",
    "importes__importe_adjudicacion_(sin_iva)": "459.000,00EUR",
    "datosbasicos__organo_contratacion": "Consejeria de Economia, Hacienda y Administracion Publica. Direccion General de Politica Digital",
    "id": 80363,
    "datosbasicos__tipo_contrato": "Servicios",
    "presentacion_ofertas__notas": [
        "C/ Juan Antonio de Vizarron S/N 41071 (SEVILLA Espana)",
        "En tres sobres cerrados, en el lugar indicado en este apartado. En el caso de enviarse por correo, el licitador debera justificar la fecha y hora de imposicion del envio en la oficina de Correos y anunciar a la Consejeria de Economia, Hacienda y Administracion Publica la remision de la oferta en el mismo dia.(955 06 47 19).",
        "Registro General de la Consejeria de Economia, Hacienda y Administracion Publica"
    ],
    "datosbasicos__titulo_expediente": "Mantenimiento de servidores de capacidad de procesamiento tipo medio",
    "referencias_diarios_oficiales": [],
    "datosbasicos__numero_expediente": "CONTR 2018 0000043070",
    "secciones": {
        "importes": 0,
        "estado_expediente": 1,
        "presentacion_solicitudes": 5,
        "anuncios_publicados": 9,
        "presentacion_ofertas": 6,
        "obtencion_documentacion_informacion": 3,
        "requisitos_criterios_condiciones": 4,
        "documentacion_complementaria": 2,
        "apertura_ofertas": 7,
        "referencias_diarios_oficiales": 8
    },
    "estado_expediente__nif": "B91447193",
    "datosbasicos__lugar_ejecucion": "SEVILLA",
    "apertura_ofertas": {
        "lugar": [
            "Sala de Juntas de la Consejeria de Economia, Hacienda y Administracion Publica, 7a planta del edificio Torretriana",
            "C/ Juan Antonio de Vizarron S/N 41071 (SEVILLA Espana)"
        ]
    },
    "estado_expediente__adjudicatario": "SOLUTIA INNOVAWORD TECHNOLOGIES SL",
    "presentacion_ofertas__fecha_limite_presentacion_ofertas": "07/09/2018 a las 14:00 horas",
    "datosbasicos__duracion_contrato": "24 meses",
    "datosbasicos__descripcion": "Servicio de mantenimiento de servidores de capacidad de procesamiento tipo medio de la Junta de Andalucia que permita garantizar la operatividad, eficiencia y alargamiento de la vida util de los equipos incluidos.",
    "anuncios_publicados": [
        {
            "anuncio_desc": "Convocatoria de licitaci\u00f3n",
            "numero_expediente": "CONTR 2018 0000043070",
            "descripcion": "07/08/2018 10:44, 2018-0000027363-Convocatoria de licitaci\u00f3n",
            "datetime": "2018-08-07T10:44:00+00:00",
            "anuncio_id": " 2018-0000027363",
            "link": "http://www.juntadeandalucia.es/haciendayadministracionpublica/apl/verifirmapdc/descargaInformeParametros?transaccion=W3fwus6ukF5Fy4iU9mu42vI9rwqOEXGf&tipoPie=4"
        },
        {
            "anuncio_desc": "Convocatoria de licitaci\u00f3n (Infor.Adicional)",
            "numero_expediente": "CONTR 2018 0000043070",
            "descripcion": "30/08/2018 13:56, 2018-0000031324-Convocatoria de licitaci\u00f3n (Infor.Adicional)",
            "datetime": "2018-08-30T13:56:00+00:00",
            "anuncio_id": " 2018-0000031324",
            "link": "http://www.juntadeandalucia.es/haciendayadministracionpublica/apl/verifirmapdc/descargaInformeParametros?transaccion=c4x15SSGe9Wkfi%2BxAsE%2FeiJqUCje%2B%2B1i&tipoPie=4"
        },
        {
            "anuncio_desc": "Convocatoria de licitaci\u00f3n (Infor.Adicional)",
            "numero_expediente": "CONTR 2018 0000043070",
            "descripcion": "04/09/2018 15:11, 2018-0000032254-Convocatoria de licitaci\u00f3n (Infor.Adicional)",
            "datetime": "2018-09-04T15:11:00+00:00",
            "anuncio_id": " 2018-0000032254",
            "link": "http://www.juntadeandalucia.es/haciendayadministracionpublica/apl/verifirmapdc/descargaInformeParametros?transaccion=FW28X0yY4oBi8zxJpVZBSKvJYER37PP1&tipoPie=4"
        },
        {
            "anuncio_desc": "Convocatoria de licitaci\u00f3n (Infor.Adicional)",
            "numero_expediente": "CONTR 2018 0000043070",
            "descripcion": "18/09/2018 12:30, 2018-0000034827-Convocatoria de licitaci\u00f3n (Infor.Adicional)",
            "datetime": "2018-09-18T12:30:00+00:00",
            "anuncio_id": " 2018-0000034827",
            "link": "http://www.juntadeandalucia.es/haciendayadministracionpublica/apl/verifirmapdc/descargaInformeParametros?transaccion=8YNDdYhbwS5DJeuor52toXlqT3SzUohr&tipoPie=4"
        },
        {
            "anuncio_desc": "Convocatoria de licitaci\u00f3n (Infor.Adicional)",
            "numero_expediente": "CONTR 2018 0000043070",
            "descripcion": "19/09/2018 15:23, 2018-0000035234-Convocatoria de licitaci\u00f3n (Infor.Adicional)",
            "datetime": "2018-09-19T15:23:00+00:00",
            "anuncio_id": " 2018-0000035234",
            "link": "http://www.juntadeandalucia.es/haciendayadministracionpublica/apl/verifirmapdc/descargaInformeParametros?transaccion=3cxwrhHtrAy9QLqTtHofZimkfG71%2BFxx&tipoPie=4"
        },
        {
            "anuncio_desc": "Convocatoria de licitaci\u00f3n (Infor.Adicional)",
            "numero_expediente": "CONTR 2018 0000043070",
            "descripcion": "24/09/2018 14:29, 2018-0000035910-Convocatoria de licitaci\u00f3n (Infor.Adicional)",
            "datetime": "2018-09-24T14:29:00+00:00",
            "anuncio_id": " 2018-0000035910",
            "link": "http://www.juntadeandalucia.es/haciendayadministracionpublica/apl/verifirmapdc/descargaInformeParametros?transaccion=cjeUa%2FK8IzbQ%2FYGQDkYnKIYdAfNuj%2FNj&tipoPie=4"
        },
        {
            "anuncio_desc": "Convocatoria de licitaci\u00f3n (Infor.Adicional)",
            "numero_expediente": "CONTR 2018 0000043070",
            "descripcion": "26/09/2018 15:16, 2018-0000036519-Convocatoria de licitaci\u00f3n (Infor.Adicional)",
            "datetime": "2018-09-26T15:16:00+00:00",
            "anuncio_id": " 2018-0000036519",
            "link": "http://www.juntadeandalucia.es/haciendayadministracionpublica/apl/verifirmapdc/descargaInformeParametros?transaccion=SkQHMWn56onomOmsU7hN8imkfG71%2BFxx&tipoPie=4"
        },
        {
            "anuncio_desc": "Convocatoria de licitaci\u00f3n (Infor.Adicional)",
            "numero_expediente": "CONTR 2018 0000043070",
            "descripcion": "17/10/2018 15:17, 2018-0000041263-Convocatoria de licitaci\u00f3n (Infor.Adicional)",
            "datetime": "2018-10-17T15:17:00+00:00",
            "anuncio_id": " 2018-0000041263",
            "link": "http://www.juntadeandalucia.es/haciendayadministracionpublica/apl/verifirmapdc/descargaInformeParametros?transaccion=YplTFOaTDLmHELtlGVysbSmkfG71%2BFxx&tipoPie=4"
        },
        {
            "anuncio_desc": "Convocatoria de licitaci\u00f3n (Infor.Adicional)",
            "numero_expediente": "CONTR 2018 0000043070",
            "descripcion": "30/10/2018 19:14, 2018-0000044668-Convocatoria de licitaci\u00f3n (Infor.Adicional)",
            "datetime": "2018-10-30T19:14:00+00:00",
            "anuncio_id": " 2018-0000044668",
            "link": "http://www.juntadeandalucia.es/haciendayadministracionpublica/apl/verifirmapdc/descargaInformeParametros?transaccion=0YRd0B1y9S4prb%2F%2BZFGjECJqUCje%2B%2B1i&tipoPie=4"
        },
        {
            "anuncio_desc": "Adjudicaci\u00f3n",
            "numero_expediente": "CONTR 2018 0000043070",
            "descripcion": "02/11/2018 15:19, 2018-0000045281-Adjudicaci\u00f3n",
            "datetime": "2018-11-02T15:19:00+00:00",
            "anuncio_id": " 2018-0000045281",
            "link": "http://www.juntadeandalucia.es/haciendayadministracionpublica/apl/verifirmapdc/descargaInformeParametros?transaccion=HTB4HOzpWkqNF9%2F%2FMHWn73P4a3pxggof&tipoPie=4"
        },
        {
            "anuncio_desc": "Formalizaci\u00f3n",
            "numero_expediente": "CONTR 2018 0000043070",
            "descripcion": "12/12/2018 12:15, 2018-0000061221-Formalizaci\u00f3n",
            "datetime": "2018-12-12T12:15:00+00:00",
            "anuncio_id": " 2018-0000061221",
            "link": "http://www.juntadeandalucia.es/haciendayadministracionpublica/apl/verifirmapdc/descargaInformeParametros?transaccion=jlNEfiYCt4YtiaGGJm190KvJYER37PP1&tipoPie=4"
        }
    ],
    "datosbasicos__procedimiento": "Abierto",
    "importes__valor_estimado": "1.452.800,00EUR",
    "origen": {
        "url": "http://www.juntadeandalucia.es/temas/contratacion-publica/perfiles-licitaciones/detalle/000000080363.html",
        "terminos_uso": "http://www.juntadeandalucia.es/informacion/legal.html"
    },
    "datosbasicos__lugar_ejecucion_nuts": "ES618",
    "datosbasicos__lugar_tramitacion": "SEVILLA",
    "datosbasicos__division_por_lotes": "No",
    "estado_expediente__fecha_adjudicacion": "31/10/2018",
    "documentacion_complementaria": [
        {
            "numero_expediente": "CONTR 2018 0000043070",
            "link": "http://www.juntadeandalucia.es/contratacion/document/download?refCode=2018-0000061221&refDoc=2018-0000061221-0",
            "descripcion": "Contrato formalizado (PDF) (92.06Kb)"
        },
        {
            "numero_expediente": "CONTR 2018 0000043070",
            "link": "http://www.juntadeandalucia.es/contratacion/document/download?refCode=2018-0000045281&refDoc=2018-0000045281-0",
            "descripcion": "Resoluci\u00f3n de adjudicaci\u00f3n (PDF) (120Kb)"
        },
        {
            "numero_expediente": "CONTR 2018 0000043070",
            "link": "http://www.juntadeandalucia.es/contratacion/document/download?refCode=2018-0000044668&refDoc=2018-0000044668-0",
            "descripcion": "Memoria justificativa (PDF) (98.71Kb)"
        },
        {
            "numero_expediente": "CONTR 2018 0000043070",
            "link": "http://www.juntadeandalucia.es/contratacion/document/download?refCode=2018-0000044668&refDoc=2018-0000044668-1",
            "descripcion": "Acuerdo de inicio (PDF) (75.81Kb)"
        },
        {
            "numero_expediente": "CONTR 2018 0000043070",
            "link": "http://www.juntadeandalucia.es/contratacion/document/download?refCode=2018-0000044668&refDoc=2018-0000044668-2",
            "descripcion": "Resoluci\u00f3n de aprobaci\u00f3n del expediente (PDF) (79.65Kb)"
        },
        {
            "numero_expediente": "CONTR 2018 0000043070",
            "link": "http://www.juntadeandalucia.es/contratacion/document/download?refCode=2018-0000044668&refDoc=2018-0000044668-3",
            "descripcion": "Pliego de cl\u00e1usulas administrativas particulares (PDF) (590.57Kb)"
        },
        {
            "numero_expediente": "CONTR 2018 0000043070",
            "link": "http://www.juntadeandalucia.es/contratacion/document/download?refCode=2018-0000044668&refDoc=2018-0000044668-4",
            "descripcion": "Pliego de prescripciones t\u00e9cnicas (PDF) (868.58Kb)"
        },
        {
            "numero_expediente": "CONTR 2018 0000043070",
            "link": "http://www.juntadeandalucia.es/contratacion/document/download?refCode=2018-0000044668&refDoc=2018-0000044668-5",
            "descripcion": "Consulta licitadores (PDF) (45.93Kb)"
        },
        {
            "numero_expediente": "CONTR 2018 0000043070",
            "link": "http://www.juntadeandalucia.es/contratacion/document/download?refCode=2018-0000044668&refDoc=2018-0000044668-6",
            "descripcion": "Listado de equipamiento (ODS) (64.31Kb)"
        },
        {
            "numero_expediente": "CONTR 2018 0000043070",
            "link": "http://www.juntadeandalucia.es/contratacion/document/download?refCode=2018-0000044668&refDoc=2018-0000044668-7",
            "descripcion": "Designaci\u00f3n composici\u00f3n de la Mesa (PDF) (70.08Kb)"
        },
        {
            "numero_expediente": "CONTR 2018 0000043070",
            "link": "http://www.juntadeandalucia.es/contratacion/document/download?refCode=2018-0000044668&refDoc=2018-0000044668-8",
            "descripcion": "Acta mesa calificaci\u00f3n administrativa (PDF) (60.47Kb)"
        },
        {
            "numero_expediente": "CONTR 2018 0000043070",
            "link": "http://www.juntadeandalucia.es/contratacion/document/download?refCode=2018-0000044668&refDoc=2018-0000044668-9",
            "descripcion": "Acta mesa calificaci\u00f3n juicio de valor (PDF) (68.06Kb)"
        },
        {
            "numero_expediente": "CONTR 2018 0000043070",
            "link": "http://www.juntadeandalucia.es/contratacion/document/download?refCode=2018-0000044668&refDoc=2018-0000044668-10",
            "descripcion": "Acta mesa apertura sobre aplicaci\u00f3n de f\u00f3rmulas (PDF) (100.55Kb)"
        },
        {
            "numero_expediente": "CONTR 2018 0000043070",
            "link": "http://www.juntadeandalucia.es/contratacion/document/download?refCode=2018-0000044668&refDoc=2018-0000044668-11",
            "descripcion": "Acta de calificaci\u00f3n administrativa (PDF) (64.05Kb)"
        }
    ],
    "importes__importe_licitacion_(sin_iva)": "726.400,00EUR",
    "datosbasicos__clasificacion_cpv": "50312000 Mantenimiento y reparacion de equipo informatico",
    "importes__importe_licitacion_(con_iva)": "878.944,00EUR",
    "estado_expediente__fecha_la_formalizacion": "29/11/2018",
    "estado_expediente__notas": [
        "12/12/2018 12:15 - Formalizacion",
        "Actualizado: Formalizacion"
    ],
    "importes__importe_adjudicacion_(con_iva)": "555.390,00EUR",
    "datosbasicos__tramitacion": "Ordinario"
}