{
    "secciones": {
        "importes": 0,
        "estado_expediente": 1,
        "documentacion_complementaria": 2,
        "obtencion_documentacion_informacion": 3,
        "requisitos_criterios_condiciones": 4,
        "presentacion_solicitudes": 5,
        "presentacion_ofertas": 6,
        "apertura_ofertas": 7,
        "referencias_diarios_oficiales": 8,
        "anuncios_publicados": 9
    },
    "datosbasicos__numero_expediente": "IJ17.119.00CS",
    "datosbasicos__titulo_expediente": "Servicio de apoyo integral al Servicio de Informatica del Instituto Andaluz de la Juventud",
    "datosbasicos__organo_contratacion": "Instituto Andaluz de la Juventud",
    "datosbasicos__tipo_contrato": "Servicios",
    "datosbasicos__procedimiento": "Abierto",
    "datosbasicos__tramitacion": "Ordinario",
    "datosbasicos__clasificacion_cpv": "72610000 Servicios de apoyo informatico.",
    "datosbasicos__duracion_contrato": "24 meses",
    "datosbasicos__division_por_lotes": "No",
    "datosbasicos__lugar_ejecucion_nuts": "ES61",
    "datosbasicos__lugar_ejecucion": [
        "ALMERIA",
        "CADIZ",
        "CORDOBA",
        "GRANADA",
        "HUELVA",
        "JAEN",
        "MALAGA",
        "SEVILLA"
    ],
    "importes__importe_licitacion_(sin_iva)": "725.289,26EUR",
    "importes__importe_licitacion_(con_iva)": "877.600,00EUR",
    "importes__valor_estimado": "1.450.578,52EUR",
    "importes__importe_adjudicacion_(sin_iva)": "696.356,57EUR",
    "importes__importe_adjudicacion_(con_iva)": "842.591,45EUR",
    "documentacion_complementaria": [
        {
            "numero_expediente": "IJ17.119.00CS",
            "link": "http://www.juntadeandalucia.es/contratacion/document/download?refCode=2018-0000019513&refDoc=2018-0000019513-0",
            "descripcion": "Pliego de Cl\u00e1usulas Administrativas Particulares (pdf) (408.96Kb)"
        },
        {
            "numero_expediente": "IJ17.119.00CS",
            "link": "http://www.juntadeandalucia.es/contratacion/document/download?refCode=2018-0000019513&refDoc=2018-0000019513-1",
            "descripcion": "Pliego de Prescripciones T\u00e9cnicas (pdf) (252.67Kb)"
        },
        {
            "numero_expediente": "IJ17.119.00CS",
            "link": "http://www.juntadeandalucia.es/contratacion/document/download?refCode=2018-0000022748&refDoc=2018-0000022748-0",
            "descripcion": "Anuncio adjudicaci\u00f3n en DOUE (pdf) (94.71Kb)"
        },
        {
            "numero_expediente": "IJ17.119.00CS",
            "link": "http://www.juntadeandalucia.es/contratacion/document/download?refCode=2018-0000019513&refDoc=2018-0000019513-2",
            "descripcion": "Resoluci\u00f3n constituci\u00f3n Mesa de contrataci\u00f3n (pdf) (354.45Kb)"
        },
        {
            "numero_expediente": "IJ17.119.00CS",
            "link": "http://www.juntadeandalucia.es/contratacion/document/download?refCode=2018-0000019513&refDoc=2018-0000019513-3",
            "descripcion": "Resoluci\u00f3n modificaci\u00f3n composici\u00f3n Mesa de Contrataci\u00f3n (pdf) (316.25Kb)"
        },
        {
            "numero_expediente": "IJ17.119.00CS",
            "link": "http://www.juntadeandalucia.es/contratacion/document/download?refCode=2018-0000019513&refDoc=2018-0000019513-7",
            "descripcion": "Resoluci\u00f3n modificaci\u00f3n composici\u00f3n Mesa de contrataci\u00f2n (pdf) (330.38Kb)"
        },
        {
            "numero_expediente": "IJ17.119.00CS",
            "link": "http://www.juntadeandalucia.es/contratacion/document/download?refCode=2018-0000019513&refDoc=2018-0000019513-4",
            "descripcion": "Acta Mesa de Contrataci\u00f3n sobre n\u00ba 1 de requisitos previos. Plazo de subsanaci\u00f3n (pdf) (742.71Kb)"
        },
        {
            "numero_expediente": "IJ17.119.00CS",
            "link": "http://www.juntadeandalucia.es/contratacion/document/download?refCode=2018-0000019513&refDoc=2018-0000019513-5",
            "descripcion": "Acta Mesa de Contrataci\u00f3n apertura sobre n\u00ba 2 (pdf) (661.01Kb)"
        },
        {
            "numero_expediente": "IJ17.119.00CS",
            "link": "http://www.juntadeandalucia.es/contratacion/document/download?refCode=2018-0000019513&refDoc=2018-0000019513-6",
            "descripcion": "Acta Mesa de contrataci\u00f3n apertura sobre n\u00ba 3 (pdf) (901.98Kb)"
        }
    ],
    "obtencion_documentacion_informacion": {
        "fecha_limite_obtencion": "09/04/2018 a las 14:00 horas",
        "lugar": [
            "Instituto Andaluz de la Juventud",
            "Calle Munoz Olive 1, 3a 41001 (Sevilla )"
        ],
        "puntos_contacto": [
            "Fernando Gonzalez Gonzalez, Servicio de Informatica, Instituto Andaluz de la Juventud",
            "955035000",
            "955035041",
            "CA-Informatica.iaj@juntadeandalucia.es",
            "http://www.juntadeandalucia.es/contratacion"
        ]
    },
    "requisitos_criterios_condiciones": {
        "requisitos_minimos_contratista": "Los establecidos en el pliego de cl\u00e1usulas administrativas particulares",
        "criterios_adjudicacion": "Los establecidos en el pliego de cl\u00e1usulas administrativas particulares",
        "criterios_objetivos_para_la_seleccion_candidatos_el_procedimiento": "Los establecidos en el pliego de cl\u00e1usulas administrativas particulares",
        "condiciones_especiales_adjudicacion_contrato": "Las establecidas en el pliego de cl\u00e1usulas administrativas particulares"
    },
    "presentacion_ofertas__fecha_limite_presentacion_ofertas": "09/04/2018 a las 14:00 horas",
    "presentacion_ofertas__notas": [
        "Calle Munoz Olive 1, 3a 41001 (Sevilla )",
        "Instituto Andaluz de la Juventud. Registro General.",
        "Las ofertas se presentaran necesariamente en el Registro General indicado o mediante envio por correo segun las indicaciones contenidas en el Pliego de Clausulas Administrativas Particulares."
    ],
    "apertura_ofertas": {
        "lugar": [
            "Instituto Andaluz de la Juventud. Sala de reuniones.",
            "Calle Munoz Olive 1, 3a 41001 (Sevilla )",
            "Fecha Apertura del sobre de criterios de adjudicacion que dependen de un juicio de valor : 02/05/2018 a las 13:00 horas",
            "Fecha Apertura del sobre de criterios de adjudicacion evaluables por aplicacion de formulas : 21/05/2018 a las 11:00 horas"
        ],
        "aclaraciones": "La apertura del sobre no 1, de requisitos previos, tendra lugar el dia 25 de abril de 2018, procediendose a publicar el resultado en este perfil del contratante para posibles subsanaciones en el plazo que determine la Mesa de Contratacion."
    },
    "referencias_diarios_oficiales": [
        {
            "numero_expediente": "IJ17.119.00CS",
            "link": "http://ted.europa.eu/TED/notice/udl?uri=TED:NOTICE:74061-2018:TEXT:ES:HTML",
            "descripcion": "DOUE n\u00ba S34 del a\u00f1o 2018, p\u00e1gina . ( Env\u00edo: 15/02/2018, Publicaci\u00f3n: 17/02/2018 ) Referencia 074061"
        },
        {
            "numero_expediente": "IJ17.119.00CS",
            "link": "http://www.juntadeandalucia.es/eboja/2018/39/BOJA18-039-00002-2984-01_00130718.pdf",
            "descripcion": "BOJA n\u00ba 39 del a\u00f1o 2018, p\u00e1gina 181 Referencia PD.561/2018"
        },
        {
            "numero_expediente": "IJ17.119.00CS",
            "link": "http://www.boe.es/boe/dias/2018/02/21/pdfs/BOE-B-2018-10461.pdf",
            "descripcion": "BOE n\u00ba 46 del a\u00f1o 2018, p\u00e1gina 13139 Referencia 10461"
        }
    ],
    "anuncios_publicados": [
        {
            "numero_expediente": "IJ17.119.00CS",
            "link": "http://www.juntadeandalucia.es/haciendayadministracionpublica/apl/verifirmapdc/descargaInformeParametros?transaccion=49z%2FsQeVZ76K4921OUK6rXP4a3pxggof&tipoPie=4",
            "descripcion": "19/02/2018 09:15, 2018-0000007015-Convocatoria de licitaci\u00f3n",
            "datetime": "2018-02-19T09:15:00+00:00",
            "anuncio_id": " 2018-0000007015",
            "anuncio_desc": "Convocatoria de licitaci\u00f3n"
        },
        {
            "numero_expediente": "IJ17.119.00CS",
            "link": "http://www.juntadeandalucia.es/haciendayadministracionpublica/apl/verifirmapdc/descargaInformeParametros?transaccion=BAcQDxV%2FzEvZfuR5REAgjM4cenB071d7&tipoPie=4",
            "descripcion": "19/02/2018 13:04, 2018-0000007515-Convocatoria de licitaci\u00f3n (Correci\u00f3n)",
            "datetime": "2018-02-19T13:04:00+00:00",
            "anuncio_id": " 2018-0000007515",
            "anuncio_desc": "Convocatoria de licitaci\u00f3n (Correci\u00f3n)"
        },
        {
            "numero_expediente": "IJ17.119.00CS",
            "link": "http://www.juntadeandalucia.es/haciendayadministracionpublica/apl/verifirmapdc/descargaInformeParametros?transaccion=bsgQp9S6JvPPHgJAhLD%2BuqVT2q%2Bc%2Fsfz&tipoPie=4",
            "descripcion": "23/02/2018 09:00, 2018-0000007818-Convocatoria de licitaci\u00f3n (Infor.Adicional)",
            "datetime": "2018-02-23T09:00:00+00:00",
            "anuncio_id": " 2018-0000007818",
            "anuncio_desc": "Convocatoria de licitaci\u00f3n (Infor.Adicional)"
        },
        {
            "numero_expediente": "IJ17.119.00CS",
            "link": "http://www.juntadeandalucia.es/haciendayadministracionpublica/apl/verifirmapdc/descargaInformeParametros?transaccion=e%2FGALMQr6ki%2FhLfjSaIEJSmkfG71%2BFxx&tipoPie=4",
            "descripcion": "06/04/2018 09:22, 2018-0000013415-Convocatoria de licitaci\u00f3n (Infor.Adicional)",
            "datetime": "2018-04-06T09:22:00+00:00",
            "anuncio_id": " 2018-0000013415",
            "anuncio_desc": "Convocatoria de licitaci\u00f3n (Infor.Adicional)"
        },
        {
            "numero_expediente": "IJ17.119.00CS",
            "link": "http://www.juntadeandalucia.es/haciendayadministracionpublica/apl/verifirmapdc/descargaInformeParametros?transaccion=9MTJvaACRfZFT4nWRwavPaVT2q%2Bc%2Fsfz&tipoPie=4",
            "descripcion": "13/04/2018 11:31, 2018-0000014400-Convocatoria de licitaci\u00f3n (Infor.Adicional)",
            "datetime": "2018-04-13T11:31:00+00:00",
            "anuncio_id": " 2018-0000014400",
            "anuncio_desc": "Convocatoria de licitaci\u00f3n (Infor.Adicional)"
        },
        {
            "numero_expediente": "IJ17.119.00CS",
            "link": "http://www.juntadeandalucia.es/haciendayadministracionpublica/apl/verifirmapdc/descargaInformeParametros?transaccion=%2BwTqA8WJY2uYfJv%2BvrD%2FyvI9rwqOEXGf&tipoPie=4",
            "descripcion": "25/04/2018 12:57, 2018-0000015418-Convocatoria de licitaci\u00f3n (Infor.Adicional)",
            "datetime": "2018-04-25T12:57:00+00:00",
            "anuncio_id": " 2018-0000015418",
            "anuncio_desc": "Convocatoria de licitaci\u00f3n (Infor.Adicional)"
        },
        {
            "numero_expediente": "IJ17.119.00CS",
            "link": "http://www.juntadeandalucia.es/haciendayadministracionpublica/apl/verifirmapdc/descargaInformeParametros?transaccion=IvTXRqjVUb4TxloFv0CpsvI9rwqOEXGf&tipoPie=4",
            "descripcion": "03/05/2018 09:24, 2018-0000016008-Convocatoria de licitaci\u00f3n (Infor.Adicional)",
            "datetime": "2018-05-03T09:24:00+00:00",
            "anuncio_id": " 2018-0000016008",
            "anuncio_desc": "Convocatoria de licitaci\u00f3n (Infor.Adicional)"
        },
        {
            "numero_expediente": "IJ17.119.00CS",
            "link": "http://www.juntadeandalucia.es/haciendayadministracionpublica/apl/verifirmapdc/descargaInformeParametros?transaccion=sEoF8uKsrgrIQ5PSmvp2hPI9rwqOEXGf&tipoPie=4",
            "descripcion": "22/05/2018 17:28, 2018-0000017757-Convocatoria de licitaci\u00f3n (Infor.Adicional)",
            "datetime": "2018-05-22T17:28:00+00:00",
            "anuncio_id": " 2018-0000017757",
            "anuncio_desc": "Convocatoria de licitaci\u00f3n (Infor.Adicional)"
        },
        {
            "numero_expediente": "IJ17.119.00CS",
            "link": "http://www.juntadeandalucia.es/haciendayadministracionpublica/apl/verifirmapdc/descargaInformeParametros?transaccion=4X9MedGuyFFVFfP549z5WIYdAfNuj%2FNj&tipoPie=4",
            "descripcion": "08/06/2018 11:57, 2018-0000019513-Convocatoria de licitaci\u00f3n (Infor.Adicional)",
            "datetime": "2018-06-08T11:57:00+00:00",
            "anuncio_id": " 2018-0000019513",
            "anuncio_desc": "Convocatoria de licitaci\u00f3n (Infor.Adicional)"
        },
        {
            "numero_expediente": "IJ17.119.00CS",
            "link": "http://www.juntadeandalucia.es/haciendayadministracionpublica/apl/verifirmapdc/descargaInformeParametros?transaccion=UB%2Bj3WHnp0oLAO%2FTL22%2B0nlqT3SzUohr&tipoPie=4",
            "descripcion": "21/06/2018 13:41, 2018-0000020921-Adjudicaci\u00f3n",
            "datetime": "2018-06-21T13:41:00+00:00",
            "anuncio_id": " 2018-0000020921",
            "anuncio_desc": "Adjudicaci\u00f3n"
        },
        {
            "numero_expediente": "IJ17.119.00CS",
            "link": "http://www.juntadeandalucia.es/haciendayadministracionpublica/apl/verifirmapdc/descargaInformeParametros?transaccion=matfYravdFZisZx2dZ50LKVT2q%2Bc%2Fsfz&tipoPie=4",
            "descripcion": "05/07/2018 08:56, 2018-0000022748-Adjudicaci\u00f3n (Infor.Adicional)",
            "datetime": "2018-07-05T08:56:00+00:00",
            "anuncio_id": " 2018-0000022748",
            "anuncio_desc": "Adjudicaci\u00f3n (Infor.Adicional)"
        },
        {
            "numero_expediente": "IJ17.119.00CS",
            "link": "http://www.juntadeandalucia.es/haciendayadministracionpublica/apl/verifirmapdc/descargaInformeParametros?transaccion=W5vgBR%2BCpZSfQo0lI9j2NKvJYER37PP1&tipoPie=4",
            "descripcion": "01/08/2018 13:14, 2018-0000026207-Formalizaci\u00f3n",
            "datetime": "2018-08-01T13:14:00+00:00",
            "anuncio_id": " 2018-0000026207",
            "anuncio_desc": "Formalizaci\u00f3n"
        }
    ],
    "id": 70599,
    "origen": {
        "url": "http://www.juntadeandalucia.es/temas/contratacion-publica/perfiles-licitaciones/detalle/000000070599.html",
        "terminos_uso": "http://www.juntadeandalucia.es/informacion/legal.html"
    }
}