{
    "obtencion_documentacion_informacion": {
        "puntos_contacto": [
            "Mar Reina Catalan",
            "955839100",
            "955839147",
            "contratacion.administrativa.asbg.sspa@juntadeandalucia.es",
            "http://www.juntadeandalucia.es/epsbg"
        ],
        "lugar": [
            "Agencia Publica Empresarial Sanitaria Bajo Guadalquivir",
            "Avda. Brigadas Internacionales, s/n 41710 (Utrera )"
        ]
    },
    "datosbasicos__titulo_expediente": "Suministro mediante arrendamiento (opcion renting) y mantenimiento de equipos de impresion para el Hospital de Alta Resolucion La Janda dependiente de la Agencia Publica Empresarial Sanitaria Bajo Guadalquivir",
    "datosbasicos__organo_contratacion": "Agencia Publica Empresarial Sanitaria Bajo Guadalquivir",
    "datosbasicos__clasificacion_cpv": "30120000 Fotocopiadoras, maquinas offset e impresoras.",
    "datosbasicos__tipo_contrato": "Suministros",
    "origen": {
        "url": "http://www.juntadeandalucia.es/temas/contratacion-publica/perfiles-licitaciones/detalle/000000092383.html",
        "terminos_uso": "http://www.juntadeandalucia.es/informacion/legal.html"
    },
    "presentacion_ofertas__notas": [
        "Agencia Publica Empresarial Sanitaria Bajo Guadalquivir",
        "Avda. Brigadas Internacionales, s/n 41710 (Utrera )"
    ],
    "apertura_ofertas": {
        "aclaraciones": "Se anunciara con 48 horas de antelacion en el Perfil del Contratante y en el tablon de anuncios de la Agencia.",
        "lugar": [
            "Agencia Publica Empresarial Sanitaria Bajo Guadalquivir",
            "Avda. Brigadas Internacionales, s/n 41710 (Utrera )",
            "Fecha Apertura del sobre de criterios de adjudicacion que dependen de un juicio de valor : 21/12/2018 a las 12:10 horas",
            "Fecha Apertura del sobre de criterios de adjudicacion evaluables por aplicacion de formulas : 15/03/2019 a las 11:45 horas"
        ]
    },
    "estado_expediente__adjudicatario": "INFORMATICA EL CORTE INGLES, S.A.",
    "datosbasicos__procedimiento": "Abierto",
    "datosbasicos__tramitacion": "Urgencia",
    "documentacion_complementaria": [
        {
            "link": "http://www.juntadeandalucia.es/contratacion/document/download?refCode=2019-0000038316&refDoc=2019-0000038316-0",
            "descripcion": "Resoluci\u00f3n de Adjudicaci\u00f3n (pdf) (205.95Kb)",
            "numero_expediente": "2018/PA-52-6"
        },
        {
            "link": "http://www.juntadeandalucia.es/contratacion/document/download?refCode=2019-0000028965&refDoc=2019-0000028965-7",
            "descripcion": "Designaci\u00f3n mesa de contrataci\u00f3n (pdf) (61.88Kb)",
            "numero_expediente": "2018/PA-52-6"
        },
        {
            "link": "http://www.juntadeandalucia.es/contratacion/document/download?refCode=2019-0000028965&refDoc=2019-0000028965-8",
            "descripcion": "Documento Europeo \u00danico de Contrataci\u00f3n (DEUC) en XML (xml) (125.06Kb)",
            "numero_expediente": "2018/PA-52-6"
        },
        {
            "link": "http://www.juntadeandalucia.es/contratacion/document/download?refCode=2019-0000028965&refDoc=2019-0000028965-9",
            "descripcion": "Documento Europeo \u00danico de Contrataci\u00f3n (DEUC) en PDF (pdf) (80Kb)",
            "numero_expediente": "2018/PA-52-6"
        },
        {
            "link": "http://www.juntadeandalucia.es/contratacion/document/download?refCode=2019-0000028965&refDoc=2019-0000028965-19",
            "descripcion": "Declaraci\u00f3n de Urgencia (pdf) (81.08Kb)",
            "numero_expediente": "2018/PA-52-6"
        },
        {
            "link": "http://www.juntadeandalucia.es/contratacion/document/download?refCode=2019-0000028965&refDoc=2019-0000028965-21",
            "descripcion": "PCAP \u00ecmpresi\u00f3n (pdf) (1080.6Kb)",
            "numero_expediente": "2018/PA-52-6"
        },
        {
            "link": "http://www.juntadeandalucia.es/contratacion/document/download?refCode=2019-0000028965&refDoc=2019-0000028965-22",
            "descripcion": "PPT impresi\u00f3n (pdf) (195.76Kb)",
            "numero_expediente": "2018/PA-52-6"
        },
        {
            "link": "http://www.juntadeandalucia.es/contratacion/document/download?refCode=2019-0000028965&refDoc=2019-0000028965-23",
            "descripcion": "Memoria justificativa de necesidad (pdf) (629.49Kb)",
            "numero_expediente": "2018/PA-52-6"
        },
        {
            "link": "http://www.juntadeandalucia.es/contratacion/document/download?refCode=2019-0000028965&refDoc=2019-0000028965-24",
            "descripcion": "Resoluci\u00f3n de modificaci\u00f3n de los pliegos (pdf) (242.65Kb)",
            "numero_expediente": "2018/PA-52-6"
        },
        {
            "link": "http://www.juntadeandalucia.es/contratacion/document/download?refCode=2019-0000028965&refDoc=2019-0000028965-25",
            "descripcion": "Aprobaci\u00f3n del expediente (pdf) (195.45Kb)",
            "numero_expediente": "2018/PA-52-6"
        },
        {
            "link": "http://www.juntadeandalucia.es/contratacion/document/download?refCode=2019-0000038316&refDoc=2019-0000038316-1",
            "descripcion": "Acta n\u00ba 3 Apertura de criterios evaluados mediante f\u00f3rmulas (pdf) (152.98Kb)",
            "numero_expediente": "2018/PA-52-6"
        },
        {
            "link": "http://www.juntadeandalucia.es/contratacion/document/download?refCode=2019-0000038316&refDoc=2019-0000038316-2",
            "descripcion": "Acta n\u00ba 4 Calificaci\u00f3n documentaci\u00f3n previa a la adjudicaci\u00f3n (pdf) (69.38Kb)",
            "numero_expediente": "2018/PA-52-6"
        },
        {
            "link": "http://www.juntadeandalucia.es/contratacion/document/download?refCode=2019-0000038316&refDoc=2019-0000038316-3",
            "descripcion": "Resoluci\u00f3n de Adjudicaci\u00f3n (pdf) (335.74Kb)",
            "numero_expediente": "2018/PA-52-6"
        },
        {
            "link": "http://www.juntadeandalucia.es/contratacion/document/download?refCode=2019-0000028965&refDoc=2019-0000028965-26",
            "descripcion": "Mesa de contrataci\u00f3n (Modificaci\u00f3n) (pdf) (68.91Kb)",
            "numero_expediente": "2018/PA-52-6"
        },
        {
            "link": "http://www.juntadeandalucia.es/contratacion/document/download?refCode=2019-0000028965&refDoc=2019-0000028965-27",
            "descripcion": "Mesa de contrataci\u00f3n (Modificaci\u00f3n) v2 (pdf) (68.54Kb)",
            "numero_expediente": "2018/PA-52-6"
        },
        {
            "link": "http://www.juntadeandalucia.es/contratacion/document/download?refCode=2019-0000028965&refDoc=2019-0000028965-30",
            "descripcion": "Informe de Valoraci\u00f3n (pdf) (220.43Kb)",
            "numero_expediente": "2018/PA-52-6"
        },
        {
            "link": "http://www.juntadeandalucia.es/contratacion/document/download?refCode=2019-0000028965&refDoc=2019-0000028965-28",
            "descripcion": "Acta n\u00ba 1 Calificaci\u00f3n documentaci\u00f3n requisitos previos (pdf) (93.72Kb)",
            "numero_expediente": "2018/PA-52-6"
        },
        {
            "link": "http://www.juntadeandalucia.es/contratacion/document/download?refCode=2019-0000028965&refDoc=2019-0000028965-29",
            "descripcion": "Acta n\u00ba 2 Apertura de criterios evaluados mediante juicio de valor (pdf) (119.88Kb)",
            "numero_expediente": "2018/PA-52-6"
        }
    ],
    "presentacion_ofertas__fecha_limite_presentacion_ofertas": "07/12/2018 a las 14:00 horas",
    "estado_expediente__nif": "A28855260",
    "datosbasicos__lugar_ejecucion": "CADIZ",
    "secciones": {
        "presentacion_ofertas": 6,
        "requisitos_criterios_condiciones": 4,
        "estado_expediente": 1,
        "apertura_ofertas": 7,
        "obtencion_documentacion_informacion": 3,
        "presentacion_solicitudes": 5,
        "referencias_diarios_oficiales": 8,
        "documentacion_complementaria": 2,
        "anuncios_publicados": 9,
        "importes": 0
    },
    "importes__importe_adjudicacion_(con_iva)": "103.500,88EUR",
    "id": 92383,
    "datosbasicos__duracion_contrato": "48 meses",
    "datosbasicos__lugar_tramitacion": "SEVILLA",
    "importes__importe_licitacion_(con_iva)": "160.138,91EUR",
    "referencias_diarios_oficiales": [],
    "importes__importe_licitacion_(sin_iva)": "132.346,21EUR",
    "importes__valor_estimado": "158.815,45EUR",
    "requisitos_criterios_condiciones": {
        "criterios_objetivos_para_la_seleccion_candidatos_el_procedimiento": "Los establecidos en el pliego de cl\u00e1usulas administrativas particulares",
        "condiciones_especiales_adjudicacion_contrato": "Las establecidas en el pliego de cl\u00e1usulas administrativas particulares",
        "requisitos_minimos_contratista": "Los establecidos en el pliego de cl\u00e1usulas administrativas particulares",
        "criterios_adjudicacion": "Los establecidos en el pliego de cl\u00e1usulas administrativas particulares"
    },
    "estado_expediente__no_licitadores": "9",
    "estado_expediente__notas": [
        "10/05/2019 12:07 - Adjudicacion (Infor.Adicional)",
        "Actualizado: Adjudicacion (Infor.Adicional)",
        "Se adjunta documento de informacion adicional"
    ],
    "datosbasicos__division_por_lotes": "No",
    "estado_expediente__fecha_adjudicacion": "10/04/2019",
    "estado_expediente__estado": "Adjudicado",
    "anuncios_publicados": [
        {
            "link": "http://www.juntadeandalucia.es/haciendayadministracionpublica/apl/verifirmapdc/descargaInformeParametros?transaccion=uF7U8gUweCyPrZ9kwvrT8avJYER37PP1&tipoPie=4",
            "numero_expediente": "2018/PA-52-6",
            "descripcion": "13/11/2018 12:45, 2018-0000046161-Convocatoria de licitaci\u00f3n",
            "datetime": "2018-11-13T12:45:00+00:00",
            "anuncio_id": " 2018-0000046161",
            "anuncio_desc": "Convocatoria de licitaci\u00f3n"
        },
        {
            "link": "http://www.juntadeandalucia.es/haciendayadministracionpublica/apl/verifirmapdc/descargaInformeParametros?transaccion=lkDKp1snF594Av%2Bq4uAnEYYdAfNuj%2FNj&tipoPie=4",
            "numero_expediente": "2018/PA-52-6",
            "descripcion": "14/11/2018 10:20, 2018-0000047716-Convocatoria de licitaci\u00f3n (Correcci\u00f3n)",
            "datetime": "2018-11-14T10:20:00+00:00",
            "anuncio_id": " 2018-0000047716",
            "anuncio_desc": "Convocatoria de licitaci\u00f3n (Correcci\u00f3n)"
        },
        {
            "link": "http://www.juntadeandalucia.es/haciendayadministracionpublica/apl/verifirmapdc/descargaInformeParametros?transaccion=SR6vlgSPAQjfr2mMbtNGlimkfG71%2BFxx&tipoPie=4",
            "numero_expediente": "2018/PA-52-6",
            "descripcion": "14/11/2018 14:16, 2018-0000047926-Convocatoria de licitaci\u00f3n (Correcci\u00f3n)",
            "datetime": "2018-11-14T14:16:00+00:00",
            "anuncio_id": " 2018-0000047926",
            "anuncio_desc": "Convocatoria de licitaci\u00f3n (Correcci\u00f3n)"
        },
        {
            "link": "http://www.juntadeandalucia.es/haciendayadministracionpublica/apl/verifirmapdc/descargaInformeParametros?transaccion=OqX7%2FdVwG1WsTObEc%2BPUZIYdAfNuj%2FNj&tipoPie=4",
            "numero_expediente": "2018/PA-52-6",
            "descripcion": "15/11/2018 11:35, 2018-0000048174-Convocatoria de licitaci\u00f3n (Infor.Adicional)",
            "datetime": "2018-11-15T11:35:00+00:00",
            "anuncio_id": " 2018-0000048174",
            "anuncio_desc": "Convocatoria de licitaci\u00f3n (Infor.Adicional)"
        },
        {
            "link": "http://www.juntadeandalucia.es/haciendayadministracionpublica/apl/verifirmapdc/descargaInformeParametros?transaccion=%2F%2FSoVsXhm4pbtRwKrRVfYvI9rwqOEXGf&tipoPie=4",
            "numero_expediente": "2018/PA-52-6",
            "descripcion": "21/11/2018 11:34, 2018-0000049578-Convocatoria de licitaci\u00f3n (Infor.Adicional)",
            "datetime": "2018-11-21T11:34:00+00:00",
            "anuncio_id": " 2018-0000049578",
            "anuncio_desc": "Convocatoria de licitaci\u00f3n (Infor.Adicional)"
        },
        {
            "link": "http://www.juntadeandalucia.es/haciendayadministracionpublica/apl/verifirmapdc/descargaInformeParametros?transaccion=Ig1EvaFN2U3Gph9MG6kcOCJqUCje%2B%2B1i&tipoPie=4",
            "numero_expediente": "2018/PA-52-6",
            "descripcion": "22/11/2018 13:21, 2018-0000049966-Convocatoria de licitaci\u00f3n (Correcci\u00f3n)",
            "datetime": "2018-11-22T13:21:00+00:00",
            "anuncio_id": " 2018-0000049966",
            "anuncio_desc": "Convocatoria de licitaci\u00f3n (Correcci\u00f3n)"
        },
        {
            "link": "http://www.juntadeandalucia.es/haciendayadministracionpublica/apl/verifirmapdc/descargaInformeParametros?transaccion=ga%2FZaUncZY7EXreOFoA7hPI9rwqOEXGf&tipoPie=4",
            "numero_expediente": "2018/PA-52-6",
            "descripcion": "27/11/2018 09:54, 2018-0000050685-Convocatoria de licitaci\u00f3n (Infor.Adicional)",
            "datetime": "2018-11-27T09:54:00+00:00",
            "anuncio_id": " 2018-0000050685",
            "anuncio_desc": "Convocatoria de licitaci\u00f3n (Infor.Adicional)"
        },
        {
            "link": "http://www.juntadeandalucia.es/haciendayadministracionpublica/apl/verifirmapdc/descargaInformeParametros?transaccion=9EWYAT5bHrR51kgNh9MQcnlqT3SzUohr&tipoPie=4",
            "numero_expediente": "2018/PA-52-6",
            "descripcion": "27/11/2018 10:12, 2018-0000050695-Convocatoria de licitaci\u00f3n (Correcci\u00f3n)",
            "datetime": "2018-11-27T10:12:00+00:00",
            "anuncio_id": " 2018-0000050695",
            "anuncio_desc": "Convocatoria de licitaci\u00f3n (Correcci\u00f3n)"
        },
        {
            "link": "http://www.juntadeandalucia.es/haciendayadministracionpublica/apl/verifirmapdc/descargaInformeParametros?transaccion=kDfPN%2BtyKXULM4bq6W5bUSJqUCje%2B%2B1i&tipoPie=4",
            "numero_expediente": "2018/PA-52-6",
            "descripcion": "28/11/2018 10:41, 2018-0000051047-Convocatoria de licitaci\u00f3n (Infor.Adicional)",
            "datetime": "2018-11-28T10:41:00+00:00",
            "anuncio_id": " 2018-0000051047",
            "anuncio_desc": "Convocatoria de licitaci\u00f3n (Infor.Adicional)"
        },
        {
            "link": "http://www.juntadeandalucia.es/haciendayadministracionpublica/apl/verifirmapdc/descargaInformeParametros?transaccion=n1WEMfKQVp%2BdfK49M2LD3CJqUCje%2B%2B1i&tipoPie=4",
            "numero_expediente": "2018/PA-52-6",
            "descripcion": "29/11/2018 14:04, 2018-0000051442-Convocatoria de licitaci\u00f3n (Correcci\u00f3n)",
            "datetime": "2018-11-29T14:04:00+00:00",
            "anuncio_id": " 2018-0000051442",
            "anuncio_desc": "Convocatoria de licitaci\u00f3n (Correcci\u00f3n)"
        },
        {
            "link": "http://www.juntadeandalucia.es/haciendayadministracionpublica/apl/verifirmapdc/descargaInformeParametros?transaccion=n1WEMfKQVp%2FELO1loUnSW%2FI9rwqOEXGf&tipoPie=4",
            "numero_expediente": "2018/PA-52-6",
            "descripcion": "29/11/2018 14:08, 2018-0000051488-Convocatoria de licitaci\u00f3n (Infor.Adicional)",
            "datetime": "2018-11-29T14:08:00+00:00",
            "anuncio_id": " 2018-0000051488",
            "anuncio_desc": "Convocatoria de licitaci\u00f3n (Infor.Adicional)"
        },
        {
            "link": "http://www.juntadeandalucia.es/haciendayadministracionpublica/apl/verifirmapdc/descargaInformeParametros?transaccion=Ct2URmRyx6xE6TPw5OMzoavJYER37PP1&tipoPie=4",
            "numero_expediente": "2018/PA-52-6",
            "descripcion": "11/12/2018 09:09, 2018-0000060916-Convocatoria de licitaci\u00f3n (Infor.Adicional)",
            "datetime": "2018-12-11T09:09:00+00:00",
            "anuncio_id": " 2018-0000060916",
            "anuncio_desc": "Convocatoria de licitaci\u00f3n (Infor.Adicional)"
        },
        {
            "link": "http://www.juntadeandalucia.es/haciendayadministracionpublica/apl/verifirmapdc/descargaInformeParametros?transaccion=UUWYKzc5WmX9hwgpjOE7sHP4a3pxggof&tipoPie=4",
            "numero_expediente": "2018/PA-52-6",
            "descripcion": "19/12/2018 12:11, 2018-0000062658-Convocatoria de licitaci\u00f3n (Infor.Adicional)",
            "datetime": "2018-12-19T12:11:00+00:00",
            "anuncio_id": " 2018-0000062658",
            "anuncio_desc": "Convocatoria de licitaci\u00f3n (Infor.Adicional)"
        },
        {
            "link": "http://www.juntadeandalucia.es/haciendayadministracionpublica/apl/verifirmapdc/descargaInformeParametros?transaccion=Mhz8Fbs%2FerlN8tnAg7HcVvI9rwqOEXGf&tipoPie=4",
            "numero_expediente": "2018/PA-52-6",
            "descripcion": "19/12/2018 13:04, 2018-0000062719-Convocatoria de licitaci\u00f3n (Correcci\u00f3n)",
            "datetime": "2018-12-19T13:04:00+00:00",
            "anuncio_id": " 2018-0000062719",
            "anuncio_desc": "Convocatoria de licitaci\u00f3n (Correcci\u00f3n)"
        },
        {
            "link": "http://www.juntadeandalucia.es/haciendayadministracionpublica/apl/verifirmapdc/descargaInformeParametros?transaccion=RgYZqM47Nu9%2F2JodX0hPu6vJYER37PP1&tipoPie=4",
            "numero_expediente": "2018/PA-52-6",
            "descripcion": "19/12/2018 13:22, 2018-0000062747-Convocatoria de licitaci\u00f3n (Infor.Adicional)",
            "datetime": "2018-12-19T13:22:00+00:00",
            "anuncio_id": " 2018-0000062747",
            "anuncio_desc": "Convocatoria de licitaci\u00f3n (Infor.Adicional)"
        },
        {
            "link": "http://www.juntadeandalucia.es/haciendayadministracionpublica/apl/verifirmapdc/descargaInformeParametros?transaccion=%2F5vDDf891lwYZi8UNmNbx3P4a3pxggof&tipoPie=4",
            "numero_expediente": "2018/PA-52-6",
            "descripcion": "15/01/2019 14:41, 2019-0000002512-Convocatoria de licitaci\u00f3n (Infor.Adicional)",
            "datetime": "2019-01-15T14:41:00+00:00",
            "anuncio_id": " 2019-0000002512",
            "anuncio_desc": "Convocatoria de licitaci\u00f3n (Infor.Adicional)"
        },
        {
            "link": "http://www.juntadeandalucia.es/haciendayadministracionpublica/apl/verifirmapdc/descargaInformeParametros?transaccion=HLUPh0Alu8LDwLFL%2FM5KGnlqT3SzUohr&tipoPie=4",
            "numero_expediente": "2018/PA-52-6",
            "descripcion": "23/01/2019 10:37, 2019-0000004468-Convocatoria de licitaci\u00f3n (Infor.Adicional)",
            "datetime": "2019-01-23T10:37:00+00:00",
            "anuncio_id": " 2019-0000004468",
            "anuncio_desc": "Convocatoria de licitaci\u00f3n (Infor.Adicional)"
        },
        {
            "link": "http://www.juntadeandalucia.es/haciendayadministracionpublica/apl/verifirmapdc/descargaInformeParametros?transaccion=M0w3yLbtlrLlR93LLrflKXlqT3SzUohr&tipoPie=4",
            "numero_expediente": "2018/PA-52-6",
            "descripcion": "13/03/2019 11:46, 2019-0000025463-Convocatoria de licitaci\u00f3n (Infor.Adicional)",
            "datetime": "2019-03-13T11:46:00+00:00",
            "anuncio_id": " 2019-0000025463",
            "anuncio_desc": "Convocatoria de licitaci\u00f3n (Infor.Adicional)"
        },
        {
            "link": "http://www.juntadeandalucia.es/haciendayadministracionpublica/apl/verifirmapdc/descargaInformeParametros?transaccion=fPJNkhYk7ywRLX1F9LP5aimkfG71%2BFxx&tipoPie=4",
            "numero_expediente": "2018/PA-52-6",
            "descripcion": "04/04/2019 09:56, 2019-0000028965-Convocatoria de licitaci\u00f3n (Infor.Adicional)",
            "datetime": "2019-04-04T09:56:00+00:00",
            "anuncio_id": " 2019-0000028965",
            "anuncio_desc": "Convocatoria de licitaci\u00f3n (Infor.Adicional)"
        },
        {
            "link": "http://www.juntadeandalucia.es/haciendayadministracionpublica/apl/verifirmapdc/descargaInformeParametros?transaccion=YbhrWd%2FS1X4usS61825OyoYdAfNuj%2FNj&tipoPie=4",
            "numero_expediente": "2018/PA-52-6",
            "descripcion": "11/04/2019 14:23, 2019-0000030498-Adjudicaci\u00f3n",
            "datetime": "2019-04-11T14:23:00+00:00",
            "anuncio_id": " 2019-0000030498",
            "anuncio_desc": "Adjudicaci\u00f3n"
        },
        {
            "link": "http://www.juntadeandalucia.es/haciendayadministracionpublica/apl/verifirmapdc/descargaInformeParametros?transaccion=ZHhc5TVwazXIa0DSmjsuoYYdAfNuj%2FNj&tipoPie=4",
            "numero_expediente": "2018/PA-52-6",
            "descripcion": "12/04/2019 13:44, 2019-0000030700-Adjudicaci\u00f3n (Correcci\u00f3n)",
            "datetime": "2019-04-12T13:44:00+00:00",
            "anuncio_id": " 2019-0000030700",
            "anuncio_desc": "Adjudicaci\u00f3n (Correcci\u00f3n)"
        },
        {
            "link": "http://www.juntadeandalucia.es/haciendayadministracionpublica/apl/verifirmapdc/descargaInformeParametros?transaccion=rZ%2BlJSR3tXDgjVEpy3oRsoJinNB9TyKu&tipoPie=4",
            "numero_expediente": "2018/PA-52-6",
            "descripcion": "23/04/2019 14:56, 2019-0000031720-Adjudicaci\u00f3n (Infor.Adicional)",
            "datetime": "2019-04-23T14:56:00+00:00",
            "anuncio_id": " 2019-0000031720",
            "anuncio_desc": "Adjudicaci\u00f3n (Infor.Adicional)"
        },
        {
            "link": "http://www.juntadeandalucia.es/haciendayadministracionpublica/apl/verifirmapdc/descargaInformeParametros?transaccion=B%2Bq6dil3WNt02%2FRv75sH06VT2q%2Bc%2Fsfz&tipoPie=4",
            "numero_expediente": "2018/PA-52-6",
            "descripcion": "10/05/2019 12:07, 2019-0000038316-Adjudicaci\u00f3n (Infor.Adicional)",
            "datetime": "2019-05-10T12:07:00+00:00",
            "anuncio_id": " 2019-0000038316",
            "anuncio_desc": "Adjudicaci\u00f3n (Infor.Adicional)"
        }
    ],
    "datosbasicos__numero_expediente": "2018/PA-52-6",
    "datosbasicos__descripcion": "Suministro mediante arrendamiento (opcion renting) y mantenimiento de equipos de impresion para el Hospital de Alta Resolucion La Janda dependiente de la Agencia Publica Empresarial Sanitaria Bajo Guadalquivir",
    "datosbasicos__lugar_ejecucion_nuts": "ES612",
    "importes__importe_adjudicacion_(sin_iva)": "85.537,92EUR"
}