{
    "estado_expediente__notas": [
        "05/04/2018 12:36 - Formalizacion",
        "Actualizado: Formalizacion"
    ],
    "estado_expediente__estado": "Resuelta (Formalizado)",
    "datosbasicos__procedimiento": "Abierto",
    "estado_expediente__adjudicatario": "EVERIS SPAIN S.L.U.",
    "anuncios_publicados": [
        {
            "descripcion": "01/08/2017 09:32, 2017-0000017832-Convocatoria de licitaci\u00f3n",
            "datetime": "2017-08-01T09:32:00+00:00",
            "anuncio_id": " 2017-0000017832",
            "link": "http://www.juntadeandalucia.es/haciendayadministracionpublica/apl/verifirmapdc/descargaInformeParametros?transaccion=r59QriyvNubJT6T6%2BLzTwoJinNB9TyKu&tipoPie=4",
            "numero_expediente": "2017/000023",
            "anuncio_desc": "Convocatoria de licitaci\u00f3n"
        },
        {
            "descripcion": "11/08/2017 13:07, 2017-0000018742-Convocatoria de licitaci\u00f3n (Infor.Adicional)",
            "datetime": "2017-08-11T13:07:00+00:00",
            "anuncio_id": " 2017-0000018742",
            "link": "http://www.juntadeandalucia.es/haciendayadministracionpublica/apl/verifirmapdc/descargaInformeParametros?transaccion=AeNWRt0KRYpKrUKrrMEbjc4cenB071d7&tipoPie=4",
            "numero_expediente": "2017/000023",
            "anuncio_desc": "Convocatoria de licitaci\u00f3n (Infor.Adicional)"
        },
        {
            "descripcion": "28/09/2017 13:41, 2017-0000021796-Convocatoria de licitaci\u00f3n (Infor.Adicional)",
            "datetime": "2017-09-28T13:41:00+00:00",
            "anuncio_id": " 2017-0000021796",
            "link": "http://www.juntadeandalucia.es/haciendayadministracionpublica/apl/verifirmapdc/descargaInformeParametros?transaccion=0DTpvh%2FkylqGZq6X6UHW5fI9rwqOEXGf&tipoPie=4",
            "numero_expediente": "2017/000023",
            "anuncio_desc": "Convocatoria de licitaci\u00f3n (Infor.Adicional)"
        },
        {
            "descripcion": "28/09/2017 13:48, 2017-0000021798-Convocatoria de licitaci\u00f3n (Infor.Adicional)",
            "datetime": "2017-09-28T13:48:00+00:00",
            "anuncio_id": " 2017-0000021798",
            "link": "http://www.juntadeandalucia.es/haciendayadministracionpublica/apl/verifirmapdc/descargaInformeParametros?transaccion=Y7lpdnY4x5%2B2cT8PE2CbwIYdAfNuj%2FNj&tipoPie=4",
            "numero_expediente": "2017/000023",
            "anuncio_desc": "Convocatoria de licitaci\u00f3n (Infor.Adicional)"
        },
        {
            "descripcion": "28/09/2017 14:26, 2017-0000021809-Convocatoria de licitaci\u00f3n (Infor.Adicional)",
            "datetime": "2017-09-28T14:26:00+00:00",
            "anuncio_id": " 2017-0000021809",
            "link": "http://www.juntadeandalucia.es/haciendayadministracionpublica/apl/verifirmapdc/descargaInformeParametros?transaccion=A0nM%2FmTRpRSwz704VdjARPI9rwqOEXGf&tipoPie=4",
            "numero_expediente": "2017/000023",
            "anuncio_desc": "Convocatoria de licitaci\u00f3n (Infor.Adicional)"
        },
        {
            "descripcion": "05/10/2017 13:32, 2017-0000022467-Convocatoria de licitaci\u00f3n (Infor.Adicional)",
            "datetime": "2017-10-05T13:32:00+00:00",
            "anuncio_id": " 2017-0000022467",
            "link": "http://www.juntadeandalucia.es/haciendayadministracionpublica/apl/verifirmapdc/descargaInformeParametros?transaccion=V%2BZX8hMD3vDM5bD9h0qIRPI9rwqOEXGf&tipoPie=4",
            "numero_expediente": "2017/000023",
            "anuncio_desc": "Convocatoria de licitaci\u00f3n (Infor.Adicional)"
        },
        {
            "descripcion": "17/10/2017 14:35, 2017-0000023304-Convocatoria de licitaci\u00f3n (Infor.Adicional)",
            "datetime": "2017-10-17T14:35:00+00:00",
            "anuncio_id": " 2017-0000023304",
            "link": "http://www.juntadeandalucia.es/haciendayadministracionpublica/apl/verifirmapdc/descargaInformeParametros?transaccion=8PkPmdd41eaFlAAZBBSiDoJinNB9TyKu&tipoPie=4",
            "numero_expediente": "2017/000023",
            "anuncio_desc": "Convocatoria de licitaci\u00f3n (Infor.Adicional)"
        },
        {
            "descripcion": "24/10/2017 17:30, 2017-0000024043-Convocatoria de licitaci\u00f3n (Infor.Adicional)",
            "datetime": "2017-10-24T17:30:00+00:00",
            "anuncio_id": " 2017-0000024043",
            "link": "http://www.juntadeandalucia.es/haciendayadministracionpublica/apl/verifirmapdc/descargaInformeParametros?transaccion=rpTXr86iQ%2BkSBYMaeEmXzaVT2q%2Bc%2Fsfz&tipoPie=4",
            "numero_expediente": "2017/000023",
            "anuncio_desc": "Convocatoria de licitaci\u00f3n (Infor.Adicional)"
        },
        {
            "descripcion": "27/10/2017 12:29, 2017-0000024429-Convocatoria de licitaci\u00f3n (Infor.Adicional)",
            "datetime": "2017-10-27T12:29:00+00:00",
            "anuncio_id": " 2017-0000024429",
            "link": "http://www.juntadeandalucia.es/haciendayadministracionpublica/apl/verifirmapdc/descargaInformeParametros?transaccion=7yfaYI7hhMtRBhsOdSHZ4oYdAfNuj%2FNj&tipoPie=4",
            "numero_expediente": "2017/000023",
            "anuncio_desc": "Convocatoria de licitaci\u00f3n (Infor.Adicional)"
        },
        {
            "descripcion": "31/10/2017 19:16, 2017-0000024866-Convocatoria de licitaci\u00f3n (Infor.Adicional)",
            "datetime": "2017-10-31T19:16:00+00:00",
            "anuncio_id": " 2017-0000024866",
            "link": "http://www.juntadeandalucia.es/haciendayadministracionpublica/apl/verifirmapdc/descargaInformeParametros?transaccion=yZzAbTEnYCMhWrVkAC42RaVT2q%2Bc%2Fsfz&tipoPie=4",
            "numero_expediente": "2017/000023",
            "anuncio_desc": "Convocatoria de licitaci\u00f3n (Infor.Adicional)"
        },
        {
            "descripcion": "15/11/2017 13:38, 2017-0000026796-Adjudicaci\u00f3n",
            "datetime": "2017-11-15T13:38:00+00:00",
            "anuncio_id": " 2017-0000026796",
            "link": "http://www.juntadeandalucia.es/haciendayadministracionpublica/apl/verifirmapdc/descargaInformeParametros?transaccion=plRDxjPBpa05AW7D09GxiSJqUCje%2B%2B1i&tipoPie=4",
            "numero_expediente": "2017/000023",
            "anuncio_desc": "Adjudicaci\u00f3n"
        },
        {
            "descripcion": "13/12/2017 14:48, 2017-0000029364-Adjudicaci\u00f3n (Suspendido)",
            "datetime": "2017-12-13T14:48:00+00:00",
            "anuncio_id": " 2017-0000029364",
            "link": "http://www.juntadeandalucia.es/haciendayadministracionpublica/apl/verifirmapdc/descargaInformeParametros?transaccion=b0TGyGGjfGMkibMliVjeRs4cenB071d7&tipoPie=4",
            "numero_expediente": "2017/000023",
            "anuncio_desc": "Adjudicaci\u00f3n (Suspendido)"
        },
        {
            "descripcion": "05/04/2018 12:29, 2018-0000013304-Adjudicaci\u00f3n (Levantamiento)",
            "datetime": "2018-04-05T12:29:00+00:00",
            "anuncio_id": " 2018-0000013304",
            "link": "http://www.juntadeandalucia.es/haciendayadministracionpublica/apl/verifirmapdc/descargaInformeParametros?transaccion=EaQACksrVZE5U4g2D5VDcaVT2q%2Bc%2Fsfz&tipoPie=4",
            "numero_expediente": "2017/000023",
            "anuncio_desc": "Adjudicaci\u00f3n (Levantamiento)"
        },
        {
            "descripcion": "05/04/2018 12:36, 2018-0000013345-Formalizaci\u00f3n",
            "datetime": "2018-04-05T12:36:00+00:00",
            "anuncio_id": " 2018-0000013345",
            "link": "http://www.juntadeandalucia.es/haciendayadministracionpublica/apl/verifirmapdc/descargaInformeParametros?transaccion=EaQACksrVZHYrY3ekzVyDymkfG71%2BFxx&tipoPie=4",
            "numero_expediente": "2017/000023",
            "anuncio_desc": "Formalizaci\u00f3n"
        }
    ],
    "estado_expediente__fecha_adjudicacion": "14/11/2017",
    "importes__importe_adjudicacion_(sin_iva)": "120.000,00EUR",
    "estado_expediente__fecha_la_formalizacion": "19/01/2018",
    "id": 449,
    "datosbasicos__lugar_tramitacion": "SEVILLA",
    "datosbasicos__titulo_expediente": "SERVICIO DE OFICINA TECNICA PARA LA EVALUACION DE POLITICAS Y SERVICIOS PUBLICOS",
    "datosbasicos__lugar_ejecucion_nuts": "ES618",
    "presentacion_ofertas__notas": [
        "A los efectos de lo previsto en la clausula 9.1 del Pliego de Clausulas Administrativas Particulares, en caso de presentacion de la oferta por correo certificado, el anuncio de presentacion debera realizarse exclusivamente en el Fax del Registro General del IAAP: 955 04 24 17",
        "C/ TORNEO No 26 41002 (SEVILLA )",
        "INSTITUTO ANDALUZ DE ADMINISTRACION PUBLICA"
    ],
    "requisitos_criterios_condiciones": {
        "requisitos_minimos_contratista": "Los establecidos en el pliego de cl\u00e1usulas administrativas particulares",
        "criterios_adjudicacion": "Los establecidos en el pliego de cl\u00e1usulas administrativas particulares",
        "criterios_objetivos_para_la_seleccion_candidatos_el_procedimiento": "Los establecidos en el pliego de cl\u00e1usulas administrativas particulares",
        "condiciones_especiales_adjudicacion_contrato": "Las establecidas en el pliego de cl\u00e1usulas administrativas particulares"
    },
    "datosbasicos__descripcion": "SERVICIO DE OFICINA TECNICA PARA LA EVALUACION DE POLITICAS Y SERVICIOS PUBLICOS",
    "datosbasicos__organo_contratacion": "Instituto Andaluz de Administracion Publica",
    "datosbasicos__division_por_lotes": "No",
    "referencias_diarios_oficiales": [
        {
            "descripcion": "BOE n\u00ba 188 del a\u00f1o 2017, p\u00e1gina 58766. ( Env\u00edo: 28/07/2017, Publicaci\u00f3n: 08/08/2017 ) Referencia",
            "link": "https://www.boe.es/diario_boe/txt.php?id=BOE-B-2017-47881",
            "numero_expediente": "2017/000023"
        },
        {
            "descripcion": "DOUE n\u00ba S145 del a\u00f1o 2017, p\u00e1gina 29955. ( Env\u00edo: 27/07/2017, Publicaci\u00f3n: 01/08/2017 ) Referencia",
            "link": "http://ted.europa.eu/udl?uri=TED:NOTICE:299553-2017:TEXT:ES:HTML",
            "numero_expediente": "2017/000023"
        },
        {
            "descripcion": "BOJA n\u00ba 154 del a\u00f1o 2017, p\u00e1gina 157. ( Env\u00edo: 31/07/2017, Publicaci\u00f3n: 11/08/2017 ) Referencia",
            "link": "http://juntadeandalucia.es/boja/2017/154/22",
            "numero_expediente": "2017/000023"
        }
    ],
    "datosbasicos__clasificacion_cpv": "73210000 Servicios de consultoria en investigacion.",
    "importes__importe_licitacion_(con_iva)": "197.472,00EUR",
    "obtencion_documentacion_informacion": {
        "fecha_limite_obtencion": "18/09/2017 a las 14:00 horas",
        "lugar": [
            "INSTITUTO ANDALUZ DE ADMINISTRACION PUBLICA",
            "C/ TORNEO No 26 41002 (SEVILLA )"
        ],
        "puntos_contacto": [
            "JESUS BENJUMEA VAZQUEZ",
            "955042437",
            "contratacion.iaap@juntadeandalucia.es"
        ]
    },
    "datosbasicos__lugar_ejecucion": "SEVILLA",
    "estado_expediente__no_licitadores": "3",
    "apertura_ofertas": {
        "aclaraciones": "Se informara de las fechas de celebracion de las mesas de contratacion y de apertura de ofertas a traves del perfil del contratante del IAAP",
        "lugar": [
            "INSTITUTO ANDALUZ DE ADMINISTRACION PUBLICA",
            "C/ TORNEO No 26 41002 (SEVILLA )",
            "Fecha Apertura del sobre de criterios de adjudicacion que dependen de un juicio de valor : 04/10/2017 a las 10:00 horas",
            "Fecha Apertura del sobre de criterios de adjudicacion evaluables por aplicacion de formulas : 31/10/2017 a las 10:00 horas"
        ]
    },
    "origen": {
        "terminos_uso": "http://www.juntadeandalucia.es/informacion/legal.html",
        "url": "http://www.juntadeandalucia.es/temas/contratacion-publica/perfiles-licitaciones/detalle/000000000449.html"
    },
    "presentacion_ofertas__fecha_limite_presentacion_ofertas": "20/09/2017 a las 14:00 horas",
    "datosbasicos__tipo_contrato": "Servicios",
    "documentacion_complementaria": [
        {
            "descripcion": "Resoluci\u00f3n de Adjudicaci\u00f3n (pdf) (195.48Kb)",
            "link": "http://www.juntadeandalucia.es/contratacion/document/download?refCode=2018-0000013304&refDoc=2018-0000013304-0",
            "numero_expediente": "2017/000023"
        },
        {
            "descripcion": "PLIEGO DE PRESCRIPCIONES T\u00c9CNICAS PARTICULARES (pdf) (102.31Kb)",
            "link": "http://www.juntadeandalucia.es/contratacion/document/download?refCode=2017-0000024866&refDoc=2017-0000024866-0",
            "numero_expediente": "2017/000023"
        },
        {
            "descripcion": "PLIEGO DE CL\u00c1USULAS ADMINISTRATIVAS PARTICULARES (pdf) (949.1Kb)",
            "link": "http://www.juntadeandalucia.es/contratacion/document/download?refCode=2017-0000024866&refDoc=2017-0000024866-1",
            "numero_expediente": "2017/000023"
        },
        {
            "descripcion": "DESIGNACI\u00d3N COMPOSICI\u00d3N MESA (pdf) (81.9Kb)",
            "link": "http://www.juntadeandalucia.es/contratacion/document/download?refCode=2017-0000024866&refDoc=2017-0000024866-2",
            "numero_expediente": "2017/000023"
        },
        {
            "descripcion": "Nota informativa Mesa n\u00ba 1 (pdf) (66.99Kb)",
            "link": "http://www.juntadeandalucia.es/contratacion/document/download?refCode=2017-0000024866&refDoc=2017-0000024866-3",
            "numero_expediente": "2017/000023"
        },
        {
            "descripcion": "Nota informativa Mesa n\u00ba 2 (pdf) (61.09Kb)",
            "link": "http://www.juntadeandalucia.es/contratacion/document/download?refCode=2017-0000024866&refDoc=2017-0000024866-4",
            "numero_expediente": "2017/000023"
        },
        {
            "descripcion": "NOTA INFORMATIVA MESA N\u00ba 3 (pdf) (61.5Kb)",
            "link": "http://www.juntadeandalucia.es/contratacion/document/download?refCode=2017-0000024866&refDoc=2017-0000024866-5",
            "numero_expediente": "2017/000023"
        },
        {
            "descripcion": "Nota Informativa Resultados de Mesa n\u00ba 4 (pdf) (61.16Kb)",
            "link": "http://www.juntadeandalucia.es/contratacion/document/download?refCode=2017-0000024866&refDoc=2017-0000024866-6",
            "numero_expediente": "2017/000023"
        },
        {
            "descripcion": "NOTA INFORMATIVA MESA N\u00ba 5 (pdf) (79.24Kb)",
            "link": "http://www.juntadeandalucia.es/contratacion/document/download?refCode=2017-0000024866&refDoc=2017-0000024866-7",
            "numero_expediente": "2017/000023"
        },
        {
            "descripcion": "Solicitud de expediente (pdf) (62.7Kb)",
            "link": "http://www.juntadeandalucia.es/contratacion/document/download?refCode=2018-0000013304&refDoc=2018-0000013304-1",
            "numero_expediente": "2017/000023"
        },
        {
            "descripcion": "Resoluci\u00f3n TRCJA (pdf) (1693.29Kb)",
            "link": "http://www.juntadeandalucia.es/contratacion/document/download?refCode=2018-0000013304&refDoc=2018-0000013304-2",
            "numero_expediente": "2017/000023"
        }
    ],
    "datosbasicos__numero_expediente": "2017/000023",
    "importes__importe_licitacion_(sin_iva)": "163.200,00EUR",
    "importes__importe_adjudicacion_(con_iva)": "145.200,00EUR",
    "datosbasicos__duracion_contrato": "12 meses",
    "estado_expediente__nif": "B82387770",
    "importes__valor_estimado": "326.400,00EUR",
    "secciones": {
        "documentacion_complementaria": 2,
        "presentacion_solicitudes": 5,
        "referencias_diarios_oficiales": 8,
        "apertura_ofertas": 7,
        "obtencion_documentacion_informacion": 3,
        "estado_expediente": 1,
        "requisitos_criterios_condiciones": 4,
        "presentacion_ofertas": 6,
        "importes": 0,
        "anuncios_publicados": 9
    }
}