{
    "secciones": {
        "importes": 0,
        "estado_expediente": 1,
        "documentacion_complementaria": 2,
        "obtencion_documentacion_informacion": 3,
        "requisitos_criterios_condiciones": 4,
        "presentacion_solicitudes": 5,
        "presentacion_ofertas": 6,
        "apertura_ofertas": 7,
        "referencias_diarios_oficiales": 8,
        "anuncios_publicados": 9
    },
    "datosbasicos__numero_expediente": "ADM/2017/0005",
    "datosbasicos__titulo_expediente": "SUMINISTRO DE LA PLATAFORMA DE DETECCION Y MONITORIZACION DE EVENTOS DE SEGURIDAD Y SERVICIOS PROFESIONALES ASOCIADOS PARA LA RESPUESTA A INCIDENTES DE SEGURIDAD DIGITAL EN LA JUNTA DE ANDALUCIA",
    "datosbasicos__descripcion": "El objeto de este contrato es el suministro, instalacion, integracion y mantenimiento de una plataforma de monitorizacion de eventos y deteccion de incidentes de seguridad a ubicar en los dos nodos de interconexion de la Red Corporativa de Telecomunicaciones de la Junta de Andalucia. Dicha plataforma tendra la capacidad de analizar trafico de red, recoger y normalizar eventos de seguridad y flujos de distintas fuentes, realizar correlacion y generar alarmas, gestionables a traves de una consola de operacion integrada, con capacidad para generar informes y definir politicas de riesgo.",
    "datosbasicos__organo_contratacion": "Consejeria de Empleo, Empresa y Comercio. Secretaria General Tecnica",
    "datosbasicos__tipo_contrato": "Suministros",
    "datosbasicos__procedimiento": "Abierto",
    "datosbasicos__tramitacion": "Ordinario",
    "datosbasicos__clasificacion_cpv": "48732000 Paquetes de software de seguridad de datos",
    "datosbasicos__duracion_contrato": "4 anos",
    "datosbasicos__division_por_lotes": "No",
    "datosbasicos__lugar_tramitacion": "SEVILLA",
    "datosbasicos__lugar_ejecucion_nuts": "ES618",
    "datosbasicos__lugar_ejecucion": "SEVILLA",
    "importes__importe_licitacion_(sin_iva)": "1.044.070,25EUR",
    "importes__importe_licitacion_(con_iva)": "1.263.325,00EUR",
    "importes__valor_estimado": "1.292.004,25EUR",
    "importes__importe_adjudicacion_(sin_iva)": "599.906,00EUR",
    "importes__importe_adjudicacion_(con_iva)": "725.886,26EUR",
    "documentacion_complementaria": [
        {
            "numero_expediente": "ADM/2017/0005",
            "link": "http://www.juntadeandalucia.es/contratacion/document/download?refCode=2018-0000020824&refDoc=2018-0000020824-0",
            "descripcion": "Resoluci\u00f3n de adjudicaci\u00f3n (pdf) (97.64Kb)"
        },
        {
            "numero_expediente": "ADM/2017/0005",
            "link": "http://www.juntadeandalucia.es/contratacion/document/download?refCode=2018-0000019129&refDoc=2018-0000019129-0",
            "descripcion": "PLIEGO DE CL\u00c1USULAS ADMINISTRATIVAS PARTICULARES (pdf) (982.55Kb)"
        },
        {
            "numero_expediente": "ADM/2017/0005",
            "link": "http://www.juntadeandalucia.es/contratacion/document/download?refCode=2018-0000019129&refDoc=2018-0000019129-1",
            "descripcion": "PLIEGO DE PRESCRIPCIONES T\u00c9CNICAS (pdf) (497.95Kb)"
        },
        {
            "numero_expediente": "ADM/2017/0005",
            "link": "http://www.juntadeandalucia.es/contratacion/document/download?refCode=2018-0000019129&refDoc=2018-0000019129-2",
            "descripcion": "NOTA ACLARATORIA DE DUDAS PLANTEADAS (pdf) (86.15Kb)"
        },
        {
            "numero_expediente": "ADM/2017/0005",
            "link": "http://www.juntadeandalucia.es/contratacion/document/download?refCode=2018-0000019129&refDoc=2018-0000019129-3",
            "descripcion": "Nota aclaratoria de dudas planteadas (pdf) (80.97Kb)"
        },
        {
            "numero_expediente": "ADM/2017/0005",
            "link": "http://www.juntadeandalucia.es/contratacion/document/download?refCode=2018-0000019129&refDoc=2018-0000019129-4",
            "descripcion": "Notas aclaratorias a nuevas consultas planteadas (pdf) (82.02Kb)"
        },
        {
            "numero_expediente": "ADM/2017/0005",
            "link": "http://www.juntadeandalucia.es/contratacion/document/download?refCode=2018-0000019129&refDoc=2018-0000019129-5",
            "descripcion": "Nota aclaratoria a dudas planteadas Vector (pdf) (77.38Kb)"
        },
        {
            "numero_expediente": "ADM/2017/0005",
            "link": "http://www.juntadeandalucia.es/contratacion/document/download?refCode=2018-0000019129&refDoc=2018-0000019129-6",
            "descripcion": "ACTA 1\u00aa MESA DE CONTRATACI\u00d3N (pdf) (116.04Kb)"
        },
        {
            "numero_expediente": "ADM/2017/0005",
            "link": "http://www.juntadeandalucia.es/contratacion/document/download?refCode=2018-0000019129&refDoc=2018-0000019129-7",
            "descripcion": "ACTA DE LA 2\u00aa MESA DE CONTRATACI\u00d3N (pdf) (106.12Kb)"
        },
        {
            "numero_expediente": "ADM/2017/0005",
            "link": "http://www.juntadeandalucia.es/contratacion/document/download?refCode=2018-0000019129&refDoc=2018-0000019129-8",
            "descripcion": "ACTA DE LA 3\u00aa MESA DE CONTRATACI\u00d3N (pdf) (110.18Kb)"
        },
        {
            "numero_expediente": "ADM/2017/0005",
            "link": "http://www.juntadeandalucia.es/contratacion/document/download?refCode=2018-0000019129&refDoc=2018-0000019129-9",
            "descripcion": "Acta 4\u00aa sesi\u00f3n de la mesa de contrataci\u00f3n (pdf) (1521.67Kb)"
        },
        {
            "numero_expediente": "ADM/2017/0005",
            "link": "http://www.juntadeandalucia.es/contratacion/document/download?refCode=2018-0000019129&refDoc=2018-0000019129-10",
            "descripcion": "Acta 5\u00aa sesi\u00f3n de la mesa de contrataci\u00f3n (pdf) (753.8Kb)"
        },
        {
            "numero_expediente": "ADM/2017/0005",
            "link": "http://www.juntadeandalucia.es/contratacion/document/download?refCode=2018-0000019129&refDoc=2018-0000019129-11",
            "descripcion": "Acta 7\u00aa sesi\u00f3n de la mesa de contrataci\u00f3n (pdf) (1573.7Kb)"
        },
        {
            "numero_expediente": "ADM/2017/0005",
            "link": "http://www.juntadeandalucia.es/contratacion/document/download?refCode=2018-0000019129&refDoc=2018-0000019129-12",
            "descripcion": "Acta 6\u00aa sesi\u00f3n de la mesa de contrataci\u00f3n (pdf) (67.38Kb)"
        },
        {
            "numero_expediente": "ADM/2017/0005",
            "link": "http://www.juntadeandalucia.es/contratacion/document/download?refCode=2018-0000019129&refDoc=2018-0000019129-13",
            "descripcion": "Acta 8\u00aa sesi\u00f3n de la mesa de contrataci\u00f3n (pdf) (120.87Kb)"
        }
    ],
    "obtencion_documentacion_informacion": {
        "lugar": [
            "Consejeria de Empleo, Empresa y Comercio",
            "C/Albert Einstein no4, Edificio World Trade Center, Isla de la Cartuja 41092 (Sevilla )"
        ],
        "puntos_contacto": [
            "Servicio de Administracion General y Contratacion",
            "954995205",
            "954995230",
            "sv.admonycont.cont.ceec@juntadeandalucia.es"
        ]
    },
    "requisitos_criterios_condiciones": {
        "requisitos_minimos_contratista": "Los establecidos en el pliego de cl\u00e1usulas administrativas particulares",
        "criterios_adjudicacion": "Los establecidos en el pliego de cl\u00e1usulas administrativas particulares",
        "criterios_objetivos_para_la_seleccion_candidatos_el_procedimiento": "Los establecidos en el pliego de cl\u00e1usulas administrativas particulares",
        "condiciones_especiales_adjudicacion_contrato": "Las establecidas en el pliego de cl\u00e1usulas administrativas particulares"
    },
    "presentacion_ofertas__fecha_limite_presentacion_ofertas": "14/09/2017 a las 20:00 horas",
    "presentacion_ofertas__notas": [
        "C/Albert Einstein no4, Edificio World Trade Center, Isla de la Cartuja 41092 (Sevilla )",
        "Consejeria de Empleo, Empresa y Comercio"
    ],
    "apertura_ofertas": {
        "lugar": [
            "Consejeria de Empleo, Empresa y Comercio",
            "C/Albert Einstein no4, Edificio World Trade Center, Isla de la Cartuja 41092 (Sevilla )",
            "Fecha Apertura del sobre de criterios de adjudicacion que dependen de un juicio de valor : 09/10/2017 a las 09:30 horas",
            "Fecha Apertura del sobre de criterios de adjudicacion evaluables por aplicacion de formulas : 02/03/2018 a las 10:30 horas"
        ],
        "aclaraciones": "La apertura del Sobre no 3 se realizara en la Sala de Juntas de la Consejeria de Empleo, Empresa y Comercio, sita la planta baja del edificio World Trade Center, en C/Albert Einstein no4, Isla de la Cartuja, Sevilla"
    },
    "referencias_diarios_oficiales": [],
    "anuncios_publicados": [
        {
            "numero_expediente": "ADM/2017/0005",
            "link": "http://www.juntadeandalucia.es/haciendayadministracionpublica/apl/verifirmapdc/descargaInformeParametros?transaccion=%2B7xlQxdXl8iafWlVWZKGaXlqT3SzUohr&tipoPie=4",
            "descripcion": "17/08/2017 23:15, 2017-0000018913-Convocatoria de licitaci\u00f3n",
            "datetime": "2017-08-17T23:15:00+00:00",
            "anuncio_id": " 2017-0000018913",
            "anuncio_desc": "Convocatoria de licitaci\u00f3n"
        },
        {
            "numero_expediente": "ADM/2017/0005",
            "link": "http://www.juntadeandalucia.es/haciendayadministracionpublica/apl/verifirmapdc/descargaInformeParametros?transaccion=9XZqQ0hCLoUghvRta89pUCmkfG71%2BFxx&tipoPie=4",
            "descripcion": "01/09/2017 19:07, 2017-0000019737-Convocatoria de licitaci\u00f3n (Infor.Adicional)",
            "datetime": "2017-09-01T19:07:00+00:00",
            "anuncio_id": " 2017-0000019737",
            "anuncio_desc": "Convocatoria de licitaci\u00f3n (Infor.Adicional)"
        },
        {
            "numero_expediente": "ADM/2017/0005",
            "link": "http://www.juntadeandalucia.es/haciendayadministracionpublica/apl/verifirmapdc/descargaInformeParametros?transaccion=K88gI%2BQPfek8ZJHGaREohs4cenB071d7&tipoPie=4",
            "descripcion": "06/09/2017 15:28, 2017-0000020016-Convocatoria de licitaci\u00f3n (Infor.Adicional)",
            "datetime": "2017-09-06T15:28:00+00:00",
            "anuncio_id": " 2017-0000020016",
            "anuncio_desc": "Convocatoria de licitaci\u00f3n (Infor.Adicional)"
        },
        {
            "numero_expediente": "ADM/2017/0005",
            "link": "http://www.juntadeandalucia.es/haciendayadministracionpublica/apl/verifirmapdc/descargaInformeParametros?transaccion=3bQWtl7vcf5VfmBbw9Lh6PI9rwqOEXGf&tipoPie=4",
            "descripcion": "07/09/2017 15:03, 2017-0000020090-Convocatoria de licitaci\u00f3n (Infor.Adicional)",
            "datetime": "2017-09-07T15:03:00+00:00",
            "anuncio_id": " 2017-0000020090",
            "anuncio_desc": "Convocatoria de licitaci\u00f3n (Infor.Adicional)"
        },
        {
            "numero_expediente": "ADM/2017/0005",
            "link": "http://www.juntadeandalucia.es/haciendayadministracionpublica/apl/verifirmapdc/descargaInformeParametros?transaccion=GbQx%2FQu4gZtgKp6WjGb0fs4cenB071d7&tipoPie=4",
            "descripcion": "13/09/2017 08:32, 2017-0000020505-Convocatoria de licitaci\u00f3n (Infor.Adicional)",
            "datetime": "2017-09-13T08:32:00+00:00",
            "anuncio_id": " 2017-0000020505",
            "anuncio_desc": "Convocatoria de licitaci\u00f3n (Infor.Adicional)"
        },
        {
            "numero_expediente": "ADM/2017/0005",
            "link": "http://www.juntadeandalucia.es/haciendayadministracionpublica/apl/verifirmapdc/descargaInformeParametros?transaccion=0NL6qrplKSYvmH0grZtPzymkfG71%2BFxx&tipoPie=4",
            "descripcion": "04/10/2017 15:37, 2017-0000022342-Convocatoria de licitaci\u00f3n (Infor.Adicional)",
            "datetime": "2017-10-04T15:37:00+00:00",
            "anuncio_id": " 2017-0000022342",
            "anuncio_desc": "Convocatoria de licitaci\u00f3n (Infor.Adicional)"
        },
        {
            "numero_expediente": "ADM/2017/0005",
            "link": "http://www.juntadeandalucia.es/haciendayadministracionpublica/apl/verifirmapdc/descargaInformeParametros?transaccion=7Zdkquf9HswwHuqD04QKrYJinNB9TyKu&tipoPie=4",
            "descripcion": "19/10/2017 08:48, 2017-0000023417-Convocatoria de licitaci\u00f3n (Infor.Adicional)",
            "datetime": "2017-10-19T08:48:00+00:00",
            "anuncio_id": " 2017-0000023417",
            "anuncio_desc": "Convocatoria de licitaci\u00f3n (Infor.Adicional)"
        },
        {
            "numero_expediente": "ADM/2017/0005",
            "link": "http://www.juntadeandalucia.es/haciendayadministracionpublica/apl/verifirmapdc/descargaInformeParametros?transaccion=QTVrs0c2xbYQgBeFUqVzi3P4a3pxggof&tipoPie=4",
            "descripcion": "16/01/2018 16:30, 2018-0000001485-Convocatoria de licitaci\u00f3n (Infor.Adicional)",
            "datetime": "2018-01-16T16:30:00+00:00",
            "anuncio_id": " 2018-0000001485",
            "anuncio_desc": "Convocatoria de licitaci\u00f3n (Infor.Adicional)"
        },
        {
            "numero_expediente": "ADM/2017/0005",
            "link": "http://www.juntadeandalucia.es/haciendayadministracionpublica/apl/verifirmapdc/descargaInformeParametros?transaccion=A%2F5EEV2%2B9LUsEUXui9DH7SmkfG71%2BFxx&tipoPie=4",
            "descripcion": "27/02/2018 11:10, 2018-0000008540-Convocatoria de licitaci\u00f3n (Infor.Adicional)",
            "datetime": "2018-02-27T11:10:00+00:00",
            "anuncio_id": " 2018-0000008540",
            "anuncio_desc": "Convocatoria de licitaci\u00f3n (Infor.Adicional)"
        },
        {
            "numero_expediente": "ADM/2017/0005",
            "link": "http://www.juntadeandalucia.es/haciendayadministracionpublica/apl/verifirmapdc/descargaInformeParametros?transaccion=elpF11T5Y1c%2BIFGK4aFB5PI9rwqOEXGf&tipoPie=4",
            "descripcion": "20/03/2018 22:17, 2018-0000011719-Convocatoria de licitaci\u00f3n (Infor.Adicional)",
            "datetime": "2018-03-20T22:17:00+00:00",
            "anuncio_id": " 2018-0000011719",
            "anuncio_desc": "Convocatoria de licitaci\u00f3n (Infor.Adicional)"
        },
        {
            "numero_expediente": "ADM/2017/0005",
            "link": "http://www.juntadeandalucia.es/haciendayadministracionpublica/apl/verifirmapdc/descargaInformeParametros?transaccion=nvGYyxgi3Fp7wXAXxfw286VT2q%2Bc%2Fsfz&tipoPie=4",
            "descripcion": "10/05/2018 14:37, 2018-0000016771-Convocatoria de licitaci\u00f3n (Infor.Adicional)",
            "datetime": "2018-05-10T14:37:00+00:00",
            "anuncio_id": " 2018-0000016771",
            "anuncio_desc": "Convocatoria de licitaci\u00f3n (Infor.Adicional)"
        },
        {
            "numero_expediente": "ADM/2017/0005",
            "link": "http://www.juntadeandalucia.es/haciendayadministracionpublica/apl/verifirmapdc/descargaInformeParametros?transaccion=EVx1bhjAZg5YZeizhYne2ymkfG71%2BFxx&tipoPie=4",
            "descripcion": "11/05/2018 12:41, 2018-0000016863-Convocatoria de licitaci\u00f3n (Infor.Adicional)",
            "datetime": "2018-05-11T12:41:00+00:00",
            "anuncio_id": " 2018-0000016863",
            "anuncio_desc": "Convocatoria de licitaci\u00f3n (Infor.Adicional)"
        },
        {
            "numero_expediente": "ADM/2017/0005",
            "link": "http://www.juntadeandalucia.es/haciendayadministracionpublica/apl/verifirmapdc/descargaInformeParametros?transaccion=r8jMI8fTL72%2BoaScsvK8gM4cenB071d7&tipoPie=4",
            "descripcion": "06/06/2018 09:23, 2018-0000019129-Convocatoria de licitaci\u00f3n (Infor.Adicional)",
            "datetime": "2018-06-06T09:23:00+00:00",
            "anuncio_id": " 2018-0000019129",
            "anuncio_desc": "Convocatoria de licitaci\u00f3n (Infor.Adicional)"
        },
        {
            "numero_expediente": "ADM/2017/0005",
            "link": "http://www.juntadeandalucia.es/haciendayadministracionpublica/apl/verifirmapdc/descargaInformeParametros?transaccion=Luc1mL7qkQsxXyBhqnGWEPI9rwqOEXGf&tipoPie=4",
            "descripcion": "20/06/2018 20:00, 2018-0000020824-Adjudicaci\u00f3n",
            "datetime": "2018-06-20T20:00:00+00:00",
            "anuncio_id": " 2018-0000020824",
            "anuncio_desc": "Adjudicaci\u00f3n"
        },
        {
            "numero_expediente": "ADM/2017/0005",
            "link": "http://www.juntadeandalucia.es/haciendayadministracionpublica/apl/verifirmapdc/descargaInformeParametros?transaccion=qWsoDNrm95y%2BSdk4TJUOG3lqT3SzUohr&tipoPie=4",
            "descripcion": "24/09/2018 09:30, 2018-0000035523-Formalizaci\u00f3n",
            "datetime": "2018-09-24T09:30:00+00:00",
            "anuncio_id": " 2018-0000035523",
            "anuncio_desc": "Formalizaci\u00f3n"
        }
    ],
    "id": 263,
    "origen": {
        "url": "http://www.juntadeandalucia.es/temas/contratacion-publica/perfiles-licitaciones/detalle/000000000263.html",
        "terminos_uso": "http://www.juntadeandalucia.es/informacion/legal.html"
    }
}