{
    "secciones": {
        "importes": 0,
        "estado_expediente": 1,
        "informacion_lotes_adjudicados_o_resueltos": 2,
        "documentacion_complementaria": 3,
        "obtencion_documentacion_informacion": 4,
        "requisitos_criterios_condiciones": 5,
        "presentacion_solicitudes": 6,
        "presentacion_ofertas": 7,
        "apertura_ofertas": 8,
        "referencias_diarios_oficiales": 9,
        "anuncios_publicados": 10,
        "modificaciones_contrato": 11
    },
    "datosbasicos__numero_expediente": "CCA. 6-38M4V",
    "datosbasicos__titulo_expediente": "2015/063324. Suministro de reactivos y material fungible para la realizacion de determinaciones analiticas para la Plataforma de Logistica Sanitaria de Cordoba y la APES Hospital Alto Guadalquivir",
    "datosbasicos__descripcion": "Suministro de reactivos y material fungible para la realizacion de determinaciones analiticas para la Plataforma de Logistica Sanitaria de Cordoba y la APES Hospital Alto Guadalquivir.",
    "datosbasicos__organo_contratacion": "Servicio Andaluz de Salud",
    "datosbasicos__tipo_contrato": "Suministros",
    "datosbasicos__procedimiento": "Abierto",
    "datosbasicos__tramitacion": "Ordinario",
    "datosbasicos__clasificacion_cpv": [
        "33141000 Productos consumibles medicos no quimicos desechables y productos consumibles hematologicos",
        "33696500 Reactivos de laboratorio",
        "50421000 Servicios de reparacion y mantenimiento de equipos medicos",
        "71900000 Servicios de laboratorio"
    ],
    "datosbasicos__division_por_lotes": "Si",
    "datosbasicos__numero_lotes": "385",
    "datosbasicos__lugar_tramitacion": "CORDOBA",
    "datosbasicos__lugar_ejecucion_nuts": "ES613",
    "datosbasicos__lugar_ejecucion": "CORDOBA",
    "importes__importe_licitacion_(sin_iva)": "16.008.642,30EUR",
    "importes__importe_licitacion_(con_iva)": "19.282.357,80EUR",
    "importes__valor_estimado": "36.019.445,18EUR",
    "importes__importes_adjudicacion": "Ver lotes",
    "informacion_lotes_adjudicados_o_resueltos": [
        {
            "numero_expediente": "CCA. 6-38M4V",
            "id": "lote_-",
            "lote_-__nif": "-",
            "lote_-__adjudicatario": "Ver Resolucion de Adjudicacion y anexos adjuntos.",
            "lote_-__importe_adjudicacion_(sin_iva)": "14.318.013,77EUR",
            "lote_-__importe_adjudicacion_(con_iva)": "17.324.796,66EUR"
        }
    ],
    "documentacion_complementaria": [
        {
            "numero_expediente": "CCA. 6-38M4V",
            "link": "http://www.juntadeandalucia.es/contratacion/document/download?refCode=2016-0000013378&refDoc=2016-0000013378-0",
            "descripcion": "Resoluci\u00f3n de Adjudicaci\u00f3n (pdf) (9276.74Kb)"
        },
        {
            "numero_expediente": "CCA. 6-38M4V",
            "link": "http://www.juntadeandalucia.es/contratacion/document/download?refCode=2016-0000013378&refDoc=2016-0000013378-1",
            "descripcion": "Resolucion de adjudicacion Anexo A (pdf) (441.71Kb)"
        },
        {
            "numero_expediente": "CCA. 6-38M4V",
            "link": "http://www.juntadeandalucia.es/contratacion/document/download?refCode=2016-0000013378&refDoc=2016-0000013378-2",
            "descripcion": "Resolucion de adjudicacion Anexo B (pdf) (119.51Kb)"
        },
        {
            "numero_expediente": "CCA. 6-38M4V",
            "link": "http://www.juntadeandalucia.es/contratacion/document/download?refCode=2016-0000013378&refDoc=2016-0000013378-3",
            "descripcion": "Resolucion de adjudicacion Anexo C (pdf) (335.39Kb)"
        },
        {
            "numero_expediente": "CCA. 6-38M4V",
            "link": "http://www.juntadeandalucia.es/contratacion/document/download?refCode=2016-0000013378&refDoc=2016-0000013378-4",
            "descripcion": "Anexo Resoluci\u00f3n de Adjudicaci\u00f3n D (pdf) (525.36Kb)"
        },
        {
            "numero_expediente": "CCA. 6-38M4V",
            "link": "http://www.juntadeandalucia.es/contratacion/document/download?refCode=2015-0000013608&refDoc=2015-0000013608-0",
            "descripcion": "Resoluci\u00f3n sobre Mesas de Contrataci\u00f3n (pdf) (47.74Kb)"
        },
        {
            "numero_expediente": "CCA. 6-38M4V",
            "link": "http://www.juntadeandalucia.es/contratacion/document/download?refCode=2015-0000013608&refDoc=2015-0000013608-1",
            "descripcion": "Pliegos y Anexos (zip) (1371.8Kb)"
        },
        {
            "numero_expediente": "CCA. 6-38M4V",
            "link": "http://www.juntadeandalucia.es/contratacion/document/download?refCode=2015-0000013608&refDoc=2015-0000013608-3",
            "descripcion": "Resoluci\u00f3n de rectificaci\u00f3n de errores (pdf) (901.21Kb)"
        },
        {
            "numero_expediente": "CCA. 6-38M4V",
            "link": "http://www.juntadeandalucia.es/contratacion/document/download?refCode=2015-0000013608&refDoc=2015-0000013608-4",
            "descripcion": "Anexo I PCAP.Corregido (xls) (518Kb)"
        },
        {
            "numero_expediente": "CCA. 6-38M4V",
            "link": "http://www.juntadeandalucia.es/contratacion/document/download?refCode=2015-0000013608&refDoc=2015-0000013608-5",
            "descripcion": "Anexo PPT B Corregido (xls) (27Kb)"
        },
        {
            "numero_expediente": "CCA. 6-38M4V",
            "link": "http://www.juntadeandalucia.es/contratacion/document/download?refCode=2015-0000013608&refDoc=2015-0000013608-6",
            "descripcion": "Anexo C PPT Corregido (xls) (139Kb)"
        },
        {
            "numero_expediente": "CCA. 6-38M4V",
            "link": "http://www.juntadeandalucia.es/contratacion/document/download?refCode=2016-0000013378&refDoc=2016-0000013378-5",
            "descripcion": "Resolucion de adjudicacion Anexo (pdf) (1508.82Kb)"
        },
        {
            "numero_expediente": "CCA. 6-38M4V",
            "link": "http://www.juntadeandalucia.es/contratacion/document/download?refCode=2016-0000013378&refDoc=2016-0000013378-6",
            "descripcion": "Resoluci\u00f3n Suspensi\u00f3n Parcial (pdf) (324.03Kb)"
        },
        {
            "numero_expediente": "CCA. 6-38M4V",
            "link": "http://www.juntadeandalucia.es/contratacion/document/download?refCode=2016-0000013378&refDoc=2016-0000013378-7",
            "descripcion": "Diligencia Levantamiento suspensi\u00f3n (pdf) (281.49Kb)"
        },
        {
            "numero_expediente": "CCA. 6-38M4V",
            "link": "http://www.juntadeandalucia.es/contratacion/document/download?refCode=2016-0000013378&refDoc=2016-0000013378-8",
            "descripcion": "Diligencia de Suspensi\u00f3n (pdf) (262.09Kb)"
        },
        {
            "numero_expediente": "CCA. 6-38M4V",
            "link": "http://www.juntadeandalucia.es/contratacion/document/download?refCode=2016-0000013378&refDoc=2016-0000013378-9",
            "descripcion": "Diligencia Levantamiento suspensi\u00f3n (pdf) (268.46Kb)"
        },
        {
            "numero_expediente": "CCA. 6-38M4V",
            "link": "http://www.juntadeandalucia.es/contratacion/document/download?refCode=2015-0000013608&refDoc=2015-0000013608-2",
            "descripcion": "Nota reuni\u00f3n informativa PA 25-15 (pdf) (321.32Kb)"
        },
        {
            "numero_expediente": "CCA. 6-38M4V",
            "link": "http://www.juntadeandalucia.es/contratacion/document/download?refCode=2015-0000013608&refDoc=2015-0000013608-7",
            "descripcion": "Acta (pdf) (8242.49Kb)"
        },
        {
            "numero_expediente": "CCA. 6-38M4V",
            "link": "http://www.juntadeandalucia.es/contratacion/document/download?refCode=2018-0000032799&refDoc=2018-0000032799-0",
            "descripcion": "Resoluci\u00f3n Modificaci\u00f3n (pdf) (1700.58Kb)"
        },
        {
            "numero_expediente": "CCA. 6-38M4V",
            "link": "http://www.juntadeandalucia.es/contratacion/document/download?refCode=2018-0000024293&refDoc=2018-0000024293-1",
            "descripcion": "Resoluci\u00f3n de modificaci\u00f3n (pdf) (1642.95Kb)"
        },
        {
            "numero_expediente": "CCA. 6-38M4V",
            "link": "http://www.juntadeandalucia.es/contratacion/document/download?refCode=2018-0000024293&refDoc=2018-0000024293-2",
            "descripcion": "Resoluci\u00f3n Modificaci\u00f3n (pdf) (1565.88Kb)"
        },
        {
            "numero_expediente": "CCA. 6-38M4V",
            "link": "http://www.juntadeandalucia.es/contratacion/document/download?refCode=2018-0000024293&refDoc=2018-0000024293-4",
            "descripcion": "Resoluci\u00f3n Modificaci\u00f3n (pdf) (1526.27Kb)"
        },
        {
            "numero_expediente": "CCA. 6-38M4V",
            "link": "http://www.juntadeandalucia.es/contratacion/document/download?refCode=2018-0000024293&refDoc=2018-0000024293-5",
            "descripcion": "Resoluci\u00f3n de modificaci\u00f3n (pdf) (1660.06Kb)"
        },
        {
            "numero_expediente": "CCA. 6-38M4V",
            "link": "http://www.juntadeandalucia.es/contratacion/document/download?refCode=2018-0000024293&refDoc=2018-0000024293-3",
            "descripcion": "Resoluci\u00f3n cesi\u00f3n lotes (pdf) (789.88Kb)"
        },
        {
            "numero_expediente": "CCA. 6-38M4V",
            "link": "http://www.juntadeandalucia.es/contratacion/document/download?refCode=2018-0000024293&refDoc=2018-0000024293-0",
            "descripcion": "Resoluci\u00f3n cesi\u00f3n lote (pdf) (668.86Kb)"
        }
    ],
    "obtencion_documentacion_informacion": {
        "fecha_limite_obtencion": "28/09/2015 a las 14:00 horas",
        "lugar": [
            "Hospital Universitario Reina Sofia",
            "Avda. Menendez Pidal s/n 14004 (Cordoba )"
        ],
        "puntos_contacto": [
            "Plataforma de Logistica Sanitaria de Cordoba",
            "957/010384",
            "957/011046",
            "http://www.juntadeandalucia.es/servicioandaluzdesalud"
        ],
        "aclaraciones": "Se adjunta Resolucion publicada en BOJA no 223 de 13/11/2013 sobre composicion de las Mesas de Contratacion del Servicio Andaluz de Salud."
    },
    "requisitos_criterios_condiciones": {
        "requisitos_minimos_contratista": "Los establecidos en el pliego de cl\u00e1usulas administrativas particulares",
        "criterios_adjudicacion": "Los establecidos en el pliego de cl\u00e1usulas administrativas particulares",
        "criterios_objetivos_para_la_seleccion_candidatos_el_procedimiento": "Los establecidos en el pliego de cl\u00e1usulas administrativas particulares",
        "condiciones_especiales_adjudicacion_contrato": "Las establecidas en el pliego de cl\u00e1usulas administrativas particulares"
    },
    "presentacion_ofertas__fecha_limite_presentacion_ofertas": "28/09/2015 a las 14:00 horas",
    "presentacion_ofertas__notas": [
        "Avda. Menendez Pidal s/n 14004 (Cordoba )",
        "Registro General del Hospital Universitario Reina Sofia"
    ],
    "apertura_ofertas": {
        "lugar": [
            "Hospital Universitario Reina Sofia",
            "Avda. Menendez Pidal s/n 14004 (Cordoba )"
        ],
        "aclaraciones": "Tendra lugar en las dependencias del citado Hospital, en la fecha y hora que se comunicara en la pagina web (www.hospitalreinasofia.org) de dicho Centro con, al menos, 72 horas de antelacion."
    },
    "referencias_diarios_oficiales": [],
    "anuncios_publicados": [
        {
            "numero_expediente": "CCA. 6-38M4V",
            "link": "http://www.juntadeandalucia.es/haciendayadministracionpublica/apl/verifirmapdc/descargaInformeParametros?transaccion=m%2FVyI0W3Xi0k%2FmR7cuvvDYYdAfNuj%2FNj&tipoPie=4",
            "descripcion": "20/08/2015 09:57, 2015-0000012451-Convocatoria de licitaci\u00f3n",
            "datetime": "2015-08-20T09:57:00+00:00",
            "anuncio_id": " 2015-0000012451",
            "anuncio_desc": "Convocatoria de licitaci\u00f3n"
        },
        {
            "numero_expediente": "CCA. 6-38M4V",
            "link": "http://www.juntadeandalucia.es/haciendayadministracionpublica/apl/verifirmapdc/descargaInformeParametros?transaccion=wZ%2F4t8iOTNI84vfBxsAE5PI9rwqOEXGf&tipoPie=4",
            "descripcion": "25/08/2015 14:07, 2015-0000012679-Convocatoria de licitaci\u00f3n (Infor.Adicional)",
            "datetime": "2015-08-25T14:07:00+00:00",
            "anuncio_id": " 2015-0000012679",
            "anuncio_desc": "Convocatoria de licitaci\u00f3n (Infor.Adicional)"
        },
        {
            "numero_expediente": "CCA. 6-38M4V",
            "link": "http://www.juntadeandalucia.es/haciendayadministracionpublica/apl/verifirmapdc/descargaInformeParametros?transaccion=q7Jv%2F%2F%2FuRcSJ3jVJ%2BdwO%2B6VT2q%2Bc%2Fsfz&tipoPie=4",
            "descripcion": "14/09/2015 09:43, 2015-0000013527-Convocatoria de licitaci\u00f3n (Correci\u00f3n)",
            "datetime": "2015-09-14T09:43:00+00:00",
            "anuncio_id": " 2015-0000013527",
            "anuncio_desc": "Convocatoria de licitaci\u00f3n (Correci\u00f3n)"
        },
        {
            "numero_expediente": "CCA. 6-38M4V",
            "link": "http://www.juntadeandalucia.es/haciendayadministracionpublica/apl/verifirmapdc/descargaInformeParametros?transaccion=WdFXQ28oNpnUdGL37d8xeXlqT3SzUohr&tipoPie=4",
            "descripcion": "15/09/2015 09:35, 2015-0000013608-Convocatoria de licitaci\u00f3n (Infor.Adicional)",
            "datetime": "2015-09-15T09:35:00+00:00",
            "anuncio_id": " 2015-0000013608",
            "anuncio_desc": "Convocatoria de licitaci\u00f3n (Infor.Adicional)"
        },
        {
            "numero_expediente": "CCA. 6-38M4V",
            "link": "http://www.juntadeandalucia.es/haciendayadministracionpublica/apl/verifirmapdc/descargaInformeParametros?transaccion=tvAozE81unpcVP%2B9vYY%2FCKvJYER37PP1&tipoPie=4",
            "descripcion": "18/04/2016 14:06, 2016-0000006866-Adjudicaci\u00f3n",
            "datetime": "2016-04-18T14:06:00+00:00",
            "anuncio_id": " 2016-0000006866",
            "anuncio_desc": "Adjudicaci\u00f3n"
        },
        {
            "numero_expediente": "CCA. 6-38M4V",
            "link": "http://www.juntadeandalucia.es/haciendayadministracionpublica/apl/verifirmapdc/descargaInformeParametros?transaccion=G%2FS67wNDPJdFznJZHM%2BG0IYdAfNuj%2FNj&tipoPie=4",
            "descripcion": "19/04/2016 08:52, 2016-0000006897-Adjudicaci\u00f3n (Infor.Adicional)",
            "datetime": "2016-04-19T08:52:00+00:00",
            "anuncio_id": " 2016-0000006897",
            "anuncio_desc": "Adjudicaci\u00f3n (Infor.Adicional)"
        },
        {
            "numero_expediente": "CCA. 6-38M4V",
            "link": "http://www.juntadeandalucia.es/haciendayadministracionpublica/apl/verifirmapdc/descargaInformeParametros?transaccion=OnmW6SQni%2Bjmnxds%2BowH6YYdAfNuj%2FNj&tipoPie=4",
            "descripcion": "25/04/2016 11:37, 2016-0000007280-Adjudicaci\u00f3n (Correci\u00f3n)",
            "datetime": "2016-04-25T11:37:00+00:00",
            "anuncio_id": " 2016-0000007280",
            "anuncio_desc": "Adjudicaci\u00f3n (Correci\u00f3n)"
        },
        {
            "numero_expediente": "CCA. 6-38M4V",
            "link": "http://www.juntadeandalucia.es/haciendayadministracionpublica/apl/verifirmapdc/descargaInformeParametros?transaccion=cXK6EYR34rG8E3REE%2B9KtSmkfG71%2BFxx&tipoPie=4",
            "descripcion": "04/05/2016 11:58, 2016-0000007857-Adjudicaci\u00f3n",
            "datetime": "2016-05-04T11:58:00+00:00",
            "anuncio_id": " 2016-0000007857",
            "anuncio_desc": "Adjudicaci\u00f3n"
        },
        {
            "numero_expediente": "CCA. 6-38M4V",
            "link": "http://www.juntadeandalucia.es/haciendayadministracionpublica/apl/verifirmapdc/descargaInformeParametros?transaccion=NYq2ASWhl%2F2D3gdg13sAEaVT2q%2Bc%2Fsfz&tipoPie=4",
            "descripcion": "06/05/2016 12:41, 2016-0000008069-Adjudicaci\u00f3n (Infor.Adicional)",
            "datetime": "2016-05-06T12:41:00+00:00",
            "anuncio_id": " 2016-0000008069",
            "anuncio_desc": "Adjudicaci\u00f3n (Infor.Adicional)"
        },
        {
            "numero_expediente": "CCA. 6-38M4V",
            "link": "http://www.juntadeandalucia.es/haciendayadministracionpublica/apl/verifirmapdc/descargaInformeParametros?transaccion=n8xBPIFMbdUFYiDKoT8BefI9rwqOEXGf&tipoPie=4",
            "descripcion": "21/06/2016 09:42, 2016-0000011249-Adjudicaci\u00f3n (Infor.Adicional)",
            "datetime": "2016-06-21T09:42:00+00:00",
            "anuncio_id": " 2016-0000011249",
            "anuncio_desc": "Adjudicaci\u00f3n (Infor.Adicional)"
        },
        {
            "numero_expediente": "CCA. 6-38M4V",
            "link": "http://www.juntadeandalucia.es/haciendayadministracionpublica/apl/verifirmapdc/descargaInformeParametros?transaccion=BNtcdaLg0SbfCRv%2FszoBn3lqT3SzUohr&tipoPie=4",
            "descripcion": "13/07/2016 11:25, 2016-0000012888-Adjudicaci\u00f3n (Infor.Adicional)",
            "datetime": "2016-07-13T11:25:00+00:00",
            "anuncio_id": " 2016-0000012888",
            "anuncio_desc": "Adjudicaci\u00f3n (Infor.Adicional)"
        },
        {
            "numero_expediente": "CCA. 6-38M4V",
            "link": "http://www.juntadeandalucia.es/haciendayadministracionpublica/apl/verifirmapdc/descargaInformeParametros?transaccion=DUC4SRNwtwyhOW0xvONrbiJqUCje%2B%2B1i&tipoPie=4",
            "descripcion": "19/07/2016 14:02, 2016-0000013378-Adjudicaci\u00f3n (Infor.Adicional)",
            "datetime": "2016-07-19T14:02:00+00:00",
            "anuncio_id": " 2016-0000013378",
            "anuncio_desc": "Adjudicaci\u00f3n (Infor.Adicional)"
        },
        {
            "numero_expediente": "CCA. 6-38M4V",
            "link": "http://www.juntadeandalucia.es/haciendayadministracionpublica/apl/verifirmapdc/descargaInformeParametros?transaccion=rELDtx20OrW6vK3PMz2Lj4JinNB9TyKu&tipoPie=4",
            "descripcion": "20/09/2016 14:02, 2016-0000016450-Formalizaci\u00f3n",
            "datetime": "2016-09-20T14:02:00+00:00",
            "anuncio_id": " 2016-0000016450",
            "anuncio_desc": "Formalizaci\u00f3n"
        },
        {
            "numero_expediente": "CCA. 6-38M4V",
            "link": "http://www.juntadeandalucia.es/haciendayadministracionpublica/apl/verifirmapdc/descargaInformeParametros?transaccion=WTfbDYPgnBhcdp42ZMXc9YYdAfNuj%2FNj&tipoPie=4",
            "descripcion": "20/09/2016 14:11, 2016-0000016519-Formalizaci\u00f3n",
            "datetime": "2016-09-20T14:11:00+00:00",
            "anuncio_id": " 2016-0000016519",
            "anuncio_desc": "Formalizaci\u00f3n"
        },
        {
            "numero_expediente": "CCA. 6-38M4V",
            "link": "http://www.juntadeandalucia.es/haciendayadministracionpublica/apl/verifirmapdc/descargaInformeParametros?transaccion=WTfbDYPgnBjAeBG9mzt%2B9PI9rwqOEXGf&tipoPie=4",
            "descripcion": "20/09/2016 14:16, 2016-0000016520-Formalizaci\u00f3n",
            "datetime": "2016-09-20T14:16:00+00:00",
            "anuncio_id": " 2016-0000016520",
            "anuncio_desc": "Formalizaci\u00f3n"
        },
        {
            "numero_expediente": "CCA. 6-38M4V",
            "link": "http://www.juntadeandalucia.es/haciendayadministracionpublica/apl/verifirmapdc/descargaInformeParametros?transaccion=Ug52KY1jae6qb%2BgMp6UoEavJYER37PP1&tipoPie=4",
            "descripcion": "20/09/2016 14:30, 2016-0000016523-Formalizaci\u00f3n",
            "datetime": "2016-09-20T14:30:00+00:00",
            "anuncio_id": " 2016-0000016523",
            "anuncio_desc": "Formalizaci\u00f3n"
        },
        {
            "numero_expediente": "CCA. 6-38M4V",
            "link": "http://www.juntadeandalucia.es/haciendayadministracionpublica/apl/verifirmapdc/descargaInformeParametros?transaccion=Ug52KY1jae5OvTi1JLcXP6vJYER37PP1&tipoPie=4",
            "descripcion": "20/09/2016 14:34, 2016-0000016524-Formalizaci\u00f3n",
            "datetime": "2016-09-20T14:34:00+00:00",
            "anuncio_id": " 2016-0000016524",
            "anuncio_desc": "Formalizaci\u00f3n"
        },
        {
            "numero_expediente": "CCA. 6-38M4V",
            "link": "http://www.juntadeandalucia.es/haciendayadministracionpublica/apl/verifirmapdc/descargaInformeParametros?transaccion=IzD95vALJsx%2Bl1c0g4dNGiJqUCje%2B%2B1i&tipoPie=4",
            "descripcion": "20/09/2016 14:39, 2016-0000016525-Formalizaci\u00f3n",
            "datetime": "2016-09-20T14:39:00+00:00",
            "anuncio_id": " 2016-0000016525",
            "anuncio_desc": "Formalizaci\u00f3n"
        },
        {
            "numero_expediente": "CCA. 6-38M4V",
            "link": "http://www.juntadeandalucia.es/haciendayadministracionpublica/apl/verifirmapdc/descargaInformeParametros?transaccion=IzD95vALJsxL21o8nW6R%2BIYdAfNuj%2FNj&tipoPie=4",
            "descripcion": "20/09/2016 14:44, 2016-0000016526-Formalizaci\u00f3n",
            "datetime": "2016-09-20T14:44:00+00:00",
            "anuncio_id": " 2016-0000016526",
            "anuncio_desc": "Formalizaci\u00f3n"
        },
        {
            "numero_expediente": "CCA. 6-38M4V",
            "link": "http://www.juntadeandalucia.es/haciendayadministracionpublica/apl/verifirmapdc/descargaInformeParametros?transaccion=wP%2FfW3VR0c7qZEBzXRHbN3P4a3pxggof&tipoPie=4",
            "descripcion": "21/09/2016 09:32, 2016-0000016528-Formalizaci\u00f3n",
            "datetime": "2016-09-21T09:32:00+00:00",
            "anuncio_id": " 2016-0000016528",
            "anuncio_desc": "Formalizaci\u00f3n"
        },
        {
            "numero_expediente": "CCA. 6-38M4V",
            "link": "http://www.juntadeandalucia.es/haciendayadministracionpublica/apl/verifirmapdc/descargaInformeParametros?transaccion=zaRtjExlpVQnrGmw2gfpFoJinNB9TyKu&tipoPie=4",
            "descripcion": "05/09/2017 11:49, 2017-0000019846-Formalizaci\u00f3n (Infor.Adicional)",
            "datetime": "2017-09-05T11:49:00+00:00",
            "anuncio_id": " 2017-0000019846",
            "anuncio_desc": "Formalizaci\u00f3n (Infor.Adicional)"
        },
        {
            "numero_expediente": "CCA. 6-38M4V",
            "link": "http://www.juntadeandalucia.es/haciendayadministracionpublica/apl/verifirmapdc/descargaInformeParametros?transaccion=J9BghQ4DIPjId83JQUKupYYdAfNuj%2FNj&tipoPie=4",
            "descripcion": "23/04/2018 14:34, 2018-0000015166-Formalizaci\u00f3n (Modificaci\u00ef\u00bf\u00bdn/Pr\u00ef\u00bf\u00bdrroga)",
            "datetime": "2018-04-23T14:34:00+00:00",
            "anuncio_id": " 2018-0000015166",
            "anuncio_desc": "Formalizaci\u00f3n (Modificaci\u00ef\u00bf\u00bdn/Pr\u00ef\u00bf\u00bdrroga)"
        },
        {
            "numero_expediente": "CCA. 6-38M4V",
            "link": "http://www.juntadeandalucia.es/haciendayadministracionpublica/apl/verifirmapdc/descargaInformeParametros?transaccion=3aSJIOLO%2BDDNnoYqTw1fCs4cenB071d7&tipoPie=4",
            "descripcion": "03/05/2018 13:31, 2018-0000016079-Formalizaci\u00f3n (Modificaci\u00ef\u00bf\u00bdn/Pr\u00ef\u00bf\u00bdrroga)",
            "datetime": "2018-05-03T13:31:00+00:00",
            "anuncio_id": " 2018-0000016079",
            "anuncio_desc": "Formalizaci\u00f3n (Modificaci\u00ef\u00bf\u00bdn/Pr\u00ef\u00bf\u00bdrroga)"
        },
        {
            "numero_expediente": "CCA. 6-38M4V",
            "link": "http://www.juntadeandalucia.es/haciendayadministracionpublica/apl/verifirmapdc/descargaInformeParametros?transaccion=JILyhZbWghZTGDxMjhkkYCJqUCje%2B%2B1i&tipoPie=4",
            "descripcion": "25/05/2018 08:45, 2018-0000018047-Formalizaci\u00f3n (Infor.Adicional)",
            "datetime": "2018-05-25T08:45:00+00:00",
            "anuncio_id": " 2018-0000018047",
            "anuncio_desc": "Formalizaci\u00f3n (Infor.Adicional)"
        },
        {
            "numero_expediente": "CCA. 6-38M4V",
            "link": "http://www.juntadeandalucia.es/haciendayadministracionpublica/apl/verifirmapdc/descargaInformeParametros?transaccion=Wxbt1tWR8WNRYXw5PHT%2BuIJinNB9TyKu&tipoPie=4",
            "descripcion": "11/06/2018 13:36, 2018-0000019653-Formalizaci\u00f3n (Modificaci\u00ef\u00bf\u00bdn/Pr\u00ef\u00bf\u00bdrroga)",
            "datetime": "2018-06-11T13:36:00+00:00",
            "anuncio_id": " 2018-0000019653",
            "anuncio_desc": "Formalizaci\u00f3n (Modificaci\u00ef\u00bf\u00bdn/Pr\u00ef\u00bf\u00bdrroga)"
        },
        {
            "numero_expediente": "CCA. 6-38M4V",
            "link": "http://www.juntadeandalucia.es/haciendayadministracionpublica/apl/verifirmapdc/descargaInformeParametros?transaccion=1QvB7fkplENevc4TiWzhESmkfG71%2BFxx&tipoPie=4",
            "descripcion": "17/07/2018 09:02, 2018-0000024293-Formalizaci\u00f3n (Modificaci\u00ef\u00bf\u00bdn/Pr\u00ef\u00bf\u00bdrroga)",
            "datetime": "2018-07-17T09:02:00+00:00",
            "anuncio_id": " 2018-0000024293",
            "anuncio_desc": "Formalizaci\u00f3n (Modificaci\u00ef\u00bf\u00bdn/Pr\u00ef\u00bf\u00bdrroga)"
        },
        {
            "numero_expediente": "CCA. 6-38M4V",
            "link": "http://www.juntadeandalucia.es/haciendayadministracionpublica/apl/verifirmapdc/descargaInformeParametros?transaccion=mTyn8f10uLq3Yegd4aljGc4cenB071d7&tipoPie=4",
            "descripcion": "06/09/2018 13:42, 2018-0000032799-Formalizaci\u00f3n (Modificaci\u00ef\u00bf\u00bdn/Pr\u00ef\u00bf\u00bdrroga)",
            "datetime": "2018-09-06T13:42:00+00:00",
            "anuncio_id": " 2018-0000032799",
            "anuncio_desc": "Formalizaci\u00f3n (Modificaci\u00ef\u00bf\u00bdn/Pr\u00ef\u00bf\u00bdrroga)"
        }
    ],
    "id": 58040,
    "origen": {
        "url": "http://www.juntadeandalucia.es/temas/contratacion-publica/perfiles-licitaciones/detalle/000000058040.html",
        "terminos_uso": "http://www.juntadeandalucia.es/informacion/legal.html"
    }
}