{
    "obtencion_documentacion_informacion": {
        "puntos_contacto": [
            "SERVICIO DE CONTRATACION",
            "955065399",
            "955926777",
            "perfilcontratante.sgt.cfv@juntadeandalucia.es",
            "http://juntadeandalucia.es/temas/contratacion-publica/perfiles-licitaciones.html"
        ],
        "fecha_limite_obtencion": "14/03/2019 a las 14:00 horas",
        "lugar": [
            "SECRETARIA GENERAL TECNICA",
            "PABLO PICASSO 6 41018 (SEVILLA Espana)"
        ]
    },
    "datosbasicos__division_por_lotes": "Si",
    "datosbasicos__clasificacion_cpv": "50230000 Servicios de reparacion, mantenimiento y servicios asociados relacionados con carreteras y otros equipos",
    "datosbasicos__numero_lotes": "6",
    "importes__importe_licitacion_(sin_iva)": "36.085.969,91EUR",
    "datosbasicos__organo_contratacion": "Consejeria de Fomento, Infraestructuras y Ordenacion del Territorio. Secretaria General Tecnica",
    "documentacion_complementaria": [
        {
            "descripcion": "Memoria justificativa (PDF) (116.76Kb)",
            "link": "http://www.juntadeandalucia.es/contratacion/document/download?refCode=2019-0000047307&refDoc=2019-0000047307-0",
            "numero_expediente": "CONTR 2018 0000051932"
        },
        {
            "descripcion": "Memoria complementaria (PDF) (182.29Kb)",
            "link": "http://www.juntadeandalucia.es/contratacion/document/download?refCode=2019-0000047307&refDoc=2019-0000047307-1",
            "numero_expediente": "CONTR 2018 0000051932"
        },
        {
            "descripcion": "Pliego de Cl\u00e1usula Administrativa (PDF) (698.51Kb)",
            "link": "http://www.juntadeandalucia.es/contratacion/document/download?refCode=2019-0000047307&refDoc=2019-0000047307-2",
            "numero_expediente": "CONTR 2018 0000051932"
        },
        {
            "descripcion": "PPTP lote 1 (con las observaciones de la IG) (PDF) (4575.09Kb)",
            "link": "http://www.juntadeandalucia.es/contratacion/document/download?refCode=2019-0000047307&refDoc=2019-0000047307-3",
            "numero_expediente": "CONTR 2018 0000051932"
        },
        {
            "descripcion": "PPTP lote 2 (con las observaciones de la IG) (PDF) (4691.22Kb)",
            "link": "http://www.juntadeandalucia.es/contratacion/document/download?refCode=2019-0000047307&refDoc=2019-0000047307-4",
            "numero_expediente": "CONTR 2018 0000051932"
        },
        {
            "descripcion": "PPTP lote 3 (con las observaciones de la IG) (PDF) (4760.83Kb)",
            "link": "http://www.juntadeandalucia.es/contratacion/document/download?refCode=2019-0000047307&refDoc=2019-0000047307-5",
            "numero_expediente": "CONTR 2018 0000051932"
        },
        {
            "descripcion": "PPTP lote 4 (con las observaciones de la IG) (PDF) (4751.83Kb)",
            "link": "http://www.juntadeandalucia.es/contratacion/document/download?refCode=2019-0000047307&refDoc=2019-0000047307-6",
            "numero_expediente": "CONTR 2018 0000051932"
        },
        {
            "descripcion": "PPTP lote 5 (con las observaciones de la IG) (PDF) (4685.87Kb)",
            "link": "http://www.juntadeandalucia.es/contratacion/document/download?refCode=2019-0000047307&refDoc=2019-0000047307-7",
            "numero_expediente": "CONTR 2018 0000051932"
        },
        {
            "descripcion": "PPTP lote 6 (con las observaciones de la IG) (PDF) (13280.12Kb)",
            "link": "http://www.juntadeandalucia.es/contratacion/document/download?refCode=2019-0000047307&refDoc=2019-0000047307-8",
            "numero_expediente": "CONTR 2018 0000051932"
        },
        {
            "descripcion": "PERSONAL LOTE 1 (PDF) (446.8Kb)",
            "link": "http://www.juntadeandalucia.es/contratacion/document/download?refCode=2019-0000047307&refDoc=2019-0000047307-9",
            "numero_expediente": "CONTR 2018 0000051932"
        },
        {
            "descripcion": "PERSONAL LOTE 2 (PDF) (530.09Kb)",
            "link": "http://www.juntadeandalucia.es/contratacion/document/download?refCode=2019-0000047307&refDoc=2019-0000047307-10",
            "numero_expediente": "CONTR 2018 0000051932"
        },
        {
            "descripcion": "PERSONAL LOTE 3 (PDF) (479.63Kb)",
            "link": "http://www.juntadeandalucia.es/contratacion/document/download?refCode=2019-0000047307&refDoc=2019-0000047307-11",
            "numero_expediente": "CONTR 2018 0000051932"
        },
        {
            "descripcion": "PERSONAL LOTE 4 (PDF) (412.75Kb)",
            "link": "http://www.juntadeandalucia.es/contratacion/document/download?refCode=2019-0000047307&refDoc=2019-0000047307-12",
            "numero_expediente": "CONTR 2018 0000051932"
        },
        {
            "descripcion": "PERSONAL LOTE 5 (PDF) (1106.62Kb)",
            "link": "http://www.juntadeandalucia.es/contratacion/document/download?refCode=2019-0000047307&refDoc=2019-0000047307-13",
            "numero_expediente": "CONTR 2018 0000051932"
        },
        {
            "descripcion": "PERSONAL LOTE 6 (PDF) (714.19Kb)",
            "link": "http://www.juntadeandalucia.es/contratacion/document/download?refCode=2019-0000047307&refDoc=2019-0000047307-14",
            "numero_expediente": "CONTR 2018 0000051932"
        },
        {
            "descripcion": "INF.INSUF.MEDIOS (PDF) (67.47Kb)",
            "link": "http://www.juntadeandalucia.es/contratacion/document/download?refCode=2019-0000047307&refDoc=2019-0000047307-15",
            "numero_expediente": "CONTR 2018 0000051932"
        },
        {
            "descripcion": "Resoluci\u00f3n de aprobaci\u00f3n del expediente (PDF) (76.08Kb)",
            "link": "http://www.juntadeandalucia.es/contratacion/document/download?refCode=2019-0000047307&refDoc=2019-0000047307-16",
            "numero_expediente": "CONTR 2018 0000051932"
        },
        {
            "descripcion": "DEUC (XML) (236.01Kb)",
            "link": "http://www.juntadeandalucia.es/contratacion/document/download?refCode=2019-0000047307&refDoc=2019-0000047307-17",
            "numero_expediente": "CONTR 2018 0000051932"
        },
        {
            "descripcion": "Anuncio DOUE (PDF) (167.65Kb)",
            "link": "http://www.juntadeandalucia.es/contratacion/document/download?refCode=2019-0000047307&refDoc=2019-0000047307-18",
            "numero_expediente": "CONTR 2018 0000051932"
        },
        {
            "descripcion": "Respuestas a consultas planteadas en expdte 2018 51837 (PDF) (95.07Kb)",
            "link": "http://www.juntadeandalucia.es/contratacion/document/download?refCode=2019-0000047307&refDoc=2019-0000047307-19",
            "numero_expediente": "CONTR 2018 0000051932"
        },
        {
            "descripcion": "Correcci\u00f3n PCAP (PDF) (85.58Kb)",
            "link": "http://www.juntadeandalucia.es/contratacion/document/download?refCode=2019-0000047307&refDoc=2019-0000047307-20",
            "numero_expediente": "CONTR 2018 0000051932"
        },
        {
            "descripcion": "ACLARACION PRESENTACION SOBRES POR LOTE (PDF) (32.87Kb)",
            "link": "http://www.juntadeandalucia.es/contratacion/document/download?refCode=2019-0000047307&refDoc=2019-0000047307-21",
            "numero_expediente": "CONTR 2018 0000051932"
        },
        {
            "descripcion": "Propuesta designaci\u00f3n composici\u00f3n de la Mesa (PDF) (72.24Kb)",
            "link": "http://www.juntadeandalucia.es/contratacion/document/download?refCode=2019-0000047307&refDoc=2019-0000047307-22",
            "numero_expediente": "CONTR 2018 0000051932"
        },
        {
            "descripcion": "Propuesta designaci\u00f3n Comisi\u00f3n T\u00e9cnica (PDF) (67.69Kb)",
            "link": "http://www.juntadeandalucia.es/contratacion/document/download?refCode=2019-0000047307&refDoc=2019-0000047307-23",
            "numero_expediente": "CONTR 2018 0000051932"
        },
        {
            "descripcion": "ACLARACI\u00d3N CUMPLIMENTACI\u00d3N ANEXO VII (PDF) (44Kb)",
            "link": "http://www.juntadeandalucia.es/contratacion/document/download?refCode=2019-0000047307&refDoc=2019-0000047307-24",
            "numero_expediente": "CONTR 2018 0000051932"
        },
        {
            "descripcion": "Anuncio de subsanaci\u00f3n (PDF) (106.11Kb)",
            "link": "http://www.juntadeandalucia.es/contratacion/document/download?refCode=2019-0000047307&refDoc=2019-0000047307-25",
            "numero_expediente": "CONTR 2018 0000051932"
        },
        {
            "descripcion": "Acta mesa calificaci\u00f3n administrativa (PDF) (126.38Kb)",
            "link": "http://www.juntadeandalucia.es/contratacion/document/download?refCode=2019-0000047307&refDoc=2019-0000047307-26",
            "numero_expediente": "CONTR 2018 0000051932"
        },
        {
            "descripcion": "Acta mesa calificaci\u00f3n juicio de valor (PDF) (61.96Kb)",
            "link": "http://www.juntadeandalucia.es/contratacion/document/download?refCode=2019-0000047307&refDoc=2019-0000047307-27",
            "numero_expediente": "CONTR 2018 0000051932"
        },
        {
            "descripcion": "Puntuacion ofertas y prop.econ\u00f3micas (PDF) (342.85Kb)",
            "link": "http://www.juntadeandalucia.es/contratacion/document/download?refCode=2019-0000047307&refDoc=2019-0000047307-28",
            "numero_expediente": "CONTR 2018 0000051932"
        },
        {
            "descripcion": "Acta mesa n\u00fam. 3 (PDF) (453.87Kb)",
            "link": "http://www.juntadeandalucia.es/contratacion/document/download?refCode=2019-0000047307&refDoc=2019-0000047307-29",
            "numero_expediente": "CONTR 2018 0000051932"
        },
        {
            "descripcion": "Informe T\u00e9cnico sobre criterios juicio de valor (LOTE 1) (PDF) (452.66Kb)",
            "link": "http://www.juntadeandalucia.es/contratacion/document/download?refCode=2019-0000047307&refDoc=2019-0000047307-30",
            "numero_expediente": "CONTR 2018 0000051932"
        },
        {
            "descripcion": "Informe T\u00e9cnico sobre criterios juicio de valor (LOTE 2) (PDF) (513.6Kb)",
            "link": "http://www.juntadeandalucia.es/contratacion/document/download?refCode=2019-0000047307&refDoc=2019-0000047307-31",
            "numero_expediente": "CONTR 2018 0000051932"
        },
        {
            "descripcion": "Informe T\u00e9cnico sobre criterios juicio de valor (LOTE 3) (PDF) (512.26Kb)",
            "link": "http://www.juntadeandalucia.es/contratacion/document/download?refCode=2019-0000047307&refDoc=2019-0000047307-32",
            "numero_expediente": "CONTR 2018 0000051932"
        },
        {
            "descripcion": "Informe T\u00e9cnico sobre criterios juicio de valor (LOTE 4) (PDF) (573.5Kb)",
            "link": "http://www.juntadeandalucia.es/contratacion/document/download?refCode=2019-0000047307&refDoc=2019-0000047307-33",
            "numero_expediente": "CONTR 2018 0000051932"
        },
        {
            "descripcion": "Informe T\u00e9cnico sobre criterios juicio de valor (LOTE 5) (PDF) (430.41Kb)",
            "link": "http://www.juntadeandalucia.es/contratacion/document/download?refCode=2019-0000047307&refDoc=2019-0000047307-34",
            "numero_expediente": "CONTR 2018 0000051932"
        },
        {
            "descripcion": "Informe T\u00e9cnico sobre criterios juicio de valor (LOTE 6) (PDF) (423.82Kb)",
            "link": "http://www.juntadeandalucia.es/contratacion/document/download?refCode=2019-0000047307&refDoc=2019-0000047307-35",
            "numero_expediente": "CONTR 2018 0000051932"
        },
        {
            "descripcion": "Acta Mesa n\u00fam. 4 (PDF) (387.4Kb)",
            "link": "http://www.juntadeandalucia.es/contratacion/document/download?refCode=2019-0000047307&refDoc=2019-0000047307-36",
            "numero_expediente": "CONTR 2018 0000051932"
        },
        {
            "descripcion": "Informe sobre las ofertas incursas en valores anormales LOTE 1 (PDF) (542.55Kb)",
            "link": "http://www.juntadeandalucia.es/contratacion/document/download?refCode=2019-0000047307&refDoc=2019-0000047307-37",
            "numero_expediente": "CONTR 2018 0000051932"
        },
        {
            "descripcion": "Informe sobre las ofertas incursas en valores anormales (LOTE 2) (PDF) (510.82Kb)",
            "link": "http://www.juntadeandalucia.es/contratacion/document/download?refCode=2019-0000047307&refDoc=2019-0000047307-38",
            "numero_expediente": "CONTR 2018 0000051932"
        },
        {
            "descripcion": "Informe sobre las ofertas incursas en valores anormales (LOTE 3) (PDF) (468.4Kb)",
            "link": "http://www.juntadeandalucia.es/contratacion/document/download?refCode=2019-0000047307&refDoc=2019-0000047307-39",
            "numero_expediente": "CONTR 2018 0000051932"
        },
        {
            "descripcion": "Informe sobre las ofertas incursas en valores anormales (LOTE 4) (PDF) (508.75Kb)",
            "link": "http://www.juntadeandalucia.es/contratacion/document/download?refCode=2019-0000047307&refDoc=2019-0000047307-40",
            "numero_expediente": "CONTR 2018 0000051932"
        },
        {
            "descripcion": "Acta de la Mesa n\u00ba5. Examen de la documentaci\u00f3n previa a la adjudicaci\u00f3n (LOTES 5 Y 6) (.PD) (59.19Kb)",
            "link": "http://www.juntadeandalucia.es/contratacion/document/download?refCode=2019-0000047307&refDoc=2019-0000047307-41",
            "numero_expediente": "CONTR 2018 0000051932"
        }
    ],
    "datosbasicos__procedimiento": "Abierto",
    "datosbasicos__tipo_contrato": "Servicios",
    "apertura_ofertas": {
        "lugar": [
            "CONSEJERIA DE FOMENTO Y VIVIENDA",
            "PABLO PICASSO 6 41018 (SEVILLA Espana)",
            "Fecha Apertura del sobre de criterios de adjudicacion que dependen de un juicio de valor : 04/04/2019 a las 11:00 horas",
            "Fecha Apertura del sobre de criterios de adjudicacion evaluables por aplicacion de formulas : 30/04/2019 a las 11:00 horas"
        ]
    },
    "estado_expediente__estado": "Evaluacion",
    "datosbasicos__lugar_ejecucion_nuts": "ES61",
    "presentacion_ofertas__fecha_limite_presentacion_ofertas": "15/03/2019 a las 20:00 horas",
    "estado_expediente__notas": [
        "05/06/2019 13:31 - Convocatoria de licitacion (Infor.Adicional)",
        "Acta de la 5a sesion de la Mesa. Examen de la documentacion previa a la adjudicacion (LOTES 5 Y 6).",
        "Actualizado: Convocatoria de licitacion (Infor.Adicional)"
    ],
    "datosbasicos__tramitacion": "Ordinario",
    "importes__importe_licitacion_(con_iva)": "43.664.023,60EUR",
    "datosbasicos__descripcion": "Servicios de diversas operaciones de conservacion en los siguientes tramos de la Red de carreteras: ZONA NORTE GRANADA, ZONA SURESTE JAEN, ZONA SUROESTE CADIZ, ZONA SUR GRANADA, ZONA SUR SEVILLA, ZONA ESTE ALMERIA",
    "datosbasicos__lugar_ejecucion": [
        "ALMERIA",
        "CADIZ",
        "GRANADA",
        "JAEN",
        "SEVILLA"
    ],
    "datosbasicos__numero_expediente": "CONTR 2018 0000051932",
    "secciones": {
        "estado_expediente": 1,
        "obtencion_documentacion_informacion": 4,
        "clausulas_sociales_ambientales_innovacion_tecnologica": 6,
        "informacion_lotes_adjudicados_o_resueltos": 2,
        "importes": 0,
        "presentacion_solicitudes": 7,
        "documentacion_complementaria": 3,
        "referencias_diarios_oficiales": 10,
        "presentacion_ofertas": 8,
        "apertura_ofertas": 9,
        "anuncios_publicados": 11,
        "requisitos_criterios_condiciones": 5
    },
    "datosbasicos__titulo_expediente": "SERVICIOS DE CONSERVACION EN TRAMOS DE CARRETERAS DE LA RED AUTONOMICA",
    "datosbasicos__lugar_tramitacion": "OTRAS",
    "importes__valor_estimado": "49.618.208,64EUR",
    "id": 107969,
    "anuncios_publicados": [
        {
            "anuncio_id": " 2019-0000003107",
            "numero_expediente": "CONTR 2018 0000051932",
            "descripcion": "16/01/2019 13:01, 2019-0000003107-Convocatoria de licitaci\u00f3n",
            "datetime": "2019-01-16T13:01:00+00:00",
            "link": "http://www.juntadeandalucia.es/haciendayadministracionpublica/apl/verifirmapdc/descargaInformeParametros?transaccion=Rs6z7WVmHUKohFQgM8M%2BSHP4a3pxggof&tipoPie=4",
            "anuncio_desc": "Convocatoria de licitaci\u00f3n"
        },
        {
            "anuncio_id": " 2019-0000004285",
            "numero_expediente": "CONTR 2018 0000051932",
            "descripcion": "18/01/2019 13:08, 2019-0000004285-Convocatoria de licitaci\u00f3n (Infor.Adicional)",
            "datetime": "2019-01-18T13:08:00+00:00",
            "link": "http://www.juntadeandalucia.es/haciendayadministracionpublica/apl/verifirmapdc/descargaInformeParametros?transaccion=TYxV1HdNJrg%2Fq6STo5HuI84cenB071d7&tipoPie=4",
            "anuncio_desc": "Convocatoria de licitaci\u00f3n (Infor.Adicional)"
        },
        {
            "anuncio_id": " 2019-0000006321",
            "numero_expediente": "CONTR 2018 0000051932",
            "descripcion": "24/01/2019 10:34, 2019-0000006321-Convocatoria de licitaci\u00f3n (Correcci\u00f3n)",
            "datetime": "2019-01-24T10:34:00+00:00",
            "link": "http://www.juntadeandalucia.es/haciendayadministracionpublica/apl/verifirmapdc/descargaInformeParametros?transaccion=DiB%2Bb4U8tv%2FDcLjbW1o8KCmkfG71%2BFxx&tipoPie=4",
            "anuncio_desc": "Convocatoria de licitaci\u00f3n (Correcci\u00f3n)"
        },
        {
            "anuncio_id": " 2019-0000011833",
            "numero_expediente": "CONTR 2018 0000051932",
            "descripcion": "08/02/2019 09:10, 2019-0000011833-Convocatoria de licitaci\u00f3n (Infor.Adicional)",
            "datetime": "2019-02-08T09:10:00+00:00",
            "link": "http://www.juntadeandalucia.es/haciendayadministracionpublica/apl/verifirmapdc/descargaInformeParametros?transaccion=%2BXpMyrdVMg7agBr3btXLmCJqUCje%2B%2B1i&tipoPie=4",
            "anuncio_desc": "Convocatoria de licitaci\u00f3n (Infor.Adicional)"
        },
        {
            "anuncio_id": " 2019-0000016887",
            "numero_expediente": "CONTR 2018 0000051932",
            "descripcion": "18/02/2019 14:27, 2019-0000016887-Convocatoria de licitaci\u00f3n (Infor.Adicional)",
            "datetime": "2019-02-18T14:27:00+00:00",
            "link": "http://www.juntadeandalucia.es/haciendayadministracionpublica/apl/verifirmapdc/descargaInformeParametros?transaccion=Bnz9z3atZkQt8W3VRvfxD6VT2q%2Bc%2Fsfz&tipoPie=4",
            "anuncio_desc": "Convocatoria de licitaci\u00f3n (Infor.Adicional)"
        },
        {
            "anuncio_id": " 2019-0000025521",
            "numero_expediente": "CONTR 2018 0000051932",
            "descripcion": "13/03/2019 13:04, 2019-0000025521-Convocatoria de licitaci\u00f3n (Infor.Adicional)",
            "datetime": "2019-03-13T13:04:00+00:00",
            "link": "http://www.juntadeandalucia.es/haciendayadministracionpublica/apl/verifirmapdc/descargaInformeParametros?transaccion=faiWzA026afelEFcdjlOgSmkfG71%2BFxx&tipoPie=4",
            "anuncio_desc": "Convocatoria de licitaci\u00f3n (Infor.Adicional)"
        },
        {
            "anuncio_id": " 2019-0000028464",
            "numero_expediente": "CONTR 2018 0000051932",
            "descripcion": "28/03/2019 14:56, 2019-0000028464-Convocatoria de licitaci\u00f3n (Infor.Adicional)",
            "datetime": "2019-03-28T14:56:00+00:00",
            "link": "http://www.juntadeandalucia.es/haciendayadministracionpublica/apl/verifirmapdc/descargaInformeParametros?transaccion=zyHD%2FcAqTmfieqsQutZX9s4cenB071d7&tipoPie=4",
            "anuncio_desc": "Convocatoria de licitaci\u00f3n (Infor.Adicional)"
        },
        {
            "anuncio_id": " 2019-0000028941",
            "numero_expediente": "CONTR 2018 0000051932",
            "descripcion": "01/04/2019 19:15, 2019-0000028941-Convocatoria de licitaci\u00f3n (Infor.Adicional)",
            "datetime": "2019-04-01T19:15:00+00:00",
            "link": "http://www.juntadeandalucia.es/haciendayadministracionpublica/apl/verifirmapdc/descargaInformeParametros?transaccion=sagBwhMMr7xPFGOa93lfQPI9rwqOEXGf&tipoPie=4",
            "anuncio_desc": "Convocatoria de licitaci\u00f3n (Infor.Adicional)"
        },
        {
            "anuncio_id": " 2019-0000029964",
            "numero_expediente": "CONTR 2018 0000051932",
            "descripcion": "05/04/2019 13:26, 2019-0000029964-Convocatoria de licitaci\u00f3n (Infor.Adicional)",
            "datetime": "2019-04-05T13:26:00+00:00",
            "link": "http://www.juntadeandalucia.es/haciendayadministracionpublica/apl/verifirmapdc/descargaInformeParametros?transaccion=o63EjHWUyPvQLt2rY6vyDyJqUCje%2B%2B1i&tipoPie=4",
            "anuncio_desc": "Convocatoria de licitaci\u00f3n (Infor.Adicional)"
        },
        {
            "anuncio_id": " 2019-0000034453",
            "numero_expediente": "CONTR 2018 0000051932",
            "descripcion": "30/04/2019 18:26, 2019-0000034453-Convocatoria de licitaci\u00f3n (Infor.Adicional)",
            "datetime": "2019-04-30T18:26:00+00:00",
            "link": "http://www.juntadeandalucia.es/haciendayadministracionpublica/apl/verifirmapdc/descargaInformeParametros?transaccion=FLeDGugd9egDexbPNXX3zXlqT3SzUohr&tipoPie=4",
            "anuncio_desc": "Convocatoria de licitaci\u00f3n (Infor.Adicional)"
        },
        {
            "anuncio_id": " 2019-0000046146",
            "numero_expediente": "CONTR 2018 0000051932",
            "descripcion": "29/05/2019 14:07, 2019-0000046146-Convocatoria de licitaci\u00f3n (Infor.Adicional)",
            "datetime": "2019-05-29T14:07:00+00:00",
            "link": "http://www.juntadeandalucia.es/haciendayadministracionpublica/apl/verifirmapdc/descargaInformeParametros?transaccion=gQZjhaEZjdyPHBcmRayL2%2FI9rwqOEXGf&tipoPie=4",
            "anuncio_desc": "Convocatoria de licitaci\u00f3n (Infor.Adicional)"
        },
        {
            "anuncio_id": " 2019-0000047299",
            "numero_expediente": "CONTR 2018 0000051932",
            "descripcion": "05/06/2019 13:26, 2019-0000047299-Convocatoria de licitaci\u00f3n (Infor.Adicional)",
            "datetime": "2019-06-05T13:26:00+00:00",
            "link": "http://www.juntadeandalucia.es/haciendayadministracionpublica/apl/verifirmapdc/descargaInformeParametros?transaccion=kXciqiGTSpqjtYufEf9C%2BfI9rwqOEXGf&tipoPie=4",
            "anuncio_desc": "Convocatoria de licitaci\u00f3n (Infor.Adicional)"
        },
        {
            "anuncio_id": " 2019-0000047307",
            "numero_expediente": "CONTR 2018 0000051932",
            "descripcion": "05/06/2019 13:31, 2019-0000047307-Convocatoria de licitaci\u00f3n (Infor.Adicional)",
            "datetime": "2019-06-05T13:31:00+00:00",
            "link": "http://www.juntadeandalucia.es/haciendayadministracionpublica/apl/verifirmapdc/descargaInformeParametros?transaccion=kXciqiGTSpo2juGiDteR4YJinNB9TyKu&tipoPie=4",
            "anuncio_desc": "Convocatoria de licitaci\u00f3n (Infor.Adicional)"
        }
    ],
    "requisitos_criterios_condiciones": {
        "criterios_objetivos_para_la_seleccion_candidatos_el_procedimiento": "Los establecidos en el pliego de cl\u00e1usulas administrativas particulares",
        "criterios_adjudicacion": "Los establecidos en el pliego de cl\u00e1usulas administrativas particulares",
        "requisitos_minimos_contratista": "Los establecidos en el pliego de cl\u00e1usulas administrativas particulares",
        "condiciones_especiales_adjudicacion_contrato": "Los establecidos en el pliego de cl\u00e1usulas administrativas particulares"
    },
    "referencias_diarios_oficiales": [
        {
            "descripcion": "DOUE n\u00ba 36923 del a\u00f1o 2019, p\u00e1gina . ( Env\u00edo: 23/01/2019, Publicaci\u00f3n: 24/01/2019 ) Referencia 2018-51932",
            "link": "https://ted.europa.eu/udl?=TED:NOTICE:36923-2019:TEXT:ES:HTML",
            "numero_expediente": "CONTR 2018 0000051932"
        },
        {
            "descripcion": "DOUE n\u00ba S10 del a\u00f1o 2019, p\u00e1gina . ( Env\u00edo: 14/01/2019, Publicaci\u00f3n: 15/01/2019 ) Referencia 19-020516-001",
            "link": "https://ted.europa.eu/udl?=TED:NOTICE:19216-2019:TEXT:ES:HTML",
            "numero_expediente": "CONTR 2018 0000051932"
        }
    ],
    "presentacion_ofertas__notas": [
        "PABLO PICASSO 6 41018 (SEVILLA Espana)",
        "REGISTRO GENERAL DE LA CONSEJERIA DE FOMENTO Y VIVIENDA",
        "Registro General de la Consejeria de Fomento y Vivienda. No fax: 955926777 No telefono 955065372 Correo electronico: registro.sscc.cfv@juntadeandalucia.es"
    ],
    "origen": {
        "terminos_uso": "http://www.juntadeandalucia.es/informacion/legal.html",
        "url": "http://www.juntadeandalucia.es/temas/contratacion-publica/perfiles-licitaciones/detalle/000000107969.html"
    },
    "informacion_lotes_adjudicados_o_resueltos": []
}