{
    "apertura_ofertas": {
        "lugar": [
            "Agencia de Innovacion y Desarrollo de Andalucia",
            "Calle Leonardo da Vinci 17A 41092 (Sevilla )",
            "Fecha Apertura del sobre de criterios de adjudicacion evaluables por aplicacion de formulas : 17/05/2018 a las 10:00 horas"
        ]
    },
    "datosbasicos__numero_expediente": "3/2018-RRHH-SA",
    "importes__importe_licitacion_(con_iva)": "284.883,95EUR",
    "datosbasicos__division_por_lotes": "Si",
    "importes__valor_estimado": "353.161,92EUR",
    "datosbasicos__lugar_ejecucion": "NO PROVINCIALIZABLE",
    "datosbasicos__tramitacion": "Ordinario",
    "datosbasicos__organo_contratacion": "Agencia de Innovacion y Desarrollo de Andalucia (IDEA)",
    "origen": {
        "url": "http://www.juntadeandalucia.es/temas/contratacion-publica/perfiles-licitaciones/detalle/000000071821.html",
        "terminos_uso": "http://www.juntadeandalucia.es/informacion/legal.html"
    },
    "id": 71821,
    "informacion_lotes_adjudicados_o_resueltos": [
        {
            "lote_2_-_desierto__observaciones": "No concurre ningun licitador a los lote no1 y lote no2 ",
            "numero_expediente": "3/2018-RRHH-SA",
            "id": "lote_2_-_desierto"
        },
        {
            "lote_1__no_licitadores": "2",
            "id": "lote_1",
            "lote_1__adjudicatario": "ONTIME TRANSPORTE Y LOGISTICA, S.L.",
            "lote_1__importe_adjudicacion_(sin_iva)": "0,00EUR",
            "numero_expediente": "3/2018-RRHH-SA",
            "lote_1__nif": "B85720290",
            "lote_1__importe_adjudicacion_(con_iva)": "0,00EUR"
        }
    ],
    "datosbasicos__titulo_expediente": "Servicios postales, burofax, valija, mensajeria y paqueteria para la Agencia de Innovacion y Desarrollo de Andalucia",
    "referencias_diarios_oficiales": [],
    "datosbasicos__lugar_ejecucion_nuts": "ES61",
    "datosbasicos__clasificacion_cpv": [
        "64100000 Servicios postales y de correo rapido.",
        "64110000 Servicios postales.",
        "64112000 Servicios postales relacionados con cartas.",
        "64113000 Servicios postales relacionados con paquetes.",
        "64121100 Servicios de distribucion postal.",
        "64121200 Servicios de distribucion de paquetes.",
        "64122000 Servicios de correo interno."
    ],
    "estado_expediente__notas": [
        "18/12/2018 14:55 - Convocatoria de licitacion (Infor.Adicional)",
        "Actualizado: Convocatoria de licitacion (Infor.Adicional)",
        "Anuncio de la Mesa de contratacion: Requerimiento de subsanacion de la documentacion requerida conforme a la clausula 10.7 del PCAP para el Lote no3 (Servicios de valija).",
        "Ver lotes"
    ],
    "datosbasicos__numero_lotes": "4",
    "obtencion_documentacion_informacion": {
        "lugar": [
            "Agencia de Innovacion y Desarrollo de Andalucia",
            "Calle Leonardo da Vinci 17A 41092 (Sevilla )"
        ],
        "aclaraciones": "La fecha limite de obtencion de documentacion e informacion sera el ultimo dia del plazo de presentacion de ofertas.",
        "fecha_limite_obtencion": "23/03/2018 a las 23:55 horas",
        "puntos_contacto": [
            "Departamento de Contratacion",
            "955030784",
            "955030780",
            "contratacion@agenciaidea.es"
        ]
    },
    "datosbasicos__descripcion": "Servicios postales, burofax, valija, mensajeria y paqueteria para la Agencia de Innovacion y Desarrollo de Andalucia.",
    "presentacion_ofertas__notas": [
        "Agencia de Innovacion y Desarrollo de Andalucia",
        "Calle Leonardo da Vinci 17A 41092 (Sevilla )",
        "Respecto al lugar de presentacion debera atenderse a lo dispuesto en la clausula 9.1 del PCAP. Cuando las proposiciones se envien por Correos se deberan cumplir los requisitos alli dispuestos, pudiendo anunciar la remision de la oferta a traves del correo electronico a la siguiente direccion: contratacion@agenciaidea.es. Debera acompanar copia del documento de remision por correos. La fecha limite de presentacion de ofertas es el 23 de marzo de 2018 a las 23:59 horas."
    ],
    "anuncios_publicados": [
        {
            "descripcion": "08/03/2018 15:03, 2018-0000009698-Convocatoria de licitaci\u00f3n",
            "datetime": "2018-03-08T15:03:00+00:00",
            "anuncio_desc": "Convocatoria de licitaci\u00f3n",
            "numero_expediente": "3/2018-RRHH-SA",
            "link": "http://www.juntadeandalucia.es/haciendayadministracionpublica/apl/verifirmapdc/descargaInformeParametros?transaccion=WqLdw%2Bq8GLoGUy7c9v1MXYJinNB9TyKu&tipoPie=4",
            "anuncio_id": " 2018-0000009698"
        },
        {
            "descripcion": "04/04/2018 14:08, 2018-0000013250-Convocatoria de licitaci\u00f3n (Infor.Adicional)",
            "datetime": "2018-04-04T14:08:00+00:00",
            "anuncio_desc": "Convocatoria de licitaci\u00f3n (Infor.Adicional)",
            "numero_expediente": "3/2018-RRHH-SA",
            "link": "http://www.juntadeandalucia.es/haciendayadministracionpublica/apl/verifirmapdc/descargaInformeParametros?transaccion=SU%2F5r%2BnZERYfV3D2%2FIu%2BWnlqT3SzUohr&tipoPie=4",
            "anuncio_id": " 2018-0000013250"
        },
        {
            "descripcion": "16/04/2018 14:23, 2018-0000014610-Convocatoria de licitaci\u00f3n (Infor.Adicional)",
            "datetime": "2018-04-16T14:23:00+00:00",
            "anuncio_desc": "Convocatoria de licitaci\u00f3n (Infor.Adicional)",
            "numero_expediente": "3/2018-RRHH-SA",
            "link": "http://www.juntadeandalucia.es/haciendayadministracionpublica/apl/verifirmapdc/descargaInformeParametros?transaccion=RBFqcV9cE1KtRUvQvQkXpoYdAfNuj%2FNj&tipoPie=4",
            "anuncio_id": " 2018-0000014610"
        },
        {
            "descripcion": "09/05/2018 13:58, 2018-0000016641-Convocatoria de licitaci\u00f3n (Infor.Adicional)",
            "datetime": "2018-05-09T13:58:00+00:00",
            "anuncio_desc": "Convocatoria de licitaci\u00f3n (Infor.Adicional)",
            "numero_expediente": "3/2018-RRHH-SA",
            "link": "http://www.juntadeandalucia.es/haciendayadministracionpublica/apl/verifirmapdc/descargaInformeParametros?transaccion=bOylcTuJCkMI39BMUHC%2Bb4JinNB9TyKu&tipoPie=4",
            "anuncio_id": " 2018-0000016641"
        },
        {
            "descripcion": "11/05/2018 14:58, 2018-0000016923-Convocatoria de licitaci\u00f3n (Infor.Adicional)",
            "datetime": "2018-05-11T14:58:00+00:00",
            "anuncio_desc": "Convocatoria de licitaci\u00f3n (Infor.Adicional)",
            "numero_expediente": "3/2018-RRHH-SA",
            "link": "http://www.juntadeandalucia.es/haciendayadministracionpublica/apl/verifirmapdc/descargaInformeParametros?transaccion=%2BRiFobgxsgxeEAudyr%2BGASmkfG71%2BFxx&tipoPie=4",
            "anuncio_id": " 2018-0000016923"
        },
        {
            "descripcion": "14/05/2018 12:13, 2018-0000016996-Convocatoria de licitaci\u00f3n (Infor.Adicional)",
            "datetime": "2018-05-14T12:13:00+00:00",
            "anuncio_desc": "Convocatoria de licitaci\u00f3n (Infor.Adicional)",
            "numero_expediente": "3/2018-RRHH-SA",
            "link": "http://www.juntadeandalucia.es/haciendayadministracionpublica/apl/verifirmapdc/descargaInformeParametros?transaccion=pmORZYXjhNO%2B1mR0QPeJ3vI9rwqOEXGf&tipoPie=4",
            "anuncio_id": " 2018-0000016996"
        },
        {
            "descripcion": "02/10/2018 15:22, 2018-0000037728-Convocatoria de licitaci\u00f3n (Infor.Adicional)",
            "datetime": "2018-10-02T15:22:00+00:00",
            "anuncio_desc": "Convocatoria de licitaci\u00f3n (Infor.Adicional)",
            "numero_expediente": "3/2018-RRHH-SA",
            "link": "http://www.juntadeandalucia.es/haciendayadministracionpublica/apl/verifirmapdc/descargaInformeParametros?transaccion=vASvi4IumNTqcA6mvG3JNs4cenB071d7&tipoPie=4",
            "anuncio_id": " 2018-0000037728"
        },
        {
            "descripcion": "25/10/2018 14:15, 2018-0000043479-Convocatoria de licitaci\u00f3n (Infor.Adicional)",
            "datetime": "2018-10-25T14:15:00+00:00",
            "anuncio_desc": "Convocatoria de licitaci\u00f3n (Infor.Adicional)",
            "numero_expediente": "3/2018-RRHH-SA",
            "link": "http://www.juntadeandalucia.es/haciendayadministracionpublica/apl/verifirmapdc/descargaInformeParametros?transaccion=9XTeVaQywwfI8uHdZiuDXXP4a3pxggof&tipoPie=4",
            "anuncio_id": " 2018-0000043479"
        },
        {
            "descripcion": "14/11/2018 15:12, 2018-0000047971-Convocatoria de licitaci\u00f3n (Infor.Adicional)",
            "datetime": "2018-11-14T15:12:00+00:00",
            "anuncio_desc": "Convocatoria de licitaci\u00f3n (Infor.Adicional)",
            "numero_expediente": "3/2018-RRHH-SA",
            "link": "http://www.juntadeandalucia.es/haciendayadministracionpublica/apl/verifirmapdc/descargaInformeParametros?transaccion=LNeie4znxqezi4DuoibfiavJYER37PP1&tipoPie=4",
            "anuncio_id": " 2018-0000047971"
        },
        {
            "descripcion": "29/11/2018 12:09, 2018-0000051388-Convocatoria de licitaci\u00f3n (Infor.Adicional)",
            "datetime": "2018-11-29T12:09:00+00:00",
            "anuncio_desc": "Convocatoria de licitaci\u00f3n (Infor.Adicional)",
            "numero_expediente": "3/2018-RRHH-SA",
            "link": "http://www.juntadeandalucia.es/haciendayadministracionpublica/apl/verifirmapdc/descargaInformeParametros?transaccion=%2Be%2ByBgmsHIJ4kSxcQzMOEM4cenB071d7&tipoPie=4",
            "anuncio_id": " 2018-0000051388"
        },
        {
            "descripcion": "30/11/2018 11:16, 2018-0000051630-Adjudicaci\u00f3n",
            "datetime": "2018-11-30T11:16:00+00:00",
            "anuncio_desc": "Adjudicaci\u00f3n",
            "numero_expediente": "3/2018-RRHH-SA",
            "link": "http://www.juntadeandalucia.es/haciendayadministracionpublica/apl/verifirmapdc/descargaInformeParametros?transaccion=mixd6i09h8sCQnMasyt2ECmkfG71%2BFxx&tipoPie=4",
            "anuncio_id": " 2018-0000051630"
        },
        {
            "descripcion": "30/11/2018 11:40, 2018-0000051661-Procedimiento desierto",
            "datetime": "2018-11-30T11:40:00+00:00",
            "anuncio_desc": "Procedimiento desierto",
            "numero_expediente": "3/2018-RRHH-SA",
            "link": "http://www.juntadeandalucia.es/haciendayadministracionpublica/apl/verifirmapdc/descargaInformeParametros?transaccion=f4Wb3JBPx%2BSo6wfYAeOspoJinNB9TyKu&tipoPie=4",
            "anuncio_id": " 2018-0000051661"
        },
        {
            "descripcion": "18/12/2018 14:55, 2018-0000062535-Convocatoria de licitaci\u00f3n (Infor.Adicional)",
            "datetime": "2018-12-18T14:55:00+00:00",
            "anuncio_desc": "Convocatoria de licitaci\u00f3n (Infor.Adicional)",
            "numero_expediente": "3/2018-RRHH-SA",
            "link": "http://www.juntadeandalucia.es/haciendayadministracionpublica/apl/verifirmapdc/descargaInformeParametros?transaccion=uvBAkrKP2qqBjWIC1cDftCJqUCje%2B%2B1i&tipoPie=4",
            "anuncio_id": " 2018-0000062535"
        }
    ],
    "presentacion_ofertas__fecha_limite_presentacion_ofertas": "23/03/2018 a las 23:55 horas",
    "datosbasicos__lugar_tramitacion": "SEVILLA",
    "estado_expediente__estado": "Adjudicado",
    "importes__notas": "El contrato es susceptible de una prorroga por un periodo unico de 24 meses de duracion. En el supuesto de que la prorroga se lleve a cabo, el importe de la misma sera equivalente al presupuesto maximo de licitacion relativo a 24 meses.",
    "documentacion_complementaria": [
        {
            "numero_expediente": "3/2018-RRHH-SA",
            "link": "http://www.juntadeandalucia.es/contratacion/document/download?refCode=2018-0000051661&refDoc=2018-0000051661-0",
            "descripcion": "Resoluci\u00f3n de desierto Lote n\u00ba1 y n\u00ba2 (pdf) (49.76Kb)"
        },
        {
            "numero_expediente": "3/2018-RRHH-SA",
            "link": "http://www.juntadeandalucia.es/contratacion/document/download?refCode=2018-0000062535&refDoc=2018-0000062535-0",
            "descripcion": "Pliego de Cl\u00e1usulas Administrativas Particulares (pdf) (390.94Kb)"
        },
        {
            "numero_expediente": "3/2018-RRHH-SA",
            "link": "http://www.juntadeandalucia.es/contratacion/document/download?refCode=2018-0000062535&refDoc=2018-0000062535-1",
            "descripcion": "Anexos del PCAP (pdf) (1209.46Kb)"
        },
        {
            "numero_expediente": "3/2018-RRHH-SA",
            "link": "http://www.juntadeandalucia.es/contratacion/document/download?refCode=2018-0000062535&refDoc=2018-0000062535-2",
            "descripcion": "Pliego de Prescripciones T\u00e9cnicas (pdf) (1134.38Kb)"
        },
        {
            "numero_expediente": "3/2018-RRHH-SA",
            "link": "http://www.juntadeandalucia.es/contratacion/document/download?refCode=2018-0000051630&refDoc=2018-0000051630-0",
            "descripcion": "Resoluci\u00f3n de adjudicaci\u00f3n del Lote n\u00ba4. (pdf) (446.25Kb)"
        },
        {
            "numero_expediente": "3/2018-RRHH-SA",
            "link": "http://www.juntadeandalucia.es/contratacion/document/download?refCode=2018-0000062535&refDoc=2018-0000062535-3",
            "descripcion": "Resoluci\u00f3n composici\u00f3n Mesa de Contrataci\u00f3n (pdf) (45.38Kb)"
        },
        {
            "numero_expediente": "3/2018-RRHH-SA",
            "link": "http://www.juntadeandalucia.es/contratacion/document/download?refCode=2018-0000062535&refDoc=2018-0000062535-4",
            "descripcion": "Anuncio aclaraciones sobre n\u00ba 1 (pdf) (103.7Kb)"
        },
        {
            "numero_expediente": "3/2018-RRHH-SA",
            "link": "http://www.juntadeandalucia.es/contratacion/document/download?refCode=2018-0000062535&refDoc=2018-0000062535-5",
            "descripcion": "Relaci\u00f3n de licitadores (pdf) (357.04Kb)"
        },
        {
            "numero_expediente": "3/2018-RRHH-SA",
            "link": "http://www.juntadeandalucia.es/contratacion/document/download?refCode=2018-0000062535&refDoc=2018-0000062535-6",
            "descripcion": "Anuncio Acto P\u00fablico (pdf) (177.35Kb)"
        },
        {
            "numero_expediente": "3/2018-RRHH-SA",
            "link": "http://www.juntadeandalucia.es/contratacion/document/download?refCode=2018-0000062535&refDoc=2018-0000062535-7",
            "descripcion": "ANUNCIO DE ACLARACI\u00d3N DEL SOBRE N\u00ba3 (pdf) (109.71Kb)"
        },
        {
            "numero_expediente": "3/2018-RRHH-SA",
            "link": "http://www.juntadeandalucia.es/contratacion/document/download?refCode=2018-0000062535&refDoc=2018-0000062535-8",
            "descripcion": "RESOLUCI\u00d3N OFERTA ECON\u00d3MICAMENTE M\u00c1S VENTAJOSA LOTE n\u00ba3 y n\u00ba4 (pdf) (432.11Kb)"
        },
        {
            "numero_expediente": "3/2018-RRHH-SA",
            "link": "http://www.juntadeandalucia.es/contratacion/document/download?refCode=2018-0000062535&refDoc=2018-0000062535-9",
            "descripcion": "ANUNCIO SUBSANACI\u00d3N DE LA DOCUMENTACI\u00d3N ACREDITATIVA CL\u00c1USULA 10.7 PCAP (pdf) (166.94Kb)"
        },
        {
            "numero_expediente": "3/2018-RRHH-SA",
            "link": "http://www.juntadeandalucia.es/contratacion/document/download?refCode=2018-0000062535&refDoc=2018-0000062535-10",
            "descripcion": "RESOLUCI\u00d3N DE NUEVA OFERTA ECON\u00d3MICAMENTE M\u00c1S VENTAJOSA LOTE N\u00ba 3 (pdf) (329.04Kb)"
        },
        {
            "numero_expediente": "3/2018-RRHH-SA",
            "link": "http://www.juntadeandalucia.es/contratacion/document/download?refCode=2018-0000062535&refDoc=2018-0000062535-11",
            "descripcion": "ANUNCIO DE LA MESA CONTRATACI\u00d3N: SUBSANACIONES DOC PREVIA (pdf) (135.1Kb)"
        }
    ],
    "datosbasicos__tipo_contrato": "Servicios",
    "requisitos_criterios_condiciones": {
        "requisitos_minimos_contratista": "Los establecidos en el pliego de cl\u00e1usulas administrativas particulares. Los licitadores que concurran al Lote 1 deber\u00e1n acreditar que est\u00e1n inscritos en el Registro General de Empresas Prestadoras de Servicios Postales, en la secci\u00f3n B, esto es, que est\u00e1n habilitados para prestar el servicio postal universal. Asimismo deber\u00e1n presentar la autorizaci\u00f3n administrativa singular.Y para los licitadores que deseen concurrir al resto de los lotes deber\u00e1n acreditar que est\u00e1n inscritas en el Registro General de Empresas Prestadoras de Servicios Postales, en lasecci\u00f3n A, esto es, que est\u00e1n habilitados para prestar servicios postales no incluidos en el \u00e1mbito del servicio postal universal. Deber\u00e1n presentar la autorizaci\u00f3n administrativa general.",
        "criterios_adjudicacion": "Los establecidos en el pliego de cl\u00e1usulas administrativas particulares",
        "condiciones_especiales_adjudicacion_contrato": "Las establecidas en el pliego de cl\u00e1usulas administrativas particulares",
        "criterios_objetivos_para_la_seleccion_candidatos_el_procedimiento": "La solvencia econ\u00f3mica o financiera se acreditar\u00e1 en la forma se\u00f1alada en el PCAP por alguno de los siguientes medios/criterios: a) volumen anual de negocios, que referido al a\u00f1o de mayor volumen de negocio de los tres \u00faltimos concluidos deber\u00e1 ser, igual o superior a 1,5 veces del valor anual medio o b) mediante la clasificaci\u00f3n administrativa, Grupo R, Subgrupo 9, Categor\u00eda A \u00f3 1 \u00f3 superior. La solvencia t\u00e9cnica o profesional se acreditar\u00e1 en la forma se\u00f1alada en el PCAP por alguno de los siguientes medios/criterios: a) relaci\u00f3n de los principales servicios realizados en los \u00faltimos cinco a\u00f1os, cuyos importes anuales acumulados en el a\u00f1o de mayor ejecuci\u00f3n sean igual o superiores al valor anual medio o b) mediante la clasificaci\u00f3n administrativa, Grupo R, Subgrupo 9, Categor\u00eda A \u00f3 1 \u00f3 superior."
    },
    "importes__importes_adjudicacion": "Ver lotes",
    "secciones": {
        "apertura_ofertas": 8,
        "referencias_diarios_oficiales": 9,
        "estado_expediente": 1,
        "informacion_lotes_adjudicados_o_resueltos": 2,
        "documentacion_complementaria": 3,
        "presentacion_ofertas": 7,
        "anuncios_publicados": 11,
        "requisitos_criterios_condiciones": 5,
        "importes": 0,
        "presentacion_solicitudes": 6,
        "clasificacion_empresarial": 10,
        "obtencion_documentacion_informacion": 4
    },
    "datosbasicos__procedimiento": "Abierto",
    "importes__importe_licitacion_(sin_iva)": "235.441,28EUR"
}