{
    "secciones": {
        "importes": 0,
        "estado_expediente": 1,
        "informacion_lotes_adjudicados_o_resueltos": 2,
        "documentacion_complementaria": 3,
        "obtencion_documentacion_informacion": 4,
        "requisitos_criterios_condiciones": 5,
        "presentacion_solicitudes": 6,
        "presentacion_ofertas": 7,
        "apertura_ofertas": 8,
        "referencias_diarios_oficiales": 9,
        "anuncios_publicados": 10
    },
    "datosbasicos__numero_expediente": "CA-13/2017",
    "datosbasicos__titulo_expediente": "Servicio de centro de dia para personas mayores en situacion de dependencia en centros de titularidad publica denominados UED Cuevas de Almanzora (Cuevas de Almanzora, Almeria) y UED Virgen de la Capilla (Jaen)",
    "datosbasicos__descripcion": "Servicio de centro de dia para personas mayores en situacion de dependencia en centros de titularidad publica denominados UED Cuevas de Almanzora (Cuevas de Almanzora, Almeria) y UED Virgen de la Capilla (Jaen)",
    "datosbasicos__organo_contratacion": "Agencia de Servicios Sociales y Dependencia de Andalucia",
    "datosbasicos__tipo_contrato": "Servicios",
    "datosbasicos__procedimiento": "Abierto",
    "datosbasicos__tramitacion": "Ordinario",
    "datosbasicos__clasificacion_cpv": "85312100 Servicios de centros de dia.",
    "datosbasicos__duracion_contrato": "4 anos",
    "datosbasicos__division_por_lotes": "Si",
    "datosbasicos__numero_lotes": "2",
    "datosbasicos__lugar_tramitacion": "SEVILLA",
    "datosbasicos__lugar_ejecucion_nuts": "ES61",
    "datosbasicos__lugar_ejecucion": [
        "ALMERIA",
        "JAEN"
    ],
    "importes__importe_licitacion_(sin_iva)": "1.560.932,40EUR",
    "importes__importe_licitacion_(con_iva)": "1.623.463,20EUR",
    "importes__valor_estimado": "2.653.050,88EUR",
    "importes__notas": "Importe para cada uno de los lotes:780.466,20 iva excluidoValor estimado para cada uno de los lotes: 1.326.525,44 iva excluido.",
    "importes__importes_adjudicacion": "Ver lotes",
    "informacion_lotes_adjudicados_o_resueltos": [
        {
            "numero_expediente": "CA-13/2017",
            "id": "lote_2",
            "lote_2__no_licitadores": "2",
            "lote_2__nif": "B23432164",
            "lote_2__adjudicatario": "Servisur para la Insercion SL",
            "lote_2__importe_adjudicacion_(sin_iva)": "759.720,00EUR",
            "lote_2__importe_adjudicacion_(con_iva)": "790.108,80EUR"
        },
        {
            "numero_expediente": "CA-13/2017",
            "id": "lote_1",
            "lote_1__no_licitadores": "2",
            "lote_1__nif": "G04054425",
            "lote_1__adjudicatario": "Federacion Almeriense de asociaciones de personas con discapacidad",
            "lote_1__importe_adjudicacion_(sin_iva)": "725.532,60EUR",
            "lote_1__importe_adjudicacion_(con_iva)": "725.532,60EUR"
        }
    ],
    "documentacion_complementaria": [
        {
            "numero_expediente": "CA-13/2017",
            "link": "http://www.juntadeandalucia.es/contratacion/document/download?refCode=2018-0000017737&refDoc=2018-0000017737-0",
            "descripcion": "Pliego de Prescripciones T\u00e9cnicas (pdf) (3215.08Kb)"
        },
        {
            "numero_expediente": "CA-13/2017",
            "link": "http://www.juntadeandalucia.es/contratacion/document/download?refCode=2018-0000017737&refDoc=2018-0000017737-1",
            "descripcion": "Pliego de Cl\u00e1usulas Administrativas Particulares (pdf) (992.29Kb)"
        },
        {
            "numero_expediente": "CA-13/2017",
            "link": "http://www.juntadeandalucia.es/contratacion/document/download?refCode=2018-0000017737&refDoc=2018-0000017737-2",
            "descripcion": "Resoluci\u00f3n aprobaci\u00f3n del expediente (pdf) (636.53Kb)"
        },
        {
            "numero_expediente": "CA-13/2017",
            "link": "http://www.juntadeandalucia.es/contratacion/document/download?refCode=2018-0000017737&refDoc=2018-0000017737-3",
            "descripcion": "Resoluci\u00f3n composici\u00f3n de la Mesa de Contrataci\u00f3n (pdf) (574.47Kb)"
        },
        {
            "numero_expediente": "CA-13/2017",
            "link": "http://www.juntadeandalucia.es/contratacion/document/download?refCode=2018-0000017737&refDoc=2018-0000017737-4",
            "descripcion": "Modelo Anexo VI B (odt) (151.99Kb)"
        },
        {
            "numero_expediente": "CA-13/2017",
            "link": "http://www.juntadeandalucia.es/contratacion/document/download?refCode=2018-0000017737&refDoc=2018-0000017737-5",
            "descripcion": "Elementos patrimoniales Cuevas de Almanzora (pdf) (1841.51Kb)"
        },
        {
            "numero_expediente": "CA-13/2017",
            "link": "http://www.juntadeandalucia.es/contratacion/document/download?refCode=2018-0000017737&refDoc=2018-0000017737-6",
            "descripcion": "Elementos patrimoniales Vrgen de la Capilla (pdf) (33.5Kb)"
        },
        {
            "numero_expediente": "CA-13/2017",
            "link": "http://www.juntadeandalucia.es/contratacion/document/download?refCode=2018-0000017737&refDoc=2018-0000017737-7",
            "descripcion": "Resoluc correcci\u00f3n composici\u00f3n mesa (pdf) (244.49Kb)"
        },
        {
            "numero_expediente": "CA-13/2017",
            "link": "http://www.juntadeandalucia.es/contratacion/document/download?refCode=2018-0000017737&refDoc=2018-0000017737-8",
            "descripcion": "Resoluc correcci\u00f3n aprobac expediente (pdf) (253.25Kb)"
        },
        {
            "numero_expediente": "CA-13/2017",
            "link": "http://www.juntadeandalucia.es/contratacion/document/download?refCode=2018-0000023964&refDoc=2018-0000023964-0",
            "descripcion": "Contrato lote1 (pdf) (5731.5Kb)"
        },
        {
            "numero_expediente": "CA-13/2017",
            "link": "http://www.juntadeandalucia.es/contratacion/document/download?refCode=2018-0000037569&refDoc=2018-0000037569-0",
            "descripcion": "Contrato Lote 2 (pdf) (5472.58Kb)"
        },
        {
            "numero_expediente": "CA-13/2017",
            "link": "http://www.juntadeandalucia.es/contratacion/document/download?refCode=2018-0000017737&refDoc=2018-0000017737-9",
            "descripcion": "Anuncio requerimiento subsanaci\u00f3n sobre 1 (pdf) (259.86Kb)"
        },
        {
            "numero_expediente": "CA-13/2017",
            "link": "http://www.juntadeandalucia.es/contratacion/document/download?refCode=2018-0000017737&refDoc=2018-0000017737-10",
            "descripcion": "Resoluci\u00f3n exclusi\u00f3n ADL SCA (pdf) (1120.68Kb)"
        },
        {
            "numero_expediente": "CA-13/2017",
            "link": "http://www.juntadeandalucia.es/contratacion/document/download?refCode=2018-0000017737&refDoc=2018-0000017737-11",
            "descripcion": "Resoluci\u00f3n de la Directora Gerente de cese y designaci\u00f3n de miembros de la Mesa (pdf) (642.14Kb)"
        }
    ],
    "obtencion_documentacion_informacion": {
        "fecha_limite_obtencion": "06/04/2018 a las 10:00 horas",
        "lugar": [
            "Agencia de Servicios Sociales y Dependencia de Andalucia",
            "Avda de Hytasa 14 41071 (Sevilla )"
        ],
        "puntos_contacto": [
            "Cayetano Garcia de la Borbolla Carrero",
            "955405685",
            "955048801",
            "licitaciones.assda@juntadeandalucia.e"
        ]
    },
    "requisitos_criterios_condiciones": {
        "requisitos_minimos_contratista": "Los establecidos en el pliego de cl\u00e1usulas administrativas particulares",
        "criterios_adjudicacion": "Los establecidos en el pliego de cl\u00e1usulas administrativas particulares",
        "criterios_objetivos_para_la_seleccion_candidatos_el_procedimiento": "Los establecidos en el pliego de cl\u00e1usulas administrativas particulares",
        "condiciones_especiales_adjudicacion_contrato": "Las establecidas en el pliego de cl\u00e1usulas administrativas particulares"
    },
    "presentacion_ofertas__fecha_limite_presentacion_ofertas": "06/04/2018 a las 14:00 horas",
    "presentacion_ofertas__notas": [
        "Agencia de Servicios Sociales y Dependencia de Andalucia",
        "Avda de Hytasa 14 41071 (Sevilla )"
    ],
    "apertura_ofertas": {
        "lugar": [
            "Agencia de Servicios Sociales y dependencia de Andalucia",
            "Calle Seda 5 41006 (Sevilla )",
            "Fecha Apertura del sobre de criterios de adjudicacion que dependen de un juicio de valor : 02/05/2018 a las 12:00 horas",
            "Fecha Apertura del sobre de criterios de adjudicacion evaluables por aplicacion de formulas : 23/05/2018 a las 12:00 horas"
        ]
    },
    "referencias_diarios_oficiales": [],
    "anuncios_publicados": [
        {
            "numero_expediente": "CA-13/2017",
            "link": "http://www.juntadeandalucia.es/haciendayadministracionpublica/apl/verifirmapdc/descargaInformeParametros?transaccion=DltsA%2B1VFLkphMlGAEK3JimkfG71%2BFxx&tipoPie=4",
            "descripcion": "01/03/2018 13:47, 2018-0000008637-Convocatoria de licitaci\u00f3n",
            "datetime": "2018-03-01T13:47:00+00:00",
            "anuncio_id": " 2018-0000008637",
            "anuncio_desc": "Convocatoria de licitaci\u00f3n"
        },
        {
            "numero_expediente": "CA-13/2017",
            "link": "http://www.juntadeandalucia.es/haciendayadministracionpublica/apl/verifirmapdc/descargaInformeParametros?transaccion=2n2gbPJ24aaw7LOGKMZInYJinNB9TyKu&tipoPie=4",
            "descripcion": "02/03/2018 14:49, 2018-0000009017-Convocatoria de licitaci\u00f3n (Correci\u00f3n)",
            "datetime": "2018-03-02T14:49:00+00:00",
            "anuncio_id": " 2018-0000009017",
            "anuncio_desc": "Convocatoria de licitaci\u00f3n (Correci\u00f3n)"
        },
        {
            "numero_expediente": "CA-13/2017",
            "link": "http://www.juntadeandalucia.es/haciendayadministracionpublica/apl/verifirmapdc/descargaInformeParametros?transaccion=5yCfKfMSyOihG9CXoFrIDYYdAfNuj%2FNj&tipoPie=4",
            "descripcion": "26/04/2018 15:15, 2018-0000015640-Convocatoria de licitaci\u00f3n (Infor.Adicional)",
            "datetime": "2018-04-26T15:15:00+00:00",
            "anuncio_id": " 2018-0000015640",
            "anuncio_desc": "Convocatoria de licitaci\u00f3n (Infor.Adicional)"
        },
        {
            "numero_expediente": "CA-13/2017",
            "link": "http://www.juntadeandalucia.es/haciendayadministracionpublica/apl/verifirmapdc/descargaInformeParametros?transaccion=EhRLThTaPtO16ySnyrMQK3lqT3SzUohr&tipoPie=4",
            "descripcion": "09/05/2018 13:15, 2018-0000016582-Convocatoria de licitaci\u00f3n (Infor.Adicional)",
            "datetime": "2018-05-09T13:15:00+00:00",
            "anuncio_id": " 2018-0000016582",
            "anuncio_desc": "Convocatoria de licitaci\u00f3n (Infor.Adicional)"
        },
        {
            "numero_expediente": "CA-13/2017",
            "link": "http://www.juntadeandalucia.es/haciendayadministracionpublica/apl/verifirmapdc/descargaInformeParametros?transaccion=ojdIUIyYOp%2BR7GNk3S1LV3lqT3SzUohr&tipoPie=4",
            "descripcion": "23/05/2018 09:17, 2018-0000017737-Convocatoria de licitaci\u00f3n (Infor.Adicional)",
            "datetime": "2018-05-23T09:17:00+00:00",
            "anuncio_id": " 2018-0000017737",
            "anuncio_desc": "Convocatoria de licitaci\u00f3n (Infor.Adicional)"
        },
        {
            "numero_expediente": "CA-13/2017",
            "link": "http://www.juntadeandalucia.es/haciendayadministracionpublica/apl/verifirmapdc/descargaInformeParametros?transaccion=2WVfwKstkWUcX0f8ZGq%2FWYYdAfNuj%2FNj&tipoPie=4",
            "descripcion": "06/06/2018 15:44, 2018-0000019213-Adjudicaci\u00f3n",
            "datetime": "2018-06-06T15:44:00+00:00",
            "anuncio_id": " 2018-0000019213",
            "anuncio_desc": "Adjudicaci\u00f3n"
        },
        {
            "numero_expediente": "CA-13/2017",
            "link": "http://www.juntadeandalucia.es/haciendayadministracionpublica/apl/verifirmapdc/descargaInformeParametros?transaccion=IfyzucT7LDbp4Q0fck1NwYJinNB9TyKu&tipoPie=4",
            "descripcion": "08/06/2018 14:59, 2018-0000019569-Adjudicaci\u00f3n",
            "datetime": "2018-06-08T14:59:00+00:00",
            "anuncio_id": " 2018-0000019569",
            "anuncio_desc": "Adjudicaci\u00f3n"
        },
        {
            "numero_expediente": "CA-13/2017",
            "link": "http://www.juntadeandalucia.es/haciendayadministracionpublica/apl/verifirmapdc/descargaInformeParametros?transaccion=v3ywhJJdEJ3kMXlie%2BBEy6VT2q%2Bc%2Fsfz&tipoPie=4",
            "descripcion": "11/07/2018 08:47, 2018-0000023225-Formalizaci\u00f3n",
            "datetime": "2018-07-11T08:47:00+00:00",
            "anuncio_id": " 2018-0000023225",
            "anuncio_desc": "Formalizaci\u00f3n"
        },
        {
            "numero_expediente": "CA-13/2017",
            "link": "http://www.juntadeandalucia.es/haciendayadministracionpublica/apl/verifirmapdc/descargaInformeParametros?transaccion=O7NDenGzUVyScCg%2B0efmXvI9rwqOEXGf&tipoPie=4",
            "descripcion": "18/07/2018 13:18, 2018-0000023964-Formalizaci\u00f3n",
            "datetime": "2018-07-18T13:18:00+00:00",
            "anuncio_id": " 2018-0000023964",
            "anuncio_desc": "Formalizaci\u00f3n"
        },
        {
            "numero_expediente": "CA-13/2017",
            "link": "http://www.juntadeandalucia.es/haciendayadministracionpublica/apl/verifirmapdc/descargaInformeParametros?transaccion=CGGR2QmvYr3QiVEuixgZ5%2FI9rwqOEXGf&tipoPie=4",
            "descripcion": "03/10/2018 11:12, 2018-0000037569-Formalizaci\u00f3n (Infor.Adicional)",
            "datetime": "2018-10-03T11:12:00+00:00",
            "anuncio_id": " 2018-0000037569",
            "anuncio_desc": "Formalizaci\u00f3n (Infor.Adicional)"
        }
    ],
    "id": 71349,
    "origen": {
        "url": "http://www.juntadeandalucia.es/temas/contratacion-publica/perfiles-licitaciones/detalle/000000071349.html",
        "terminos_uso": "http://www.juntadeandalucia.es/informacion/legal.html"
    }
}