{
    "secciones": {
        "importes": 0,
        "estado_expediente": 1,
        "informacion_lotes_adjudicados_o_resueltos": 2,
        "documentacion_complementaria": 3,
        "obtencion_documentacion_informacion": 4,
        "requisitos_criterios_condiciones": 5,
        "presentacion_solicitudes": 6,
        "presentacion_ofertas": 7,
        "apertura_ofertas": 8,
        "referencias_diarios_oficiales": 9,
        "anuncios_publicados": 10
    },
    "datosbasicos__numero_expediente": "SUM 02/18",
    "datosbasicos__titulo_expediente": "SUMINISTRO DE PRODUCTOS ALIMENTICIOS PARA EL CENTRO DE MENORES \"SAN JUAN DE AVILA\", DEPENDIENTE DE LA DELEGACION TERRITORIAL DE IGUALDAD, SALUD Y POLITICAS SOCIALES",
    "datosbasicos__descripcion": "LOTE 1.- CARNES, HUEVOS Y DERIVADOS FRESCOS.LOTE 2.- CONGELADOS.LOTE 3.- FRUTAS Y VERDURAS.LOTE 4.- PANES Y DERIVADOS.LOTE 5.- VARIOS",
    "datosbasicos__organo_contratacion": "Delegacion Territorial de Igualdad, Salud y Politicas Sociales en Sevilla",
    "datosbasicos__tipo_contrato": "Suministros",
    "datosbasicos__procedimiento": "Abierto",
    "datosbasicos__tramitacion": "Ordinario",
    "datosbasicos__clasificacion_cpv": "15000000 Alimentos, bebidas, tabaco y productos afines.",
    "datosbasicos__duracion_contrato": "12 meses",
    "datosbasicos__division_por_lotes": "Si",
    "datosbasicos__numero_lotes": "5",
    "datosbasicos__lugar_tramitacion": "SEVILLA",
    "datosbasicos__lugar_ejecucion_nuts": "ES618",
    "datosbasicos__lugar_ejecucion": "SEVILLA",
    "importes__importe_licitacion_(sin_iva)": "90.192,11EUR",
    "importes__importe_licitacion_(con_iva)": "97.771,40EUR",
    "importes__valor_estimado": "378.806,86EUR",
    "importes__notas": "Por posibilidad de prorrogas de duracion del plazo inicial de ejecucion, hasta un maximo de tres prorrogas dentro del limite establecido en el art. 40 de la TRLGHP para los gastos plurianuales, y por posibilidad de modificacion de hasta un 20% el importe de cada lote.",
    "importes__importes_adjudicacion": "Ver lotes",
    "informacion_lotes_adjudicados_o_resueltos": [
        {
            "numero_expediente": "SUM 02/18",
            "id": "lote_5",
            "lote_5__no_licitadores": "4",
            "lote_5__nif": "B91016238",
            "lote_5__adjudicatario": "PLATAFORMA FEMAR,SL",
            "lote_5__importe_adjudicacion_(sin_iva)": "18.819,79EUR",
            "lote_5__importe_adjudicacion_(con_iva)": "20.457,27EUR"
        },
        {
            "numero_expediente": "SUM 02/18",
            "id": "lote_1",
            "lote_1__no_licitadores": "1",
            "lote_1__nif": "B91016238",
            "lote_1__adjudicatario": "PLATAFORMA FEMAR,SL",
            "lote_1__importe_adjudicacion_(sin_iva)": "18.075,00EUR",
            "lote_1__importe_adjudicacion_(con_iva)": "19.882,50EUR"
        },
        {
            "numero_expediente": "SUM 02/18",
            "id": "lote_2",
            "lote_2__no_licitadores": "2",
            "lote_2__nif": "B91016238",
            "lote_2__adjudicatario": "PLATAFORMA FEMAR,SL",
            "lote_2__importe_adjudicacion_(sin_iva)": "14.728,30EUR",
            "lote_2__importe_adjudicacion_(con_iva)": "16.190,45EUR"
        },
        {
            "numero_expediente": "SUM 02/18",
            "id": "lote_4",
            "lote_4__no_licitadores": "1",
            "lote_4__nif": "B91016238",
            "lote_4__adjudicatario": "PLATAFORMA FEMAR,SL",
            "lote_4__importe_adjudicacion_(sin_iva)": "6.561,40EUR",
            "lote_4__importe_adjudicacion_(con_iva)": "6.967,38EUR"
        },
        {
            "numero_expediente": "SUM 02/18",
            "id": "lote_3",
            "lote_3__no_licitadores": "2",
            "lote_3__nif": "B91016238",
            "lote_3__adjudicatario": "PLATAFORMA FEMAR,SL",
            "lote_3__importe_adjudicacion_(sin_iva)": "10.085,80EUR",
            "lote_3__importe_adjudicacion_(con_iva)": "10.489,23EUR"
        }
    ],
    "documentacion_complementaria": [
        {
            "numero_expediente": "SUM 02/18",
            "link": "http://www.juntadeandalucia.es/contratacion/document/download?refCode=2018-0000024848&refDoc=2018-0000024848-0",
            "descripcion": "RESOLUCI\u00d3N ADJUDICACI\u00d3N (pdf) (282.25Kb)"
        },
        {
            "numero_expediente": "SUM 02/18",
            "link": "http://www.juntadeandalucia.es/contratacion/document/download?refCode=2018-0000035880&refDoc=2018-0000035880-0",
            "descripcion": "CONTRATO FORMALIZADO (PDF) (7313.44Kb)"
        },
        {
            "numero_expediente": "SUM 02/18",
            "link": "http://www.juntadeandalucia.es/contratacion/document/download?refCode=2018-0000021761&refDoc=2018-0000021761-0",
            "descripcion": "Pliego de Cl\u00e1uslas Administrativas Particulares (pdf) (1963.35Kb)"
        },
        {
            "numero_expediente": "SUM 02/18",
            "link": "http://www.juntadeandalucia.es/contratacion/document/download?refCode=2018-0000021761&refDoc=2018-0000021761-1",
            "descripcion": "Pliego de Prescripciones T\u00e9cnicas (pdf) (70.18Kb)"
        },
        {
            "numero_expediente": "SUM 02/18",
            "link": "http://www.juntadeandalucia.es/contratacion/document/download?refCode=2018-0000021761&refDoc=2018-0000021761-2",
            "descripcion": "RESOLUCION NOMBRAMIENTO MESA DE CONTRATACION (pdf) (58.16Kb)"
        },
        {
            "numero_expediente": "SUM 02/18",
            "link": "http://www.juntadeandalucia.es/contratacion/document/download?refCode=2018-0000021761&refDoc=2018-0000021761-3",
            "descripcion": "PRIMERA ACTA (PDF) (1183.44Kb)"
        },
        {
            "numero_expediente": "SUM 02/18",
            "link": "http://www.juntadeandalucia.es/contratacion/document/download?refCode=2018-0000021761&refDoc=2018-0000021761-4",
            "descripcion": "SEGUNDA ACTA (pdf) (4374.66Kb)"
        },
        {
            "numero_expediente": "SUM 02/18",
            "link": "http://www.juntadeandalucia.es/contratacion/document/download?refCode=2018-0000021761&refDoc=2018-0000021761-5",
            "descripcion": "TERCERA ACTA (PDF) (606.89Kb)"
        },
        {
            "numero_expediente": "SUM 02/18",
            "link": "http://www.juntadeandalucia.es/contratacion/document/download?refCode=2018-0000021761&refDoc=2018-0000021761-6",
            "descripcion": "CUARTA ACTA (PDF) (230.03Kb)"
        },
        {
            "numero_expediente": "SUM 02/18",
            "link": "http://www.juntadeandalucia.es/contratacion/document/download?refCode=2018-0000021761&refDoc=2018-0000021761-7",
            "descripcion": "QUINTA ACTA (PDF) (376.08Kb)"
        },
        {
            "numero_expediente": "SUM 02/18",
            "link": "http://www.juntadeandalucia.es/contratacion/document/download?refCode=2018-0000021761&refDoc=2018-0000021761-8",
            "descripcion": "SEXTA ACTA (pdf) (443.22Kb)"
        },
        {
            "numero_expediente": "SUM 02/18",
            "link": "http://www.juntadeandalucia.es/contratacion/document/download?refCode=2018-0000021761&refDoc=2018-0000021761-9",
            "descripcion": "S\u00c9PTIMA ACTA (pdf) (749.7Kb)"
        },
        {
            "numero_expediente": "SUM 02/18",
            "link": "http://www.juntadeandalucia.es/contratacion/document/download?refCode=2018-0000021761&refDoc=2018-0000021761-10",
            "descripcion": "OCTAVA ACTA (PDF) (296.83Kb)"
        }
    ],
    "obtencion_documentacion_informacion": {
        "fecha_limite_obtencion": "13/04/2018 a las 14:00 horas",
        "lugar": [
            "Delegacion Territorial de Igualdad, Salud y Politicas Sociales",
            "Avda. Luis Montoto 87-89 41018 (Sevilla )"
        ],
        "puntos_contacto": [
            "Seccion de contratacion",
            "955006869/6979",
            "955006847",
            "contratacion.se.csalud@juntadeandalucia.es",
            "http://www.juntadeandalucia.es"
        ]
    },
    "requisitos_criterios_condiciones": {
        "requisitos_minimos_contratista": "Los establecidos en el pliego de cl\u00e1usulas administrativas particulares",
        "criterios_adjudicacion": "Los establecidos en el pliego de cl\u00e1usulas administrativas particulares",
        "criterios_objetivos_para_la_seleccion_candidatos_el_procedimiento": "Los establecidos en el pliego de cl\u00e1usulas administrativas particulares",
        "condiciones_especiales_adjudicacion_contrato": "Las establecidas en el pliego de cl\u00e1usulas administrativas particulares"
    },
    "presentacion_ofertas__fecha_limite_presentacion_ofertas": "13/04/2018 a las 14:00 horas",
    "presentacion_ofertas__notas": [
        "Avda. Luis Montoto 87-89 41018 (Sevilla )",
        "Delegacion Territorial de Igualdad, Salud y Politicas Sociales",
        "Presentacion en el Registro General de la Delegacion Territorial sito en planta baja del no 87 en la Avenida Luis Montoto, de Sevilla"
    ],
    "apertura_ofertas": {
        "lugar": [
            "Delegacion Territorial de Igualdad, Salud y Politicas Sociales",
            "Avda. Luis Montoto 87-89 41018 (Sevilla )",
            "Fecha Apertura del sobre de criterios de adjudicacion evaluables por aplicacion de formulas : 02/05/2018 a las 09:00 horas"
        ],
        "aclaraciones": "Se celebrara en la Sala sita en la primera planta de la Avenida Luis Montoto no89 de Sevilla"
    },
    "referencias_diarios_oficiales": [
        {
            "numero_expediente": "SUM 02/18",
            "link": "http://ted.europa.eu/TED",
            "descripcion": "DOUE n\u00ba S48 del a\u00f1o 2018, p\u00e1gina . ( Env\u00edo: 05/03/2018, Publicaci\u00f3n: 09/03/2018 ) Referencia 106591-2018-ES"
        }
    ],
    "anuncios_publicados": [
        {
            "numero_expediente": "SUM 02/18",
            "link": "http://www.juntadeandalucia.es/haciendayadministracionpublica/apl/verifirmapdc/descargaInformeParametros?transaccion=XuC5vad3betl9gaW0z49piJqUCje%2B%2B1i&tipoPie=4",
            "descripcion": "08/03/2018 12:32, 2018-0000009868-Convocatoria de licitaci\u00f3n",
            "datetime": "2018-03-08T12:32:00+00:00",
            "anuncio_id": " 2018-0000009868",
            "anuncio_desc": "Convocatoria de licitaci\u00f3n"
        },
        {
            "numero_expediente": "SUM 02/18",
            "link": "http://www.juntadeandalucia.es/haciendayadministracionpublica/apl/verifirmapdc/descargaInformeParametros?transaccion=C6rN6joR11KmMRQCceubofI9rwqOEXGf&tipoPie=4",
            "descripcion": "09/03/2018 11:11, 2018-0000010275-Convocatoria de licitaci\u00f3n (Infor.Adicional)",
            "datetime": "2018-03-09T11:11:00+00:00",
            "anuncio_id": " 2018-0000010275",
            "anuncio_desc": "Convocatoria de licitaci\u00f3n (Infor.Adicional)"
        },
        {
            "numero_expediente": "SUM 02/18",
            "link": "http://www.juntadeandalucia.es/haciendayadministracionpublica/apl/verifirmapdc/descargaInformeParametros?transaccion=ovWbZ%2F1AXQLVSYkLxU1XgimkfG71%2BFxx&tipoPie=4",
            "descripcion": "28/03/2018 12:18, 2018-0000012795-Convocatoria de licitaci\u00f3n (Infor.Adicional)",
            "datetime": "2018-03-28T12:18:00+00:00",
            "anuncio_id": " 2018-0000012795",
            "anuncio_desc": "Convocatoria de licitaci\u00f3n (Infor.Adicional)"
        },
        {
            "numero_expediente": "SUM 02/18",
            "link": "http://www.juntadeandalucia.es/haciendayadministracionpublica/apl/verifirmapdc/descargaInformeParametros?transaccion=Os5dAnqbLw8WrULdnKQEmc4cenB071d7&tipoPie=4",
            "descripcion": "02/05/2018 14:13, 2018-0000015979-Convocatoria de licitaci\u00f3n (Infor.Adicional)",
            "datetime": "2018-05-02T14:13:00+00:00",
            "anuncio_id": " 2018-0000015979",
            "anuncio_desc": "Convocatoria de licitaci\u00f3n (Infor.Adicional)"
        },
        {
            "numero_expediente": "SUM 02/18",
            "link": "http://www.juntadeandalucia.es/haciendayadministracionpublica/apl/verifirmapdc/descargaInformeParametros?transaccion=rBKFGFywYwPc3y7gtyf2W%2FI9rwqOEXGf&tipoPie=4",
            "descripcion": "14/05/2018 14:51, 2018-0000017050-Convocatoria de licitaci\u00f3n (Infor.Adicional)",
            "datetime": "2018-05-14T14:51:00+00:00",
            "anuncio_id": " 2018-0000017050",
            "anuncio_desc": "Convocatoria de licitaci\u00f3n (Infor.Adicional)"
        },
        {
            "numero_expediente": "SUM 02/18",
            "link": "http://www.juntadeandalucia.es/haciendayadministracionpublica/apl/verifirmapdc/descargaInformeParametros?transaccion=dXyX5iyXeHh5kWYwvxE%2BeqvJYER37PP1&tipoPie=4",
            "descripcion": "15/05/2018 11:52, 2018-0000017126-Convocatoria de licitaci\u00f3n (Infor.Adicional)",
            "datetime": "2018-05-15T11:52:00+00:00",
            "anuncio_id": " 2018-0000017126",
            "anuncio_desc": "Convocatoria de licitaci\u00f3n (Infor.Adicional)"
        },
        {
            "numero_expediente": "SUM 02/18",
            "link": "http://www.juntadeandalucia.es/haciendayadministracionpublica/apl/verifirmapdc/descargaInformeParametros?transaccion=XcXR8lIiK%2BoG%2B4XXXFHFLSmkfG71%2BFxx&tipoPie=4",
            "descripcion": "17/05/2018 13:21, 2018-0000017393-Convocatoria de licitaci\u00f3n (Infor.Adicional)",
            "datetime": "2018-05-17T13:21:00+00:00",
            "anuncio_id": " 2018-0000017393",
            "anuncio_desc": "Convocatoria de licitaci\u00f3n (Infor.Adicional)"
        },
        {
            "numero_expediente": "SUM 02/18",
            "link": "http://www.juntadeandalucia.es/haciendayadministracionpublica/apl/verifirmapdc/descargaInformeParametros?transaccion=q7Ei9gW0CJsF3uXZT0ZL03lqT3SzUohr&tipoPie=4",
            "descripcion": "25/05/2018 11:42, 2018-0000018107-Convocatoria de licitaci\u00f3n (Infor.Adicional)",
            "datetime": "2018-05-25T11:42:00+00:00",
            "anuncio_id": " 2018-0000018107",
            "anuncio_desc": "Convocatoria de licitaci\u00f3n (Infor.Adicional)"
        },
        {
            "numero_expediente": "SUM 02/18",
            "link": "http://www.juntadeandalucia.es/haciendayadministracionpublica/apl/verifirmapdc/descargaInformeParametros?transaccion=fCtIUbo41TBA8%2BuuxZU%2BvyJqUCje%2B%2B1i&tipoPie=4",
            "descripcion": "21/06/2018 14:32, 2018-0000020960-Convocatoria de licitaci\u00f3n (Infor.Adicional)",
            "datetime": "2018-06-21T14:32:00+00:00",
            "anuncio_id": " 2018-0000020960",
            "anuncio_desc": "Convocatoria de licitaci\u00f3n (Infor.Adicional)"
        },
        {
            "numero_expediente": "SUM 02/18",
            "link": "http://www.juntadeandalucia.es/haciendayadministracionpublica/apl/verifirmapdc/descargaInformeParametros?transaccion=dl3A69OE129FEPFylbsfns4cenB071d7&tipoPie=4",
            "descripcion": "27/06/2018 13:16, 2018-0000021761-Convocatoria de licitaci\u00f3n (Infor.Adicional)",
            "datetime": "2018-06-27T13:16:00+00:00",
            "anuncio_id": " 2018-0000021761",
            "anuncio_desc": "Convocatoria de licitaci\u00f3n (Infor.Adicional)"
        },
        {
            "numero_expediente": "SUM 02/18",
            "link": "http://www.juntadeandalucia.es/haciendayadministracionpublica/apl/verifirmapdc/descargaInformeParametros?transaccion=mDhWAJOQt9G5Tuxll9Pm%2FyJqUCje%2B%2B1i&tipoPie=4",
            "descripcion": "19/07/2018 13:39, 2018-0000024848-Adjudicaci\u00f3n",
            "datetime": "2018-07-19T13:39:00+00:00",
            "anuncio_id": " 2018-0000024848",
            "anuncio_desc": "Adjudicaci\u00f3n"
        },
        {
            "numero_expediente": "SUM 02/18",
            "link": "http://www.juntadeandalucia.es/haciendayadministracionpublica/apl/verifirmapdc/descargaInformeParametros?transaccion=5QPVhBbIuDbzNZTyNhPiwHlqT3SzUohr&tipoPie=4",
            "descripcion": "24/09/2018 13:39, 2018-0000035880-Formalizaci\u00f3n",
            "datetime": "2018-09-24T13:39:00+00:00",
            "anuncio_id": " 2018-0000035880",
            "anuncio_desc": "Formalizaci\u00f3n"
        }
    ],
    "id": 71924,
    "origen": {
        "url": "http://www.juntadeandalucia.es/temas/contratacion-publica/perfiles-licitaciones/detalle/000000071924.html",
        "terminos_uso": "http://www.juntadeandalucia.es/informacion/legal.html"
    }
}