{
    "importes__importe_licitacion_(con_iva)": "2.450.000,01EUR",
    "datosbasicos__lugar_ejecucion_nuts": "ES618",
    "importes__importe_licitacion_(sin_iva)": "2.024.793,40EUR",
    "importes__financiado_por": "FEDER (Fondo Europeo de Desarrollo Regional)",
    "origen": {
        "terminos_uso": "http://www.juntadeandalucia.es/informacion/legal.html",
        "url": "http://www.juntadeandalucia.es/temas/contratacion-publica/perfiles-licitaciones/detalle/000000077616.html"
    },
    "apertura_ofertas": {
        "aclaraciones": "En la fecha y hora que se anunciara en el Perfil de Contratante del SAS y en la pagina web: www.juntadeandalucia.es/servicioandaluzdesalud (seccion de proveedores, contratacion publica, mesa de contratacion) con, al menos, 48 horas de antelacion.",
        "lugar": [
            "Dependencias de los Servicios Centrales",
            "Avda. de la Constitucion 18 41071 (Sevilla )"
        ]
    },
    "datosbasicos__organo_contratacion": "Servicio Andaluz de Salud",
    "datosbasicos__clasificacion_cpv": "33100000 Equipamiento medico.",
    "datosbasicos__numero_expediente": "CCA. 6R1WU81",
    "secciones": {
        "importes": 0,
        "estado_expediente": 1,
        "presentacion_solicitudes": 6,
        "documentacion_complementaria": 3,
        "requisitos_criterios_condiciones": 5,
        "obtencion_documentacion_informacion": 4,
        "informacion_lotes_adjudicados_o_resueltos": 2,
        "referencias_diarios_oficiales": 9,
        "presentacion_ofertas": 7,
        "apertura_ofertas": 8,
        "anuncios_publicados": 10
    },
    "datosbasicos__titulo_expediente": "2018/041893. Suministro de equipos de ultrasonidos, con destino a diversos centros de la Red Asistencial de la Junta de Andalucia, cofinanciado en un 80% con Fondos FEDER",
    "id": 77616,
    "documentacion_complementaria": [
        {
            "link": "http://www.juntadeandalucia.es/contratacion/document/download?refCode=2018-0000049682&refDoc=2018-0000049682-0",
            "descripcion": "Resoluci\u00f3n de Adjudicaci\u00f3n (pdf) (288.52Kb)",
            "numero_expediente": "CCA. 6R1WU81"
        },
        {
            "link": "http://www.juntadeandalucia.es/contratacion/document/download?refCode=2018-0000049517&refDoc=2018-0000049517-0",
            "descripcion": "Memoria justificativa (pdf) (194.4Kb)",
            "numero_expediente": "CCA. 6R1WU81"
        },
        {
            "link": "http://www.juntadeandalucia.es/contratacion/document/download?refCode=2018-0000049517&refDoc=2018-0000049517-1",
            "descripcion": "Pliegos y Anexos (zip) (2313.22Kb)",
            "numero_expediente": "CCA. 6R1WU81"
        },
        {
            "link": "http://www.juntadeandalucia.es/contratacion/document/download?refCode=2018-0000049517&refDoc=2018-0000049517-2",
            "descripcion": "Resoluci\u00f3n de aprobaci\u00f3n del expediente (pdf) (86.46Kb)",
            "numero_expediente": "CCA. 6R1WU81"
        },
        {
            "link": "http://www.juntadeandalucia.es/contratacion/document/download?refCode=2018-0000049517&refDoc=2018-0000049517-3",
            "descripcion": "Resoluci\u00f3n sobre Mesas de Contrataci\u00f3n (pdf) (47.74Kb)",
            "numero_expediente": "CCA. 6R1WU81"
        },
        {
            "link": "http://www.juntadeandalucia.es/contratacion/document/download?refCode=2018-0000049517&refDoc=2018-0000049517-4",
            "descripcion": "Lic041893 DEUC (xml) (235.81Kb)",
            "numero_expediente": "CCA. 6R1WU81"
        },
        {
            "link": "http://www.juntadeandalucia.es/contratacion/document/download?refCode=2018-0000049517&refDoc=2018-0000049517-5",
            "descripcion": "PPT.Anexo II Formulario (xls) (29Kb)",
            "numero_expediente": "CCA. 6R1WU81"
        },
        {
            "link": "http://www.juntadeandalucia.es/contratacion/document/download?refCode=2018-0000049517&refDoc=2018-0000049517-6",
            "descripcion": "Notificaciones. Documento 1. De fecha 20/8/2018. (pdf) (30.16Kb)",
            "numero_expediente": "CCA. 6R1WU81"
        },
        {
            "link": "http://www.juntadeandalucia.es/contratacion/document/download?refCode=2018-0000049517&refDoc=2018-0000049517-7",
            "descripcion": "Acta de mesa. Documento 1. De fecha 16/8/2018. (pdf) (87.19Kb)",
            "numero_expediente": "CCA. 6R1WU81"
        },
        {
            "link": "http://www.juntadeandalucia.es/contratacion/document/download?refCode=2018-0000049517&refDoc=2018-0000049517-8",
            "descripcion": "Acta de mesa. Documento 1. De fecha 24/8/2018. (pdf) (68.95Kb)",
            "numero_expediente": "CCA. 6R1WU81"
        },
        {
            "link": "http://www.juntadeandalucia.es/contratacion/document/download?refCode=2018-0000049517&refDoc=2018-0000049517-9",
            "descripcion": "Anuncio de acto p\u00fablico. Documento 1. De fecha 1/10/2018. (pdf) (30Kb)",
            "numero_expediente": "CCA. 6R1WU81"
        },
        {
            "link": "http://www.juntadeandalucia.es/contratacion/document/download?refCode=2018-0000049517&refDoc=2018-0000049517-10",
            "descripcion": "Informe de criterios de valoraci\u00f3n no autom\u00e1ticos. Documento 1. De fecha 26/9/2018. (pdf) (522.49Kb)",
            "numero_expediente": "CCA. 6R1WU81"
        },
        {
            "link": "http://www.juntadeandalucia.es/contratacion/document/download?refCode=2018-0000049517&refDoc=2018-0000049517-11",
            "descripcion": "Anuncio de acto p\u00fablico. Documento 1. De fecha 4/10/2018. (pdf) (30.06Kb)",
            "numero_expediente": "CCA. 6R1WU81"
        },
        {
            "link": "http://www.juntadeandalucia.es/contratacion/document/download?refCode=2018-0000049517&refDoc=2018-0000049517-12",
            "descripcion": "Acta de mesa. Documento 1. De fecha 17/10/2018. (pdf) (177.83Kb)",
            "numero_expediente": "CCA. 6R1WU81"
        },
        {
            "link": "http://www.juntadeandalucia.es/contratacion/document/download?refCode=2018-0000049517&refDoc=2018-0000049517-13",
            "descripcion": "Acta de mesa. Documento 1. De fecha 3/10/2018. (pdf) (102.9Kb)",
            "numero_expediente": "CCA. 6R1WU81"
        },
        {
            "link": "http://www.juntadeandalucia.es/contratacion/document/download?refCode=2018-0000049517&refDoc=2018-0000049517-14",
            "descripcion": "Acta de mesa. Documento 1. De fecha 25/10/2018. (pdf) (216.8Kb)",
            "numero_expediente": "CCA. 6R1WU81"
        },
        {
            "link": "http://www.juntadeandalucia.es/contratacion/document/download?refCode=2018-0000049517&refDoc=2018-0000049517-15",
            "descripcion": "Acta de mesa. Documento 1. De fecha 26/10/2018. (pdf) (66.87Kb)",
            "numero_expediente": "CCA. 6R1WU81"
        },
        {
            "link": "http://www.juntadeandalucia.es/contratacion/document/download?refCode=2018-0000049517&refDoc=2018-0000049517-16",
            "descripcion": "N\u00famero e identidad de licitadores. Documento 1. De fecha 21/11/2018. (pdf) (98.15Kb)",
            "numero_expediente": "CCA. 6R1WU81"
        }
    ],
    "datosbasicos__procedimiento": "Abierto",
    "presentacion_ofertas__notas": [
        "Avda. de la Constitucion 18 41071 (Sevilla )",
        "Registro General de los Servicios Centrales"
    ],
    "referencias_diarios_oficiales": [],
    "datosbasicos__division_por_lotes": "Si",
    "requisitos_criterios_condiciones": {
        "criterios_adjudicacion": "Los establecidos en el pliego de cl\u00e1usulas administrativas particulares",
        "requisitos_minimos_contratista": "La solvencia econ\u00f3mica y financiera se acreditar\u00e1 conforme al art\u00edculo 87.1 a) del LCSP, mediante una declaraci\u00f3n del volumen anual de negocios, que referido al a\u00f1o de mayor volumen de negocio de los tres \u00faltimos concluidos, deber\u00e1 ser, al menos, una vez y media el valor estimado del contrato. Por tanto, en este caso deber\u00e1 ser igual o superior a 3.037.190,01 euros. El volumen de negocios se acreditar\u00e1 mediante dep\u00f3sito de cuentas anuales en el Registro oficial y los empresarios individuales no inscritos mediante sus libros inventarios y cuentas anuales legalizados por el Registro Mercantil y la solvencia t\u00e9cnica se acreditar\u00e1 conforme al art\u00edculo 89.1 a) del LCSP. El n\u00famero de unidades suministradas ser\u00e1 igual o superior a cincuenta.",
        "criterios_objetivos_para_la_seleccion_candidatos_el_procedimiento": "Los establecidos en el pliego de cl\u00e1usulas administrativas particulares",
        "condiciones_especiales_adjudicacion_contrato": "Las establecidas en el pliego de cl\u00e1usulas administrativas particulares"
    },
    "importes__regulacion": "Sujeto a regulacion armonizada",
    "datosbasicos__tramitacion": "Ordinario",
    "datosbasicos__numero_lotes": "1",
    "datosbasicos__tipo_contrato": "Suministros",
    "estado_expediente__notas": [
        "21/11/2018 13:22 - Adjudicacion",
        "Actualizado: Adjudicacion",
        "Ver lotes"
    ],
    "importes__tasa_cofinanciacion": "80,00",
    "presentacion_ofertas__fecha_limite_presentacion_ofertas": "09/08/2018 a las 14:00 horas",
    "datosbasicos__lugar_ejecucion": "SEVILLA",
    "datosbasicos__lugar_tramitacion": "SEVILLA",
    "anuncios_publicados": [
        {
            "link": "http://www.juntadeandalucia.es/haciendayadministracionpublica/apl/verifirmapdc/descargaInformeParametros?transaccion=lJmD7%2BLqs4ATer1la8N4YM4cenB071d7&tipoPie=4",
            "anuncio_desc": "Convocatoria de licitaci\u00f3n",
            "anuncio_id": " 2018-0000022850",
            "descripcion": "10/07/2018 10:54, 2018-0000022850-Convocatoria de licitaci\u00f3n",
            "numero_expediente": "CCA. 6R1WU81",
            "datetime": "2018-07-10T10:54:00+00:00"
        },
        {
            "link": "http://www.juntadeandalucia.es/haciendayadministracionpublica/apl/verifirmapdc/descargaInformeParametros?transaccion=2RYu9Oi00OhTSW1vEC7PmYYdAfNuj%2FNj&tipoPie=4",
            "anuncio_desc": "Convocatoria de licitaci\u00f3n (Correcci\u00f3n)",
            "anuncio_id": " 2018-0000023974",
            "descripcion": "13/07/2018 10:21, 2018-0000023974-Convocatoria de licitaci\u00f3n (Correcci\u00f3n)",
            "numero_expediente": "CCA. 6R1WU81",
            "datetime": "2018-07-13T10:21:00+00:00"
        },
        {
            "link": "http://www.juntadeandalucia.es/haciendayadministracionpublica/apl/verifirmapdc/descargaInformeParametros?transaccion=H81Gi8hosgSM2g30AUhwys4cenB071d7&tipoPie=4",
            "anuncio_desc": "Convocatoria de licitaci\u00f3n (Infor.Adicional)",
            "anuncio_id": " 2018-0000029229",
            "descripcion": "20/08/2018 13:44, 2018-0000029229-Convocatoria de licitaci\u00f3n (Infor.Adicional)",
            "numero_expediente": "CCA. 6R1WU81",
            "datetime": "2018-08-20T13:44:00+00:00"
        },
        {
            "link": "http://www.juntadeandalucia.es/haciendayadministracionpublica/apl/verifirmapdc/descargaInformeParametros?transaccion=uz4UC1Y9RfHUjzLUnGBnZYYdAfNuj%2FNj&tipoPie=4",
            "anuncio_desc": "Convocatoria de licitaci\u00f3n (Infor.Adicional)",
            "anuncio_id": " 2018-0000031572",
            "descripcion": "31/08/2018 10:54, 2018-0000031572-Convocatoria de licitaci\u00f3n (Infor.Adicional)",
            "numero_expediente": "CCA. 6R1WU81",
            "datetime": "2018-08-31T10:54:00+00:00"
        },
        {
            "link": "http://www.juntadeandalucia.es/haciendayadministracionpublica/apl/verifirmapdc/descargaInformeParametros?transaccion=bfCmQKuwJ4Ld49%2FsmUoconP4a3pxggof&tipoPie=4",
            "anuncio_desc": "Convocatoria de licitaci\u00f3n (Infor.Adicional)",
            "anuncio_id": " 2018-0000031863",
            "descripcion": "03/09/2018 13:10, 2018-0000031863-Convocatoria de licitaci\u00f3n (Infor.Adicional)",
            "numero_expediente": "CCA. 6R1WU81",
            "datetime": "2018-09-03T13:10:00+00:00"
        },
        {
            "link": "http://www.juntadeandalucia.es/haciendayadministracionpublica/apl/verifirmapdc/descargaInformeParametros?transaccion=riNVDbhFFTQqMwjKBRzlbKvJYER37PP1&tipoPie=4",
            "anuncio_desc": "Convocatoria de licitaci\u00f3n (Infor.Adicional)",
            "anuncio_id": " 2018-0000037366",
            "descripcion": "01/10/2018 14:29, 2018-0000037366-Convocatoria de licitaci\u00f3n (Infor.Adicional)",
            "numero_expediente": "CCA. 6R1WU81",
            "datetime": "2018-10-01T14:29:00+00:00"
        },
        {
            "link": "http://www.juntadeandalucia.es/haciendayadministracionpublica/apl/verifirmapdc/descargaInformeParametros?transaccion=iiCiHjiMNwgAfrP%2FEjfynHlqT3SzUohr&tipoPie=4",
            "anuncio_desc": "Convocatoria de licitaci\u00f3n (Infor.Adicional)",
            "anuncio_id": " 2018-0000037647",
            "descripcion": "02/10/2018 13:38, 2018-0000037647-Convocatoria de licitaci\u00f3n (Infor.Adicional)",
            "numero_expediente": "CCA. 6R1WU81",
            "datetime": "2018-10-02T13:38:00+00:00"
        },
        {
            "link": "http://www.juntadeandalucia.es/haciendayadministracionpublica/apl/verifirmapdc/descargaInformeParametros?transaccion=Uj%2F9LTKwwsNvXqVduWR%2FSymkfG71%2BFxx&tipoPie=4",
            "anuncio_desc": "Convocatoria de licitaci\u00f3n (Infor.Adicional)",
            "anuncio_id": " 2018-0000038125",
            "descripcion": "04/10/2018 13:13, 2018-0000038125-Convocatoria de licitaci\u00f3n (Infor.Adicional)",
            "numero_expediente": "CCA. 6R1WU81",
            "datetime": "2018-10-04T13:13:00+00:00"
        },
        {
            "link": "http://www.juntadeandalucia.es/haciendayadministracionpublica/apl/verifirmapdc/descargaInformeParametros?transaccion=oxj0D%2BMz6d1ou7k82dfQxXlqT3SzUohr&tipoPie=4",
            "anuncio_desc": "Convocatoria de licitaci\u00f3n (Infor.Adicional)",
            "anuncio_id": " 2018-0000041153",
            "descripcion": "17/10/2018 12:27, 2018-0000041153-Convocatoria de licitaci\u00f3n (Infor.Adicional)",
            "numero_expediente": "CCA. 6R1WU81",
            "datetime": "2018-10-17T12:27:00+00:00"
        },
        {
            "link": "http://www.juntadeandalucia.es/haciendayadministracionpublica/apl/verifirmapdc/descargaInformeParametros?transaccion=mosU5aXA3umKLny9pbdoSCJqUCje%2B%2B1i&tipoPie=4",
            "anuncio_desc": "Convocatoria de licitaci\u00f3n (Infor.Adicional)",
            "anuncio_id": " 2018-0000041194",
            "descripcion": "17/10/2018 13:05, 2018-0000041194-Convocatoria de licitaci\u00f3n (Infor.Adicional)",
            "numero_expediente": "CCA. 6R1WU81",
            "datetime": "2018-10-17T13:05:00+00:00"
        },
        {
            "link": "http://www.juntadeandalucia.es/haciendayadministracionpublica/apl/verifirmapdc/descargaInformeParametros?transaccion=Pf%2FXMHoCiXD0LvuRFgKkQaVT2q%2Bc%2Fsfz&tipoPie=4",
            "anuncio_desc": "Convocatoria de licitaci\u00f3n (Infor.Adicional)",
            "anuncio_id": " 2018-0000043459",
            "descripcion": "25/10/2018 13:53, 2018-0000043459-Convocatoria de licitaci\u00f3n (Infor.Adicional)",
            "numero_expediente": "CCA. 6R1WU81",
            "datetime": "2018-10-25T13:53:00+00:00"
        },
        {
            "link": "http://www.juntadeandalucia.es/haciendayadministracionpublica/apl/verifirmapdc/descargaInformeParametros?transaccion=GTj%2FVd7zlTvajDDrcobaG6VT2q%2Bc%2Fsfz&tipoPie=4",
            "anuncio_desc": "Convocatoria de licitaci\u00f3n (Infor.Adicional)",
            "anuncio_id": " 2018-0000047060",
            "descripcion": "12/11/2018 09:46, 2018-0000047060-Convocatoria de licitaci\u00f3n (Infor.Adicional)",
            "numero_expediente": "CCA. 6R1WU81",
            "datetime": "2018-11-12T09:46:00+00:00"
        },
        {
            "link": "http://www.juntadeandalucia.es/haciendayadministracionpublica/apl/verifirmapdc/descargaInformeParametros?transaccion=O4uk%2F6XXz0pDYofLnDrIB4JinNB9TyKu&tipoPie=4",
            "anuncio_desc": "Convocatoria de licitaci\u00f3n (Infor.Adicional)",
            "anuncio_id": " 2018-0000049517",
            "descripcion": "21/11/2018 09:26, 2018-0000049517-Convocatoria de licitaci\u00f3n (Infor.Adicional)",
            "numero_expediente": "CCA. 6R1WU81",
            "datetime": "2018-11-21T09:26:00+00:00"
        },
        {
            "link": "http://www.juntadeandalucia.es/haciendayadministracionpublica/apl/verifirmapdc/descargaInformeParametros?transaccion=oXt3OgjMAkSidCXMW%2ByZpYJinNB9TyKu&tipoPie=4",
            "anuncio_desc": "Adjudicaci\u00f3n",
            "anuncio_id": " 2018-0000049682",
            "descripcion": "21/11/2018 13:22, 2018-0000049682-Adjudicaci\u00f3n",
            "numero_expediente": "CCA. 6R1WU81",
            "datetime": "2018-11-21T13:22:00+00:00"
        }
    ],
    "importes__importes_adjudicacion": "Ver lotes",
    "datosbasicos__descripcion": "Suministro de equipos de ultrasonidos, con destino a diversos centros de la Red Asistencial de la Junta de Andalucia, cofinanciado en un 80% por el Fondo Europeo de Desarrollo Regional (FEDER), en el marco del Programa Operativo Feder Andalucia 2014-2020",
    "obtencion_documentacion_informacion": {
        "fecha_limite_obtencion": "09/08/2018 a las 14:00 horas",
        "puntos_contacto": [
            "Subdireccion de Inversiones",
            "955/018295",
            "955/018058",
            "http://www.juntadeandalucia.es/servicioandaluzdesalud"
        ],
        "lugar": [
            "Servicios Centrales",
            "Avda. de la Constitucion 18 41071 (Sevilla )"
        ],
        "aclaraciones": "Se adjunta Resolucion publicada en BOJA no 223 de 13/11/2013 sobre composicion de las Mesas de Contratacion del Servicio Andaluz de Salud."
    },
    "datosbasicos__duracion_contrato": "2 meses",
    "importes__valor_estimado": "2.024.793,40EUR",
    "estado_expediente__estado": "Adjudicado",
    "informacion_lotes_adjudicados_o_resueltos": [
        {
            "lote_1__adjudicatario": "General Electric Healthcare Espana, S.A.",
            "lote_1__importe_adjudicacion_(con_iva)": "2.301.706,83EUR",
            "lote_1__nif": "A28061737",
            "id": "lote_1",
            "lote_1__importe_adjudicacion_(sin_iva)": "1.902.237,05EUR",
            "numero_expediente": "CCA. 6R1WU81",
            "lote_1__no_licitadores": "7"
        }
    ]
}