{
    "secciones": {
        "importes": 0,
        "estado_expediente": 1,
        "informacion_lotes_adjudicados_o_resueltos": 2,
        "documentacion_complementaria": 3,
        "obtencion_documentacion_informacion": 4,
        "requisitos_criterios_condiciones": 5,
        "presentacion_solicitudes": 6,
        "presentacion_ofertas": 7,
        "apertura_ofertas": 8,
        "referencias_diarios_oficiales": 9,
        "anuncios_publicados": 10
    },
    "datosbasicos__numero_expediente": "98.0100SV.17",
    "datosbasicos__titulo_expediente": "98.0100SV.17 ELABORACION DE LOS CATALOGOS DE PAISAJE DE LAS PROVINCIAS DE ALMERIA, CADIZ, CORDOBA, HUELVA Y JAEN.(5 LOTES)",
    "datosbasicos__descripcion": "Lote 1: 98.0100SV.17-AL Elaboracion del catalogo de paisaje de la provincia de Almeria. Lote 2: 98.0100SV.17-CA Elaboracion del catalogo de paisaje de la provincia de Cadiz. Lote 3: 98.0100SV.17-CO Elaboracion del catalogo de paisaje de la provincia de Cordoba. Lote 4: 98.0100SV.17-HU Elaboracion del catalogo de paisaje de la provincia de Huelva. Lote 5: 98.0100SV.17-JA Elaboracion del catalogo de paisaje de la provincia de Jaen.",
    "datosbasicos__organo_contratacion": "Consejeria de Medio Ambiente y Ordenacion del Territorio.Secretaria General de Ordenacion del Territorio y Sostenibilidad Urbana",
    "datosbasicos__tipo_contrato": "Servicios",
    "datosbasicos__procedimiento": "Abierto",
    "datosbasicos__tramitacion": "Ordinario",
    "datosbasicos__clasificacion_cpv": "71400000 Servicios de Planificacion Urbana y Arquitectura Paisajistica",
    "datosbasicos__division_por_lotes": "Si",
    "datosbasicos__numero_lotes": "5",
    "datosbasicos__lugar_tramitacion": "SEVILLA",
    "datosbasicos__lugar_ejecucion_nuts": "ES61",
    "datosbasicos__lugar_ejecucion": "NO PROVINCIALIZABLE",
    "importes__importe_licitacion_(sin_iva)": "504.132,23EUR",
    "importes__importe_licitacion_(con_iva)": "610.000,00EUR",
    "importes__valor_estimado": "504.132,23EUR",
    "importes__notas": "a) Lote 1: 99.173,55 euros;Lote 2: 90.909,09 euros; Lote 3: 107.438,02 euros;Lote 4: 99.173,55 euros; Lote 5:107.438,02 euros;",
    "importes__financiado_por": "FEADER (Fondo Europeo de Desarrollo Rural)",
    "importes__tasa_cofinanciacion": "75,00",
    "importes__regulacion": "Sujeto a regulacion armonizada",
    "informacion_lotes_adjudicados_o_resueltos": [],
    "documentacion_complementaria": [
        {
            "numero_expediente": "98.0100SV.17",
            "link": "http://www.juntadeandalucia.es/contratacion/document/download?refCode=2018-0000033414&refDoc=2018-0000033414-0",
            "descripcion": "Pliego de Cl\u00e1usulas Administrativas Particulares (pdf) (744.45Kb)"
        },
        {
            "numero_expediente": "98.0100SV.17",
            "link": "http://www.juntadeandalucia.es/contratacion/document/download?refCode=2018-0000033414&refDoc=2018-0000033414-1",
            "descripcion": "Pliego de Prescripciones T\u00e9cnicas (pdf) (190.47Kb)"
        },
        {
            "numero_expediente": "98.0100SV.17",
            "link": "http://www.juntadeandalucia.es/contratacion/document/download?refCode=2018-0000033414&refDoc=2018-0000033414-2",
            "descripcion": "FORMULARIO DEUC (xml) (125.63Kb)"
        },
        {
            "numero_expediente": "98.0100SV.17",
            "link": "http://www.juntadeandalucia.es/contratacion/document/download?refCode=2018-0000033414&refDoc=2018-0000033414-3",
            "descripcion": "INSTRUCCIONES DEUC (odt) (16.14Kb)"
        },
        {
            "numero_expediente": "98.0100SV.17",
            "link": "http://www.juntadeandalucia.es/contratacion/document/download?refCode=2018-0000033414&refDoc=2018-0000033414-13",
            "descripcion": "Acta 5\u00aa Sesi\u00f3n Mesa de Contrataci\u00f3n (pdf) (305.62Kb)"
        },
        {
            "numero_expediente": "98.0100SV.17",
            "link": "http://www.juntadeandalucia.es/contratacion/document/download?refCode=2018-0000033414&refDoc=2018-0000033414-12",
            "descripcion": "Acta de 4\u00aa Mesa de Contrataci\u00f3n (pdf) (1820.89Kb)"
        },
        {
            "numero_expediente": "98.0100SV.17",
            "link": "http://www.juntadeandalucia.es/contratacion/document/download?refCode=2018-0000033414&refDoc=2018-0000033414-11",
            "descripcion": "Acta de 3\u00aa Sesi\u00f3n de la Mesa de Contrataci\u00f3n (pdf) (3371.56Kb)"
        },
        {
            "numero_expediente": "98.0100SV.17",
            "link": "http://www.juntadeandalucia.es/contratacion/document/download?refCode=2018-0000033414&refDoc=2018-0000033414-10",
            "descripcion": "Acta 2\u00aa Sesi\u00f3n Mesa de Contrataci\u00f3n (pdf) (1021.27Kb)"
        },
        {
            "numero_expediente": "98.0100SV.17",
            "link": "http://www.juntadeandalucia.es/contratacion/document/download?refCode=2018-0000033414&refDoc=2018-0000033414-9",
            "descripcion": "Certificado de subsanaciones (pdf) (127.65Kb)"
        },
        {
            "numero_expediente": "98.0100SV.17",
            "link": "http://www.juntadeandalucia.es/contratacion/document/download?refCode=2018-0000033414&refDoc=2018-0000033414-8",
            "descripcion": "Documento con consultas de los licitadores a 27/03/2018 (pdf) (1031.02Kb)"
        },
        {
            "numero_expediente": "98.0100SV.17",
            "link": "http://www.juntadeandalucia.es/contratacion/document/download?refCode=2018-0000033414&refDoc=2018-0000033414-7",
            "descripcion": "Formulario DEUC editable (doc) (274Kb)"
        },
        {
            "numero_expediente": "98.0100SV.17",
            "link": "http://www.juntadeandalucia.es/contratacion/document/download?refCode=2018-0000033414&refDoc=2018-0000033414-5",
            "descripcion": "Resoluc\u00f3n de designaci\u00f3n de los miembros de la Comisi\u00f3n T\u00e9cnica de Apoyo (pdf) (74.58Kb)"
        },
        {
            "numero_expediente": "98.0100SV.17",
            "link": "http://www.juntadeandalucia.es/contratacion/document/download?refCode=2018-0000033414&refDoc=2018-0000033414-4",
            "descripcion": "Resoluci\u00f3n de designaci\u00f3n de los miembros de la Mesa de Contrataci\u00f3n (pdf) (81.55Kb)"
        }
    ],
    "obtencion_documentacion_informacion": {
        "fecha_limite_obtencion": "27/03/2018 a las 14:00 horas",
        "lugar": [
            "Consejeria de Medio Ambiente Y Ordenacion del Territorio. Secretaria General de Ordenacion del Territorio y Sostenibilidad Urbana",
            "Avda. de la Guardia Civil 1 41071 (Sevilla )"
        ],
        "puntos_contacto": [
            "Servicio de Planificacion y Estadistica. Secretaria General de Ordenacion del Territorio y Sostenibilidad Urbana",
            "alvaroj.lozano@juntadeandalucia.es",
            "http://juntadeandalucia.es/temas/contratacion-publica/perfiles-licitaciones/perfiles-contratante/detalle/CMAOT1.html"
        ]
    },
    "requisitos_criterios_condiciones": {
        "requisitos_minimos_contratista": "Los establecidos en el pliego de cl\u00e1usulas administrativas particulares",
        "criterios_adjudicacion": "Los establecidos en el pliego de cl\u00e1usulas administrativas particulares",
        "criterios_objetivos_para_la_seleccion_candidatos_el_procedimiento": "Los establecidos en el pliego de cl\u00e1usulas administrativas particulares",
        "condiciones_especiales_adjudicacion_contrato": "Las establecidas en el pliego de cl\u00e1usulas administrativas particulares"
    },
    "presentacion_ofertas__fecha_limite_presentacion_ofertas": "27/03/2018 a las 14:00 horas",
    "presentacion_ofertas__notas": [
        "Avda. Manuel Siurot 50 41071 (Sevilla )",
        "Cuando las proposiciones se envien por correo, el licitador debera justificar la fecha y hora de imposicion del envio en las oficinas de Correos y anunciar la remision de su oferta en el mismo dia, a traves de burofax, telegrama o fax al Registro General numero 955003775.",
        "Registro General de la Consejeria de Medio Ambiente y Ordenacion del Territorio"
    ],
    "apertura_ofertas": {
        "lugar": [
            "Consejeria de Medio Ambiente y Ordenacion del Territorio",
            "Avda. Manuel Siurot 50 41071 (Sevilla )",
            "Fecha Apertura del sobre de criterios de adjudicacion que dependen de un juicio de valor : 24/04/2018 a las 10:45 horas",
            "Fecha Apertura del sobre de criterios de adjudicacion evaluables por aplicacion de formulas : 12/06/2018 a las 10:30 horas"
        ],
        "aclaraciones": "La fecha y hora de apertura de los sobres se publicara en el Perfil de Contratante una vez se fijen por la Mesa de Contratacion."
    },
    "referencias_diarios_oficiales": [
        {
            "numero_expediente": "98.0100SV.17",
            "link": "http://boe.es/boe/dias/2018/02/05/pdfs/BOE-B-2018-6789.pdf",
            "descripcion": "BOE n\u00ba 32 del a\u00f1o 2018, p\u00e1gina 8506 Referencia 6789"
        },
        {
            "numero_expediente": "98.0100SV.17",
            "link": "http://ted.europa.eu/TED/notice/udl?uri=TED:NOTICE:36001-2018:TEXT:ES:HTML",
            "descripcion": "DOUE n\u00ba S17 del a\u00f1o 2018, p\u00e1gina . ( Env\u00edo: 23/01/2018, Publicaci\u00f3n: 25/01/2018 ) Referencia"
        },
        {
            "numero_expediente": "98.0100SV.17",
            "link": "http://juntadeandalucia.es/boja/2018/24/BOJA18-024-00002-1441-01_00129089.pdf",
            "descripcion": "BOJA n\u00ba 24 del a\u00f1o 2018, p\u00e1gina 120. ( Env\u00edo: 26/01/2018, Publicaci\u00f3n: 02/02/2018 ) Referencia PD 261/2018"
        }
    ],
    "anuncios_publicados": [
        {
            "numero_expediente": "98.0100SV.17",
            "link": "http://www.juntadeandalucia.es/haciendayadministracionpublica/apl/verifirmapdc/descargaInformeParametros?transaccion=otqZECKb2o0WGq8cj%2Bf6KSJqUCje%2B%2B1i&tipoPie=4",
            "descripcion": "25/01/2018 12:28, 2018-0000003400-Convocatoria de licitaci\u00f3n",
            "datetime": "2018-01-25T12:28:00+00:00",
            "anuncio_id": " 2018-0000003400",
            "anuncio_desc": "Convocatoria de licitaci\u00f3n"
        },
        {
            "numero_expediente": "98.0100SV.17",
            "link": "http://www.juntadeandalucia.es/haciendayadministracionpublica/apl/verifirmapdc/descargaInformeParametros?transaccion=Yf8%2FcFGub0ZMx3bWcaeSu84cenB071d7&tipoPie=4",
            "descripcion": "02/02/2018 08:19, 2018-0000004600-Convocatoria de licitaci\u00f3n (Infor.Adicional)",
            "datetime": "2018-02-02T08:19:00+00:00",
            "anuncio_id": " 2018-0000004600",
            "anuncio_desc": "Convocatoria de licitaci\u00f3n (Infor.Adicional)"
        },
        {
            "numero_expediente": "98.0100SV.17",
            "link": "http://www.juntadeandalucia.es/haciendayadministracionpublica/apl/verifirmapdc/descargaInformeParametros?transaccion=iVos3OTJBkNXlDutMQrrcfI9rwqOEXGf&tipoPie=4",
            "descripcion": "05/02/2018 08:08, 2018-0000004799-Convocatoria de licitaci\u00f3n (Infor.Adicional)",
            "datetime": "2018-02-05T08:08:00+00:00",
            "anuncio_id": " 2018-0000004799",
            "anuncio_desc": "Convocatoria de licitaci\u00f3n (Infor.Adicional)"
        },
        {
            "numero_expediente": "98.0100SV.17",
            "link": "http://www.juntadeandalucia.es/haciendayadministracionpublica/apl/verifirmapdc/descargaInformeParametros?transaccion=ejUeBmK71E3byq%2BwB09VIKvJYER37PP1&tipoPie=4",
            "descripcion": "13/02/2018 09:26, 2018-0000006286-Convocatoria de licitaci\u00f3n (Correci\u00f3n)",
            "datetime": "2018-02-13T09:26:00+00:00",
            "anuncio_id": " 2018-0000006286",
            "anuncio_desc": "Convocatoria de licitaci\u00f3n (Correci\u00f3n)"
        },
        {
            "numero_expediente": "98.0100SV.17",
            "link": "http://www.juntadeandalucia.es/haciendayadministracionpublica/apl/verifirmapdc/descargaInformeParametros?transaccion=ejUeBmK71E0jeseGlrw5vimkfG71%2BFxx&tipoPie=4",
            "descripcion": "13/02/2018 09:32, 2018-0000006293-Convocatoria de licitaci\u00f3n (Infor.Adicional)",
            "datetime": "2018-02-13T09:32:00+00:00",
            "anuncio_id": " 2018-0000006293",
            "anuncio_desc": "Convocatoria de licitaci\u00f3n (Infor.Adicional)"
        },
        {
            "numero_expediente": "98.0100SV.17",
            "link": "http://www.juntadeandalucia.es/haciendayadministracionpublica/apl/verifirmapdc/descargaInformeParametros?transaccion=%2BbPCKqF0tN7ZQZoyWoRueqVT2q%2Bc%2Fsfz&tipoPie=4",
            "descripcion": "14/03/2018 08:35, 2018-0000010757-Convocatoria de licitaci\u00f3n (Infor.Adicional)",
            "datetime": "2018-03-14T08:35:00+00:00",
            "anuncio_id": " 2018-0000010757",
            "anuncio_desc": "Convocatoria de licitaci\u00f3n (Infor.Adicional)"
        },
        {
            "numero_expediente": "98.0100SV.17",
            "link": "http://www.juntadeandalucia.es/haciendayadministracionpublica/apl/verifirmapdc/descargaInformeParametros?transaccion=Ck2%2FNPDetAIf6240CHwRv84cenB071d7&tipoPie=4",
            "descripcion": "14/03/2018 13:47, 2018-0000010867-Convocatoria de licitaci\u00f3n (Infor.Adicional)",
            "datetime": "2018-03-14T13:47:00+00:00",
            "anuncio_id": " 2018-0000010867",
            "anuncio_desc": "Convocatoria de licitaci\u00f3n (Infor.Adicional)"
        },
        {
            "numero_expediente": "98.0100SV.17",
            "link": "http://www.juntadeandalucia.es/haciendayadministracionpublica/apl/verifirmapdc/descargaInformeParametros?transaccion=k506Dtwk9s82ZI60NZEr%2FfI9rwqOEXGf&tipoPie=4",
            "descripcion": "15/03/2018 15:03, 2018-0000011089-Convocatoria de licitaci\u00f3n (Infor.Adicional)",
            "datetime": "2018-03-15T15:03:00+00:00",
            "anuncio_id": " 2018-0000011089",
            "anuncio_desc": "Convocatoria de licitaci\u00f3n (Infor.Adicional)"
        },
        {
            "numero_expediente": "98.0100SV.17",
            "link": "http://www.juntadeandalucia.es/haciendayadministracionpublica/apl/verifirmapdc/descargaInformeParametros?transaccion=YSbeYBz8JxWp%2FtdETLXIHqvJYER37PP1&tipoPie=4",
            "descripcion": "19/03/2018 14:48, 2018-0000011471-Convocatoria de licitaci\u00f3n (Infor.Adicional)",
            "datetime": "2018-03-19T14:48:00+00:00",
            "anuncio_id": " 2018-0000011471",
            "anuncio_desc": "Convocatoria de licitaci\u00f3n (Infor.Adicional)"
        },
        {
            "numero_expediente": "98.0100SV.17",
            "link": "http://www.juntadeandalucia.es/haciendayadministracionpublica/apl/verifirmapdc/descargaInformeParametros?transaccion=TJ0UD6%2BGhQgtUz9%2FqT8zWvI9rwqOEXGf&tipoPie=4",
            "descripcion": "21/03/2018 12:40, 2018-0000011820-Convocatoria de licitaci\u00f3n (Infor.Adicional)",
            "datetime": "2018-03-21T12:40:00+00:00",
            "anuncio_id": " 2018-0000011820",
            "anuncio_desc": "Convocatoria de licitaci\u00f3n (Infor.Adicional)"
        },
        {
            "numero_expediente": "98.0100SV.17",
            "link": "http://www.juntadeandalucia.es/haciendayadministracionpublica/apl/verifirmapdc/descargaInformeParametros?transaccion=hVnEw%2BVwTbk4xBTkvgUH7KvJYER37PP1&tipoPie=4",
            "descripcion": "26/03/2018 09:57, 2018-0000012237-Convocatoria de licitaci\u00f3n (Infor.Adicional)",
            "datetime": "2018-03-26T09:57:00+00:00",
            "anuncio_id": " 2018-0000012237",
            "anuncio_desc": "Convocatoria de licitaci\u00f3n (Infor.Adicional)"
        },
        {
            "numero_expediente": "98.0100SV.17",
            "link": "http://www.juntadeandalucia.es/haciendayadministracionpublica/apl/verifirmapdc/descargaInformeParametros?transaccion=00kOqgrkip8ptp5677kEZSJqUCje%2B%2B1i&tipoPie=4",
            "descripcion": "27/03/2018 09:06, 2018-0000012356-Convocatoria de licitaci\u00f3n (Infor.Adicional)",
            "datetime": "2018-03-27T09:06:00+00:00",
            "anuncio_id": " 2018-0000012356",
            "anuncio_desc": "Convocatoria de licitaci\u00f3n (Infor.Adicional)"
        },
        {
            "numero_expediente": "98.0100SV.17",
            "link": "http://www.juntadeandalucia.es/haciendayadministracionpublica/apl/verifirmapdc/descargaInformeParametros?transaccion=RBFqcV9cE1J6rz7p6MgFF6vJYER37PP1&tipoPie=4",
            "descripcion": "16/04/2018 14:22, 2018-0000014613-Convocatoria de licitaci\u00f3n (Infor.Adicional)",
            "datetime": "2018-04-16T14:22:00+00:00",
            "anuncio_id": " 2018-0000014613",
            "anuncio_desc": "Convocatoria de licitaci\u00f3n (Infor.Adicional)"
        },
        {
            "numero_expediente": "98.0100SV.17",
            "link": "http://www.juntadeandalucia.es/haciendayadministracionpublica/apl/verifirmapdc/descargaInformeParametros?transaccion=AlbgQYeBjNRoJCfwduTdi3lqT3SzUohr&tipoPie=4",
            "descripcion": "17/04/2018 14:18, 2018-0000014737-Convocatoria de licitaci\u00f3n (Infor.Adicional)",
            "datetime": "2018-04-17T14:18:00+00:00",
            "anuncio_id": " 2018-0000014737",
            "anuncio_desc": "Convocatoria de licitaci\u00f3n (Infor.Adicional)"
        },
        {
            "numero_expediente": "98.0100SV.17",
            "link": "http://www.juntadeandalucia.es/haciendayadministracionpublica/apl/verifirmapdc/descargaInformeParametros?transaccion=Ancg8smSKbK6LYe7vNLyDYJinNB9TyKu&tipoPie=4",
            "descripcion": "07/05/2018 12:21, 2018-0000016347-Convocatoria de licitaci\u00f3n (Infor.Adicional)",
            "datetime": "2018-05-07T12:21:00+00:00",
            "anuncio_id": " 2018-0000016347",
            "anuncio_desc": "Convocatoria de licitaci\u00f3n (Infor.Adicional)"
        },
        {
            "numero_expediente": "98.0100SV.17",
            "link": "http://www.juntadeandalucia.es/haciendayadministracionpublica/apl/verifirmapdc/descargaInformeParametros?transaccion=gDESWiupudVjGP%2F2qt1UQ6vJYER37PP1&tipoPie=4",
            "descripcion": "07/06/2018 08:14, 2018-0000019276-Convocatoria de licitaci\u00f3n (Infor.Adicional)",
            "datetime": "2018-06-07T08:14:00+00:00",
            "anuncio_id": " 2018-0000019276",
            "anuncio_desc": "Convocatoria de licitaci\u00f3n (Infor.Adicional)"
        },
        {
            "numero_expediente": "98.0100SV.17",
            "link": "http://www.juntadeandalucia.es/haciendayadministracionpublica/apl/verifirmapdc/descargaInformeParametros?transaccion=U6YLMRsuUVaZ1uAvDVvnSnP4a3pxggof&tipoPie=4",
            "descripcion": "03/07/2018 14:13, 2018-0000022520-Convocatoria de licitaci\u00f3n (Infor.Adicional)",
            "datetime": "2018-07-03T14:13:00+00:00",
            "anuncio_id": " 2018-0000022520",
            "anuncio_desc": "Convocatoria de licitaci\u00f3n (Infor.Adicional)"
        },
        {
            "numero_expediente": "98.0100SV.17",
            "link": "http://www.juntadeandalucia.es/haciendayadministracionpublica/apl/verifirmapdc/descargaInformeParametros?transaccion=PbLwlIFzD5u9HF%2Bh6xOLAfI9rwqOEXGf&tipoPie=4",
            "descripcion": "12/07/2018 11:37, 2018-0000023521-Convocatoria de licitaci\u00f3n (Infor.Adicional)",
            "datetime": "2018-07-12T11:37:00+00:00",
            "anuncio_id": " 2018-0000023521",
            "anuncio_desc": "Convocatoria de licitaci\u00f3n (Infor.Adicional)"
        },
        {
            "numero_expediente": "98.0100SV.17",
            "link": "http://www.juntadeandalucia.es/haciendayadministracionpublica/apl/verifirmapdc/descargaInformeParametros?transaccion=RB%2FS4G8zP8ppLobjBjbxDSmkfG71%2BFxx&tipoPie=4",
            "descripcion": "10/09/2018 14:37, 2018-0000033414-Convocatoria de licitaci\u00f3n (Infor.Adicional)",
            "datetime": "2018-09-10T14:37:00+00:00",
            "anuncio_id": " 2018-0000033414",
            "anuncio_desc": "Convocatoria de licitaci\u00f3n (Infor.Adicional)"
        }
    ],
    "id": 69016,
    "origen": {
        "url": "http://www.juntadeandalucia.es/temas/contratacion-publica/perfiles-licitaciones/detalle/000000069016.html",
        "terminos_uso": "http://www.juntadeandalucia.es/informacion/legal.html"
    }
}