{
    "secciones": {
        "importes": 0,
        "estado_expediente": 1,
        "informacion_lotes_adjudicados_o_resueltos": 2,
        "documentacion_complementaria": 3,
        "obtencion_documentacion_informacion": 4,
        "requisitos_criterios_condiciones": 5,
        "presentacion_solicitudes": 6,
        "presentacion_ofertas": 7,
        "apertura_ofertas": 8,
        "referencias_diarios_oficiales": 9,
        "anuncios_publicados": 10
    },
    "datosbasicos__numero_expediente": "1/CRPM LA CAROLINA/2018",
    "datosbasicos__titulo_expediente": "SUMINISTRO DE PRODUCTOS DE ALIMENTACION POR LOTES (14) PARA EL CENTRO RESIDENCIAL PARA PERSONAS MAYORES \"LOS OLIVARES\" DE LA CAROLINA",
    "datosbasicos__descripcion": "SUMINISTRO DE PRODUCTOS DE ALIMENTACION POR LOTES (14) PARA EL CENTRO RESIDENCIAL PARA PERSONAS MAYORES \"LOS OLIVARES\" DE LA CAROLINA",
    "datosbasicos__organo_contratacion": "Delegacion Territorial de Igualdad, Salud y Politicas Sociales en Jaen",
    "datosbasicos__tipo_contrato": "Suministros",
    "datosbasicos__procedimiento": "Abierto",
    "datosbasicos__tramitacion": "Ordinario",
    "datosbasicos__clasificacion_cpv": "15000000 Alimentos, bebidas, tabaco y productos afines",
    "datosbasicos__duracion_contrato": "1 ano",
    "datosbasicos__division_por_lotes": "Si",
    "datosbasicos__numero_lotes": "14",
    "datosbasicos__lugar_tramitacion": "JAEN",
    "datosbasicos__lugar_ejecucion_nuts": "ES616",
    "datosbasicos__lugar_ejecucion": "JAEN",
    "importes__importe_licitacion_(sin_iva)": "126.552,42EUR",
    "importes__importe_licitacion_(con_iva)": "136.191,65EUR",
    "importes__valor_estimado": "303.725,80EUR",
    "importes__notas": "Cabe una prorroga de 12 meses y modificaciones",
    "importes__importes_adjudicacion": "Ver lotes",
    "informacion_lotes_adjudicados_o_resueltos": [
        {
            "numero_expediente": "1/CRPM LA CAROLINA/2018",
            "id": "lote_5_10_11_12",
            "lote_5_10_11_12__no_licitadores": "13",
            "lote_5_10_11_12__nif": "A23060288",
            "lote_5_10_11_12__adjudicatario": "LUIS PINA S.A.",
            "lote_5_10_11_12__importe_adjudicacion_(sin_iva)": "17.135,19EUR",
            "lote_5_10_11_12__importe_adjudicacion_(con_iva)": "18.331,57EUR"
        },
        {
            "numero_expediente": "1/CRPM LA CAROLINA/2018",
            "id": "lote_1_2_3_4_6_7_8_9_13_14",
            "lote_1_2_3_4_6_7_8_9_13_14__no_licitadores": "37",
            "lote_1_2_3_4_6_7_8_9_13_14__nif": "B91016238",
            "lote_1_2_3_4_6_7_8_9_13_14__adjudicatario": "PLATAFORMA FEMAR S.L.",
            "lote_1_2_3_4_6_7_8_9_13_14__importe_adjudicacion_(sin_iva)": "79.855,37EUR",
            "lote_1_2_3_4_6_7_8_9_13_14__importe_adjudicacion_(con_iva)": "85.964,23EUR"
        }
    ],
    "documentacion_complementaria": [
        {
            "numero_expediente": "1/CRPM LA CAROLINA/2018",
            "link": "http://www.juntadeandalucia.es/contratacion/document/download?refCode=2018-0000026856&refDoc=2018-0000026856-0",
            "descripcion": "RESOLUCION DE ADJUDICACI\u00d3N (pdf) (113.11Kb)"
        },
        {
            "numero_expediente": "1/CRPM LA CAROLINA/2018",
            "link": "http://www.juntadeandalucia.es/contratacion/document/download?refCode=2018-0000024287&refDoc=2018-0000024287-0",
            "descripcion": "PLIEGO DE CLAUSULAS ADMINISTRATIVAS PARTICULARES (pdf) (1321.97Kb)"
        },
        {
            "numero_expediente": "1/CRPM LA CAROLINA/2018",
            "link": "http://www.juntadeandalucia.es/contratacion/document/download?refCode=2018-0000024287&refDoc=2018-0000024287-1",
            "descripcion": "PLIEGO DE PRESCRIPCIONES TECNICAS (pdf) (144.75Kb)"
        },
        {
            "numero_expediente": "1/CRPM LA CAROLINA/2018",
            "link": "http://www.juntadeandalucia.es/contratacion/document/download?refCode=2018-0000024287&refDoc=2018-0000024287-2",
            "descripcion": "CORRECION DE ERRORES AL PCAP (pdf) (92.92Kb)"
        },
        {
            "numero_expediente": "1/CRPM LA CAROLINA/2018",
            "link": "http://www.juntadeandalucia.es/contratacion/document/download?refCode=2018-0000024287&refDoc=2018-0000024287-6",
            "descripcion": "Resoluci\u00f3n Correcci\u00f3n de errores (pdf) (90.81Kb)"
        },
        {
            "numero_expediente": "1/CRPM LA CAROLINA/2018",
            "link": "http://www.juntadeandalucia.es/contratacion/document/download?refCode=2018-0000024287&refDoc=2018-0000024287-3",
            "descripcion": "RESOLUCION DE COMPOSICION DE LA MESA DE CONTRATACION (pdf) (142.6Kb)"
        },
        {
            "numero_expediente": "1/CRPM LA CAROLINA/2018",
            "link": "http://www.juntadeandalucia.es/contratacion/document/download?refCode=2018-0000024287&refDoc=2018-0000024287-4",
            "descripcion": "RESOLUCION SUSPENSION PROCEDIMIENTO (pdf) (75.51Kb)"
        },
        {
            "numero_expediente": "1/CRPM LA CAROLINA/2018",
            "link": "http://www.juntadeandalucia.es/contratacion/document/download?refCode=2018-0000024287&refDoc=2018-0000024287-5",
            "descripcion": "ACTA MESA CONTRATACION DIA 20 DE FEBRERO 2018 (pdf) (131.94Kb)"
        },
        {
            "numero_expediente": "1/CRPM LA CAROLINA/2018",
            "link": "http://www.juntadeandalucia.es/contratacion/document/download?refCode=2018-0000024287&refDoc=2018-0000024287-7",
            "descripcion": "ACTA MESA CONTRATACION DEL D\u00cdA 25 DE MAYO DE 2018 (pdf) (66Kb)"
        },
        {
            "numero_expediente": "1/CRPM LA CAROLINA/2018",
            "link": "http://www.juntadeandalucia.es/contratacion/document/download?refCode=2018-0000024287&refDoc=2018-0000024287-8",
            "descripcion": "ACTGA MESA CONTRATACION DIA 30 DE MAYO (pdf) (79.99Kb)"
        },
        {
            "numero_expediente": "1/CRPM LA CAROLINA/2018",
            "link": "http://www.juntadeandalucia.es/contratacion/document/download?refCode=2018-0000024287&refDoc=2018-0000024287-9",
            "descripcion": "ACTA MESA CONTRATACI\u00d3N 8 DE JUNIO 2018 (pdf) (213.64Kb)"
        },
        {
            "numero_expediente": "1/CRPM LA CAROLINA/2018",
            "link": "http://www.juntadeandalucia.es/contratacion/document/download?refCode=2018-0000024287&refDoc=2018-0000024287-10",
            "descripcion": "ACTA MESA CONTRATACION 15 JUNIO (pdf) (131.73Kb)"
        },
        {
            "numero_expediente": "1/CRPM LA CAROLINA/2018",
            "link": "http://www.juntadeandalucia.es/contratacion/document/download?refCode=2018-0000024287&refDoc=2018-0000024287-11",
            "descripcion": "ACTA MESA CONTRATACI\u00d3N DIA 13 DE JULIO (pdf) (87.42Kb)"
        }
    ],
    "obtencion_documentacion_informacion": {
        "fecha_limite_obtencion": "14/02/2018 a las 14:00 horas",
        "lugar": [
            "CENTRO RESIDENCIAL PARA PERSONAS MAYORES \"LOS OLIVARES\" DE LA CAROLINA",
            "Plaza de Sor Primitiva S/N 23200 (La Carolina )"
        ],
        "puntos_contacto": [
            "MANUEL MENENDEZ TORRES- ADMINISTRADOR",
            "953009900",
            "953009904"
        ]
    },
    "requisitos_criterios_condiciones": {
        "requisitos_minimos_contratista": "Los establecidos en el pliego de cl\u00e1usulas administrativas particulares",
        "criterios_adjudicacion": "Los establecidos en el pliego de cl\u00e1usulas administrativas particulares",
        "criterios_objetivos_para_la_seleccion_candidatos_el_procedimiento": "Los establecidos en el pliego de cl\u00e1usulas administrativas particulares",
        "condiciones_especiales_adjudicacion_contrato": "Las establecidas en el pliego de cl\u00e1usulas administrativas particulares"
    },
    "presentacion_ofertas__fecha_limite_presentacion_ofertas": "11/05/2018 a las 14:00 horas",
    "presentacion_ofertas__notas": [
        "CENTRO RESIDENCIAL PARA PERSONAS MAYORES \"LOS OLIVARES\" DE LA CAROLINA",
        "Plaza de Sor Primitiva S/N 23200 (La Carolina )",
        "Se abrira nuevo plazo de quince dias naturales desde el dia siguiente a la publicacion de la Correccion de errores en el Boletin Oficial del Estado."
    ],
    "apertura_ofertas": {
        "lugar": [
            "D.T. IGUALDAD, SALUD Y POLITICAS SOCIALES DE JAEN",
            "PASEO DE LA ESTACION 15 23071 (JAEN )"
        ],
        "relacion_miembros_asistentes_a_la_mesa_contratacion": [
            "Acto 1. MESA CONTRATACION DIA 30 DE MAYO DE 2018",
            "Fecha de celebracion: 30/05/2018 a las 09:00 horas",
            "Fecha de publicacion: 01/06/2018 a las 14:12 horas",
            "Descargar PDF firmado",
            "Acto 2. MESA DE CONTRATACION APERTURA SOBRE 1",
            "Fecha de celebracion: 20/02/2018 a las 08:35 horas",
            "Fecha de publicacion: 27/02/2018 a las 12:37 horas",
            "Descargar PDF firmado",
            "Acto 3. MESA CONTRATACION EN ACTO PUBLICO PARA LA APERTURA DEL SOBRE 3 DE LA EMPRESA ANGEL GARCIA VALENZUELA S.L.",
            "Fecha de celebracion: 15/06/2018 a las 11:35 horas",
            "Fecha de publicacion: 04/07/2018 a las 10:59 horas",
            "Descargar PDF firmado",
            "Acto 4. MESA CONTRATACION: COMPROBACION OFERTAS DE LA EMPRESA PLATAFORMA FEMAR S.L. Y PROPUESTA DE ADJUDICACION DE CADA LOTE.",
            "Fecha de celebracion: 13/07/2018 a las 10:00 horas",
            "Acto 5. MESA CONTRATACION DIA 25 DE MAYO DE 2018",
            "Fecha de celebracion: 25/05/2018 a las 08:30 horas",
            "Fecha de publicacion: 01/06/2018 a las 14:12 horas",
            "Descargar PDF firmado",
            "Acto 6. ACTA MESA CONTRATACION REVISION DE LA DOCUMENTACION REQUERIDA Y APERTURA DEL SOBRE 3(OFERTA ECONOMICA) ACTO PUBLICO",
            "Fecha de celebracion: 08/06/2018 a las 08:35 horas",
            "Fecha de publicacion: 04/07/2018 a las 10:59 horas",
            "Descargar PDF firmado"
        ],
        "aclaraciones": "MESA CONTRATACION DIA COMPROBACION OFERTAS EMPRESA FEMAR S.L. Y PROPUESTA DE ADJUDICACION DE CADA LOTE DE ESTE CONTRATO."
    },
    "referencias_diarios_oficiales": [],
    "anuncios_publicados": [
        {
            "numero_expediente": "1/CRPM LA CAROLINA/2018",
            "link": "http://www.juntadeandalucia.es/haciendayadministracionpublica/apl/verifirmapdc/descargaInformeParametros?transaccion=wQDbLEhCOHeNHOdwqR9dbHP4a3pxggof&tipoPie=4",
            "descripcion": "11/01/2018 08:58, 2018-0000000729-Convocatoria de licitaci\u00f3n",
            "datetime": "2018-01-11T08:58:00+00:00",
            "anuncio_id": " 2018-0000000729",
            "anuncio_desc": "Convocatoria de licitaci\u00f3n"
        },
        {
            "numero_expediente": "1/CRPM LA CAROLINA/2018",
            "link": "http://www.juntadeandalucia.es/haciendayadministracionpublica/apl/verifirmapdc/descargaInformeParametros?transaccion=bE34s3V5aM2kxIST%2Ft%2F%2FaXP4a3pxggof&tipoPie=4",
            "descripcion": "23/01/2018 12:21, 2018-0000003030-Convocatoria de licitaci\u00f3n (Correci\u00f3n)",
            "datetime": "2018-01-23T12:21:00+00:00",
            "anuncio_id": " 2018-0000003030",
            "anuncio_desc": "Convocatoria de licitaci\u00f3n (Correci\u00f3n)"
        },
        {
            "numero_expediente": "1/CRPM LA CAROLINA/2018",
            "link": "http://www.juntadeandalucia.es/haciendayadministracionpublica/apl/verifirmapdc/descargaInformeParametros?transaccion=s%2F15yKnSANlEVHdNfDxDz6VT2q%2Bc%2Fsfz&tipoPie=4",
            "descripcion": "12/02/2018 13:08, 2018-0000006147-Convocatoria de licitaci\u00f3n (Infor.Adicional)",
            "datetime": "2018-02-12T13:08:00+00:00",
            "anuncio_id": " 2018-0000006147",
            "anuncio_desc": "Convocatoria de licitaci\u00f3n (Infor.Adicional)"
        },
        {
            "numero_expediente": "1/CRPM LA CAROLINA/2018",
            "link": "http://www.juntadeandalucia.es/haciendayadministracionpublica/apl/verifirmapdc/descargaInformeParametros?transaccion=gNJwOM7LRGyXmPCIu73ZOnlqT3SzUohr&tipoPie=4",
            "descripcion": "23/02/2018 11:30, 2018-0000008197-Convocatoria de licitaci\u00f3n (Infor.Adicional)",
            "datetime": "2018-02-23T11:30:00+00:00",
            "anuncio_id": " 2018-0000008197",
            "anuncio_desc": "Convocatoria de licitaci\u00f3n (Infor.Adicional)"
        },
        {
            "numero_expediente": "1/CRPM LA CAROLINA/2018",
            "link": "http://www.juntadeandalucia.es/haciendayadministracionpublica/apl/verifirmapdc/descargaInformeParametros?transaccion=zz315G0QhrLFOB198JebRymkfG71%2BFxx&tipoPie=4",
            "descripcion": "27/02/2018 12:41, 2018-0000008452-Convocatoria de licitaci\u00f3n (Infor.Adicional)",
            "datetime": "2018-02-27T12:41:00+00:00",
            "anuncio_id": " 2018-0000008452",
            "anuncio_desc": "Convocatoria de licitaci\u00f3n (Infor.Adicional)"
        },
        {
            "numero_expediente": "1/CRPM LA CAROLINA/2018",
            "link": "http://www.juntadeandalucia.es/haciendayadministracionpublica/apl/verifirmapdc/descargaInformeParametros?transaccion=zz315G0QhrJcVXyxramzwimkfG71%2BFxx&tipoPie=4",
            "descripcion": "27/02/2018 12:46, 2018-0000008594-Convocatoria de licitaci\u00f3n (Infor.Adicional)",
            "datetime": "2018-02-27T12:46:00+00:00",
            "anuncio_id": " 2018-0000008594",
            "anuncio_desc": "Convocatoria de licitaci\u00f3n (Infor.Adicional)"
        },
        {
            "numero_expediente": "1/CRPM LA CAROLINA/2018",
            "link": "http://www.juntadeandalucia.es/haciendayadministracionpublica/apl/verifirmapdc/descargaInformeParametros?transaccion=RXtdHpRlaRmN7shQyCaR5%2FI9rwqOEXGf&tipoPie=4",
            "descripcion": "26/04/2018 09:23, 2018-0000014639-Convocatoria de licitaci\u00f3n (Correci\u00f3n)",
            "datetime": "2018-04-26T09:23:00+00:00",
            "anuncio_id": " 2018-0000014639",
            "anuncio_desc": "Convocatoria de licitaci\u00f3n (Correci\u00f3n)"
        },
        {
            "numero_expediente": "1/CRPM LA CAROLINA/2018",
            "link": "http://www.juntadeandalucia.es/haciendayadministracionpublica/apl/verifirmapdc/descargaInformeParametros?transaccion=PuxmYICVrJOk2Ddy9qR5IoJinNB9TyKu&tipoPie=4",
            "descripcion": "26/04/2018 09:55, 2018-0000015501-Convocatoria de licitaci\u00f3n (Correci\u00f3n)",
            "datetime": "2018-04-26T09:55:00+00:00",
            "anuncio_id": " 2018-0000015501",
            "anuncio_desc": "Convocatoria de licitaci\u00f3n (Correci\u00f3n)"
        },
        {
            "numero_expediente": "1/CRPM LA CAROLINA/2018",
            "link": "http://www.juntadeandalucia.es/haciendayadministracionpublica/apl/verifirmapdc/descargaInformeParametros?transaccion=AJpo%2Bj5AazMFxM0aTMm%2BA3lqT3SzUohr&tipoPie=4",
            "descripcion": "21/05/2018 13:13, 2018-0000017604-Convocatoria de licitaci\u00f3n (Infor.Adicional)",
            "datetime": "2018-05-21T13:13:00+00:00",
            "anuncio_id": " 2018-0000017604",
            "anuncio_desc": "Convocatoria de licitaci\u00f3n (Infor.Adicional)"
        },
        {
            "numero_expediente": "1/CRPM LA CAROLINA/2018",
            "link": "http://www.juntadeandalucia.es/haciendayadministracionpublica/apl/verifirmapdc/descargaInformeParametros?transaccion=BQ8SHOOtXtfs1NbNQSX5UIYdAfNuj%2FNj&tipoPie=4",
            "descripcion": "01/06/2018 14:20, 2018-0000018707-Convocatoria de licitaci\u00f3n (Infor.Adicional)",
            "datetime": "2018-06-01T14:20:00+00:00",
            "anuncio_id": " 2018-0000018707",
            "anuncio_desc": "Convocatoria de licitaci\u00f3n (Infor.Adicional)"
        },
        {
            "numero_expediente": "1/CRPM LA CAROLINA/2018",
            "link": "http://www.juntadeandalucia.es/haciendayadministracionpublica/apl/verifirmapdc/descargaInformeParametros?transaccion=n%2BT3wpxKnNzsYj9mha1AfoYdAfNuj%2FNj&tipoPie=4",
            "descripcion": "04/06/2018 09:30, 2018-0000018829-Convocatoria de licitaci\u00f3n (Infor.Adicional)",
            "datetime": "2018-06-04T09:30:00+00:00",
            "anuncio_id": " 2018-0000018829",
            "anuncio_desc": "Convocatoria de licitaci\u00f3n (Infor.Adicional)"
        },
        {
            "numero_expediente": "1/CRPM LA CAROLINA/2018",
            "link": "http://www.juntadeandalucia.es/haciendayadministracionpublica/apl/verifirmapdc/descargaInformeParametros?transaccion=n%2BT3wpxKnNxc6uOYuCm0hqvJYER37PP1&tipoPie=4",
            "descripcion": "04/06/2018 09:34, 2018-0000018830-Convocatoria de licitaci\u00f3n (Infor.Adicional)",
            "datetime": "2018-06-04T09:34:00+00:00",
            "anuncio_id": " 2018-0000018830",
            "anuncio_desc": "Convocatoria de licitaci\u00f3n (Infor.Adicional)"
        },
        {
            "numero_expediente": "1/CRPM LA CAROLINA/2018",
            "link": "http://www.juntadeandalucia.es/haciendayadministracionpublica/apl/verifirmapdc/descargaInformeParametros?transaccion=B43iZ7EQoPhmdIaLff1HE4YdAfNuj%2FNj&tipoPie=4",
            "descripcion": "06/06/2018 12:37, 2018-0000019191-Convocatoria de licitaci\u00f3n (Infor.Adicional)",
            "datetime": "2018-06-06T12:37:00+00:00",
            "anuncio_id": " 2018-0000019191",
            "anuncio_desc": "Convocatoria de licitaci\u00f3n (Infor.Adicional)"
        },
        {
            "numero_expediente": "1/CRPM LA CAROLINA/2018",
            "link": "http://www.juntadeandalucia.es/haciendayadministracionpublica/apl/verifirmapdc/descargaInformeParametros?transaccion=Z%2BwKOEIDOfxx8YpkYDngnCJqUCje%2B%2B1i&tipoPie=4",
            "descripcion": "13/06/2018 11:24, 2018-0000019932-Convocatoria de licitaci\u00f3n (Infor.Adicional)",
            "datetime": "2018-06-13T11:24:00+00:00",
            "anuncio_id": " 2018-0000019932",
            "anuncio_desc": "Convocatoria de licitaci\u00f3n (Infor.Adicional)"
        },
        {
            "numero_expediente": "1/CRPM LA CAROLINA/2018",
            "link": "http://www.juntadeandalucia.es/haciendayadministracionpublica/apl/verifirmapdc/descargaInformeParametros?transaccion=PxF%2Bdd4dLVIOO%2Bx4e%2FJg%2BYYdAfNuj%2FNj&tipoPie=4",
            "descripcion": "13/06/2018 12:00, 2018-0000019949-Convocatoria de licitaci\u00f3n (Correci\u00f3n)",
            "datetime": "2018-06-13T12:00:00+00:00",
            "anuncio_id": " 2018-0000019949",
            "anuncio_desc": "Convocatoria de licitaci\u00f3n (Correci\u00f3n)"
        },
        {
            "numero_expediente": "1/CRPM LA CAROLINA/2018",
            "link": "http://www.juntadeandalucia.es/haciendayadministracionpublica/apl/verifirmapdc/descargaInformeParametros?transaccion=D66fbxWj3tC%2Bz7Gmbj%2FsxnlqT3SzUohr&tipoPie=4",
            "descripcion": "04/07/2018 10:10, 2018-0000022607-Convocatoria de licitaci\u00f3n (Infor.Adicional)",
            "datetime": "2018-07-04T10:10:00+00:00",
            "anuncio_id": " 2018-0000022607",
            "anuncio_desc": "Convocatoria de licitaci\u00f3n (Infor.Adicional)"
        },
        {
            "numero_expediente": "1/CRPM LA CAROLINA/2018",
            "link": "http://www.juntadeandalucia.es/haciendayadministracionpublica/apl/verifirmapdc/descargaInformeParametros?transaccion=A7SjuI2nme%2F9YP4cnCKRYPI9rwqOEXGf&tipoPie=4",
            "descripcion": "04/07/2018 11:07, 2018-0000022655-Convocatoria de licitaci\u00f3n (Infor.Adicional)",
            "datetime": "2018-07-04T11:07:00+00:00",
            "anuncio_id": " 2018-0000022655",
            "anuncio_desc": "Convocatoria de licitaci\u00f3n (Infor.Adicional)"
        },
        {
            "numero_expediente": "1/CRPM LA CAROLINA/2018",
            "link": "http://www.juntadeandalucia.es/haciendayadministracionpublica/apl/verifirmapdc/descargaInformeParametros?transaccion=yoan9Mwan9wk%2Fhfy2a4OZyJqUCje%2B%2B1i&tipoPie=4",
            "descripcion": "11/07/2018 09:02, 2018-0000023484-Convocatoria de licitaci\u00f3n (Infor.Adicional)",
            "datetime": "2018-07-11T09:02:00+00:00",
            "anuncio_id": " 2018-0000023484",
            "anuncio_desc": "Convocatoria de licitaci\u00f3n (Infor.Adicional)"
        },
        {
            "numero_expediente": "1/CRPM LA CAROLINA/2018",
            "link": "http://www.juntadeandalucia.es/haciendayadministracionpublica/apl/verifirmapdc/descargaInformeParametros?transaccion=NmJ6G%2FUf1mWhXGvzyZhTgavJYER37PP1&tipoPie=4",
            "descripcion": "16/07/2018 20:06, 2018-0000024287-Convocatoria de licitaci\u00f3n (Infor.Adicional)",
            "datetime": "2018-07-16T20:06:00+00:00",
            "anuncio_id": " 2018-0000024287",
            "anuncio_desc": "Convocatoria de licitaci\u00f3n (Infor.Adicional)"
        },
        {
            "numero_expediente": "1/CRPM LA CAROLINA/2018",
            "link": "http://www.juntadeandalucia.es/haciendayadministracionpublica/apl/verifirmapdc/descargaInformeParametros?transaccion=UkWg1uJrkyXaIrwDsnJqq4JinNB9TyKu&tipoPie=4",
            "descripcion": "01/08/2018 14:14, 2018-0000026856-Adjudicaci\u00f3n",
            "datetime": "2018-08-01T14:14:00+00:00",
            "anuncio_id": " 2018-0000026856",
            "anuncio_desc": "Adjudicaci\u00f3n"
        },
        {
            "numero_expediente": "1/CRPM LA CAROLINA/2018",
            "link": "http://www.juntadeandalucia.es/haciendayadministracionpublica/apl/verifirmapdc/descargaInformeParametros?transaccion=8WW%2BVS8Ig2RxrioT922KufI9rwqOEXGf&tipoPie=4",
            "descripcion": "02/10/2018 11:46, 2018-0000037528-Formalizaci\u00f3n",
            "datetime": "2018-10-02T11:46:00+00:00",
            "anuncio_id": " 2018-0000037528",
            "anuncio_desc": "Formalizaci\u00f3n"
        }
    ],
    "id": 67087,
    "origen": {
        "url": "http://www.juntadeandalucia.es/temas/contratacion-publica/perfiles-licitaciones/detalle/000000067087.html",
        "terminos_uso": "http://www.juntadeandalucia.es/informacion/legal.html"
    }
}