{
    "secciones": {
        "importes": 0,
        "estado_expediente": 1,
        "documentacion_complementaria": 2,
        "obtencion_documentacion_informacion": 3,
        "requisitos_criterios_condiciones": 4,
        "clausulas_sociales_ambientales_innovacion_tecnologica": 5,
        "presentacion_solicitudes": 6,
        "presentacion_ofertas": 7,
        "apertura_ofertas": 8,
        "referencias_diarios_oficiales": 9,
        "anuncios_publicados": 10
    },
    "datosbasicos__numero_expediente": "2017/000251",
    "datosbasicos__titulo_expediente": "Servicio de oficina tecnica de interoperatibilidad de la Consejeria de Medio Ambiente y Ordenacion del Territorio.",
    "datosbasicos__descripcion": "Servicio de oficina tecnica de interoperatibilidad de la Consejeria de Medio Ambiente y Ordenacion del Territorio.",
    "datosbasicos__organo_contratacion": "Consejeria de Medio Ambiente y Ordenacion del Territorio. Secretaria General Tecnica",
    "datosbasicos__tipo_contrato": "Servicios",
    "datosbasicos__procedimiento": "Abierto",
    "datosbasicos__tramitacion": "Ordinario",
    "datosbasicos__clasificacion_cpv": "72212211 Servicios de desarrollo de software de interconectividad de plataformas.",
    "datosbasicos__duracion_contrato": "24 meses",
    "datosbasicos__division_por_lotes": "No",
    "datosbasicos__lugar_tramitacion": "SEVILLA",
    "datosbasicos__lugar_ejecucion_nuts": "ES618",
    "datosbasicos__lugar_ejecucion": "SEVILLA",
    "importes__importe_licitacion_(sin_iva)": "748.880,00EUR",
    "importes__importe_licitacion_(con_iva)": "906.144,80EUR",
    "importes__valor_estimado": "1.647.461,11EUR",
    "documentacion_complementaria": [
        {
            "numero_expediente": "2017/000251",
            "link": "http://www.juntadeandalucia.es/contratacion/document/download?refCode=2018-0000033350&refDoc=2018-0000033350-0",
            "descripcion": "Pliego de Cl\u00e1usulas Administrativas Particulares. (pdf) (1182.46Kb)"
        },
        {
            "numero_expediente": "2017/000251",
            "link": "http://www.juntadeandalucia.es/contratacion/document/download?refCode=2018-0000033350&refDoc=2018-0000033350-1",
            "descripcion": "Pliego de Prescripciones T\u00e9cnicas. (pdf) (234.39Kb)"
        },
        {
            "numero_expediente": "2017/000251",
            "link": "http://www.juntadeandalucia.es/contratacion/document/download?refCode=2018-0000033350&refDoc=2018-0000033350-2",
            "descripcion": "Anexos PCAP (odt) (27.41Kb)"
        },
        {
            "numero_expediente": "2017/000251",
            "link": "http://www.juntadeandalucia.es/contratacion/document/download?refCode=2018-0000033350&refDoc=2018-0000033350-3",
            "descripcion": "Curriculum 3.ods (ods) (20.09Kb)"
        },
        {
            "numero_expediente": "2017/000251",
            "link": "http://www.juntadeandalucia.es/contratacion/document/download?refCode=2018-0000033350&refDoc=2018-0000033350-4",
            "descripcion": "Curriculum 3.xls (lsx) (6.48Kb)"
        },
        {
            "numero_expediente": "2017/000251",
            "link": "http://www.juntadeandalucia.es/contratacion/document/download?refCode=2018-0000033350&refDoc=2018-0000033350-9",
            "descripcion": "Formulario DEUC (xml) (124.85Kb)"
        },
        {
            "numero_expediente": "2017/000251",
            "link": "http://www.juntadeandalucia.es/contratacion/document/download?refCode=2018-0000033350&refDoc=2018-0000033350-10",
            "descripcion": "Formulario PCAP.ods (ods) (17.42Kb)"
        },
        {
            "numero_expediente": "2017/000251",
            "link": "http://www.juntadeandalucia.es/contratacion/document/download?refCode=2018-0000033350&refDoc=2018-0000033350-11",
            "descripcion": "Formulario PCAP.xls (lsx) (9.99Kb)"
        },
        {
            "numero_expediente": "2017/000251",
            "link": "http://www.juntadeandalucia.es/contratacion/document/download?refCode=2018-0000033350&refDoc=2018-0000033350-12",
            "descripcion": "Curr\u00edculum solvencia.ods (ods) (19.8Kb)"
        },
        {
            "numero_expediente": "2017/000251",
            "link": "http://www.juntadeandalucia.es/contratacion/document/download?refCode=2018-0000033350&refDoc=2018-0000033350-13",
            "descripcion": "Curr\u00edculum solvencia.xls (lsx) (5.92Kb)"
        },
        {
            "numero_expediente": "2017/000251",
            "link": "http://www.juntadeandalucia.es/contratacion/document/download?refCode=2018-0000033350&refDoc=2018-0000033350-14",
            "descripcion": "Aclaraciones. (odt) (12.79Kb)"
        },
        {
            "numero_expediente": "2017/000251",
            "link": "http://www.juntadeandalucia.es/contratacion/document/download?refCode=2018-0000033350&refDoc=2018-0000033350-15",
            "descripcion": "Aclaraciones 2 (odt) (23.12Kb)"
        },
        {
            "numero_expediente": "2017/000251",
            "link": "http://www.juntadeandalucia.es/contratacion/document/download?refCode=2018-0000033350&refDoc=2018-0000033350-16",
            "descripcion": "Preguntas y respuestas 3. (odt) (16.88Kb)"
        },
        {
            "numero_expediente": "2017/000251",
            "link": "http://www.juntadeandalucia.es/contratacion/document/download?refCode=2018-0000033350&refDoc=2018-0000033350-17",
            "descripcion": "DESIGNACI\u00d3N DE VOCALES (pdf) (254.54Kb)"
        },
        {
            "numero_expediente": "2017/000251",
            "link": "http://www.juntadeandalucia.es/contratacion/document/download?refCode=2018-0000033350&refDoc=2018-0000033350-18",
            "descripcion": "DESIGNACI\u00d3N DE COMISI\u00d3N T\u00c9CNICA (pdf) (214.61Kb)"
        },
        {
            "numero_expediente": "2017/000251",
            "link": "http://www.juntadeandalucia.es/contratacion/document/download?refCode=2018-0000033350&refDoc=2018-0000033350-23",
            "descripcion": "ACTA DE LA QUINTA SESI\u00d3N (pdf) (191.44Kb)"
        },
        {
            "numero_expediente": "2017/000251",
            "link": "http://www.juntadeandalucia.es/contratacion/document/download?refCode=2018-0000033350&refDoc=2018-0000033350-24",
            "descripcion": "ANUNCIO SUBSANACION (pdf) (100.67Kb)"
        },
        {
            "numero_expediente": "2017/000251",
            "link": "http://www.juntadeandalucia.es/contratacion/document/download?refCode=2018-0000033350&refDoc=2018-0000033350-19",
            "descripcion": "ACTA DE LA PRIMERA SESI\u00d3N DE LA MESA DE CONTRATACI\u00d3N (pdf) (246.25Kb)"
        },
        {
            "numero_expediente": "2017/000251",
            "link": "http://www.juntadeandalucia.es/contratacion/document/download?refCode=2018-0000033350&refDoc=2018-0000033350-20",
            "descripcion": "ACTA DE LA SEGUNDA SESI\u00d3N DE LA MESA DE CONTRATACI\u00d3N (pdf) (1510.81Kb)"
        },
        {
            "numero_expediente": "2017/000251",
            "link": "http://www.juntadeandalucia.es/contratacion/document/download?refCode=2018-0000033350&refDoc=2018-0000033350-21",
            "descripcion": "ACTA DE LA TERCERA SESI\u00d3N DE LA MESA DE CONTRATACI\u00d3N (pdf) (1115.44Kb)"
        },
        {
            "numero_expediente": "2017/000251",
            "link": "http://www.juntadeandalucia.es/contratacion/document/download?refCode=2018-0000033350&refDoc=2018-0000033350-22",
            "descripcion": "ACTA DE LA CUARTA SESI\u00d3N DE LA MESA DE CONTRATACI\u00d3N (pdf) (844.88Kb)"
        },
        {
            "numero_expediente": "2017/000251",
            "link": "http://www.juntadeandalucia.es/contratacion/document/download?refCode=2018-0000033350&refDoc=2018-0000033350-25",
            "descripcion": "ACTA DE LA QUINTA SESION DE LA MESA DE CONTRATACI\u00d3N (pdf) (191.44Kb)"
        },
        {
            "numero_expediente": "2017/000251",
            "link": "http://www.juntadeandalucia.es/contratacion/document/download?refCode=2018-0000033350&refDoc=2018-0000033350-26",
            "descripcion": "ACTA DE LA SEXTA SESI\u00d3N DE LA MESA DE CONTRATACI\u00d3N (pdf) (366.55Kb)"
        }
    ],
    "obtencion_documentacion_informacion": {
        "fecha_limite_obtencion": "13/04/2018 a las 14:00 horas",
        "lugar": [
            "Consejeria de Medio Ambiente y Ordenacion del Territorio",
            "Avda. Manuel Siurot 50 41071 (Sevilla )"
        ]
    },
    "requisitos_criterios_condiciones": {
        "requisitos_minimos_contratista": "Los establecidos en el pliego de cl\u00e1usulas administrativas particulares",
        "criterios_adjudicacion": "Los establecidos en el pliego de cl\u00e1usulas administrativas particulares",
        "criterios_objetivos_para_la_seleccion_candidatos_el_procedimiento": "Los establecidos en el pliego de cl\u00e1usulas administrativas particulares",
        "condiciones_especiales_adjudicacion_contrato": "Las establecidas en el pliego de cl\u00e1usulas administrativas particulares"
    },
    "presentacion_ofertas__fecha_limite_presentacion_ofertas": "13/04/2018 a las 14:00 horas",
    "presentacion_ofertas__notas": [
        "Avda. Manuel Siurot 50 41071 (Sevilla )",
        "Consejeria de Medio Ambiente y Ordenacion del Territorio",
        "Exclusivamente en el Registro General de la Consejeria de Medio Ambiente y Ordenacion de Territorio. Avda. Manuel Siurot, 50. 41071 - Sevilla. De acuerdo con el punto 9.1 del PCAP, cuando las proposiciones se envien por correo, el empresario debera justificar la fecha de imposicion del envio en las Oficinas de Correos y anunciara la remision de su oferta, en el mismo dia, exclusivamente mediante telex, telegrama o fax remitido al registro general num. 955003775."
    ],
    "apertura_ofertas": {
        "lugar": [
            "Consejeria de Medio Ambiente y Ordenacion del Territorio",
            "Avda. Manuel Siurot 50 41071 (Sevilla )",
            "Fecha Apertura del sobre de criterios de adjudicacion que dependen de un juicio de valor : 15/05/2018 a las 14:30 horas",
            "Fecha Apertura del sobre de criterios de adjudicacion evaluables por aplicacion de formulas : 19/06/2018 a las 09:30 horas"
        ],
        "aclaraciones": "APERTURA PUBLICA DEL SOBRE 3 EL MARTES 19 DE JUNIO A LAS 9:30 EN LA PRIMERA PLANTA DE LA SEDE DE MANUEL SIUROT 50"
    },
    "referencias_diarios_oficiales": [],
    "anuncios_publicados": [
        {
            "numero_expediente": "2017/000251",
            "link": "http://www.juntadeandalucia.es/haciendayadministracionpublica/apl/verifirmapdc/descargaInformeParametros?transaccion=omAMR1aqMUGzvTgXCy5TIiJqUCje%2B%2B1i&tipoPie=4",
            "descripcion": "15/03/2018 09:47, 2018-0000010865-Convocatoria de licitaci\u00f3n",
            "datetime": "2018-03-15T09:47:00+00:00",
            "anuncio_id": " 2018-0000010865",
            "anuncio_desc": "Convocatoria de licitaci\u00f3n"
        },
        {
            "numero_expediente": "2017/000251",
            "link": "http://www.juntadeandalucia.es/haciendayadministracionpublica/apl/verifirmapdc/descargaInformeParametros?transaccion=03JBXxs0RACTbU%2BeQcHKbs4cenB071d7&tipoPie=4",
            "descripcion": "22/03/2018 10:57, 2018-0000011949-Convocatoria de licitaci\u00f3n (Correci\u00f3n)",
            "datetime": "2018-03-22T10:57:00+00:00",
            "anuncio_id": " 2018-0000011949",
            "anuncio_desc": "Convocatoria de licitaci\u00f3n (Correci\u00f3n)"
        },
        {
            "numero_expediente": "2017/000251",
            "link": "http://www.juntadeandalucia.es/haciendayadministracionpublica/apl/verifirmapdc/descargaInformeParametros?transaccion=MJZPmHlQ0NAN3x80lWKYIPI9rwqOEXGf&tipoPie=4",
            "descripcion": "02/04/2018 10:45, 2018-0000012865-Convocatoria de licitaci\u00f3n (Infor.Adicional)",
            "datetime": "2018-04-02T10:45:00+00:00",
            "anuncio_id": " 2018-0000012865",
            "anuncio_desc": "Convocatoria de licitaci\u00f3n (Infor.Adicional)"
        },
        {
            "numero_expediente": "2017/000251",
            "link": "http://www.juntadeandalucia.es/haciendayadministracionpublica/apl/verifirmapdc/descargaInformeParametros?transaccion=p%2BGwLUSsdisOpiRdnIeZKCJqUCje%2B%2B1i&tipoPie=4",
            "descripcion": "03/04/2018 14:28, 2018-0000013117-Convocatoria de licitaci\u00f3n (Infor.Adicional)",
            "datetime": "2018-04-03T14:28:00+00:00",
            "anuncio_id": " 2018-0000013117",
            "anuncio_desc": "Convocatoria de licitaci\u00f3n (Infor.Adicional)"
        },
        {
            "numero_expediente": "2017/000251",
            "link": "http://www.juntadeandalucia.es/haciendayadministracionpublica/apl/verifirmapdc/descargaInformeParametros?transaccion=pcc89Fg0orFpOUJP6y3h4YJinNB9TyKu&tipoPie=4",
            "descripcion": "06/04/2018 14:05, 2018-0000013475-Convocatoria de licitaci\u00f3n (Infor.Adicional)",
            "datetime": "2018-04-06T14:05:00+00:00",
            "anuncio_id": " 2018-0000013475",
            "anuncio_desc": "Convocatoria de licitaci\u00f3n (Infor.Adicional)"
        },
        {
            "numero_expediente": "2017/000251",
            "link": "http://www.juntadeandalucia.es/haciendayadministracionpublica/apl/verifirmapdc/descargaInformeParametros?transaccion=MzYGHyn09ys0gabLfNgfN3P4a3pxggof&tipoPie=4",
            "descripcion": "08/05/2018 15:50, 2018-0000016474-Convocatoria de licitaci\u00f3n (Infor.Adicional)",
            "datetime": "2018-05-08T15:50:00+00:00",
            "anuncio_id": " 2018-0000016474",
            "anuncio_desc": "Convocatoria de licitaci\u00f3n (Infor.Adicional)"
        },
        {
            "numero_expediente": "2017/000251",
            "link": "http://www.juntadeandalucia.es/haciendayadministracionpublica/apl/verifirmapdc/descargaInformeParametros?transaccion=5%2F9wdRObc2gkgW29KOMfl%2FI9rwqOEXGf&tipoPie=4",
            "descripcion": "11/05/2018 12:38, 2018-0000016862-Convocatoria de licitaci\u00f3n (Infor.Adicional)",
            "datetime": "2018-05-11T12:38:00+00:00",
            "anuncio_id": " 2018-0000016862",
            "anuncio_desc": "Convocatoria de licitaci\u00f3n (Infor.Adicional)"
        },
        {
            "numero_expediente": "2017/000251",
            "link": "http://www.juntadeandalucia.es/haciendayadministracionpublica/apl/verifirmapdc/descargaInformeParametros?transaccion=AYz7AUmgt3BFURLKxpJPVnlqT3SzUohr&tipoPie=4",
            "descripcion": "18/05/2018 12:45, 2018-0000017476-Convocatoria de licitaci\u00f3n (Infor.Adicional)",
            "datetime": "2018-05-18T12:45:00+00:00",
            "anuncio_id": " 2018-0000017476",
            "anuncio_desc": "Convocatoria de licitaci\u00f3n (Infor.Adicional)"
        },
        {
            "numero_expediente": "2017/000251",
            "link": "http://www.juntadeandalucia.es/haciendayadministracionpublica/apl/verifirmapdc/descargaInformeParametros?transaccion=mZCZwF7RetVk%2B8MfieBkPSmkfG71%2BFxx&tipoPie=4",
            "descripcion": "23/05/2018 14:37, 2018-0000017890-Convocatoria de licitaci\u00f3n (Infor.Adicional)",
            "datetime": "2018-05-23T14:37:00+00:00",
            "anuncio_id": " 2018-0000017890",
            "anuncio_desc": "Convocatoria de licitaci\u00f3n (Infor.Adicional)"
        },
        {
            "numero_expediente": "2017/000251",
            "link": "http://www.juntadeandalucia.es/haciendayadministracionpublica/apl/verifirmapdc/descargaInformeParametros?transaccion=HFxD0Hbisep7n2RvaGc8enlqT3SzUohr&tipoPie=4",
            "descripcion": "30/05/2018 13:58, 2018-0000018597-Convocatoria de licitaci\u00f3n (Infor.Adicional)",
            "datetime": "2018-05-30T13:58:00+00:00",
            "anuncio_id": " 2018-0000018597",
            "anuncio_desc": "Convocatoria de licitaci\u00f3n (Infor.Adicional)"
        },
        {
            "numero_expediente": "2017/000251",
            "link": "http://www.juntadeandalucia.es/haciendayadministracionpublica/apl/verifirmapdc/descargaInformeParametros?transaccion=FKSWZ29GIUfvuSqQzwHnLc4cenB071d7&tipoPie=4",
            "descripcion": "01/06/2018 07:38, 2018-0000018695-Convocatoria de licitaci\u00f3n (Infor.Adicional)",
            "datetime": "2018-06-01T07:38:00+00:00",
            "anuncio_id": " 2018-0000018695",
            "anuncio_desc": "Convocatoria de licitaci\u00f3n (Infor.Adicional)"
        },
        {
            "numero_expediente": "2017/000251",
            "link": "http://www.juntadeandalucia.es/haciendayadministracionpublica/apl/verifirmapdc/descargaInformeParametros?transaccion=pATi114SREovUBO3xKoLTiJqUCje%2B%2B1i&tipoPie=4",
            "descripcion": "19/06/2018 14:27, 2018-0000020166-Convocatoria de licitaci\u00f3n (Infor.Adicional)",
            "datetime": "2018-06-19T14:27:00+00:00",
            "anuncio_id": " 2018-0000020166",
            "anuncio_desc": "Convocatoria de licitaci\u00f3n (Infor.Adicional)"
        },
        {
            "numero_expediente": "2017/000251",
            "link": "http://www.juntadeandalucia.es/haciendayadministracionpublica/apl/verifirmapdc/descargaInformeParametros?transaccion=9TlFQtAIvgnwX6pZJF42mIYdAfNuj%2FNj&tipoPie=4",
            "descripcion": "06/07/2018 12:12, 2018-0000022963-Convocatoria de licitaci\u00f3n (Infor.Adicional)",
            "datetime": "2018-07-06T12:12:00+00:00",
            "anuncio_id": " 2018-0000022963",
            "anuncio_desc": "Convocatoria de licitaci\u00f3n (Infor.Adicional)"
        },
        {
            "numero_expediente": "2017/000251",
            "link": "http://www.juntadeandalucia.es/haciendayadministracionpublica/apl/verifirmapdc/descargaInformeParametros?transaccion=IeheieH1O%2FYY9%2FM6TurVn4YdAfNuj%2FNj&tipoPie=4",
            "descripcion": "01/08/2018 08:59, 2018-0000026655-Convocatoria de licitaci\u00f3n (Infor.Adicional)",
            "datetime": "2018-08-01T08:59:00+00:00",
            "anuncio_id": " 2018-0000026655",
            "anuncio_desc": "Convocatoria de licitaci\u00f3n (Infor.Adicional)"
        },
        {
            "numero_expediente": "2017/000251",
            "link": "http://www.juntadeandalucia.es/haciendayadministracionpublica/apl/verifirmapdc/descargaInformeParametros?transaccion=IeheieH1O%2FbwA20uHHpVt4YdAfNuj%2FNj&tipoPie=4",
            "descripcion": "01/08/2018 09:03, 2018-0000026660-Convocatoria de licitaci\u00f3n (Infor.Adicional)",
            "datetime": "2018-08-01T09:03:00+00:00",
            "anuncio_id": " 2018-0000026660",
            "anuncio_desc": "Convocatoria de licitaci\u00f3n (Infor.Adicional)"
        },
        {
            "numero_expediente": "2017/000251",
            "link": "http://www.juntadeandalucia.es/haciendayadministracionpublica/apl/verifirmapdc/descargaInformeParametros?transaccion=n3rL33abPOI4ArojQVZIKCJqUCje%2B%2B1i&tipoPie=4",
            "descripcion": "10/09/2018 13:21, 2018-0000033350-Convocatoria de licitaci\u00f3n (Infor.Adicional)",
            "datetime": "2018-09-10T13:21:00+00:00",
            "anuncio_id": " 2018-0000033350",
            "anuncio_desc": "Convocatoria de licitaci\u00f3n (Infor.Adicional)"
        }
    ],
    "id": 72326,
    "origen": {
        "url": "http://www.juntadeandalucia.es/temas/contratacion-publica/perfiles-licitaciones/detalle/000000072326.html",
        "terminos_uso": "http://www.juntadeandalucia.es/informacion/legal.html"
    }
}