{
    "secciones": {
        "importes": 0,
        "estado_expediente": 1,
        "documentacion_complementaria": 2,
        "obtencion_documentacion_informacion": 3,
        "requisitos_criterios_condiciones": 4,
        "presentacion_solicitudes": 5,
        "presentacion_ofertas": 6,
        "apertura_ofertas": 7,
        "referencias_diarios_oficiales": 8,
        "anuncios_publicados": 9
    },
    "datosbasicos__numero_expediente": "11/2018",
    "datosbasicos__titulo_expediente": "DISENO DEL MODELO DE SERVICIOS DIGITALES Y CONSTRUCCION E IMPLANTACION DE LA PLATAFORMA SOFTWARE DE SOPORTE PARA SU DESARROLLO EN EL NUEVO PORTAL JUNTA DE ANDALUCIA",
    "datosbasicos__descripcion": "DISENO DEL MODELO DE SERVICIOS DIGITALES Y CONSTRUCCION E IMPLANTACION DE LA PLATAFORMA SOFTWARE DE SOPORTE PARA SU DESARROLLO EN EL NUEVO PORTAL JUNTA DE ANDALUCIA",
    "datosbasicos__organo_contratacion": "Consejeria de la Presidencia, Administracion Local y Memoria Democratica. Secretaria General Tecnica",
    "datosbasicos__tipo_contrato": "Servicios",
    "datosbasicos__procedimiento": "Abierto",
    "datosbasicos__tramitacion": "Ordinario",
    "datosbasicos__clasificacion_cpv": "72000000 Servicios TI: consultoria, desarrollo de software, Internet y apoyo.",
    "datosbasicos__division_por_lotes": "No",
    "datosbasicos__lugar_tramitacion": "SEVILLA",
    "datosbasicos__lugar_ejecucion_nuts": "ES618",
    "datosbasicos__lugar_ejecucion": "SEVILLA",
    "importes__importe_licitacion_(sin_iva)": "1.239.669,42EUR",
    "importes__importe_licitacion_(con_iva)": "1.500.000,00EUR",
    "importes__valor_estimado": "2.066.115,69EUR",
    "documentacion_complementaria": [
        {
            "numero_expediente": "11/2018",
            "link": "http://www.juntadeandalucia.es/contratacion/document/download?refCode=2018-0000033261&refDoc=2018-0000033261-0",
            "descripcion": "Expte. 11-18 PLIEGO DE CL\u00c1USULAS ADMINISTRATIVAS PARTICULARES (pdf) (1407.37Kb)"
        },
        {
            "numero_expediente": "11/2018",
            "link": "http://www.juntadeandalucia.es/contratacion/document/download?refCode=2018-0000033261&refDoc=2018-0000033261-1",
            "descripcion": "Expte. 11-18 PLIEGO DE PRESCRIPCIONES T\u00c9CNICAS (pdf) (1103.86Kb)"
        },
        {
            "numero_expediente": "11/2018",
            "link": "http://www.juntadeandalucia.es/contratacion/document/download?refCode=2018-0000033261&refDoc=2018-0000033261-2",
            "descripcion": "Miembros Mesa de Contrataci\u00f3n (pdf) (70.16Kb)"
        },
        {
            "numero_expediente": "11/2018",
            "link": "http://www.juntadeandalucia.es/contratacion/document/download?refCode=2018-0000033261&refDoc=2018-0000033261-3",
            "descripcion": "Miembros Comisi\u00f3n T\u00e9cnica (pdf) (67.81Kb)"
        },
        {
            "numero_expediente": "11/2018",
            "link": "http://www.juntadeandalucia.es/contratacion/document/download?refCode=2018-0000033261&refDoc=2018-0000033261-4",
            "descripcion": "11-18 NOTA ACLARATORIA RELATIVA A CUADRO DEL ANEXO V-A DEL PCAP (pdf) (374.47Kb)"
        },
        {
            "numero_expediente": "11/2018",
            "link": "http://www.juntadeandalucia.es/contratacion/document/download?refCode=2018-0000033261&refDoc=2018-0000033261-5",
            "descripcion": "11-18 NOTA ACLARATORIA RELATIVA AL C\u00c1LCULO DEL CRITERIO N\u00daMERO 4 DEL ANEXO VII (pdf) (290.12Kb)"
        },
        {
            "numero_expediente": "11/2018",
            "link": "http://www.juntadeandalucia.es/contratacion/document/download?refCode=2018-0000033261&refDoc=2018-0000033261-6",
            "descripcion": "NOTA ACLARATORIA RELATIVA AL VALOR NUM\u00c9RICO. (pdf) (61.6Kb)"
        },
        {
            "numero_expediente": "11/2018",
            "link": "http://www.juntadeandalucia.es/contratacion/document/download?refCode=2018-0000033261&refDoc=2018-0000033261-7",
            "descripcion": "Anuncio subsanaciones (pdf) (223.69Kb)"
        }
    ],
    "obtencion_documentacion_informacion": {
        "fecha_limite_obtencion": "09/05/2018 a las 14:00 horas",
        "lugar": [
            "Consejeria de la Presidencia, Administracion Local y Memoria Democratica",
            "Av. de Roma S/N 41013 (Sevilla )"
        ],
        "puntos_contacto": [
            "Servicio de Administracion General y Contratacion",
            "955035156",
            "955035221"
        ],
        "aclaraciones": "Direccion de correo electronico a la que dirigir las consultas sobre dudas de caracter tecnico y administrativo: contratacion.cpalmd@juntadeandalucia.es"
    },
    "requisitos_criterios_condiciones": {
        "requisitos_minimos_contratista": "Los establecidos en el pliego de cl\u00e1usulas administrativas particulares",
        "criterios_adjudicacion": "Los establecidos en el pliego de cl\u00e1usulas administrativas particulares",
        "criterios_objetivos_para_la_seleccion_candidatos_el_procedimiento": "Los establecidos en el pliego de cl\u00e1usulas administrativas particulares",
        "condiciones_especiales_adjudicacion_contrato": "Las establecidas en el pliego de cl\u00e1usulas administrativas particulares"
    },
    "presentacion_ofertas__fecha_limite_presentacion_ofertas": "09/05/2018 a las 14:00 horas",
    "presentacion_ofertas__notas": [
        "Av. de Roma S/N 41013 (Sevilla )",
        "Cada empresa licitadora presentara en mano en el Registro General de la Cons. de la Presidencia, Admon. Local y Memoria Democratica 3 sobres cerrados y firmados, senalados con los numeros 1, 2 y 3. Caso de enviarse por correo, las empresas deberan justificar la fecha y hora de imposicion del envio en la Oficina de Correos y comunicar en el MISMO DIA a la Consejeria de la Presidencia, Admon. Local y Memoria Democratica la remision de su oferta mediante telex, fax (955035221) o telegrama.",
        "Registro General de la Consejeria de la Presidencia, Administracion Local y Memoria Democratica. REGISTRO GENERAL."
    ],
    "apertura_ofertas": {
        "lugar": [
            "Consejeria de la Presidencia, Administracion Local y Memoria Democratica.",
            "Av. de Roma S/N 41013 (Sevilla )",
            "Fecha Apertura del sobre de criterios de adjudicacion que dependen de un juicio de valor : 21/05/2018 a las 13:00 horas",
            "Fecha Apertura del sobre de criterios de adjudicacion evaluables por aplicacion de formulas : 12/09/2018 a las 10:30 horas"
        ]
    },
    "referencias_diarios_oficiales": [],
    "anuncios_publicados": [
        {
            "numero_expediente": "11/2018",
            "link": "http://www.juntadeandalucia.es/haciendayadministracionpublica/apl/verifirmapdc/descargaInformeParametros?transaccion=Cy8YZpQ9NF4l%2BSWDg6OlvnlqT3SzUohr&tipoPie=4",
            "descripcion": "08/03/2018 16:05, 2018-0000010100-Convocatoria de licitaci\u00f3n",
            "datetime": "2018-03-08T16:05:00+00:00",
            "anuncio_id": " 2018-0000010100",
            "anuncio_desc": "Convocatoria de licitaci\u00f3n"
        },
        {
            "numero_expediente": "11/2018",
            "link": "http://www.juntadeandalucia.es/haciendayadministracionpublica/apl/verifirmapdc/descargaInformeParametros?transaccion=lC8%2FLZ2zQUzIhq9PA0CYziJqUCje%2B%2B1i&tipoPie=4",
            "descripcion": "09/03/2018 11:48, 2018-0000010298-Convocatoria de licitaci\u00f3n (Correci\u00f3n)",
            "datetime": "2018-03-09T11:48:00+00:00",
            "anuncio_id": " 2018-0000010298",
            "anuncio_desc": "Convocatoria de licitaci\u00f3n (Correci\u00f3n)"
        },
        {
            "numero_expediente": "11/2018",
            "link": "http://www.juntadeandalucia.es/haciendayadministracionpublica/apl/verifirmapdc/descargaInformeParametros?transaccion=sPbT7pZzUJIToOZurnCU5SJqUCje%2B%2B1i&tipoPie=4",
            "descripcion": "15/03/2018 15:25, 2018-0000011096-Convocatoria de licitaci\u00f3n (Correci\u00f3n)",
            "datetime": "2018-03-15T15:25:00+00:00",
            "anuncio_id": " 2018-0000011096",
            "anuncio_desc": "Convocatoria de licitaci\u00f3n (Correci\u00f3n)"
        },
        {
            "numero_expediente": "11/2018",
            "link": "http://www.juntadeandalucia.es/haciendayadministracionpublica/apl/verifirmapdc/descargaInformeParametros?transaccion=r7J4C%2BRYjhnbJgoUcQx%2FAoJinNB9TyKu&tipoPie=4",
            "descripcion": "26/03/2018 09:22, 2018-0000012222-Convocatoria de licitaci\u00f3n (Correci\u00f3n)",
            "datetime": "2018-03-26T09:22:00+00:00",
            "anuncio_id": " 2018-0000012222",
            "anuncio_desc": "Convocatoria de licitaci\u00f3n (Correci\u00f3n)"
        },
        {
            "numero_expediente": "11/2018",
            "link": "http://www.juntadeandalucia.es/haciendayadministracionpublica/apl/verifirmapdc/descargaInformeParametros?transaccion=OVg8gD2go1UZuetl%2FjYiKqVT2q%2Bc%2Fsfz&tipoPie=4",
            "descripcion": "04/04/2018 13:31, 2018-0000013230-Convocatoria de licitaci\u00f3n (Correci\u00f3n)",
            "datetime": "2018-04-04T13:31:00+00:00",
            "anuncio_id": " 2018-0000013230",
            "anuncio_desc": "Convocatoria de licitaci\u00f3n (Correci\u00f3n)"
        },
        {
            "numero_expediente": "11/2018",
            "link": "http://www.juntadeandalucia.es/haciendayadministracionpublica/apl/verifirmapdc/descargaInformeParametros?transaccion=itVD1T7pRgkdW0e5G6FsxoJinNB9TyKu&tipoPie=4",
            "descripcion": "20/04/2018 11:39, 2018-0000014981-Convocatoria de licitaci\u00f3n (Correci\u00f3n)",
            "datetime": "2018-04-20T11:39:00+00:00",
            "anuncio_id": " 2018-0000014981",
            "anuncio_desc": "Convocatoria de licitaci\u00f3n (Correci\u00f3n)"
        },
        {
            "numero_expediente": "11/2018",
            "link": "http://www.juntadeandalucia.es/haciendayadministracionpublica/apl/verifirmapdc/descargaInformeParametros?transaccion=%2F28YrlJnzZAkOeRxYeYfqiJqUCje%2B%2B1i&tipoPie=4",
            "descripcion": "20/04/2018 15:10, 2018-0000015021-Convocatoria de licitaci\u00f3n (Correci\u00f3n)",
            "datetime": "2018-04-20T15:10:00+00:00",
            "anuncio_id": " 2018-0000015021",
            "anuncio_desc": "Convocatoria de licitaci\u00f3n (Correci\u00f3n)"
        },
        {
            "numero_expediente": "11/2018",
            "link": "http://www.juntadeandalucia.es/haciendayadministracionpublica/apl/verifirmapdc/descargaInformeParametros?transaccion=QywvApv%2BzuFGDVynhE4AG4JinNB9TyKu&tipoPie=4",
            "descripcion": "23/04/2018 15:44, 2018-0000015176-Convocatoria de licitaci\u00f3n (Correci\u00f3n)",
            "datetime": "2018-04-23T15:44:00+00:00",
            "anuncio_id": " 2018-0000015176",
            "anuncio_desc": "Convocatoria de licitaci\u00f3n (Correci\u00f3n)"
        },
        {
            "numero_expediente": "11/2018",
            "link": "http://www.juntadeandalucia.es/haciendayadministracionpublica/apl/verifirmapdc/descargaInformeParametros?transaccion=HAumW%2B57pvI%2BGkxXmtIb%2FKvJYER37PP1&tipoPie=4",
            "descripcion": "26/04/2018 08:59, 2018-0000015494-Convocatoria de licitaci\u00f3n (Infor.Adicional)",
            "datetime": "2018-04-26T08:59:00+00:00",
            "anuncio_id": " 2018-0000015494",
            "anuncio_desc": "Convocatoria de licitaci\u00f3n (Infor.Adicional)"
        },
        {
            "numero_expediente": "11/2018",
            "link": "http://www.juntadeandalucia.es/haciendayadministracionpublica/apl/verifirmapdc/descargaInformeParametros?transaccion=CObh2KqAy4Wmcbi5cbc5NimkfG71%2BFxx&tipoPie=4",
            "descripcion": "07/05/2018 08:28, 2018-0000016249-Convocatoria de licitaci\u00f3n (Correci\u00f3n)",
            "datetime": "2018-05-07T08:28:00+00:00",
            "anuncio_id": " 2018-0000016249",
            "anuncio_desc": "Convocatoria de licitaci\u00f3n (Correci\u00f3n)"
        },
        {
            "numero_expediente": "11/2018",
            "link": "http://www.juntadeandalucia.es/haciendayadministracionpublica/apl/verifirmapdc/descargaInformeParametros?transaccion=SGhBj4kEXRoCcQ3%2B6MpGvqVT2q%2Bc%2Fsfz&tipoPie=4",
            "descripcion": "14/05/2018 12:23, 2018-0000017001-Convocatoria de licitaci\u00f3n (Correci\u00f3n)",
            "datetime": "2018-05-14T12:23:00+00:00",
            "anuncio_id": " 2018-0000017001",
            "anuncio_desc": "Convocatoria de licitaci\u00f3n (Correci\u00f3n)"
        },
        {
            "numero_expediente": "11/2018",
            "link": "http://www.juntadeandalucia.es/haciendayadministracionpublica/apl/verifirmapdc/descargaInformeParametros?transaccion=3o5Ux9KlZd12w2z8oEj14YJinNB9TyKu&tipoPie=4",
            "descripcion": "14/05/2018 17:41, 2018-0000017070-Convocatoria de licitaci\u00f3n (Correci\u00f3n)",
            "datetime": "2018-05-14T17:41:00+00:00",
            "anuncio_id": " 2018-0000017070",
            "anuncio_desc": "Convocatoria de licitaci\u00f3n (Correci\u00f3n)"
        },
        {
            "numero_expediente": "11/2018",
            "link": "http://www.juntadeandalucia.es/haciendayadministracionpublica/apl/verifirmapdc/descargaInformeParametros?transaccion=LxRgtc5VnsWvX%2BU%2FBzFZbIYdAfNuj%2FNj&tipoPie=4",
            "descripcion": "10/09/2018 09:49, 2018-0000033261-Convocatoria de licitaci\u00f3n (Correci\u00f3n)",
            "datetime": "2018-09-10T09:49:00+00:00",
            "anuncio_id": " 2018-0000033261",
            "anuncio_desc": "Convocatoria de licitaci\u00f3n (Correci\u00f3n)"
        }
    ],
    "id": 72095,
    "origen": {
        "url": "http://www.juntadeandalucia.es/temas/contratacion-publica/perfiles-licitaciones/detalle/000000072095.html",
        "terminos_uso": "http://www.juntadeandalucia.es/informacion/legal.html"
    }
}