{
    "secciones": {
        "importes": 0,
        "estado_expediente": 1,
        "documentacion_complementaria": 2,
        "obtencion_documentacion_informacion": 3,
        "requisitos_criterios_condiciones": 4,
        "presentacion_solicitudes": 5,
        "presentacion_ofertas": 6,
        "apertura_ofertas": 7,
        "referencias_diarios_oficiales": 8,
        "anuncios_publicados": 9
    },
    "datosbasicos__numero_expediente": "2017/000248",
    "datosbasicos__titulo_expediente": "Servicio de impresion, fotografiado y escaneado documental para todas las sedes de la Consejeria de Medio Ambiente y Ordenacion del Territorio.",
    "datosbasicos__descripcion": "Servicio de impresion, fotografiado y escaneado documental para todas las sedes de la Consejeria de Medio Ambiente y Ordenacion del Territorio.",
    "datosbasicos__organo_contratacion": "Consejeria de Medio Ambiente y Ordenacion del Territorio. Secretaria General Tecnica",
    "datosbasicos__tipo_contrato": "Servicios",
    "datosbasicos__procedimiento": "Abierto",
    "datosbasicos__tramitacion": "Ordinario",
    "datosbasicos__clasificacion_cpv": "79800000 Servicios de impresion y servicios conexos.",
    "datosbasicos__duracion_contrato": "24 meses",
    "datosbasicos__division_por_lotes": "No",
    "datosbasicos__lugar_tramitacion": "SEVILLA",
    "datosbasicos__lugar_ejecucion_nuts": "ES618",
    "datosbasicos__lugar_ejecucion": "SEVILLA",
    "importes__importe_licitacion_(sin_iva)": "553.400,00EUR",
    "importes__importe_licitacion_(con_iva)": "669.614,00EUR",
    "importes__valor_estimado": "1.217.424,66EUR",
    "importes__importe_adjudicacion_(sin_iva)": "553.400,00EUR",
    "importes__importe_adjudicacion_(con_iva)": "669.614,00EUR",
    "documentacion_complementaria": [
        {
            "numero_expediente": "2017/000248",
            "link": "http://www.juntadeandalucia.es/contratacion/document/download?refCode=2018-0000021420&refDoc=2018-0000021420-0",
            "descripcion": "Pliego de Cl\u00e1usulas Administrativas Particulares (pdf) (1109.33Kb)"
        },
        {
            "numero_expediente": "2017/000248",
            "link": "http://www.juntadeandalucia.es/contratacion/document/download?refCode=2018-0000021420&refDoc=2018-0000021420-1",
            "descripcion": "Pliego de Prescripciones T\u00e9cnicas (pdf) (190.51Kb)"
        },
        {
            "numero_expediente": "2017/000248",
            "link": "http://www.juntadeandalucia.es/contratacion/document/download?refCode=2018-0000021420&refDoc=2018-0000021420-2",
            "descripcion": "Anexos PCAP (odt) (27.41Kb)"
        },
        {
            "numero_expediente": "2017/000248",
            "link": "http://www.juntadeandalucia.es/contratacion/document/download?refCode=2018-0000021420&refDoc=2018-0000021420-3",
            "descripcion": "Formulario DEUC (xml) (124.88Kb)"
        },
        {
            "numero_expediente": "2017/000248",
            "link": "http://www.juntadeandalucia.es/contratacion/document/download?refCode=2018-0000023793&refDoc=2018-0000023793-0",
            "descripcion": "RESOLUCION DE ADJUDICACI\u00d3N (pdf) (463.81Kb)"
        },
        {
            "numero_expediente": "2017/000248",
            "link": "http://www.juntadeandalucia.es/contratacion/document/download?refCode=2018-0000021420&refDoc=2018-0000021420-4",
            "descripcion": "Formulario sobre 2. (ods) (14.13Kb)"
        },
        {
            "numero_expediente": "2017/000248",
            "link": "http://www.juntadeandalucia.es/contratacion/document/download?refCode=2018-0000021420&refDoc=2018-0000021420-5",
            "descripcion": "Formulario sobre 3. (ods) (20.78Kb)"
        },
        {
            "numero_expediente": "2017/000248",
            "link": "http://www.juntadeandalucia.es/contratacion/document/download?refCode=2018-0000021420&refDoc=2018-0000021420-6",
            "descripcion": "Preguntas y respuestas (pdf) (18.59Kb)"
        },
        {
            "numero_expediente": "2017/000248",
            "link": "http://www.juntadeandalucia.es/contratacion/document/download?refCode=2018-0000021420&refDoc=2018-0000021420-7",
            "descripcion": "Preguntas y respuestas 2 (odt) (14.41Kb)"
        },
        {
            "numero_expediente": "2017/000248",
            "link": "http://www.juntadeandalucia.es/contratacion/document/download?refCode=2018-0000021420&refDoc=2018-0000021420-8",
            "descripcion": "Diligencia correcci\u00f3n error material (pdf) (184.57Kb)"
        },
        {
            "numero_expediente": "2017/000248",
            "link": "http://www.juntadeandalucia.es/contratacion/document/download?refCode=2018-0000021420&refDoc=2018-0000021420-9",
            "descripcion": "Anuncio de subsanaci\u00f3n de documentaci\u00f3n del sobre 1 (pdf) (99.63Kb)"
        },
        {
            "numero_expediente": "2017/000248",
            "link": "http://www.juntadeandalucia.es/contratacion/document/download?refCode=2018-0000021420&refDoc=2018-0000021420-11",
            "descripcion": "DESIGNACI\u00d3N DE VOCALES (pdf) (262.95Kb)"
        },
        {
            "numero_expediente": "2017/000248",
            "link": "http://www.juntadeandalucia.es/contratacion/document/download?refCode=2018-0000021420&refDoc=2018-0000021420-12",
            "descripcion": "DESIGNACI\u00d3N DE COMISI\u00d3N T\u00c9CNICA (pdf) (218.92Kb)"
        },
        {
            "numero_expediente": "2017/000248",
            "link": "http://www.juntadeandalucia.es/contratacion/document/download?refCode=2018-0000021420&refDoc=2018-0000021420-16",
            "descripcion": "ANUNCION DE SUBSANACI\u00d3N DE DOCUMENTACI\u00d3N (pdf) (103.84Kb)"
        },
        {
            "numero_expediente": "2017/000248",
            "link": "http://www.juntadeandalucia.es/contratacion/document/download?refCode=2018-0000021420&refDoc=2018-0000021420-10",
            "descripcion": "ACTA DE LA PRIMERA SESI\u00d3N DE LA MESA DE CONTRATACI\u00d3N (pdf) (195.31Kb)"
        },
        {
            "numero_expediente": "2017/000248",
            "link": "http://www.juntadeandalucia.es/contratacion/document/download?refCode=2018-0000021420&refDoc=2018-0000021420-13",
            "descripcion": "ACTA DE LA SEGUNDA SESI\u00d3N DE LA MESA DE CONTRATACI\u00d3N (pdf) (223.17Kb)"
        },
        {
            "numero_expediente": "2017/000248",
            "link": "http://www.juntadeandalucia.es/contratacion/document/download?refCode=2018-0000021420&refDoc=2018-0000021420-14",
            "descripcion": "ACTA DE LA TERCERA SESION DE LA MESA DE CONTRATRACI\u00d3N (pdf) (1517.5Kb)"
        },
        {
            "numero_expediente": "2017/000248",
            "link": "http://www.juntadeandalucia.es/contratacion/document/download?refCode=2018-0000021420&refDoc=2018-0000021420-15",
            "descripcion": "ACTA DE LA CUARTA SESI\u00d3N DE LA MESA DE CONTRATACI\u00d3N (pdf) (1483.66Kb)"
        },
        {
            "numero_expediente": "2017/000248",
            "link": "http://www.juntadeandalucia.es/contratacion/document/download?refCode=2018-0000021420&refDoc=2018-0000021420-17",
            "descripcion": "ACTA DE LA QUINTA SESI\u00d3N DE LA MESA DE CONTRATACI\u00d3N (pdf) (347.58Kb)"
        },
        {
            "numero_expediente": "2017/000248",
            "link": "http://www.juntadeandalucia.es/contratacion/document/download?refCode=2018-0000021420&refDoc=2018-0000021420-18",
            "descripcion": "ACTA DE LA SEXTA SESI\u00d3N DE LA MESA DE CONTRATACI\u00d3N (pdf) (366.77Kb)"
        }
    ],
    "obtencion_documentacion_informacion": {
        "fecha_limite_obtencion": "10/04/2018 a las 14:00 horas",
        "lugar": [
            "Consejeria de Medio Ambiente y Ordenacion del Territorio",
            "Avda. Manuel Siurot 50 41071 (Sevilla )"
        ]
    },
    "requisitos_criterios_condiciones": {
        "requisitos_minimos_contratista": "Los establecidos en el pliego de cl\u00e1usulas administrativas particulares",
        "criterios_adjudicacion": "Los establecidos en el pliego de cl\u00e1usulas administrativas particulares",
        "criterios_objetivos_para_la_seleccion_candidatos_el_procedimiento": "Los establecidos en el pliego de cl\u00e1usulas administrativas particulares",
        "condiciones_especiales_adjudicacion_contrato": "Las establecidas en el pliego de cl\u00e1usulas administrativas particulares"
    },
    "presentacion_ofertas__fecha_limite_presentacion_ofertas": "10/04/2018 a las 14:00 horas",
    "presentacion_ofertas__notas": [
        "Avda. Manuel Siurot 50 41071 (Sevilla )",
        "Consejeria de Medio Ambiente y Ordenacion del Territorio",
        "Exclusivamente en el Registro General de la Consejeria de Medio Ambiente y Ordenacion de Territorio. Avda. Manuel Siurot, 50. 41071 - Sevilla. De acuerdo con el punto 9.1 del PCAP, cuando las proposiciones se envien por correo, el empresario debera justificar la fecha de imposicion del envio en las Oficinas de Correos y anunciara la remision de su oferta, en el mismo dia, exclusivamente mediante telex, telegrama o fax remitido al registro general num. 955003775"
    ],
    "apertura_ofertas": {
        "lugar": [
            "Consejeria de Medio Ambiente y Ordenacion del Territorio",
            "Avda. Manuel Siurot 50 41071 (Sevilla )",
            "Fecha Apertura del sobre de criterios de adjudicacion que dependen de un juicio de valor : 03/05/2018 a las 13:30 horas",
            "Fecha Apertura del sobre de criterios de adjudicacion evaluables por aplicacion de formulas : 08/05/2018 a las 09:30 horas"
        ],
        "aclaraciones": "La fecha y hora de apertura de ofertas se publicara en el Perfil del Contratante."
    },
    "referencias_diarios_oficiales": [],
    "anuncios_publicados": [
        {
            "numero_expediente": "2017/000248",
            "link": "http://www.juntadeandalucia.es/haciendayadministracionpublica/apl/verifirmapdc/descargaInformeParametros?transaccion=5PpOCsN5hvp%2FYDao5UsdxnlqT3SzUohr&tipoPie=4",
            "descripcion": "08/03/2018 13:26, 2018-0000010002-Convocatoria de licitaci\u00f3n",
            "datetime": "2018-03-08T13:26:00+00:00",
            "anuncio_id": " 2018-0000010002",
            "anuncio_desc": "Convocatoria de licitaci\u00f3n"
        },
        {
            "numero_expediente": "2017/000248",
            "link": "http://www.juntadeandalucia.es/haciendayadministracionpublica/apl/verifirmapdc/descargaInformeParametros?transaccion=KO8O9%2BKV7%2FPKGHIAelrHvM4cenB071d7&tipoPie=4",
            "descripcion": "12/03/2018 10:00, 2018-0000010456-Convocatoria de licitaci\u00f3n (Infor.Adicional)",
            "datetime": "2018-03-12T10:00:00+00:00",
            "anuncio_id": " 2018-0000010456",
            "anuncio_desc": "Convocatoria de licitaci\u00f3n (Infor.Adicional)"
        },
        {
            "numero_expediente": "2017/000248",
            "link": "http://www.juntadeandalucia.es/haciendayadministracionpublica/apl/verifirmapdc/descargaInformeParametros?transaccion=yfO0nzOvinclRjcTUbk7vYJinNB9TyKu&tipoPie=4",
            "descripcion": "04/04/2018 11:40, 2018-0000013175-Convocatoria de licitaci\u00f3n (Infor.Adicional)",
            "datetime": "2018-04-04T11:40:00+00:00",
            "anuncio_id": " 2018-0000013175",
            "anuncio_desc": "Convocatoria de licitaci\u00f3n (Infor.Adicional)"
        },
        {
            "numero_expediente": "2017/000248",
            "link": "http://www.juntadeandalucia.es/haciendayadministracionpublica/apl/verifirmapdc/descargaInformeParametros?transaccion=bYqc8WdH5ao4l4Uvzxch2fI9rwqOEXGf&tipoPie=4",
            "descripcion": "06/04/2018 13:58, 2018-0000013473-Convocatoria de licitaci\u00f3n (Infor.Adicional)",
            "datetime": "2018-04-06T13:58:00+00:00",
            "anuncio_id": " 2018-0000013473",
            "anuncio_desc": "Convocatoria de licitaci\u00f3n (Infor.Adicional)"
        },
        {
            "numero_expediente": "2017/000248",
            "link": "http://www.juntadeandalucia.es/haciendayadministracionpublica/apl/verifirmapdc/descargaInformeParametros?transaccion=5TCF92ZlJa3OGVS0rGMyZfI9rwqOEXGf&tipoPie=4",
            "descripcion": "11/04/2018 12:06, 2018-0000014103-Convocatoria de licitaci\u00f3n (Infor.Adicional)",
            "datetime": "2018-04-11T12:06:00+00:00",
            "anuncio_id": " 2018-0000014103",
            "anuncio_desc": "Convocatoria de licitaci\u00f3n (Infor.Adicional)"
        },
        {
            "numero_expediente": "2017/000248",
            "link": "http://www.juntadeandalucia.es/haciendayadministracionpublica/apl/verifirmapdc/descargaInformeParametros?transaccion=1UOEQ4Cw6mTg8Df6VY%2BlqXlqT3SzUohr&tipoPie=4",
            "descripcion": "24/04/2018 18:09, 2018-0000015338-Convocatoria de licitaci\u00f3n (Infor.Adicional)",
            "datetime": "2018-04-24T18:09:00+00:00",
            "anuncio_id": " 2018-0000015338",
            "anuncio_desc": "Convocatoria de licitaci\u00f3n (Infor.Adicional)"
        },
        {
            "numero_expediente": "2017/000248",
            "link": "http://www.juntadeandalucia.es/haciendayadministracionpublica/apl/verifirmapdc/descargaInformeParametros?transaccion=vQzks%2BLFOvxAA8vfEYdziiJqUCje%2B%2B1i&tipoPie=4",
            "descripcion": "26/04/2018 13:47, 2018-0000015608-Convocatoria de licitaci\u00f3n (Infor.Adicional)",
            "datetime": "2018-04-26T13:47:00+00:00",
            "anuncio_id": " 2018-0000015608",
            "anuncio_desc": "Convocatoria de licitaci\u00f3n (Infor.Adicional)"
        },
        {
            "numero_expediente": "2017/000248",
            "link": "http://www.juntadeandalucia.es/haciendayadministracionpublica/apl/verifirmapdc/descargaInformeParametros?transaccion=NiclC756u3MdATHYc1QtOs4cenB071d7&tipoPie=4",
            "descripcion": "03/05/2018 17:57, 2018-0000016121-Convocatoria de licitaci\u00f3n (Infor.Adicional)",
            "datetime": "2018-05-03T17:57:00+00:00",
            "anuncio_id": " 2018-0000016121",
            "anuncio_desc": "Convocatoria de licitaci\u00f3n (Infor.Adicional)"
        },
        {
            "numero_expediente": "2017/000248",
            "link": "http://www.juntadeandalucia.es/haciendayadministracionpublica/apl/verifirmapdc/descargaInformeParametros?transaccion=3LRUKnrOtZw%2BZngYY3ejFnP4a3pxggof&tipoPie=4",
            "descripcion": "04/05/2018 13:01, 2018-0000016196-Convocatoria de licitaci\u00f3n (Infor.Adicional)",
            "datetime": "2018-05-04T13:01:00+00:00",
            "anuncio_id": " 2018-0000016196",
            "anuncio_desc": "Convocatoria de licitaci\u00f3n (Infor.Adicional)"
        },
        {
            "numero_expediente": "2017/000248",
            "link": "http://www.juntadeandalucia.es/haciendayadministracionpublica/apl/verifirmapdc/descargaInformeParametros?transaccion=MzYGHyn09yvV87%2F%2Bry8eN84cenB071d7&tipoPie=4",
            "descripcion": "08/05/2018 15:48, 2018-0000016473-Convocatoria de licitaci\u00f3n (Infor.Adicional)",
            "datetime": "2018-05-08T15:48:00+00:00",
            "anuncio_id": " 2018-0000016473",
            "anuncio_desc": "Convocatoria de licitaci\u00f3n (Infor.Adicional)"
        },
        {
            "numero_expediente": "2017/000248",
            "link": "http://www.juntadeandalucia.es/haciendayadministracionpublica/apl/verifirmapdc/descargaInformeParametros?transaccion=QfuAabgYLUrHhsQcfVdDY84cenB071d7&tipoPie=4",
            "descripcion": "08/05/2018 16:41, 2018-0000016479-Convocatoria de licitaci\u00f3n (Infor.Adicional)",
            "datetime": "2018-05-08T16:41:00+00:00",
            "anuncio_id": " 2018-0000016479",
            "anuncio_desc": "Convocatoria de licitaci\u00f3n (Infor.Adicional)"
        },
        {
            "numero_expediente": "2017/000248",
            "link": "http://www.juntadeandalucia.es/haciendayadministracionpublica/apl/verifirmapdc/descargaInformeParametros?transaccion=Nn1vbL47QAOdpp9cDELZT4YdAfNuj%2FNj&tipoPie=4",
            "descripcion": "08/06/2018 08:47, 2018-0000019457-Convocatoria de licitaci\u00f3n (Infor.Adicional)",
            "datetime": "2018-06-08T08:47:00+00:00",
            "anuncio_id": " 2018-0000019457",
            "anuncio_desc": "Convocatoria de licitaci\u00f3n (Infor.Adicional)"
        },
        {
            "numero_expediente": "2017/000248",
            "link": "http://www.juntadeandalucia.es/haciendayadministracionpublica/apl/verifirmapdc/descargaInformeParametros?transaccion=fwlqzX8hIULAnFeOqLPFYyJqUCje%2B%2B1i&tipoPie=4",
            "descripcion": "13/06/2018 08:48, 2018-0000019890-Convocatoria de licitaci\u00f3n (Infor.Adicional)",
            "datetime": "2018-06-13T08:48:00+00:00",
            "anuncio_id": " 2018-0000019890",
            "anuncio_desc": "Convocatoria de licitaci\u00f3n (Infor.Adicional)"
        },
        {
            "numero_expediente": "2017/000248",
            "link": "http://www.juntadeandalucia.es/haciendayadministracionpublica/apl/verifirmapdc/descargaInformeParametros?transaccion=9y%2Fxdbf5zTMcSL%2BwsADlGymkfG71%2BFxx&tipoPie=4",
            "descripcion": "13/06/2018 13:51, 2018-0000019981-Convocatoria de licitaci\u00f3n (Infor.Adicional)",
            "datetime": "2018-06-13T13:51:00+00:00",
            "anuncio_id": " 2018-0000019981",
            "anuncio_desc": "Convocatoria de licitaci\u00f3n (Infor.Adicional)"
        },
        {
            "numero_expediente": "2017/000248",
            "link": "http://www.juntadeandalucia.es/haciendayadministracionpublica/apl/verifirmapdc/descargaInformeParametros?transaccion=aTxMofQTAomtD9UzpEaLEYYdAfNuj%2FNj&tipoPie=4",
            "descripcion": "26/06/2018 10:52, 2018-0000021420-Convocatoria de licitaci\u00f3n (Infor.Adicional)",
            "datetime": "2018-06-26T10:52:00+00:00",
            "anuncio_id": " 2018-0000021420",
            "anuncio_desc": "Convocatoria de licitaci\u00f3n (Infor.Adicional)"
        },
        {
            "numero_expediente": "2017/000248",
            "link": "http://www.juntadeandalucia.es/haciendayadministracionpublica/apl/verifirmapdc/descargaInformeParametros?transaccion=PbLwlIFzD5vWbp%2BVNuE3e4YdAfNuj%2FNj&tipoPie=4",
            "descripcion": "12/07/2018 11:41, 2018-0000023793-Adjudicaci\u00f3n",
            "datetime": "2018-07-12T11:41:00+00:00",
            "anuncio_id": " 2018-0000023793",
            "anuncio_desc": "Adjudicaci\u00f3n"
        },
        {
            "numero_expediente": "2017/000248",
            "link": "http://www.juntadeandalucia.es/haciendayadministracionpublica/apl/verifirmapdc/descargaInformeParametros?transaccion=SjCG4S%2B8fqPxKnfc6NdOrCmkfG71%2BFxx&tipoPie=4",
            "descripcion": "24/09/2018 08:49, 2018-0000035726-Formalizaci\u00f3n",
            "datetime": "2018-09-24T08:49:00+00:00",
            "anuncio_id": " 2018-0000035726",
            "anuncio_desc": "Formalizaci\u00f3n"
        }
    ],
    "id": 72017,
    "origen": {
        "url": "http://www.juntadeandalucia.es/temas/contratacion-publica/perfiles-licitaciones/detalle/000000072017.html",
        "terminos_uso": "http://www.juntadeandalucia.es/informacion/legal.html"
    }
}