{
    "secciones": {
        "importes": 0,
        "estado_expediente": 1,
        "informacion_lotes_adjudicados_o_resueltos": 2,
        "documentacion_complementaria": 3,
        "obtencion_documentacion_informacion": 4,
        "requisitos_criterios_condiciones": 5,
        "presentacion_solicitudes": 6,
        "presentacion_ofertas": 7,
        "apertura_ofertas": 8,
        "referencias_diarios_oficiales": 9,
        "anuncios_publicados": 10
    },
    "datosbasicos__numero_expediente": "00008/ISE/2016/CO",
    "datosbasicos__titulo_expediente": "SERVICIO DE TRANSPORTE ESCOLAR EN LOS CENTROS DOCENTES PUBLICOS DE LA PROVINCIA DE CORDOBA DEPENDIENTES DE LA CONSEJERIA DE EDUCACION",
    "datosbasicos__descripcion": "SERVICIO DE TRANSPORTE ESCOLAR EN LOS CENTROS DOCENTES PUBLICOS DE LA PROVINCIA DE CORDOBA DEPENDIENTES DE LA CONSEJERIA DE EDUCACION",
    "datosbasicos__organo_contratacion": "Agencia Publica Andaluza de Educacion",
    "datosbasicos__tipo_contrato": "Servicios",
    "datosbasicos__procedimiento": "Abierto",
    "datosbasicos__tramitacion": "Ordinario",
    "datosbasicos__clasificacion_cpv": "60130000 Servicios especiales de transporte de viajeros por carretera",
    "datosbasicos__division_por_lotes": "Si",
    "datosbasicos__numero_lotes": "51",
    "datosbasicos__lugar_tramitacion": "CORDOBA",
    "datosbasicos__lugar_ejecucion_nuts": "ES613",
    "datosbasicos__lugar_ejecucion": "CORDOBA",
    "importes__importe_licitacion_(sin_iva)": "13.594.458,58EUR",
    "importes__importe_licitacion_(con_iva)": "14.953.904,44EUR",
    "importes__valor_estimado": "27.188.917,16EUR",
    "importes__importes_adjudicacion": "Ver lotes",
    "importes__financiado_por": "FSE (Fondo Social Europeo)",
    "importes__tasa_cofinanciacion": "80,00",
    "importes__regulacion": "Sujeto a regulacion armonizada",
    "informacion_lotes_adjudicados_o_resueltos": [
        {
            "numero_expediente": "00008/ISE/2016/CO",
            "id": "lote_3-5-18-36-50",
            "lote_3-5-18-36-50__nif": "A14020937",
            "lote_3-5-18-36-50__adjudicatario": "AUTOTRANSPORTES SAN SEBASTIAN S.A. ",
            "lote_3-5-18-36-50__importe_adjudicacion_(sin_iva)": "943.500,00EUR",
            "lote_3-5-18-36-50__importe_adjudicacion_(con_iva)": "1.037.850,00EUR"
        },
        {
            "numero_expediente": "00008/ISE/2016/CO",
            "id": "lote_22-24",
            "lote_22-24__nif": "B14015341",
            "lote_22-24__adjudicatario": "RAFAEL RAMIREZ S.L.",
            "lote_22-24__importe_adjudicacion_(sin_iva)": "402.000,00EUR",
            "lote_22-24__importe_adjudicacion_(con_iva)": "442.200,00EUR"
        },
        {
            "numero_expediente": "00008/ISE/2016/CO",
            "id": "lote_49",
            "lote_49__nif": "B14284046",
            "lote_49__adjudicatario": "AUTOCARES MARIN S.L.",
            "lote_49__importe_adjudicacion_(sin_iva)": "144.149,53EUR",
            "lote_49__importe_adjudicacion_(con_iva)": "144.149,53EUR"
        },
        {
            "numero_expediente": "00008/ISE/2016/CO",
            "id": "lote_17-19",
            "lote_17-19__nif": "U56055189",
            "lote_17-19__adjudicatario": "UTE MICROBUSES ALCANTARA SL FRANCISCO BRAVO SA RAFAEL RAMIREZ SL LEY 18/1982",
            "lote_17-19__importe_adjudicacion_(sin_iva)": "540.000,00EUR",
            "lote_17-19__importe_adjudicacion_(con_iva)": "594.000,00EUR"
        },
        {
            "numero_expediente": "00008/ISE/2016/CO",
            "id": "lote_31",
            "lote_31__nif": "U56055288",
            "lote_31__adjudicatario": "UTE AUTOTRANSPORTES SAN SEBASTIAN SA AGUSTIN DURAN PEREZ LEY 18/1982",
            "lote_31__importe_adjudicacion_(sin_iva)": "322.345,00EUR",
            "lote_31__importe_adjudicacion_(con_iva)": "354.579,50EUR"
        },
        {
            "numero_expediente": "00008/ISE/2016/CO",
            "id": "lote_26-30-37",
            "lote_26-30-37__nif": "U56055197",
            "lote_26-30-37__adjudicatario": "UTE VALLE DE LOS PEDROCHES ",
            "lote_26-30-37__importe_adjudicacion_(sin_iva)": "668.600,00EUR",
            "lote_26-30-37__importe_adjudicacion_(con_iva)": "735.460,00EUR"
        },
        {
            "numero_expediente": "00008/ISE/2016/CO",
            "id": "lote_23-44",
            "lote_23-44__nif": "B14304695",
            "lote_23-44__adjudicatario": "ARRIBAS SUR S.L.",
            "lote_23-44__importe_adjudicacion_(sin_iva)": "304.696,00EUR",
            "lote_23-44__importe_adjudicacion_(con_iva)": "335.165,60EUR"
        },
        {
            "numero_expediente": "00008/ISE/2016/CO",
            "id": "lote_43",
            "lote_43__nif": "30466004C",
            "lote_43__adjudicatario": "MANUEL LOPEZ ARAGONES ",
            "lote_43__importe_adjudicacion_(sin_iva)": "54.176,26EUR",
            "lote_43__importe_adjudicacion_(con_iva)": "59.593,89EUR"
        },
        {
            "numero_expediente": "00008/ISE/2016/CO",
            "id": "lote_42",
            "lote_42__nif": "B14442404",
            "lote_42__adjudicatario": "TRANSPORTES TURISAN S.L. ",
            "lote_42__importe_adjudicacion_(sin_iva)": "92.734,44EUR",
            "lote_42__importe_adjudicacion_(con_iva)": "102.007,88EUR"
        },
        {
            "numero_expediente": "00008/ISE/2016/CO",
            "id": "lote_6",
            "lote_6__nif": "B11670379",
            "lote_6__adjudicatario": "AUTOCARES VALENZUELA S.L.",
            "lote_6__importe_adjudicacion_(sin_iva)": "257.245,00EUR",
            "lote_6__importe_adjudicacion_(con_iva)": "282.969,50EUR"
        },
        {
            "numero_expediente": "00008/ISE/2016/CO",
            "id": "lote_27",
            "lote_27__nif": "U56055247",
            "lote_27__adjudicatario": "UTE HERMANOS ALCAIDE PEREZ SL Y VIPBUS SL LEY 18/1982",
            "lote_27__importe_adjudicacion_(sin_iva)": "284.526,90EUR",
            "lote_27__importe_adjudicacion_(con_iva)": "312.979,59EUR"
        },
        {
            "numero_expediente": "00008/ISE/2016/CO",
            "id": "lote_32",
            "lote_32__nif": "U93496164",
            "lote_32__adjudicatario": "UTE ESCOLAR IZNAJAR  ",
            "lote_32__importe_adjudicacion_(sin_iva)": "412.075,00EUR",
            "lote_32__importe_adjudicacion_(con_iva)": "453.282,50EUR"
        },
        {
            "numero_expediente": "00008/ISE/2016/CO",
            "id": "lote_29",
            "lote_29__nif": "U56055346",
            "lote_29__adjudicatario": "UTE FUENTE PALMERA TRANSPORTE ESCOLAR LOTE 29  ",
            "lote_29__importe_adjudicacion_(sin_iva)": "323.730,00EUR",
            "lote_29__importe_adjudicacion_(con_iva)": "356.103,00EUR"
        },
        {
            "numero_expediente": "00008/ISE/2016/CO",
            "id": "lote_13-16-20-45-51",
            "lote_13-16-20-45-51__nif": "U56055494",
            "lote_13-16-20-45-51__adjudicatario": "UTE AUTOTRANSPORTES LOPEZ SLU Y LA SEPULVEDANA SAU ",
            "lote_13-16-20-45-51__importe_adjudicacion_(sin_iva)": "674.728,47EUR",
            "lote_13-16-20-45-51__importe_adjudicacion_(con_iva)": "742.201,32EUR"
        },
        {
            "numero_expediente": "00008/ISE/2016/CO",
            "id": "lote_10-11",
            "lote_10-11__nif": "U56055270",
            "lote_10-11__adjudicatario": "UTE ESCOLAR CABRA PRIEGO",
            "lote_10-11__importe_adjudicacion_(sin_iva)": "349.900,00EUR",
            "lote_10-11__importe_adjudicacion_(con_iva)": "384.890,00EUR"
        },
        {
            "numero_expediente": "00008/ISE/2016/CO",
            "id": "lote_9",
            "lote_9__nif": "U13596598",
            "lote_9__adjudicatario": "UTE CHARTERBUS CORDOBA 2016",
            "lote_9__importe_adjudicacion_(sin_iva)": "246.729,90EUR",
            "lote_9__importe_adjudicacion_(con_iva)": "271.402,89EUR"
        },
        {
            "numero_expediente": "00008/ISE/2016/CO",
            "id": "lote_4-12",
            "lote_4-12__nif": "U56050750",
            "lote_4-12__adjudicatario": "ROSA RIVERA SL SUBBETICA CAR SL UTE 583.287,84",
            "lote_4-12__importe_adjudicacion_(sin_iva)": "583.287,84EUR",
            "lote_4-12__importe_adjudicacion_(con_iva)": "641.616,62EUR"
        },
        {
            "numero_expediente": "00008/ISE/2016/CO",
            "id": "lote_21",
            "lote_21__nif": "U56055304",
            "lote_21__adjudicatario": "UTE AUTOTRANSPORTES SAN SEBASTIAN SA RAFAEL RAMIREZ SL LEY 18/1982",
            "lote_21__importe_adjudicacion_(sin_iva)": "560.857,00EUR",
            "lote_21__importe_adjudicacion_(con_iva)": "616.942,70EUR"
        },
        {
            "numero_expediente": "00008/ISE/2016/CO",
            "id": "lote_25",
            "lote_25__nif": "B85146363",
            "lote_25__adjudicatario": "NEX CONTINENTAL HOLDINGS SLU ",
            "lote_25__importe_adjudicacion_(sin_iva)": "47.464,26EUR",
            "lote_25__importe_adjudicacion_(con_iva)": "52.210,69EUR"
        },
        {
            "numero_expediente": "00008/ISE/2016/CO",
            "id": "lote_2-8-33-47",
            "lote_2-8-33-47__nif": "B14023113",
            "lote_2-8-33-47__adjudicatario": "EMPRESA CARRERA S.L. ",
            "lote_2-8-33-47__importe_adjudicacion_(sin_iva)": "881.748,00EUR",
            "lote_2-8-33-47__importe_adjudicacion_(con_iva)": "969.922,80EUR"
        },
        {
            "numero_expediente": "00008/ISE/2016/CO",
            "id": "lote_39-41",
            "lote_39-41__nif": "U56055411",
            "lote_39-41__adjudicatario": "UTE PEREZ CUBERO SL CORDOBA BUS SL LEY 18/1982",
            "lote_39-41__importe_adjudicacion_(sin_iva)": "299.500,00EUR",
            "lote_39-41__importe_adjudicacion_(con_iva)": "329.450,00EUR"
        },
        {
            "numero_expediente": "00008/ISE/2016/CO",
            "id": "lote_38",
            "lote_38__nif": "U56056294",
            "lote_38__adjudicatario": "AUTOCARES MARIN SL REINA ESPEJO SL Y AUTOCARES VALDES SL UNION TEMPORAL DE EMPRESAS LEY 18/1982 DE 26 DE MAYO",
            "lote_38__importe_adjudicacion_(sin_iva)": "489.230,14EUR",
            "lote_38__importe_adjudicacion_(con_iva)": "538.153,15EUR"
        },
        {
            "numero_expediente": "00008/ISE/2016/CO",
            "id": "lote_40",
            "lote_40__nif": "U56055262",
            "lote_40__adjudicatario": "UTE ESCOLAR RUTE",
            "lote_40__importe_adjudicacion_(sin_iva)": "495.380,00EUR",
            "lote_40__importe_adjudicacion_(con_iva)": "544.918,00EUR"
        },
        {
            "numero_expediente": "00008/ISE/2016/CO",
            "id": "lote_46",
            "lote_46__nif": "B14032346",
            "lote_46__adjudicatario": "HERMANOS MOLINA S.L.",
            "lote_46__importe_adjudicacion_(sin_iva)": "256.754,00EUR",
            "lote_46__importe_adjudicacion_(con_iva)": "256.754,00EUR"
        },
        {
            "numero_expediente": "00008/ISE/2016/CO",
            "id": "lote_35",
            "lote_35__nif": "U56055338",
            "lote_35__adjudicatario": "UTE PALMA DEL RIO TRANSPORTE ESCOLAR LOTE 35 (AUTOTRANSPORTES SAN SEBASTIAN SA AUTOCARES FLORES HERMANOS SL Y EMPRESA MOLINA FERNANDEZ SL LEY 18/1982",
            "lote_35__importe_adjudicacion_(sin_iva)": "486.670,00EUR",
            "lote_35__importe_adjudicacion_(con_iva)": "535.337,00EUR"
        },
        {
            "numero_expediente": "00008/ISE/2016/CO",
            "id": "lote_34",
            "lote_34__nif": "U56055403",
            "lote_34__adjudicatario": "UTE FERNANDEZ VILLATORO-AUTOCARES RASCON-AUTOCARES ARROYO 2000 LEY 18/1982",
            "lote_34__importe_adjudicacion_(sin_iva)": "181.958,72EUR",
            "lote_34__importe_adjudicacion_(con_iva)": "200.154,59EUR"
        },
        {
            "numero_expediente": "00008/ISE/2016/CO",
            "id": "lote_14",
            "lote_14__nif": "U56061641",
            "lote_14__adjudicatario": "UTE ESCOLAR LA CARLOTA (AUTOCARES FLORES HERMANOS SL - AUTOTRANSPORTES EL ARRECIFE SCA - EMPRESA CARRERA S.L.)",
            "lote_14__importe_adjudicacion_(sin_iva)": "754.955,00EUR",
            "lote_14__importe_adjudicacion_(con_iva)": "830.450,50EUR"
        },
        {
            "numero_expediente": "00008/ISE/2016/CO",
            "id": "lote_1",
            "lote_1__nif": "U56061823",
            "lote_1__adjudicatario": "UTE AUTOCARES LUQUE RAIGADA E HIJOS S.L. - LA SEPULVEDANA SAU - MANUEL LOPEZ ARAGONES - RAFAEL RAMIREZ S.L.",
            "lote_1__importe_adjudicacion_(sin_iva)": "532.000,00EUR",
            "lote_1__importe_adjudicacion_(con_iva)": "585.200,00EUR"
        },
        {
            "numero_expediente": "00008/ISE/2016/CO",
            "id": "lote_7-15-28-48",
            "lote_7-15-28-48__nif": "B06010169",
            "lote_7-15-28-48__adjudicatario": "TRANSPORTES AULA S.L. ",
            "lote_7-15-28-48__importe_formalizacion_(sin_iva)": "986.372,81EUR",
            "lote_7-15-28-48__importe_formalizacion_(con_iva)": "1.085.010,09EUR"
        },
        {
            "numero_expediente": "00008/ISE/2016/CO",
            "id": "lote_1-7-14-15-28-48",
            "lote_1-7-14-15-28-48__nif": "B06010169",
            "lote_1-7-14-15-28-48__adjudicatario": "TRANSPORTES AULA S.L. ",
            "lote_1-7-14-15-28-48__importe_adjudicacion_(sin_iva)": "2.168.571,98EUR",
            "lote_1-7-14-15-28-48__importe_adjudicacion_(con_iva)": "2.385.429,18EUR"
        }
    ],
    "documentacion_complementaria": [
        {
            "numero_expediente": "00008/ISE/2016/CO",
            "link": "http://www.juntadeandalucia.es/contratacion/document/download?refCode=2016-0000016943&refDoc=2016-0000016943-0",
            "descripcion": "RESOLUCION DE ADJUDICACION 2 (pdf) (149.25Kb)"
        },
        {
            "numero_expediente": "00008/ISE/2016/CO",
            "link": "http://www.juntadeandalucia.es/contratacion/document/download?refCode=2016-0000016943&refDoc=2016-0000016943-1",
            "descripcion": "RESOLUCION DE ADJUDICACION 1 (pdf) (253.42Kb)"
        },
        {
            "numero_expediente": "00008/ISE/2016/CO",
            "link": "http://www.juntadeandalucia.es/contratacion/document/download?refCode=2016-0000016943&refDoc=2016-0000016943-2",
            "descripcion": "INFORME BAJAS DESPROPORCIONADAS (pdf) (799.56Kb)"
        },
        {
            "numero_expediente": "00008/ISE/2016/CO",
            "link": "http://www.juntadeandalucia.es/contratacion/document/download?refCode=2017-0000005932&refDoc=2017-0000005932-0",
            "descripcion": "Formalizaci\u00f3n del contrato lotes 7-15-28-48 (pdf) (1714.34Kb)"
        },
        {
            "numero_expediente": "00008/ISE/2016/CO",
            "link": "http://www.juntadeandalucia.es/contratacion/document/download?refCode=2016-0000024702&refDoc=2016-0000024702-0",
            "descripcion": "RESOLUCION DE ADJUDICACION (pdf) (162.01Kb)"
        },
        {
            "numero_expediente": "00008/ISE/2016/CO",
            "link": "http://www.juntadeandalucia.es/contratacion/document/download?refCode=2016-0000012831&refDoc=2016-0000012831-7",
            "descripcion": "PLIEGO DE CL\u00c1USULAS ADMINISTRATIVAS PARTICULARES (pdf) (2249.68Kb)"
        },
        {
            "numero_expediente": "00008/ISE/2016/CO",
            "link": "http://www.juntadeandalucia.es/contratacion/document/download?refCode=2016-0000012831&refDoc=2016-0000012831-8",
            "descripcion": "PLIEGO DE PRESCRIPCIONES T\u00c9CNICAS (pdf) (291.86Kb)"
        },
        {
            "numero_expediente": "00008/ISE/2016/CO",
            "link": "http://www.juntadeandalucia.es/contratacion/document/download?refCode=2016-0000012831&refDoc=2016-0000012831-9",
            "descripcion": "RESOLUCI\u00d3N NOMBRAMIENTO MESA DE CONTRATACI\u00d3N (pdf) (87.08Kb)"
        },
        {
            "numero_expediente": "00008/ISE/2016/CO",
            "link": "http://www.juntadeandalucia.es/contratacion/document/download?refCode=2016-0000012831&refDoc=2016-0000012831-10",
            "descripcion": "INFORMACI\u00d3N LICITADORES (pdf) (152.52Kb)"
        },
        {
            "numero_expediente": "00008/ISE/2016/CO",
            "link": "http://www.juntadeandalucia.es/contratacion/document/download?refCode=2016-0000012831&refDoc=2016-0000012831-11",
            "descripcion": "FICHERO DEUC (xml) (107.78Kb)"
        },
        {
            "numero_expediente": "00008/ISE/2016/CO",
            "link": "http://www.juntadeandalucia.es/contratacion/document/download?refCode=2016-0000012831&refDoc=2016-0000012831-12",
            "descripcion": "INFORMACI\u00d3N SOBRE DEUC (pdf) (8473.96Kb)"
        },
        {
            "numero_expediente": "00008/ISE/2016/CO",
            "link": "http://www.juntadeandalucia.es/contratacion/document/download?refCode=2018-0000033273&refDoc=2018-0000033273-1",
            "descripcion": "LEVANTAMIENTO SUSPENSI\u00d3N LOTES (pdf) (216.02Kb)"
        },
        {
            "numero_expediente": "00008/ISE/2016/CO",
            "link": "http://www.juntadeandalucia.es/contratacion/document/download?refCode=2016-0000016943&refDoc=2016-0000016943-3",
            "descripcion": "RESOLUCI\u00d3N DE AMPLIACI\u00d3N DE PLAZO (pdf) (251.68Kb)"
        },
        {
            "numero_expediente": "00008/ISE/2016/CO",
            "link": "http://www.juntadeandalucia.es/contratacion/document/download?refCode=2016-0000012831&refDoc=2016-0000012831-13",
            "descripcion": "RESULTADO DE LA MESA 1 : CALIFICACI\u00d3N DE LA DOCUMENTACI\u00d3N ADMINISTRATIVA (pdf) (138.63Kb)"
        },
        {
            "numero_expediente": "00008/ISE/2016/CO",
            "link": "http://www.juntadeandalucia.es/contratacion/document/download?refCode=2016-0000012831&refDoc=2016-0000012831-14",
            "descripcion": "ACTA TABLON 2. SUBSANACIONES. (pdf) (22.58Kb)"
        },
        {
            "numero_expediente": "00008/ISE/2016/CO",
            "link": "http://www.juntadeandalucia.es/contratacion/document/download?refCode=2016-0000012831&refDoc=2016-0000012831-15",
            "descripcion": "RESULTADO DE LA APERTURA DE OFERTAS (pdf) (203.92Kb)"
        },
        {
            "numero_expediente": "00008/ISE/2016/CO",
            "link": "http://www.juntadeandalucia.es/contratacion/document/download?refCode=2018-0000033273&refDoc=2018-0000033273-2",
            "descripcion": "Documento de cesi\u00f3n de contrato Lotes 13-16-20-45-51 (pdf) (615.25Kb)"
        },
        {
            "numero_expediente": "00008/ISE/2016/CO",
            "link": "http://www.juntadeandalucia.es/contratacion/document/download?refCode=2018-0000033273&refDoc=2018-0000033273-3",
            "descripcion": "Documento cesi\u00f3n de contrato LOTES 39-41 (pdf) (494.19Kb)"
        },
        {
            "numero_expediente": "00008/ISE/2016/CO",
            "link": "http://www.juntadeandalucia.es/contratacion/document/download?refCode=2017-0000005932&refDoc=2017-0000005932-1",
            "descripcion": "ADENDA CONTRATO CESI\u00d3N LOTE 6 (pdf) (444.88Kb)"
        },
        {
            "numero_expediente": "00008/ISE/2016/CO",
            "link": "http://www.juntadeandalucia.es/contratacion/document/download?refCode=2016-0000012831&refDoc=2016-0000012831-4",
            "descripcion": "RESOLUCI\u00d3N DE SUSPENSI\u00d3N POR RECTIFICACI\u00d3N PLIEGOS (pdf) (93.19Kb)"
        },
        {
            "numero_expediente": "00008/ISE/2016/CO",
            "link": "http://www.juntadeandalucia.es/contratacion/document/download?refCode=2016-0000012831&refDoc=2016-0000012831-5",
            "descripcion": "RESOLUCI\u00d3N APROBACI\u00d3N PCAP TRANSPORTE (pdf) (105.28Kb)"
        },
        {
            "numero_expediente": "00008/ISE/2016/CO",
            "link": "http://www.juntadeandalucia.es/contratacion/document/download?refCode=2016-0000012831&refDoc=2016-0000012831-6",
            "descripcion": "RESOLUCI\u00d3N APROBACI\u00d3N EXPEDIENTE TTE 8-16 (PDF) (161.68Kb)"
        }
    ],
    "obtencion_documentacion_informacion": {
        "fecha_limite_obtencion": "27/06/2016 a las 14:00 horas",
        "lugar": [
            "GERENCIA PROVINCIAL DE CORDOBA DE LA AGENCIA PUBLICA ANDALUZA DE EDUCACION",
            "Calle Historiador Diaz del Moral 1-1a 14008 (Cordoba )"
        ],
        "puntos_contacto": [
            "Gerente Provincial de Cordoba",
            "957355202",
            "957355212",
            "cordoba.agenciaedu@juntadeandalucia.es",
            "http://www.agenciaandaluzaeducacion.es"
        ],
        "aclaraciones": "En cumplimiento de la Directiva 2014/23/UE, se adjunta fichero DEUC, y documento de informacion referente al DEUC. Las empresas participantes en la licitacion a traves del siguiente enlace (https://ec.europa.eu/growth/tools-databases/espd) importaran dicho fichero y cumplimentaran los datos necesarios, lo descargaran, lo imprimiran y presentaran firmado el DEUC con los demas documentos de la licitacion en el sobre numero 1."
    },
    "requisitos_criterios_condiciones": {
        "requisitos_minimos_contratista": "Los establecidos en el pliego de cl\u00e1usulas administrativas particulares",
        "criterios_adjudicacion": "Los establecidos en el pliego de cl\u00e1usulas administrativas particulares",
        "criterios_objetivos_para_la_seleccion_candidatos_el_procedimiento": "Los establecidos en el pliego de cl\u00e1usulas administrativas particulares",
        "condiciones_especiales_adjudicacion_contrato": "Las establecidas en el pliego de cl\u00e1usulas administrativas particulares"
    },
    "presentacion_ofertas__fecha_limite_presentacion_ofertas": "27/06/2016 a las 23:55 horas",
    "presentacion_ofertas__notas": [
        "Calle Historiador Diaz del Moral 1-1a 14008 (Cordoba )",
        "GERENCIA PROVINCIAL DE CORDOBA DE LA AGENCIA PUBLICA ANDALUZA DE EDUCACION",
        "Horario Registro de entrada: ver pagina web wwww.agenciaandaluzaeducacion.es. La presentacion de ofertas podra realizarse en el resto de registros de la Agencia Publica Andaluza de Educacion. La presentacion a traves del servicio de Correos exigira el anuncio de la remision de su oferta al organo de contratacion, en el mismo dia, mediante telex, fax, telegrama o correo electronico a la direccion indicada en el punto 1."
    ],
    "apertura_ofertas": {
        "lugar": [
            "GERENCIA PROVINCIAL DE CORDOBA DE LA AGENCIA PUBLICA ANDALUZA DE EDUCACION",
            "Calle Historiador Diaz del Moral 1-1a 14008 (Cordoba )",
            "Fecha Apertura del sobre de criterios de adjudicacion evaluables por aplicacion de formulas : 11/07/2016 a las 17:00 horas"
        ],
        "aclaraciones": "No procede senalar fecha de apertura del sobre de criterios de adjudicacion que dependen de un juicio de valor al no venir establecida su existencia en el PCAP. La fecha del acto publico del sobre de criterios de adjudicacion evaluables por aplicacion de formulas sera anunciada en el tablon de anuncios de la Gerencia Provincial de Cordoba, en el perfil del contratante, asi como en la pagina web de la Agencia con una antelacion minima de 48 horas."
    },
    "referencias_diarios_oficiales": [
        {
            "numero_expediente": "00008/ISE/2016/CO",
            "link": "http:/ted.europa.eu/",
            "descripcion": "DOUE n\u00ba S-97 del a\u00f1o 2016, p\u00e1gina . ( Env\u00edo: 16/05/2016, Publicaci\u00f3n: 21/05/2016 ) Referencia 2016/S 097-173421"
        },
        {
            "numero_expediente": "00008/ISE/2016/CO",
            "link": "https://www.boe.es/diario_boe/",
            "descripcion": "BOE n\u00ba 91 del a\u00f1o 2016, p\u00e1gina 18222 Referencia 14599"
        },
        {
            "numero_expediente": "00008/ISE/2016/CO",
            "link": "http:/ted.europa.eu/",
            "descripcion": "DOUE n\u00ba S75 del a\u00f1o 2016, p\u00e1gina . ( Env\u00edo: 12/04/2016, Publicaci\u00f3n: 16/04/2016 ) Referencia 131694-2016"
        }
    ],
    "anuncios_publicados": [
        {
            "numero_expediente": "00008/ISE/2016/CO",
            "link": "http://www.juntadeandalucia.es/haciendayadministracionpublica/apl/verifirmapdc/descargaInformeParametros?transaccion=kPZ%2F80DQ9hgkVly%2F60YgQaVT2q%2Bc%2Fsfz&tipoPie=4",
            "descripcion": "18/04/2016 08:26, 2016-0000006804-Convocatoria de licitaci\u00f3n",
            "datetime": "2016-04-18T08:26:00+00:00",
            "anuncio_id": " 2016-0000006804",
            "anuncio_desc": "Convocatoria de licitaci\u00f3n"
        },
        {
            "numero_expediente": "00008/ISE/2016/CO",
            "link": "http://www.juntadeandalucia.es/haciendayadministracionpublica/apl/verifirmapdc/descargaInformeParametros?transaccion=6dF0CIlqx7d%2BcKWix5mMAfI9rwqOEXGf&tipoPie=4",
            "descripcion": "11/05/2016 12:18, 2016-0000008358-Convocatoria de licitaci\u00f3n (Suspendido)",
            "datetime": "2016-05-11T12:18:00+00:00",
            "anuncio_id": " 2016-0000008358",
            "anuncio_desc": "Convocatoria de licitaci\u00f3n (Suspendido)"
        },
        {
            "numero_expediente": "00008/ISE/2016/CO",
            "link": "http://www.juntadeandalucia.es/haciendayadministracionpublica/apl/verifirmapdc/descargaInformeParametros?transaccion=IL1LAHxYPQlhnVyl3cQ3uSJqUCje%2B%2B1i&tipoPie=4",
            "descripcion": "23/05/2016 10:10, 2016-0000009194-Convocatoria de licitaci\u00f3n (Levantamiento)",
            "datetime": "2016-05-23T10:10:00+00:00",
            "anuncio_id": " 2016-0000009194",
            "anuncio_desc": "Convocatoria de licitaci\u00f3n (Levantamiento)"
        },
        {
            "numero_expediente": "00008/ISE/2016/CO",
            "link": "http://www.juntadeandalucia.es/haciendayadministracionpublica/apl/verifirmapdc/descargaInformeParametros?transaccion=yIHRHIII%2F6dM%2FhjjNNihH6vJYER37PP1&tipoPie=4",
            "descripcion": "23/05/2016 11:54, 2016-0000009208-Convocatoria de licitaci\u00f3n (Correci\u00f3n)",
            "datetime": "2016-05-23T11:54:00+00:00",
            "anuncio_id": " 2016-0000009208",
            "anuncio_desc": "Convocatoria de licitaci\u00f3n (Correci\u00f3n)"
        },
        {
            "numero_expediente": "00008/ISE/2016/CO",
            "link": "http://www.juntadeandalucia.es/haciendayadministracionpublica/apl/verifirmapdc/descargaInformeParametros?transaccion=3zgwoMf8oYwJQFQYl6oS7yJqUCje%2B%2B1i&tipoPie=4",
            "descripcion": "04/07/2016 14:12, 2016-0000012249-Convocatoria de licitaci\u00f3n (Infor.Adicional)",
            "datetime": "2016-07-04T14:12:00+00:00",
            "anuncio_id": " 2016-0000012249",
            "anuncio_desc": "Convocatoria de licitaci\u00f3n (Infor.Adicional)"
        },
        {
            "numero_expediente": "00008/ISE/2016/CO",
            "link": "http://www.juntadeandalucia.es/haciendayadministracionpublica/apl/verifirmapdc/descargaInformeParametros?transaccion=DclSIF7PmeXatZZtQnwGQHP4a3pxggof&tipoPie=4",
            "descripcion": "08/07/2016 11:21, 2016-0000012610-Convocatoria de licitaci\u00f3n (Infor.Adicional)",
            "datetime": "2016-07-08T11:21:00+00:00",
            "anuncio_id": " 2016-0000012610",
            "anuncio_desc": "Convocatoria de licitaci\u00f3n (Infor.Adicional)"
        },
        {
            "numero_expediente": "00008/ISE/2016/CO",
            "link": "http://www.juntadeandalucia.es/haciendayadministracionpublica/apl/verifirmapdc/descargaInformeParametros?transaccion=qZ9PG0ivsEAHWOl%2F%2B9IoaIJinNB9TyKu&tipoPie=4",
            "descripcion": "12/07/2016 15:07, 2016-0000012831-Convocatoria de licitaci\u00f3n (Infor.Adicional)",
            "datetime": "2016-07-12T15:07:00+00:00",
            "anuncio_id": " 2016-0000012831",
            "anuncio_desc": "Convocatoria de licitaci\u00f3n (Infor.Adicional)"
        },
        {
            "numero_expediente": "00008/ISE/2016/CO",
            "link": "http://www.juntadeandalucia.es/haciendayadministracionpublica/apl/verifirmapdc/descargaInformeParametros?transaccion=rmNJXXIOgVZwKZrhcep6PSJqUCje%2B%2B1i&tipoPie=4",
            "descripcion": "19/08/2016 14:57, 2016-0000015183-Adjudicaci\u00f3n",
            "datetime": "2016-08-19T14:57:00+00:00",
            "anuncio_id": " 2016-0000015183",
            "anuncio_desc": "Adjudicaci\u00f3n"
        },
        {
            "numero_expediente": "00008/ISE/2016/CO",
            "link": "http://www.juntadeandalucia.es/haciendayadministracionpublica/apl/verifirmapdc/descargaInformeParametros?transaccion=a33KwVtewKhxFPpMPvzzd6vJYER37PP1&tipoPie=4",
            "descripcion": "06/09/2016 16:49, 2016-0000016108-Adjudicaci\u00f3n (Infor.Adicional)",
            "datetime": "2016-09-06T16:49:00+00:00",
            "anuncio_id": " 2016-0000016108",
            "anuncio_desc": "Adjudicaci\u00f3n (Infor.Adicional)"
        },
        {
            "numero_expediente": "00008/ISE/2016/CO",
            "link": "http://www.juntadeandalucia.es/haciendayadministracionpublica/apl/verifirmapdc/descargaInformeParametros?transaccion=mnWW078shxF6O8f34y0Lx6vJYER37PP1&tipoPie=4",
            "descripcion": "19/09/2016 13:26, 2016-0000016940-Adjudicaci\u00f3n",
            "datetime": "2016-09-19T13:26:00+00:00",
            "anuncio_id": " 2016-0000016940",
            "anuncio_desc": "Adjudicaci\u00f3n"
        },
        {
            "numero_expediente": "00008/ISE/2016/CO",
            "link": "http://www.juntadeandalucia.es/haciendayadministracionpublica/apl/verifirmapdc/descargaInformeParametros?transaccion=FNZqA54lWGPNrEBBHFVtafI9rwqOEXGf&tipoPie=4",
            "descripcion": "19/09/2016 13:44, 2016-0000016943-Adjudicaci\u00f3n (Infor.Adicional)",
            "datetime": "2016-09-19T13:44:00+00:00",
            "anuncio_id": " 2016-0000016943",
            "anuncio_desc": "Adjudicaci\u00f3n (Infor.Adicional)"
        },
        {
            "numero_expediente": "00008/ISE/2016/CO",
            "link": "http://www.juntadeandalucia.es/haciendayadministracionpublica/apl/verifirmapdc/descargaInformeParametros?transaccion=vb9CvlacYxaMcHicoacZMKvJYER37PP1&tipoPie=4",
            "descripcion": "22/09/2016 12:46, 2016-0000017193-Formalizaci\u00f3n",
            "datetime": "2016-09-22T12:46:00+00:00",
            "anuncio_id": " 2016-0000017193",
            "anuncio_desc": "Formalizaci\u00f3n"
        },
        {
            "numero_expediente": "00008/ISE/2016/CO",
            "link": "http://www.juntadeandalucia.es/haciendayadministracionpublica/apl/verifirmapdc/descargaInformeParametros?transaccion=Obs7fk%2Bbw2ADeV4Nnig35imkfG71%2BFxx&tipoPie=4",
            "descripcion": "07/10/2016 13:50, 2016-0000018298-Formalizaci\u00f3n (Infor.Adicional)",
            "datetime": "2016-10-07T13:50:00+00:00",
            "anuncio_id": " 2016-0000018298",
            "anuncio_desc": "Formalizaci\u00f3n (Infor.Adicional)"
        },
        {
            "numero_expediente": "00008/ISE/2016/CO",
            "link": "http://www.juntadeandalucia.es/haciendayadministracionpublica/apl/verifirmapdc/descargaInformeParametros?transaccion=%2B%2FQMNfe14nJlvG25j4m0OHlqT3SzUohr&tipoPie=4",
            "descripcion": "14/11/2016 10:49, 2016-0000021105-Formalizaci\u00f3n (Infor.Adicional)",
            "datetime": "2016-11-14T10:49:00+00:00",
            "anuncio_id": " 2016-0000021105",
            "anuncio_desc": "Formalizaci\u00f3n (Infor.Adicional)"
        },
        {
            "numero_expediente": "00008/ISE/2016/CO",
            "link": "http://www.juntadeandalucia.es/haciendayadministracionpublica/apl/verifirmapdc/descargaInformeParametros?transaccion=3KxEiKSk%2BZMoM7y0u4Cf34YdAfNuj%2FNj&tipoPie=4",
            "descripcion": "14/12/2016 14:13, 2016-0000024702-Adjudicaci\u00f3n",
            "datetime": "2016-12-14T14:13:00+00:00",
            "anuncio_id": " 2016-0000024702",
            "anuncio_desc": "Adjudicaci\u00f3n"
        },
        {
            "numero_expediente": "00008/ISE/2016/CO",
            "link": "http://www.juntadeandalucia.es/haciendayadministracionpublica/apl/verifirmapdc/descargaInformeParametros?transaccion=YHYh7YUJ5RtYF12GmWm2xKVT2q%2Bc%2Fsfz&tipoPie=4",
            "descripcion": "13/01/2017 11:48, 2017-0000000965-Formalizaci\u00f3n",
            "datetime": "2017-01-13T11:48:00+00:00",
            "anuncio_id": " 2017-0000000965",
            "anuncio_desc": "Formalizaci\u00f3n"
        },
        {
            "numero_expediente": "00008/ISE/2016/CO",
            "link": "http://www.juntadeandalucia.es/haciendayadministracionpublica/apl/verifirmapdc/descargaInformeParametros?transaccion=lJl9htFjM16KwkayYCdu%2B3lqT3SzUohr&tipoPie=4",
            "descripcion": "17/01/2017 08:00, 2017-0000001109-Formalizaci\u00f3n (Correci\u00f3n)",
            "datetime": "2017-01-17T08:00:00+00:00",
            "anuncio_id": " 2017-0000001109",
            "anuncio_desc": "Formalizaci\u00f3n (Correci\u00f3n)"
        },
        {
            "numero_expediente": "00008/ISE/2016/CO",
            "link": "http://www.juntadeandalucia.es/haciendayadministracionpublica/apl/verifirmapdc/descargaInformeParametros?transaccion=MsZw7fzj3%2FLjkoVeoMWXrKVT2q%2Bc%2Fsfz&tipoPie=4",
            "descripcion": "03/03/2017 11:22, 2017-0000005932-Formalizaci\u00f3n (Infor.Adicional)",
            "datetime": "2017-03-03T11:22:00+00:00",
            "anuncio_id": " 2017-0000005932",
            "anuncio_desc": "Formalizaci\u00f3n (Infor.Adicional)"
        },
        {
            "numero_expediente": "00008/ISE/2016/CO",
            "link": "http://www.juntadeandalucia.es/haciendayadministracionpublica/apl/verifirmapdc/descargaInformeParametros?transaccion=1Dy3WddLSlqt4RbrOqMPKvI9rwqOEXGf&tipoPie=4",
            "descripcion": "18/09/2017 10:21, 2017-0000020769-Formalizaci\u00f3n (Infor.Adicional)",
            "datetime": "2017-09-18T10:21:00+00:00",
            "anuncio_id": " 2017-0000020769",
            "anuncio_desc": "Formalizaci\u00f3n (Infor.Adicional)"
        },
        {
            "numero_expediente": "00008/ISE/2016/CO",
            "link": "http://www.juntadeandalucia.es/haciendayadministracionpublica/apl/verifirmapdc/descargaInformeParametros?transaccion=ZubVtbcDzaQNd9v0HUraznP4a3pxggof&tipoPie=4",
            "descripcion": "10/09/2018 10:36, 2018-0000033273-Formalizaci\u00f3n (Infor.Adicional)",
            "datetime": "2018-09-10T10:36:00+00:00",
            "anuncio_id": " 2018-0000033273",
            "anuncio_desc": "Formalizaci\u00f3n (Infor.Adicional)"
        }
    ],
    "id": 57738,
    "origen": {
        "url": "http://www.juntadeandalucia.es/temas/contratacion-publica/perfiles-licitaciones/detalle/000000057738.html",
        "terminos_uso": "http://www.juntadeandalucia.es/informacion/legal.html"
    }
}