{
    "datosbasicos__lugar_tramitacion": "JAEN",
    "datosbasicos__division_por_lotes": "No",
    "estado_expediente__notas": [
        "31/05/2019 09:11 - Formalizacion",
        "Actualizado: Formalizacion"
    ],
    "datosbasicos__tipo_contrato": "Servicios",
    "referencias_diarios_oficiales": [],
    "datosbasicos__descripcion": "REDACCION DE PROYECTO Y DE ESTUDIO BASICO DE SEGURIDAD Y SALUD, DIRECCION DE OBRA, DIRECCION DE EJECUCION Y COORDINACION DE SEGURIDAD Y SALUD DE LA OBRA SUSTITUCION DE LUCERNARIO DE POLICARBONATO EN LA EI EL VALLE DE JAEN",
    "datosbasicos__lugar_ejecucion_nuts": "ES616",
    "datosbasicos__lugar_ejecucion": "JAEN",
    "datosbasicos__organo_contratacion": "Agencia Publica Andaluza de Educacion",
    "estado_expediente__fecha_adjudicacion": "06/05/2019",
    "obtencion_documentacion_informacion": {
        "lugar": [
            "Agencia Publica Andaluza de Educacion",
            "C/ Castilla no 4 Bajo 23071 (JAEN )"
        ],
        "fecha_limite_obtencion": "11/12/2018 a las 14:00 horas"
    },
    "datosbasicos__titulo_expediente": "REDACCION DE PROYECTO Y DE ESTUDIO BASICO DE SEGURIDAD Y SALUD, DIRECCION DE OBRA, DIRECCION DE EJECUCION Y COORDINACION DE SEGURIDAD Y SALUD DE LA OBRA SUSTITUCION DE LUCERNARIO DE POLICARBONATO EN LA EI EL VALLE DE JAEN",
    "secciones": {
        "obtencion_documentacion_informacion": 3,
        "requisitos_criterios_condiciones": 4,
        "apertura_ofertas": 7,
        "presentacion_solicitudes": 5,
        "referencias_diarios_oficiales": 8,
        "importes": 0,
        "documentacion_complementaria": 2,
        "anuncios_publicados": 9,
        "presentacion_ofertas": 6,
        "estado_expediente": 1
    },
    "apertura_ofertas": {
        "lugar": [
            "Agencia Publica Andaluza de Educacion",
            "C/ Castilla no 4 Bajo 23071 (JAEN )",
            "Fecha Apertura del sobre de criterios de adjudicacion que dependen de un juicio de valor : 17/12/2018 a las 12:00 horas",
            "Fecha Apertura del sobre de criterios de adjudicacion evaluables por aplicacion de formulas : 17/12/2018 a las 12:00 horas"
        ]
    },
    "datosbasicos__procedimiento": "Abierto Simplificado",
    "id": 94977,
    "importes__importe_licitacion_(sin_iva)": "2.562,64EUR",
    "anuncios_publicados": [
        {
            "numero_expediente": "00101/ISE/2018/JA",
            "link": "http://www.juntadeandalucia.es/haciendayadministracionpublica/apl/verifirmapdc/descargaInformeParametros?transaccion=AGh%2FXqjicVbhxVnnku7usIYdAfNuj%2FNj&tipoPie=4",
            "anuncio_id": " 2018-0000050674",
            "anuncio_desc": "Convocatoria de licitaci\u00f3n",
            "descripcion": "27/11/2018 11:54, 2018-0000050674-Convocatoria de licitaci\u00f3n",
            "datetime": "2018-11-27T11:54:00+00:00"
        },
        {
            "numero_expediente": "00101/ISE/2018/JA",
            "link": "http://www.juntadeandalucia.es/haciendayadministracionpublica/apl/verifirmapdc/descargaInformeParametros?transaccion=tjFBc87hdoWaP6Ys9Y8oEymkfG71%2BFxx&tipoPie=4",
            "anuncio_id": " 2019-0000004518",
            "anuncio_desc": "Convocatoria de licitaci\u00f3n (Infor.Adicional)",
            "descripcion": "21/01/2019 10:17, 2019-0000004518-Convocatoria de licitaci\u00f3n (Infor.Adicional)",
            "datetime": "2019-01-21T10:17:00+00:00"
        },
        {
            "numero_expediente": "00101/ISE/2018/JA",
            "link": "http://www.juntadeandalucia.es/haciendayadministracionpublica/apl/verifirmapdc/descargaInformeParametros?transaccion=ho2Xc4RyGgIRrWT3%2FAuLq3lqT3SzUohr&tipoPie=4",
            "anuncio_id": " 2019-0000012126",
            "anuncio_desc": "Convocatoria de licitaci\u00f3n (Infor.Adicional)",
            "descripcion": "11/02/2019 13:58, 2019-0000012126-Convocatoria de licitaci\u00f3n (Infor.Adicional)",
            "datetime": "2019-02-11T13:58:00+00:00"
        },
        {
            "numero_expediente": "00101/ISE/2018/JA",
            "link": "http://www.juntadeandalucia.es/haciendayadministracionpublica/apl/verifirmapdc/descargaInformeParametros?transaccion=dQkdTrBnJqAQ6u3V92SaknlqT3SzUohr&tipoPie=4",
            "anuncio_id": " 2019-0000012457",
            "anuncio_desc": "Convocatoria de licitaci\u00f3n (Infor.Adicional)",
            "descripcion": "12/02/2019 08:52, 2019-0000012457-Convocatoria de licitaci\u00f3n (Infor.Adicional)",
            "datetime": "2019-02-12T08:52:00+00:00"
        },
        {
            "numero_expediente": "00101/ISE/2018/JA",
            "link": "http://www.juntadeandalucia.es/haciendayadministracionpublica/apl/verifirmapdc/descargaInformeParametros?transaccion=qFuZflNXNZO%2FoCywEC89fnlqT3SzUohr&tipoPie=4",
            "anuncio_id": " 2019-0000024178",
            "anuncio_desc": "Convocatoria de licitaci\u00f3n (Infor.Adicional)",
            "descripcion": "06/03/2019 12:40, 2019-0000024178-Convocatoria de licitaci\u00f3n (Infor.Adicional)",
            "datetime": "2019-03-06T12:40:00+00:00"
        },
        {
            "numero_expediente": "00101/ISE/2018/JA",
            "link": "http://www.juntadeandalucia.es/haciendayadministracionpublica/apl/verifirmapdc/descargaInformeParametros?transaccion=jpCfJwBV3d1AoleRibcwJnP4a3pxggof&tipoPie=4",
            "anuncio_id": " 2019-0000026848",
            "anuncio_desc": "Convocatoria de licitaci\u00f3n (Infor.Adicional)",
            "descripcion": "20/03/2019 12:26, 2019-0000026848-Convocatoria de licitaci\u00f3n (Infor.Adicional)",
            "datetime": "2019-03-20T12:26:00+00:00"
        },
        {
            "numero_expediente": "00101/ISE/2018/JA",
            "link": "http://www.juntadeandalucia.es/haciendayadministracionpublica/apl/verifirmapdc/descargaInformeParametros?transaccion=daQR8taCvTIOC%2Fkox61XQXP4a3pxggof&tipoPie=4",
            "anuncio_id": " 2019-0000029267",
            "anuncio_desc": "Convocatoria de licitaci\u00f3n (Infor.Adicional)",
            "descripcion": "03/04/2019 10:02, 2019-0000029267-Convocatoria de licitaci\u00f3n (Infor.Adicional)",
            "datetime": "2019-04-03T10:02:00+00:00"
        },
        {
            "numero_expediente": "00101/ISE/2018/JA",
            "link": "http://www.juntadeandalucia.es/haciendayadministracionpublica/apl/verifirmapdc/descargaInformeParametros?transaccion=UOwVQ%2ByprulYlZZaJz7QnSJqUCje%2B%2B1i&tipoPie=4",
            "anuncio_id": " 2019-0000029820",
            "anuncio_desc": "Convocatoria de licitaci\u00f3n (Infor.Adicional)",
            "descripcion": "05/04/2019 10:47, 2019-0000029820-Convocatoria de licitaci\u00f3n (Infor.Adicional)",
            "datetime": "2019-04-05T10:47:00+00:00"
        },
        {
            "numero_expediente": "00101/ISE/2018/JA",
            "link": "http://www.juntadeandalucia.es/haciendayadministracionpublica/apl/verifirmapdc/descargaInformeParametros?transaccion=z45OJayaTGQG8t3mm5z%2B1IYdAfNuj%2FNj&tipoPie=4",
            "anuncio_id": " 2019-0000035136",
            "anuncio_desc": "Adjudicaci\u00f3n",
            "descripcion": "07/05/2019 08:55, 2019-0000035136-Adjudicaci\u00f3n",
            "datetime": "2019-05-07T08:55:00+00:00"
        },
        {
            "numero_expediente": "00101/ISE/2018/JA",
            "link": "http://www.juntadeandalucia.es/haciendayadministracionpublica/apl/verifirmapdc/descargaInformeParametros?transaccion=b4XAGnaiwRk%2FWcJaTp6daoYdAfNuj%2FNj&tipoPie=4",
            "anuncio_id": " 2019-0000046476",
            "anuncio_desc": "Formalizaci\u00f3n",
            "descripcion": "31/05/2019 09:11, 2019-0000046476-Formalizaci\u00f3n",
            "datetime": "2019-05-31T09:11:00+00:00"
        }
    ],
    "importes__importe_adjudicacion_(sin_iva)": "1.970,00EUR",
    "requisitos_criterios_condiciones": {
        "condiciones_especiales_adjudicacion_contrato": "Los establecidos en el pliego de cl\u00e1usulas administrativas particulares",
        "criterios_adjudicacion": "Los establecidos en el pliego de cl\u00e1usulas administrativas particulares",
        "criterios_objetivos_para_la_seleccion_candidatos_el_procedimiento": "Los establecidos en el pliego de cl\u00e1usulas administrativas particulares",
        "requisitos_minimos_contratista": "Los establecidos en el pliego de cl\u00e1usulas administrativas particulares"
    },
    "presentacion_ofertas__fecha_limite_presentacion_ofertas": "12/12/2018 a las 14:00 horas",
    "datosbasicos__departamento_que_contrata": "Este expediente pertenecio a AGENCIA PUBLICA ANDALUZA DE EDUCACION",
    "datosbasicos__clasificacion_cpv": "71000000 Servicios de arquitectura, construccion, ingenieria e inspeccion",
    "estado_expediente__adjudicatario": "JOSE RAMON TEBA COLMENERO",
    "datosbasicos__tramitacion": "Ordinario",
    "estado_expediente__estado": "Resuelta (Formalizado)",
    "datosbasicos__numero_expediente": "00101/ISE/2018/JA",
    "presentacion_ofertas__notas": [
        "Agencia Publica Andaluza de Educacion",
        "C/ Castilla no 4 Bajo 23071 (JAEN )"
    ],
    "estado_expediente__nif": "25980147Z",
    "importes__valor_estimado": "2.562,64EUR",
    "estado_expediente__no_licitadores": "8",
    "origen": {
        "url": "http://www.juntadeandalucia.es/temas/contratacion-publica/perfiles-licitaciones/detalle/000000094977.html",
        "terminos_uso": "http://www.juntadeandalucia.es/informacion/legal.html"
    },
    "documentacion_complementaria": [
        {
            "numero_expediente": "00101/ISE/2018/JA",
            "link": "http://www.juntadeandalucia.es/contratacion/document/download?refCode=2019-0000035136&refDoc=2019-0000035136-0",
            "descripcion": "RESOLUCI\u00d3N ADJUDICACI\u00d3N_586726 (pdf) (250.3Kb)"
        },
        {
            "numero_expediente": "00101/ISE/2018/JA",
            "link": "http://www.juntadeandalucia.es/contratacion/document/download?refCode=2019-0000046476&refDoc=2019-0000046476-0",
            "descripcion": "FORMALIZACI\u00d3N DEL CONTRATO_597194 (pdf) (967.65Kb)"
        },
        {
            "numero_expediente": "00101/ISE/2018/JA",
            "link": "http://www.juntadeandalucia.es/contratacion/document/download?refCode=2019-0000029820&refDoc=2019-0000029820-0",
            "descripcion": "MEMORIA JUSTIFICATIVA-DILIGENCIA DOCUMENTO_528194 (pdf) (189.08Kb)"
        },
        {
            "numero_expediente": "00101/ISE/2018/JA",
            "link": "http://www.juntadeandalucia.es/contratacion/document/download?refCode=2019-0000029820&refDoc=2019-0000029820-1",
            "descripcion": "MEMORIA JUSTIFICATIVA_485880 (pdf) (169.45Kb)"
        },
        {
            "numero_expediente": "00101/ISE/2018/JA",
            "link": "http://www.juntadeandalucia.es/contratacion/document/download?refCode=2019-0000029820&refDoc=2019-0000029820-2",
            "descripcion": "PLIEGO CL\u00c1USULAS ADMINISTRATIVAS_542639 (pdf) (644.22Kb)"
        },
        {
            "numero_expediente": "00101/ISE/2018/JA",
            "link": "http://www.juntadeandalucia.es/contratacion/document/download?refCode=2019-0000029820&refDoc=2019-0000029820-3",
            "descripcion": "PLIEGOS PRESCRIPCIONES T\u00c9CNICAS_542640 (pdf) (289.01Kb)"
        },
        {
            "numero_expediente": "00101/ISE/2018/JA",
            "link": "http://www.juntadeandalucia.es/contratacion/document/download?refCode=2019-0000029820&refDoc=2019-0000029820-4",
            "descripcion": "RESOLUCI\u00d3N NOMBRAMIENTO MESA DE CONTRATACI\u00d3N_543969 (pdf) (90.16Kb)"
        },
        {
            "numero_expediente": "00101/ISE/2018/JA",
            "link": "http://www.juntadeandalucia.es/contratacion/document/download?refCode=2019-0000029820&refDoc=2019-0000029820-5",
            "descripcion": "MEMORIA JUSTIFICATIVA-DILIGENCIA DOCUMENTO_517622 (pdf) (186.32Kb)"
        },
        {
            "numero_expediente": "00101/ISE/2018/JA",
            "link": "http://www.juntadeandalucia.es/contratacion/document/download?refCode=2019-0000029820&refDoc=2019-0000029820-6",
            "descripcion": "RESOLUCI\u00d3N APROBACI\u00d3N_548273 (pdf) (162.59Kb)"
        },
        {
            "numero_expediente": "00101/ISE/2018/JA",
            "link": "http://www.juntadeandalucia.es/contratacion/document/download?refCode=2019-0000029820&refDoc=2019-0000029820-7",
            "descripcion": "ACTA N\u00daMERO 1: CALIFICACI\u00d3N DE LA DOCUMENTACI\u00d3N_562458 (pdf) (206.94Kb)"
        },
        {
            "numero_expediente": "00101/ISE/2018/JA",
            "link": "http://www.juntadeandalucia.es/contratacion/document/download?refCode=2019-0000029820&refDoc=2019-0000029820-8",
            "descripcion": "ACTA SUBSANACI\u00d3N DOCUMENTACI\u00d3N_570671 (pdf) (191.79Kb)"
        },
        {
            "numero_expediente": "00101/ISE/2018/JA",
            "link": "http://www.juntadeandalucia.es/contratacion/document/download?refCode=2019-0000029820&refDoc=2019-0000029820-9",
            "descripcion": "ACTA SUBSANACI\u00d3N DOCUMENTACI\u00d3N_571072 (pdf) (169.53Kb)"
        },
        {
            "numero_expediente": "00101/ISE/2018/JA",
            "link": "http://www.juntadeandalucia.es/contratacion/document/download?refCode=2019-0000029820&refDoc=2019-0000029820-10",
            "descripcion": "ACTA COMPROBACION DOCUMENTACI\u00d3N_576167 (pdf) (183.04Kb)"
        },
        {
            "numero_expediente": "00101/ISE/2018/JA",
            "link": "http://www.juntadeandalucia.es/contratacion/document/download?refCode=2019-0000029820&refDoc=2019-0000029820-11",
            "descripcion": "ACTA COMPROBACION DOCUMENTACI\u00d3N_580596 (pdf) (182.07Kb)"
        },
        {
            "numero_expediente": "00101/ISE/2018/JA",
            "link": "http://www.juntadeandalucia.es/contratacion/document/download?refCode=2019-0000029820&refDoc=2019-0000029820-12",
            "descripcion": "ACTA COMPROBACION DOCUMENTACI\u00d3N_585259 (pdf) (188.16Kb)"
        },
        {
            "numero_expediente": "00101/ISE/2018/JA",
            "link": "http://www.juntadeandalucia.es/contratacion/document/download?refCode=2019-0000029820&refDoc=2019-0000029820-13",
            "descripcion": "ACTA SUBSANACI\u00d3N DOCUMENTACI\u00d3N_586693 (pdf) (169.96Kb)"
        }
    ],
    "estado_expediente__fecha_la_formalizacion": "10/05/2019",
    "datosbasicos__duracion_contrato": "1 mes"
}