{
    "documentacion_complementaria": [
        {
            "descripcion": "Memoria (pdf) (206.1Kb)",
            "link": "http://www.juntadeandalucia.es/contratacion/document/download?refCode=2019-0000026256&refDoc=2019-0000026256-0",
            "numero_expediente": "CCA.+5WBR-5"
        },
        {
            "descripcion": "Pliegos y Anexos (zip) (1197.37Kb)",
            "link": "http://www.juntadeandalucia.es/contratacion/document/download?refCode=2019-0000026256&refDoc=2019-0000026256-1",
            "numero_expediente": "CCA.+5WBR-5"
        },
        {
            "descripcion": "Resoluci\u00f3n de aprobaci\u00f3n del expediente (pdf) (127.96Kb)",
            "link": "http://www.juntadeandalucia.es/contratacion/document/download?refCode=2019-0000026256&refDoc=2019-0000026256-2",
            "numero_expediente": "CCA.+5WBR-5"
        },
        {
            "descripcion": "Resoluci\u00f3n sobre mesas de contrataci\u00f3n (pdf) (47.74Kb)",
            "link": "http://www.juntadeandalucia.es/contratacion/document/download?refCode=2019-0000026256&refDoc=2019-0000026256-3",
            "numero_expediente": "CCA.+5WBR-5"
        },
        {
            "descripcion": "DEUC (xml) (235.66Kb)",
            "link": "http://www.juntadeandalucia.es/contratacion/document/download?refCode=2019-0000026256&refDoc=2019-0000026256-4",
            "numero_expediente": "CCA.+5WBR-5"
        },
        {
            "descripcion": "Planos (rar) (1411.65Kb)",
            "link": "http://www.juntadeandalucia.es/contratacion/document/download?refCode=2019-0000026256&refDoc=2019-0000026256-5",
            "numero_expediente": "CCA.+5WBR-5"
        },
        {
            "descripcion": "Reswoluci\u00f3n de correcci\u00f3n de errores (pdf) (96.7Kb)",
            "link": "http://www.juntadeandalucia.es/contratacion/document/download?refCode=2019-0000026256&refDoc=2019-0000026256-6",
            "numero_expediente": "CCA.+5WBR-5"
        },
        {
            "descripcion": "Resoluci\u00f3n (pdf) (184.42Kb)",
            "link": "http://www.juntadeandalucia.es/contratacion/document/download?refCode=2019-0000026256&refDoc=2019-0000026256-7",
            "numero_expediente": "CCA.+5WBR-5"
        },
        {
            "descripcion": "N\u00famero e identidad de licitadores. Documento 1. De fecha 28/12/2018. (pdf) (219.34Kb)",
            "link": "http://www.juntadeandalucia.es/contratacion/document/download?refCode=2019-0000026256&refDoc=2019-0000026256-8",
            "numero_expediente": "CCA.+5WBR-5"
        },
        {
            "descripcion": "Acta de mesa. Documento 1. De fecha 10/1/2019. (pdf) (1615.94Kb)",
            "link": "http://www.juntadeandalucia.es/contratacion/document/download?refCode=2019-0000026256&refDoc=2019-0000026256-9",
            "numero_expediente": "CCA.+5WBR-5"
        },
        {
            "descripcion": "Anuncio de acto p\u00fablico. Documento 1. De fecha 12/2/2019. (pdf) (51.3Kb)",
            "link": "http://www.juntadeandalucia.es/contratacion/document/download?refCode=2019-0000026256&refDoc=2019-0000026256-10",
            "numero_expediente": "CCA.+5WBR-5"
        },
        {
            "descripcion": "Acta de mesa. Documento 1. De fecha 7/2/2019. (pdf) (2331.13Kb)",
            "link": "http://www.juntadeandalucia.es/contratacion/document/download?refCode=2019-0000026256&refDoc=2019-0000026256-11",
            "numero_expediente": "CCA.+5WBR-5"
        },
        {
            "descripcion": "Acta de mesa. Documento 1. De fecha 14/2/2019. (pdf) (2273.97Kb)",
            "link": "http://www.juntadeandalucia.es/contratacion/document/download?refCode=2019-0000026256&refDoc=2019-0000026256-12",
            "numero_expediente": "CCA.+5WBR-5"
        },
        {
            "descripcion": "Acta de mesa. Documento 1. De fecha 21/2/2019. (pdf) (9952.4Kb)",
            "link": "http://www.juntadeandalucia.es/contratacion/document/download?refCode=2019-0000026256&refDoc=2019-0000026256-13",
            "numero_expediente": "CCA.+5WBR-5"
        },
        {
            "descripcion": "Acta de mesa. Documento 1. De fecha 8/3/2019. (pdf) (1553.45Kb)",
            "link": "http://www.juntadeandalucia.es/contratacion/document/download?refCode=2019-0000026256&refDoc=2019-0000026256-14",
            "numero_expediente": "CCA.+5WBR-5"
        }
    ],
    "id": 94255,
    "apertura_ofertas": {
        "lugar": [
            "Area Hospitalaria Virgen del Rocio",
            "Avda. Manuel Siurot, s/n 41013 (Sevilla )"
        ],
        "aclaraciones": "Tendra lugar en las dependencias del Hospital U. Virgen del Rocio, en la fecha y hora que se anunciara en la Plataforma de Contratacion de la Junta de Andalucia-Perfil de Contratante del SAS con, al menos, 48 horas de antelacion."
    },
    "datosbasicos__procedimiento": "Abierto",
    "importes__valor_estimado": "322.314,05EUR",
    "requisitos_criterios_condiciones": {
        "requisitos_minimos_contratista": "La solvencia econ\u00f3mica y financiera se acreditar\u00e1 conforme al art\u00edculo 87.1.a) de la LCSP, mediante una declaraci\u00f3n sobre el volumen anual de negocios m\u00e1s elevado dentro de los \u00faltimos tres a\u00f1os, por importe igual o superior al 50% del presupuesto de licitaci\u00f3n de los lotes a los que se licite. El volumen de negocios se acreditar\u00e1 mediante dep\u00f3sito de cuentas anuales en el Registro oficial y los empresarios individuales no inscritos mediante sus libros inventarios y cuentas anuales legalizados por el Registro Mercantil y la solvencia t\u00e9cnica se acreditar\u00e1 conforme al art\u00edculo 89.1.a) de la LCSP. Los certificados no podr\u00e1n presentarse en n\u00famero inferior a tres y deber\u00e1n especificar el objeto an\u00e1logo al contrato.",
        "criterios_objetivos_para_la_seleccion_candidatos_el_procedimiento": "Los establecidos en el pliego de cl\u00e1usulas administrativas particulares",
        "criterios_adjudicacion": "Los establecidos en el pliego de cl\u00e1usulas administrativas particulares",
        "condiciones_especiales_adjudicacion_contrato": "Las establecidas en el pliego de cl\u00e1usulas administrativas particulares"
    },
    "datosbasicos__tramitacion": "Ordinario",
    "presentacion_ofertas__fecha_limite_presentacion_ofertas": "24/12/2018 a las 14:00 horas",
    "referencias_diarios_oficiales": [],
    "anuncios_publicados": [
        {
            "anuncio_desc": "Convocatoria de licitaci\u00f3n",
            "anuncio_id": " 2018-0000049313",
            "descripcion": "23/11/2018 09:36, 2018-0000049313-Convocatoria de licitaci\u00f3n",
            "datetime": "2018-11-23T09:36:00+00:00",
            "numero_expediente": "CCA.+5WBR-5",
            "link": "http://www.juntadeandalucia.es/haciendayadministracionpublica/apl/verifirmapdc/descargaInformeParametros?transaccion=PR%2B4fDRAcpQdaqn3%2FCiaIs4cenB071d7&tipoPie=4"
        },
        {
            "anuncio_desc": "Convocatoria de licitaci\u00f3n (Infor.Adicional)",
            "anuncio_id": " 2018-0000052954",
            "descripcion": "05/12/2018 08:14, 2018-0000052954-Convocatoria de licitaci\u00f3n (Infor.Adicional)",
            "datetime": "2018-12-05T08:14:00+00:00",
            "numero_expediente": "CCA.+5WBR-5",
            "link": "http://www.juntadeandalucia.es/haciendayadministracionpublica/apl/verifirmapdc/descargaInformeParametros?transaccion=CGpKrETI3n8MRygG%2FCqHfSJqUCje%2B%2B1i&tipoPie=4"
        },
        {
            "anuncio_desc": "Convocatoria de licitaci\u00f3n (Infor.Adicional)",
            "anuncio_id": " 2018-0000062154",
            "descripcion": "17/12/2018 13:09, 2018-0000062154-Convocatoria de licitaci\u00f3n (Infor.Adicional)",
            "datetime": "2018-12-17T13:09:00+00:00",
            "numero_expediente": "CCA.+5WBR-5",
            "link": "http://www.juntadeandalucia.es/haciendayadministracionpublica/apl/verifirmapdc/descargaInformeParametros?transaccion=UPG4FEERhBCTbYbybzcn4M4cenB071d7&tipoPie=4"
        },
        {
            "anuncio_desc": "Convocatoria de licitaci\u00f3n (Infor.Adicional)",
            "anuncio_id": " 2018-0000062599",
            "descripcion": "19/12/2018 10:11, 2018-0000062599-Convocatoria de licitaci\u00f3n (Infor.Adicional)",
            "datetime": "2018-12-19T10:11:00+00:00",
            "numero_expediente": "CCA.+5WBR-5",
            "link": "http://www.juntadeandalucia.es/haciendayadministracionpublica/apl/verifirmapdc/descargaInformeParametros?transaccion=mI7OIeOgpoaIqZwqivrOZfI9rwqOEXGf&tipoPie=4"
        },
        {
            "anuncio_desc": "Convocatoria de licitaci\u00f3n (Infor.Adicional)",
            "anuncio_id": " 2019-0000001581",
            "descripcion": "11/01/2019 12:31, 2019-0000001581-Convocatoria de licitaci\u00f3n (Infor.Adicional)",
            "datetime": "2019-01-11T12:31:00+00:00",
            "numero_expediente": "CCA.+5WBR-5",
            "link": "http://www.juntadeandalucia.es/haciendayadministracionpublica/apl/verifirmapdc/descargaInformeParametros?transaccion=28OFCqq8wQ9qAquS28kzDHlqT3SzUohr&tipoPie=4"
        },
        {
            "anuncio_desc": "Convocatoria de licitaci\u00f3n (Infor.Adicional)",
            "anuncio_id": " 2019-0000004570",
            "descripcion": "21/01/2019 10:41, 2019-0000004570-Convocatoria de licitaci\u00f3n (Infor.Adicional)",
            "datetime": "2019-01-21T10:41:00+00:00",
            "numero_expediente": "CCA.+5WBR-5",
            "link": "http://www.juntadeandalucia.es/haciendayadministracionpublica/apl/verifirmapdc/descargaInformeParametros?transaccion=K1c54JQIQBrIamO5E6hYyavJYER37PP1&tipoPie=4"
        },
        {
            "anuncio_desc": "Convocatoria de licitaci\u00f3n (Infor.Adicional)",
            "anuncio_id": " 2019-0000013823",
            "descripcion": "12/02/2019 12:55, 2019-0000013823-Convocatoria de licitaci\u00f3n (Infor.Adicional)",
            "datetime": "2019-02-12T12:55:00+00:00",
            "numero_expediente": "CCA.+5WBR-5",
            "link": "http://www.juntadeandalucia.es/haciendayadministracionpublica/apl/verifirmapdc/descargaInformeParametros?transaccion=ngdF2tFD7tfjeuQHPgUJ33lqT3SzUohr&tipoPie=4"
        },
        {
            "anuncio_desc": "Convocatoria de licitaci\u00f3n (Infor.Adicional)",
            "anuncio_id": " 2019-0000016022",
            "descripcion": "15/02/2019 11:37, 2019-0000016022-Convocatoria de licitaci\u00f3n (Infor.Adicional)",
            "datetime": "2019-02-15T11:37:00+00:00",
            "numero_expediente": "CCA.+5WBR-5",
            "link": "http://www.juntadeandalucia.es/haciendayadministracionpublica/apl/verifirmapdc/descargaInformeParametros?transaccion=BcE8CrBMdNgO7BHTMpXSEnlqT3SzUohr&tipoPie=4"
        },
        {
            "anuncio_desc": "Convocatoria de licitaci\u00f3n (Infor.Adicional)",
            "anuncio_id": " 2019-0000024699",
            "descripcion": "08/03/2019 12:25, 2019-0000024699-Convocatoria de licitaci\u00f3n (Infor.Adicional)",
            "datetime": "2019-03-08T12:25:00+00:00",
            "numero_expediente": "CCA.+5WBR-5",
            "link": "http://www.juntadeandalucia.es/haciendayadministracionpublica/apl/verifirmapdc/descargaInformeParametros?transaccion=2UpzRV3qAu9QsFirkk8VqyJqUCje%2B%2B1i&tipoPie=4"
        },
        {
            "anuncio_desc": "Convocatoria de licitaci\u00f3n (Infor.Adicional)",
            "anuncio_id": " 2019-0000024764",
            "descripcion": "08/03/2019 14:03, 2019-0000024764-Convocatoria de licitaci\u00f3n (Infor.Adicional)",
            "datetime": "2019-03-08T14:03:00+00:00",
            "numero_expediente": "CCA.+5WBR-5",
            "link": "http://www.juntadeandalucia.es/haciendayadministracionpublica/apl/verifirmapdc/descargaInformeParametros?transaccion=6nq2MS1QfwIK0sg0zSmZHs4cenB071d7&tipoPie=4"
        },
        {
            "anuncio_desc": "Convocatoria de licitaci\u00f3n (Infor.Adicional)",
            "anuncio_id": " 2019-0000025206",
            "descripcion": "12/03/2019 11:36, 2019-0000025206-Convocatoria de licitaci\u00f3n (Infor.Adicional)",
            "datetime": "2019-03-12T11:36:00+00:00",
            "numero_expediente": "CCA.+5WBR-5",
            "link": "http://www.juntadeandalucia.es/haciendayadministracionpublica/apl/verifirmapdc/descargaInformeParametros?transaccion=8FMA%2FpvYLVngY6G%2FKHY1sYYdAfNuj%2FNj&tipoPie=4"
        },
        {
            "anuncio_desc": "Convocatoria de licitaci\u00f3n (Infor.Adicional)",
            "anuncio_id": " 2019-0000025224",
            "descripcion": "12/03/2019 11:50, 2019-0000025224-Convocatoria de licitaci\u00f3n (Infor.Adicional)",
            "datetime": "2019-03-12T11:50:00+00:00",
            "numero_expediente": "CCA.+5WBR-5",
            "link": "http://www.juntadeandalucia.es/haciendayadministracionpublica/apl/verifirmapdc/descargaInformeParametros?transaccion=VxKV5eGVsPbaL3A%2F%2FVfH4SmkfG71%2BFxx&tipoPie=4"
        },
        {
            "anuncio_desc": "Convocatoria de licitaci\u00f3n (Infor.Adicional)",
            "anuncio_id": " 2019-0000026256",
            "descripcion": "18/03/2019 12:00, 2019-0000026256-Convocatoria de licitaci\u00f3n (Infor.Adicional)",
            "datetime": "2019-03-18T12:00:00+00:00",
            "numero_expediente": "CCA.+5WBR-5",
            "link": "http://www.juntadeandalucia.es/haciendayadministracionpublica/apl/verifirmapdc/descargaInformeParametros?transaccion=1R3qRg33m1Ski5OMk%2FFYYHP4a3pxggof&tipoPie=4"
        }
    ],
    "datosbasicos__division_por_lotes": "No",
    "datosbasicos__descripcion": "Arrendamiento de dos mamografos digitales para los Distritos de Atencion Primaria Sevilla y Aljarafe-Norte.",
    "importes__importe_licitacion_(con_iva)": "390.000,00EUR",
    "datosbasicos__lugar_ejecucion_nuts": "ES618",
    "obtencion_documentacion_informacion": {
        "fecha_limite_obtencion": "24/12/2018 a las 14:00 horas",
        "lugar": [
            "Area Hospitalaria Virgen del Rocio",
            "Avda. Manuel Siurot, s/n 41013 (Sevilla )"
        ],
        "aclaraciones": "Se adjunta Resolucion publicada en BOJA no 223 de 13/11/2013 sobre composicion de las Mesas de Contratacion del Servicio Andaluz de Salud.",
        "puntos_contacto": [
            "Plataforma de Logistica Sanitaria de Sevilla",
            "955013335",
            "955013132",
            "http://www.juntadeandalucia.es/servicioandaluzdesalud"
        ]
    },
    "importes__importe_licitacion_(sin_iva)": "322.314,05EUR",
    "datosbasicos__organo_contratacion": "Servicio Andaluz de Salud",
    "estado_expediente__estado": "Evaluacion",
    "secciones": {
        "documentacion_complementaria": 2,
        "anuncios_publicados": 10,
        "obtencion_documentacion_informacion": 3,
        "presentacion_solicitudes": 6,
        "presentacion_ofertas": 7,
        "clausulas_sociales_ambientales_innovacion_tecnologica": 5,
        "apertura_ofertas": 8,
        "estado_expediente": 1,
        "requisitos_criterios_condiciones": 4,
        "importes": 0,
        "referencias_diarios_oficiales": 9
    },
    "presentacion_ofertas__notas": [
        "Avda. Manuel Siurot, s/n 41013 (Sevilla )",
        "Registro General del Area Hospitalaria Virgen del Rocio"
    ],
    "origen": {
        "url": "http://www.juntadeandalucia.es/temas/contratacion-publica/perfiles-licitaciones/detalle/000000094255.html",
        "terminos_uso": "http://www.juntadeandalucia.es/informacion/legal.html"
    },
    "datosbasicos__numero_expediente": "CCA.+5WBR-5",
    "datosbasicos__lugar_ejecucion": "SEVILLA",
    "estado_expediente__notas": [
        "18/03/2019 12:00 - Convocatoria de licitacion (Infor.Adicional)",
        "Actualizado: Convocatoria de licitacion (Infor.Adicional)"
    ],
    "datosbasicos__lugar_tramitacion": "SEVILLA",
    "datosbasicos__duracion_contrato": "60 meses",
    "datosbasicos__tipo_contrato": "Arrendamiento",
    "datosbasicos__clasificacion_cpv": [
        "33100000 Equipamiento medico.",
        "50400000 Servicios de reparacion y mantenimiento de equipo medico y de precision."
    ],
    "datosbasicos__titulo_expediente": "2018/073974. Arrendamiento de dos mamografos digitales para los Distritos de Atencion Primaria Sevilla y Aljarafe-Norte."
}